districtNumber,districtType,districtName,year,totalStudents,totalTeachers,studentTeacherRatio
2754,01,CEDAR MOUNTAIN SCHOOL DISTRICT,2005,422,27.479999999999997,15.356622998544397
2769,01,MORRIS AREA PUBLIC SCHOOLS,2005,999,67.23,14.859437751004014
2805,01,ZUMBROTA-MAZEPPA SCHOOL DISTRICT,2005,1186,71.74000000000001,16.531920825202118
2835,01,JANESVILLE-WALDORF-PEMBERTON,2005,591,40.309999999999995,14.661374348796826
2853,01,LAC QUI PARLE VALLEY SCHOOL DIST.,2005,1049,72.32,14.504977876106196
2854,01,ADA-BORUP PUBLIC SCHOOL DISTRICT,2005,543,44.68,12.153088630259624
2856,01,STEPHEN-ARGYLE CENTRAL SCHOOLS,2005,391,29.85,13.098827470686766
2859,01,GLENCOE-SILVER LAKE SCHOOL DISTRICT,2005,1723,106.28,16.21189311253293
2860,01,BLUE EARTH AREA PUBLIC SCHOOL,2005,1338,88.3,15.152887882219707
2884,01,RED ROCK CENTRAL SCHOOL DISTRICT,2005,515,40.760000000000005,12.634936211972521
2886,01,GLENVILLE-EMMONS SCHOOL DISTRICT,2005,386,27.36,14.108187134502923
2888,01,CLINTON-GRACEVILLE-BEARDSLEY,2005,474,39.55,11.984829329962075
2889,01,LAKE PARK AUDUBON SCHOOL DISTRICT,2005,633,44.449999999999996,14.24071991001125
2890,01,RENVILLE COUNTY WEST SCHOOL DIST.,2005,712,52.14,13.65554276946682
2895,01,JACKSON COUNTY CENTRAL SCHOOL DIST.,2005,1206,82.35,14.6448087431694
2897,01,REDWOOD AREA SCHOOL DISTRICT,2005,1424,95.75,14.872062663185378
2898,01,WESTBROOK-WALNUT GROVE SCHOOLS,2005,542,41.660000000000004,13.010081613058087
2899,01,PLAINVIEW-ELGIN-MILLVILLE,2005,NA,NA,NA
2902,01,RTR PUBLIC SCHOOLS,2005,NA,NA,NA
2903,01,ORTONVILLE PUBLIC SCHOOLS,2005,NA,NA,NA
2904,01,TRACY AREA PUBLIC SCHOOL DISTRICT,2005,NA,NA,NA
2905,01,TRI-CITY UNITED SCHOOL DISTRICT,2005,NA,NA,NA
2906,01,RED LAKE COUNTY CENTRAL PUBLIC SCH,2005,NA,NA,NA
2907,01,ROUND LAKE-BREWSTER PUBLIC SCHOOLS,2005,NA,NA,NA
2908,01,BRANDON-EVANSVILLE PUBLIC SCHOOLS,2005,NA,NA,NA
4000,07,CITY ACADEMY,2005,114,9.4,12.127659574468085
4001,07,BLUFFVIEW MONTESSORI,2005,200,14.27,14.015416958654521
4003,07,"NEW HEIGHTS SCHOOL, INC.",2005,127,12.68,10.015772870662461
4004,07,CEDAR RIVERSIDE COMMUNITY SCHOOL,2005,110,10.370000000000001,10.60752169720347
4005,07,METRO DEAF SCHOOL,2005,71,15.07,4.71134704711347
4007,07,MINNESOTA NEW COUNTRY SCHOOL,2005,109,8,13.625
4008,07,PACT CHARTER SCHOOL,2005,553,34.379999999999995,16.08493310063991
4011,07,ATHLOS LEADERSHIP ACADEMY,2005,188,22.939999999999998,8.195292066259809
4015,07,COMMUNITY OF PEACE ACADEMY,2005,562,44.61,12.598072181125309
4016,07,WORLD LEARNER CHARTER SCHOOL,2005,140,7.52,18.617021276595747
4017,07,MINNESOTA TRANSITIONS CHARTER SCH,2005,871,47,18.53191489361702
4018,07,ACHIEVE LANGUAGE ACADEMY,2005,306,25.89,11.819235225955968
4020,07,DULUTH PUBLIC SCHOOLS ACADEMY,2005,772,49.37,15.637026534332591
4025,07,CYBER VILLAGE ACADEMY,2005,118,8.639999999999999,13.65740740740741
4026,07,E.C.H.O. CHARTER SCHOOL,2005,161,14.57,11.050102951269732
4027,07,HIGHER GROUND ACADEMY,2005,427,19.2,22.239583333333336
4029,07,ST. PAUL CITY SCHOOL,2005,306,29.01,10.548086866597725
4031,07,JENNINGS COMMUNITY SCHOOL,2005,84,2,42
4032,07,HARVEST PREPARATORY SCHOOL,2005,360,19,18.94736842105263
4035,07,LIFE PREP,2005,79,9.5,8.31578947368421
4036,07,FACE TO FACE ACADEMY,2005,58,3.19,18.181818181818183
4038,07,SOJOURNER TRUTH ACADEMY,2005,242,19.53,12.391193036354325
4039,07,HIGH SCHOOL FOR RECORDING ARTS,2005,211,7,30.142857142857142
4043,07,MATH AND SCIENCE ACADEMY,2005,303,17.06,17.76084407971864
4049,07,NORTHWEST PASSAGE HIGH SCHOOL,2005,176,10.51,16.74595623215985
4050,07,LAFAYETTE PUBLIC CHARTER SCHOOL,2005,105,9.350000000000001,11.22994652406417
4053,07,NORTH LAKES ACADEMY,2005,197,14.38,13.699582753824755
4054,07,LA CRESCENT MONTESSORI & STEM SCHOO,2005,70,5.17,13.539651837524179
4055,07,NERSTRAND CHARTER SCHOOL,2005,154,8.209999999999999,18.757612667478686
4056,07,ROSA PARKS CHARTER HIGH SCHOOL,2005,123,10.01,12.287712287712289
4057,07,EL COLEGIO CHARTER SCHOOL,2005,92,6.4,14.375
4058,07,SCHOOLCRAFT LEARNING COMMUNITY CHTR,2005,160,12.83,12.470771628994544
4059,07,CROSSLAKE COMMUNITY CHARTER SCHOOL,2005,90,7.109999999999999,12.658227848101268
4064,07,RIVERWAY LEARNING COMMUNITY CHTR,2005,80,7.01,11.412268188302425
4066,07,KATO PUBLIC CHARTER SCHOOL,2005,104,7.92,13.131313131313131
4067,07,AURORA CHARTER SCHOOL,2005,177,10,17.7
4068,07,EXCELL ACADEMY CHARTER,2005,189,13.1,14.427480916030534
4070,07,HOPE COMMUNITY ACADEMY,2005,459,31.09,14.76358957864265
4073,07,ACADEMIA CESAR CHAVEZ CHARTER SCH.,2005,246,14,17.571428571428573
4074,07,AFSA HIGH SCHOOL,2005,154,8.96,17.1875
4075,07,AVALON SCHOOL,2005,123,8.69,14.154200230149598
4077,07,TWIN CITIES INTERNATIONAL ELEM SCH,2005,421,29.34,14.349011588275392
4078,07,MINNESOTA INTERNATIONAL MIDDLE CHTR,2005,239,15.870000000000001,15.059861373660995
4079,07,FRIENDSHIP ACDMY OF FINE ARTS CHTR.,2005,94,5.59,16.815742397137747
4080,07,PILLAGER AREA CHARTER SCHOOL,2005,43,3.32,12.951807228915664
4081,07,DISCOVERY PUBLIC SCHOOL FARIBAULT,2005,40,6.73,5.943536404160475
4082,07,BLUESKY CHARTER SCHOOL,2005,52,2.16,24.074074074074073
4083,07,RIDGEWAY COMMUNITY SCHOOL,2005,64,5.52,11.594202898550726
4084,07,NORTH SHORE COMMUNITY SCHOOL,2005,243,12.8,18.984375
4085,07,HARBOR CITY INTERNATIONAL CHARTER,2005,204,15.65,13.035143769968052
4087,07,SAGE ACADEMY CHARTER SCHOOL,2005,79,5.8,13.620689655172415
4088,07,URBAN ACADEMY CHARTER SCHOOL,2005,141,9,15.666666666666666
4089,07,NEW CITY SCHOOL,2005,93,7.6,12.23684210526316
4090,07,PRAIRIE CREEK COMMUNITY SCHOOL,2005,110,7.55,14.56953642384106
4091,07,ARCADIA CHARTER SCHOOL,2005,93,8,11.625
4092,07,WATERSHED HIGH SCHOOL,2005,115,10.31,11.154219204655673
4093,07,NEW CENTURY ACADEMY,2005,150,11.2,13.392857142857144
4095,07,TRIO WOLF CREEK DISTANCE LEARNING,2005,70,3.5,20
4097,07,"PARTNERSHIP ACADEMY, INC.",2005,170,11.7,14.529914529914532
4098,07,NOVA CLASSICAL ACADEMY,2005,222,11.98,18.530884808013354
4100,07,GREAT EXPECTATIONS,2005,36,4.119999999999999,8.737864077669904
4102,07,MINNESOTA INTERNSHIP CENTER,2005,404,17.64,22.90249433106576
4103,07,HMONG COLLEGE PREP ACADEMY,2005,191,13,14.692307692307692
4104,07,PALADIN CAREER AND TECH HIGH SCHOOL,2005,160,6.24,25.64102564102564
4105,07,GREAT RIVER SCHOOL,2005,81,9.32,8.690987124463518
4106,07,TREKNORTH HIGH SCHOOL,2005,159,10.450000000000001,15.215311004784688
4107,07,VOYAGEURS EXPEDITIONARY,2005,50,6.109999999999999,8.183306055646481
4110,07,PIM ARTS HIGH SCHOOL,2005,106,7,15.142857142857142
4111,07,AUGSBURG FAIRVIEW ACADEMY,2005,NA,NA,NA
4112,07,ST PAUL CONSERVATORY PERFORMING ART,2005,NA,NA,NA
4113,07,SPERO ACADEMY,2005,63,7.5,8.4
4116,07,LAKES INTERNATIONAL LANGUAGE ACADEM,2005,174,8.33,20.888355342136855
4118,07,KALEIDOSCOPE CHARTER SCHOOL,2005,193,10.12,19.07114624505929
4119,07,ACADEMIC ARTS HIGH SCHOOL,2005,78,5.52,14.130434782608697
4120,07,ST. CROIX PREPARATORY ACADEMY,2005,196,11.9,16.470588235294116
4121,07,UBAH MEDICAL ACADEMY CHARTER SCHOOL,2005,123,8,15.375
4122,07,EAGLE RIDGE ACADEMY CHARTER SCHOOL,2005,120,8.46,14.184397163120567
4124,07,BEACON ACADEMY,2005,104,8,13
4126,07,PRAIRIE SEEDS ACADEMY,2005,124,7,17.714285714285715
4127,07,TEAM ACADEMY,2005,41,4,10.25
4131,07,METRO SCHOOLS CHARTER,2005,NA,NA,NA
4132,07,TWIN CITIES ACADEMY,2005,NA,NA,NA
4135,07,ROCHESTER MATH AND SCIENCE ACADEMY,2005,NA,NA,NA
4137,07,SWAN RIVER MONTESSORI CHARTER SCH,2005,NA,NA,NA
4138,07,MILROY AREA CHARTER SCHOOL,2005,NA,NA,NA
4139,07,LOVEWORKS ACADEMY FOR ARTS,2005,NA,NA,NA
4140,07,YINGHUA ACADEMY,2005,NA,NA,NA
4142,07,STRIDE ACADEMY CHARTER SCHOOL,2005,NA,NA,NA
4143,07,NEW MILLENNIUM ACADEMY CHARTER SCH,2005,NA,NA,NA
4144,07,GREEN ISLE COMMUNITY SCHOOL,2005,NA,NA,NA
4145,07,BIRCH GROVE COMMUNITY SCHOOL,2005,NA,NA,NA
4146,07,NORTHERN LIGHTS COMMUNITY SCHOOL,2005,NA,NA,NA
4150,07,MINNESOTA ONLINE HIGH SCHOOL,2005,NA,NA,NA
4151,07,EDVISIONS OFF CAMPUS SCHOOL,2005,NA,NA,NA
4152,07,TWIN CITIES GERMAN IMMERSION CHTR,2005,NA,NA,NA
4153,07,DUGSI ACADEMY,2005,NA,NA,NA
4155,07,NAYTAHWAUSH COMMUNITY SCHOOL,2005,NA,NA,NA
4159,07,SEVEN HILLS PREPARATORY ACADEMY,2005,NA,NA,NA
4160,07,SPECTRUM HIGH SCHOOL,2005,NA,NA,NA
4161,07,NEW DISCOVERIES MONTESSORI ACADEMY,2005,NA,NA,NA
4162,07,SOUTHSIDE FAMILY CHARTER SCHOOL,2005,NA,NA,NA
4163,07,LEARNING FOR LEADERSHIP CHARTER,2005,NA,NA,NA
4164,07,LAURA JEFFREY ACADEMY CHARTER,2005,NA,NA,NA
4166,07,EAST RANGE ACADEMY OF TECH-SCIENCE,2005,NA,NA,NA
4167,07,INTERNATIONAL SPANISH LANGUAGE ACAD,2005,NA,NA,NA
4168,07,GLACIAL HILLS ELEMENTARY,2005,NA,NA,NA
4169,07,STONEBRIDGE WORLD SCHOOL,2005,NA,NA,NA
4170,07,HIAWATHA ACADEMIES,2005,NA,NA,NA
4171,07,NOBLE ACADEMY,2005,NA,NA,NA
4172,07,CLARKFIELD CHARTER SCHOOL,2005,NA,NA,NA
4177,07,MINISINAAKWAANG LEADERSHIP ACADEMY,2005,NA,NA,NA
4178,07,LINCOLN INTERNATIONAL SCHOOL,2005,NA,NA,NA
4181,07,COMMUNITY SCHOOL OF EXCELLENCE,2005,NA,NA,NA
4183,07,LIONSGATE ACADEMY,2005,NA,NA,NA
4184,07,ASPEN ACADEMY,2005,NA,NA,NA
4185,07,DAVINCI ACADEMY,2005,NA,NA,NA
4186,07,GLOBAL ACADEMY,2005,NA,NA,NA
4187,07,NATURAL SCIENCE ACADEMY,2005,NA,NA,NA
4188,07,COLOGNE ACADEMY,2005,NA,NA,NA
4189,07,BRIGHT WATER ELEMENTARY,2005,NA,NA,NA
4190,07,RIVERS EDGE ACADEMY,2005,NA,NA,NA
4191,07,KIPP MINNESOTA CHARTER SCHOOL,2005,NA,NA,NA
4192,07,BEST ACADEMY,2005,NA,NA,NA
4193,07,COLLEGE PREPARATORY ELEMENTARY,2005,NA,NA,NA
4194,07,CANNON RIVER STEM SCHOOL,2005,NA,NA,NA
4195,07,OSHKI OGIMAAG CHARTER SCHOOL,2005,NA,NA,NA
4198,07,DISCOVERY WOODS,2005,NA,NA,NA
4199,07,PARNASSUS PREPARATORY CHARTER SCH,2005,NA,NA,NA
4200,07,STEP ACADEMY CHARTER SCHOOL,2005,NA,NA,NA
4201,07,CORNERSTONE MONTESSORI ELEMENTARY,2005,NA,NA,NA
4204,07,ROCHESTER STEM ACADEMY,2005,NA,NA,NA
4205,07,HENNEPIN ELEMENTARY SCHOOL,2005,NA,NA,NA
4207,07,VERMILION COUNTRY SCHOOL,2005,NA,NA,NA
4208,07,NASHA SHKOLA CHARTER SCHOOL,2005,NA,NA,NA
4209,07,MASTERY SCHOOL,2005,NA,NA,NA
4210,07,UPPER MISSISSIPPI ACADEMY,2005,NA,NA,NA
4212,07,WEST SIDE SUMMIT CHARTER SCHOOL,2005,NA,NA,NA
4213,07,PRODEO ACADEMY,2005,NA,NA,NA
4215,07,SEJONG ACADEMY OF MINNESOTA,2005,NA,NA,NA
4217,07,TECHNICAL ACADEMIES OF MINNESOTA,2005,NA,NA,NA
4218,07,VENTURE ACADEMY,2005,NA,NA,NA
4219,07,NORTHEAST COLLEGE PREP,2005,NA,NA,NA
4220,07,AGAMIM CLASSICAL ACADEMY,2005,NA,NA,NA
4221,07,DISCOVERY CHARTER SCHOOL,2005,NA,NA,NA
4223,07,SAINT CLOUD MATH AND SCIENCE ACADEM,2005,NA,NA,NA
4224,07,STAR OF THE NORTH ACADEMY CHARTER S,2005,NA,NA,NA
4225,07,UNIVERSAL ACADEMY CHARTER SCHOOL,2005,NA,NA,NA
4226,07,BDOTE LEARNING CENTER,2005,NA,NA,NA
4227,07,ART AND SCIENCE ACADEMY,2005,NA,NA,NA
4228,07,WOODBURY LEADERSHIP ACADEMY,2005,NA,NA,NA
4229,07,JANE GOODALL ENVIRONMENTAL SCIENCE,2005,NA,NA,NA
4230,07,MINNESOTA EXCELLENCE IN LEARNING AC,2005,NA,NA,NA
4231,07,MINNESOTA MATH AND SCIENCE ACADEMY,2005,NA,NA,NA
4232,07,SUCCESS ACADEMY,2005,NA,NA,NA
4233,07,LEVEL UP ACADEMY,2005,NA,NA,NA
4237,07,CAREER PATHWAYS,2005,NA,NA,NA
4238,07,ROCHESTER BEACON ACADEMY,2005,NA,NA,NA
4239,07,TESFA INTERNATIONAL SCHOOL,2005,NA,NA,NA
4240,07,NEW CENTURY SCHOOL,2005,NA,NA,NA
4243,07,NORTH METRO FLEX ACADEMY,2005,NA,NA,NA
4244,07,FIT ACADEMY,2005,NA,NA,NA
4246,07,BIG PICTURE TWIN CITIES,2005,NA,NA,NA
4250,07,ATHLOS ACADEMY OF SAINT CLOUD,2005,NA,NA,NA
4254,07,MARINE AREA COMMUNITY SCHOOL,2005,NA,NA,NA
6004,61,FRESHWATER ED. DIST.,2005,124,12,10.333333333333334
6012,61,ZUMBRO EDUCATION DISTRICT,2005,84,12,7
6013,61,HIAWATHA VALLEY ED. DISTRICT,2005,96,12.32,7.792207792207792
6014,61,RUNESTONE AREA ED. DISTRICT,2005,130,10.229999999999999,12.707722385141741
6018,61,MN RIVER VALLEY EDUCATION DISTRICT,2005,110,6.71,16.39344262295082
6026,61,WEST CENTRAL EDUCATION DISTRICT,2005,41,4.5,9.11111111111111
6027,61,MN VALLEY EDUCATION DISTRICT,2005,106,9,11.777777777777779
6049,61,RIVER BEND EDUCATION DISTRICT,2005,146,14.27,10.2312543798178
6051,61,GOODHUE COUNTY EDUCATION DISTRICT,2005,39,9.48,4.113924050632911
6074,50,CENTRAL MINNESOTA JT. POWERS DIST.,2005,35,NA,NA
6076,50,NORTHLAND LEARNING CENTER,2005,117,8.03,14.570361145703613
6079,52,RUM RIVER SPECIAL EDUCATION COOP,2005,NA,NA,NA
6083,52,SOUTHERN MN EDUCATION CONSORTIUM,2005,NA,NA,NA
6090,52,SHERBURNE AND NORTHERN WRIGHT SPECI,2005,NA,NA,NA
6094,52,CANNON VALLEY SPECIAL EDUCATION COO,2005,NA,NA,NA
6095,52,AUSTIN ALBERT LEA AREA SPECIAL EDUC,2005,NA,NA,NA
6096,52,NORTHERN LIGHTS ACADEMY COOPERATIVE,2005,NA,NA,NA
6383,61,BENTON-STEARNS ED. DISTRICT,2005,61,14.54,4.195323246217332
6979,61,MID STATE EDUCATION DISTRICT,2005,19,10.06,1.8886679920477136
0001,01,AITKIN PUBLIC SCHOOL DISTRICT,2004,1322,90.26,14.646576556614225
0001,03,MINNEAPOLIS PUBLIC SCHOOL DISTRICT,2004,43397,2958.16,14.67026800443519
0002,01,HILL CITY PUBLIC SCHOOL DISTRICT,2004,362,28.8,12.569444444444445
0004,01,MCGREGOR PUBLIC SCHOOL DISTRICT,2004,519,43.17,12.02223766504517
0006,03,SOUTH ST. PAUL PUBLIC SCHOOL DIST.,2004,3369,180.70999999999998,18.643129876597865
0011,01,ANOKA-HENNEPIN PUBLIC SCHOOL DIST.,2004,41254,2345.3700000000003,17.589548770556455
0012,01,CENTENNIAL PUBLIC SCHOOL DISTRICT,2004,7051,382.53,18.432541238595668
0013,01,COLUMBIA HEIGHTS PUBLIC SCHOOL DIST,2004,2971,183.84,16.160791993037424
0014,01,FRIDLEY PUBLIC SCHOOL DISTRICT,2004,2581,150.53,17.146083837108883
0015,01,ST. FRANCIS PUBLIC SCHOOL DISTRICT,2004,5946,297.12,20.01211631663974
0016,01,SPRING LAKE PARK PUBLIC SCHOOLS,2004,4319,234,18.457264957264957
0022,01,DETROIT LAKES PUBLIC SCHOOL DIST.,2004,2784,200.73,13.869376774772082
0023,01,FRAZEE-VERGAS PUBLIC SCHOOL DIST.,2004,1192,80.26,14.851731871417892
0025,01,PINE POINT PUBLIC SCHOOL DISTRICT,2004,69,8.99,7.675194660734149
0031,01,BEMIDJI PUBLIC SCHOOL DISTRICT,2004,4901,324.83,15.08789212819013
0032,01,BLACKDUCK PUBLIC SCHOOL DISTRICT,2004,791,55.54,14.24198775657184
0036,01,KELLIHER PUBLIC SCHOOL DISTRICT,2004,278,24.86,11.182622687047466
0038,01,RED LAKE PUBLIC SCHOOL DISTRICT,2004,1503,160.66,9.355159965143782
0047,01,SAUK RAPIDS-RICE PUBLIC SCHOOLS,2004,3605,213.38000000000002,16.894741775236664
0051,01,FOLEY PUBLIC SCHOOL DISTRICT,2004,1677,96.54,17.371037911746424
0075,01,ST. CLAIR PUBLIC SCHOOL DISTRICT,2004,652,42.2,15.450236966824644
0077,01,MANKATO PUBLIC SCHOOL DISTRICT,2004,7087,432.19,16.397880561789954
0081,01,COMFREY PUBLIC SCHOOL DISTRICT,2004,162,17.71,9.14737436476567
0084,01,SLEEPY EYE PUBLIC SCHOOL DISTRICT,2004,659,47.43,13.89415981446342
0085,01,SPRINGFIELD PUBLIC SCHOOL DISTRICT,2004,679,43.71,15.534202699611072
0088,01,NEW ULM PUBLIC SCHOOL DISTRICT,2004,2379,157.19,15.13455054392773
0091,01,BARNUM PUBLIC SCHOOL DISTRICT,2004,660,41.620000000000005,15.85776069197501
0093,01,CARLTON PUBLIC SCHOOL DISTRICT,2004,663,44.339999999999996,14.952638700947228
0094,01,CLOQUET PUBLIC SCHOOL DISTRICT,2004,2348,126.36,18.581829692940804
0095,01,CROMWELL-WRIGHT PUBLIC SCHOOLS,2004,300,24.59,12.20008133387556
0097,01,MOOSE LAKE PUBLIC SCHOOL DISTRICT,2004,804,52.54,15.302626570232205
0099,01,ESKO PUBLIC SCHOOL DISTRICT,2004,1137,60.730000000000004,18.72221307426313
0100,01,WRENSHALL PUBLIC SCHOOL DISTRICT,2004,370,23.23,15.927679724494189
0108,01,CENTRAL PUBLIC SCHOOL DISTRICT,2004,1011,65.55,15.423340961098399
0110,01,WACONIA PUBLIC SCHOOL DISTRICT,2004,2419,133.28,18.149759903961584
0111,01,WATERTOWN-MAYER PUBLIC SCHOOL DIST.,2004,1483,83.44000000000001,17.77325023969319
0112,01,EASTERN CARVER COUNTY PUBLIC SCHOOL,2004,8036,459.05,17.505718331336457
0113,01,WALKER-HACKENSACK-AKELEY SCHL. DIST,2004,1027,69.88,14.69662278191185
0115,01,CASS LAKE-BENA PUBLIC SCHOOLS,2004,1171,105.34,11.116385038921587
0116,01,PILLAGER PUBLIC SCHOOL DISTRICT,2004,762,49.120000000000005,15.51302931596091
0118,01,NORTHLAND COMMUNITY SCHOOLS,2004,532,51.720000000000006,10.286156225831398
0129,01,MONTEVIDEO PUBLIC SCHOOL DISTRICT,2004,1465,105.6,13.87310606060606
0138,01,NORTH BRANCH PUBLIC SCHOOLS,2004,3972,197.13,20.149140161314868
0139,01,RUSH CITY PUBLIC SCHOOL DISTRICT,2004,986,56,17.607142857142858
0146,01,BARNESVILLE PUBLIC SCHOOL DIST.,2004,780,45.77,17.041730391085864
0150,01,HAWLEY PUBLIC SCHOOL DISTRICT,2004,890,58.230000000000004,15.284217757169843
0152,01,MOORHEAD PUBLIC SCHOOL DISTRICT,2004,5365,347.62,15.43351936022093
0160,70,MINNESOTA STATE ACADEMIES,2004,219,40.07,5.4654354878961815
0162,01,BAGLEY PUBLIC SCHOOL DISTRICT,2004,1080,83.3,12.965186074429772
0166,01,COOK COUNTY PUBLIC SCHOOLS,2004,644,40.96,15.72265625
0173,01,MOUNTAIN LAKE PUBLIC SCHOOLS,2004,526,39.82,13.209442491210448
0177,01,WINDOM PUBLIC SCHOOL DISTRICT,2004,1040,76.05,13.675213675213676
0181,01,BRAINERD PUBLIC SCHOOL DISTRICT,2004,7258,439.04,16.53152332361516
0182,01,CROSBY-IRONTON PUBLIC SCHOOL DIST.,2004,1426,75.52,18.88241525423729
0186,01,PEQUOT LAKES PUBLIC SCHOOLS,2004,1384,83.63,16.549085256486908
0191,01,BURNSVILLE PUBLIC SCHOOL DISTRICT,2004,11220,700.3599999999999,16.020332400479756
0192,01,FARMINGTON PUBLIC SCHOOL DISTRICT,2004,5451,303.16,17.980604301359016
0194,01,LAKEVILLE PUBLIC SCHOOL DISTRICT,2004,10512,602.24,17.454835281615303
0195,01,RANDOLPH PUBLIC SCHOOL DISTRICT,2004,479,32.83,14.590313737435274
0196,01,ROSEMOUNT-APPLE VALLEY-EAGAN,2004,28561,1755.51,16.26934622987052
0197,01,WEST ST. PAUL-MENDOTA HTS.-EAGAN,2004,4789,310.57,15.42003413079177
0199,01,INVER GROVE HEIGHTS SCHOOLS,2004,3878,214.8,18.054003724394786
0200,01,HASTINGS PUBLIC SCHOOL DISTRICT,2004,5146,254.53,20.2176560719758
0203,01,HAYFIELD PUBLIC SCHOOL DISTRICT,2004,920,58.96,15.603799185888738
0204,01,KASSON-MANTORVILLE SCHOOL DISTRICT,2004,1895,110.96000000000001,17.078226387887526
0206,01,ALEXANDRIA PUBLIC SCHOOL DISTRICT,2004,4153,256.22999999999996,16.208094290286073
0213,01,OSAKIS PUBLIC SCHOOL DISTRICT,2004,666,42.8,15.560747663551403
0227,01,CHATFIELD PUBLIC SCHOOLS,2004,939,59.82,15.697091273821464
0229,01,LANESBORO PUBLIC SCHOOL DISTRICT,2004,350,27.89,12.54930082466834
0238,01,MABEL-CANTON PUBLIC SCHOOL DIST.,2004,365,28.06,13.007840342124021
0239,01,RUSHFORD-PETERSON PUBLIC SCHOOLS,2004,692,44.349999999999994,15.603156708004512
0241,01,ALBERT LEA PUBLIC SCHOOL DISTRICT,2004,3644,226.01,16.12318039024822
0242,01,ALDEN-CONGER PUBLIC SCHOOL DISTRICT,2004,433,31.09,13.927307816018013
0252,01,CANNON FALLS PUBLIC SCHOOL DISTRICT,2004,1421,90.82,15.646333406738606
0253,01,GOODHUE PUBLIC SCHOOL DISTRICT,2004,600,36.53,16.424856282507527
0255,01,PINE ISLAND PUBLIC SCHOOL DIST.,2004,1247,81.51,15.29873635136793
0256,01,RED WING PUBLIC SCHOOL DISTRICT,2004,3011,161.23,18.67518451901011
0261,01,ASHBY PUBLIC SCHOOL DISTRICT,2004,292,22.22,13.141314131413141
0264,01,HERMAN-NORCROSS SCHOOL DISTRICT,2004,126,16.71,7.5403949730700175
0270,01,HOPKINS PUBLIC SCHOOL DISTRICT,2004,8320,492.57,16.891000263921878
0271,01,BLOOMINGTON PUBLIC SCHOOL DISTRICT,2004,10653,604.24,17.63041175691778
0272,01,EDEN PRAIRIE PUBLIC SCHOOL DISTRICT,2004,10326,564.63,18.28808246108071
0273,01,EDINA PUBLIC SCHOOL DISTRICT,2004,7313,419.96,17.413563196494906
0276,01,MINNETONKA PUBLIC SCHOOL DISTRICT,2004,7646,462.21999999999997,16.541906451473327
0277,01,WESTONKA PUBLIC SCHOOL DISTRICT,2004,2270,135.4,16.76514032496307
0278,01,ORONO PUBLIC SCHOOL DISTRICT,2004,2532,136.5,18.54945054945055
0279,01,OSSEO PUBLIC SCHOOL DISTRICT,2004,21698,1199.21,18.093578272362638
0280,01,RICHFIELD PUBLIC SCHOOL DISTRICT,2004,4105,263.56,15.575201092730309
0281,01,ROBBINSDALE PUBLIC SCHOOL DISTRICT,2004,13762,768.4,17.90994273815721
0282,01,ST. ANTHONY-NEW BRIGHTON SCHOOLS,2004,1645,91.64,17.95067656045395
0283,01,ST. LOUIS PARK PUBLIC SCHOOL DIST.,2004,4348,287.16,15.141384593954589
0284,01,WAYZATA PUBLIC SCHOOL DISTRICT,2004,9718,471.21999999999997,20.623063537201308
0286,01,BROOKLYN CENTER SCHOOL DISTRICT,2004,1732,103,16.815533980582526
0287,06,INTERMEDIATE SCHOOL DISTRICT 287,2004,2026,304.02,6.664035260838103
0288,06,SOUTHWEST METRO INTERMEDIATE 288,2004,NA,NA,NA
0294,01,HOUSTON PUBLIC SCHOOL DISTRICT,2004,754,47.790000000000006,15.777359280184136
0297,01,SPRING GROVE SCHOOL DISTRICT,2004,370,25.85,14.313346228239844
0299,01,CALEDONIA PUBLIC SCHOOL DISTRICT,2004,936,67.8,13.805309734513274
0300,01,LA CRESCENT-HOKAH SCHOOL DISTRICT,2004,1609,89.86,17.90563098152682
0306,01,LAPORTE PUBLIC SCHOOL DISTRICT,2004,308,27.72,11.11111111111111
0308,01,NEVIS PUBLIC SCHOOL DISTRICT,2004,553,40.48,13.66106719367589
0309,01,PARK RAPIDS PUBLIC SCHOOL DISTRICT,2004,1755,102.57,17.11026615969582
0314,01,BRAHAM PUBLIC SCHOOL DISTRICT,2004,957,56.54,16.926070038910506
0316,01,GREENWAY PUBLIC SCHOOL DISTRICT,2004,1278,81.85,15.613927916921199
0317,01,DEER RIVER PUBLIC SCHOOL DISTRICT,2004,1026,77.05,13.316028552887735
0318,01,GRAND RAPIDS PUBLIC SCHOOL DISTRICT,2004,4034,232.4,17.35800344234079
0319,01,NASHWAUK-KEEWATIN SCHOOL DISTRICT,2004,671,42.339999999999996,15.847897968823808
0330,01,HERON LAKE-OKABENA SCHOOL DISTRICT,2004,331,25.919999999999998,12.770061728395063
0332,01,MORA PUBLIC SCHOOL DISTRICT,2004,1927,114.22,16.870950796708108
0333,01,OGILVIE PUBLIC SCHOOL DISTRICT,2004,691,48.91,14.127990186056023
0345,01,NEW LONDON-SPICER SCHOOL DISTRICT,2004,1726,105.41000000000001,16.374158049520915
0347,01,WILLMAR PUBLIC SCHOOL DISTRICT,2004,4285,308.46999999999997,13.891140143287842
0356,01,LANCASTER PUBLIC SCHOOL DISTRICT,2004,213,18.84,11.305732484076433
0361,01,INTERNATIONAL FALLS SCHOOL DISTRICT,2004,1423,79.44000000000001,17.912890231621347
0362,01,LITTLEFORK-BIG FALLS SCHOOL DIST.,2004,362,21.32,16.97936210131332
0363,01,SOUTH KOOCHICHING SCHOOL DISTRICT,2004,381,45.1,8.447893569844789
0378,01,DAWSON-BOYD PUBLIC SCHOOL DISTRICT,2004,588,41.05,14.323995127892815
0381,01,LAKE SUPERIOR PUBLIC SCHOOL DIST.,2004,1625,97.9,16.598569969356486
0390,01,LAKE OF THE WOODS SCHOOL DISTRICT,2004,701,44.03,15.920962979786509
0391,01,CLEVELAND PUBLIC SCHOOL DISTRICT,2004,419,29.74,14.088769334229994
0397,52,LAKE AGASSIZ SPECIAL ED. COOP.,2004,27,3,9
0398,52,MIDWEST SPECIAL EDUCATION COOP.,2004,5,3.53,1.41643059490085
0402,01,HENDRICKS PUBLIC SCHOOL DISTRICT,2004,201,16.51,12.17443973349485
0403,01,IVANHOE PUBLIC SCHOOL DISTRICT,2004,201,17.62,11.40749148694665
0404,01,LAKE BENTON PUBLIC SCHOOL DISTRICT,2004,205,18.5,11.08108108108108
0413,01,MARSHALL PUBLIC SCHOOL DISTRICT,2004,2235,159.13,14.045120341858858
0414,01,MINNEOTA PUBLIC SCHOOL DISTRICT,2004,466,38.190000000000005,12.20214715894213
0415,01,LYND PUBLIC SCHOOL DISTRICT,2004,100,12.54,7.974481658692185
0423,01,HUTCHINSON PUBLIC SCHOOL DISTRICT,2004,3072,180.9,16.981757877280266
0424,01,LESTER PRAIRIE PUBLIC SCHOOL DIST.,2004,484,33.04,14.648910411622277
0432,01,MAHNOMEN PUBLIC SCHOOL DISTRICT,2004,728,61,11.934426229508198
0435,01,WAUBUN-OGEMA-WHITE EARTH PUBLIC SCH,2004,613,52.09,11.768093684008447
0441,01,MARSHALL COUNTY CENTRAL SCHOOLS,2004,368,31.37,11.73095313994262
0447,01,GRYGLA PUBLIC SCHOOL DISTRICT,2004,217,19.07,11.379129522810697
0458,01,TRUMAN PUBLIC SCHOOL DISTRICT,2004,378,22.23,17.00404858299595
0463,01,EDEN VALLEY-WATKINS SCHOOL DISTRICT,2004,838,57.32,14.619678995115143
0465,01,LITCHFIELD PUBLIC SCHOOL DISTRICT,2004,1950,124.34,15.682805211516808
0466,01,DASSEL-COKATO PUBLIC SCHOOL DIST.,2004,2270,131.65,17.242688947968098
0473,01,ISLE PUBLIC SCHOOL DISTRICT,2004,584,36.720000000000006,15.904139433551196
0477,01,PRINCETON PUBLIC SCHOOL DISTRICT,2004,3439,193.28,17.79283940397351
0480,01,ONAMIA PUBLIC SCHOOL DISTRICT,2004,848,64.46000000000001,13.1554452373565
0482,01,LITTLE FALLS PUBLIC SCHOOL DISTRICT,2004,2973,179.13,16.596884943895496
0484,01,PIERZ PUBLIC SCHOOL DISTRICT,2004,992,66.61999999999999,14.890423296307418
0485,01,ROYALTON PUBLIC SCHOOL DISTRICT,2004,744,48.58,15.314944421572664
0486,01,SWANVILLE PUBLIC SCHOOL DISTRICT,2004,363,28.8,12.604166666666666
0487,01,UPSALA PUBLIC SCHOOL DISTRICT,2004,397,29.54,13.439404197698037
0492,01,AUSTIN PUBLIC SCHOOL DISTRICT,2004,4086,246.12,16.601657727937592
0495,01,GRAND MEADOW PUBLIC SCHOOL DISTRICT,2004,346,23.45,14.754797441364605
0497,01,LYLE PUBLIC SCHOOL DISTRICT,2004,273,25.59,10.668229777256741
0499,01,LEROY-OSTRANDER PUBLIC SCHOOLS,2004,373,30.1,12.39202657807309
0500,01,SOUTHLAND PUBLIC SCHOOL DISTRICT,2004,721,50.44,14.29421094369548
0505,01,FULDA PUBLIC SCHOOL DISTRICT,2004,542,39.309999999999995,13.78784024421267
0507,01,NICOLLET PUBLIC SCHOOL DISTRICT,2004,296,18.6,15.913978494623654
0508,01,ST. PETER PUBLIC SCHOOL DISTRICT,2004,1880,127.72,14.719699342311307
0511,01,ADRIAN PUBLIC SCHOOL DISTRICT,2004,661,47.09,14.036950520280314
0514,01,ELLSWORTH PUBLIC SCHOOL DISTRICT,2004,199,19.68,10.111788617886178
0518,01,WORTHINGTON PUBLIC SCHOOL DISTRICT,2004,2296,161.12,14.250248262164845
0531,01,BYRON PUBLIC SCHOOL DISTRICT,2004,1551,89.92,17.248665480427047
0533,01,DOVER-EYOTA PUBLIC SCHOOL DISTRICT,2004,1111,66.59,16.684186814837062
0534,01,STEWARTVILLE PUBLIC SCHOOL DISTRICT,2004,1771,102.83,17.222600408441117
0535,01,ROCHESTER PUBLIC SCHOOL DISTRICT,2004,16470,948.74,17.35986677066425
0542,01,BATTLE LAKE PUBLIC SCHOOL DISTRICT,2004,528,35.849999999999994,14.72803347280335
0544,01,FERGUS FALLS PUBLIC SCHOOL DISTRICT,2004,2801,191.43,14.631980358355534
0545,01,HENNING PUBLIC SCHOOL DISTRICT,2004,351,26.43,13.280363223609534
0547,01,PARKERS PRAIRIE PUBLIC SCHOOL DIST.,2004,585,43.36,13.49169741697417
0548,01,PELICAN RAPIDS PUBLIC SCHOOL DIST.,2004,1192,85.83,13.88791797739718
0549,01,PERHAM-DENT PUBLIC SCHOOL DISTRICT,2004,1639,107.7,15.21819870009285
0550,01,UNDERWOOD PUBLIC SCHOOL DISTRICT,2004,475,33.89,14.015933903806433
0553,01,NEW YORK MILLS PUBLIC SCHOOL DIST.,2004,752,48.96,15.359477124183007
0561,01,GOODRIDGE PUBLIC SCHOOL DISTRICT,2004,167,16.64,10.036057692307692
0564,01,THIEF RIVER FALLS SCHOOL DISTRICT,2004,2095,138.6,15.115440115440116
0577,01,WILLOW RIVER PUBLIC SCHOOL DISTRICT,2004,465,34.97,13.297111810122964
0578,01,PINE CITY PUBLIC SCHOOL DISTRICT,2004,1717,106.42,16.134185303514375
0581,01,EDGERTON PUBLIC SCHOOL DISTRICT,2004,288,25.21,11.424038080126934
0592,01,CLIMAX-SHELLY PUBLIC SCHOOLS,2004,148,18.45,8.021680216802169
0593,01,CROOKSTON PUBLIC SCHOOL DISTRICT,2004,1517,93.74000000000001,16.183059526349474
0595,01,EAST GRAND FORKS PUBLIC SCHOOL DIST,2004,1801,112.85,15.959237926451042
0599,01,FERTILE-BELTRAMI SCHOOL DISTRICT,2004,551,40.82,13.49828515433611
