districtNumber,districtType,districtName,year,totalStudents,totalTeachers,studentTeacherRatio
0001,01,AITKIN PUBLIC SCHOOL DISTRICT,2018,2352,167.52,14.040114613180515
0001,03,MINNEAPOLIS PUBLIC SCHOOL DISTRICT,2018,72714,5328.58,13.646037030503436
0002,01,HILL CITY PUBLIC SCHOOL DISTRICT,2018,564,53.26,10.589560645888097
0004,01,MCGREGOR PUBLIC SCHOOL DISTRICT,2018,966,75.68,12.764270613107822
0006,03,SOUTH ST. PAUL PUBLIC SCHOOL DIST.,2018,7108,441.9,16.085087123783662
0011,01,ANOKA-HENNEPIN PUBLIC SCHOOL DIST.,2018,77528,4449.62,17.423510322229763
0012,01,CENTENNIAL PUBLIC SCHOOL DISTRICT,2018,13414,716.72,18.715816497376938
0013,01,COLUMBIA HEIGHTS PUBLIC SCHOOL DIST,2018,6644,424.16,15.663900414937759
0014,01,FRIDLEY PUBLIC SCHOOL DISTRICT,2018,6414,393.66,16.29324798049078
0015,01,ST. FRANCIS PUBLIC SCHOOL DISTRICT,2018,9136,561.22,16.278821139660025
0016,01,SPRING LAKE PARK PUBLIC SCHOOLS,2018,11754,661.34,17.7730063205008
0022,01,DETROIT LAKES PUBLIC SCHOOL DIST.,2018,6162,436.68,14.11101951085463
0023,01,FRAZEE-VERGAS PUBLIC SCHOOL DIST.,2018,1854,135.26,13.70693479225196
0025,01,PINE POINT PUBLIC SCHOOL DISTRICT,2018,128,20,6.4
0031,01,BEMIDJI PUBLIC SCHOOL DISTRICT,2018,10462,682.4,15.331184056271981
0032,01,BLACKDUCK PUBLIC SCHOOL DISTRICT,2018,1284,100.06,12.832300619628223
0036,01,KELLIHER PUBLIC SCHOOL DISTRICT,2018,562,50.36,11.159650516282765
0038,01,RED LAKE PUBLIC SCHOOL DISTRICT,2018,3166,281.92,11.230136208853574
0047,01,SAUK RAPIDS-RICE PUBLIC SCHOOLS,2018,9214,536.14,17.185809676577016
0051,01,FOLEY PUBLIC SCHOOL DISTRICT,2018,3964,230.68,17.18397780475117
0075,01,ST. CLAIR PUBLIC SCHOOL DISTRICT,2018,1354,94.22,14.370621948630864
0077,01,MANKATO PUBLIC SCHOOL DISTRICT,2018,17560,1129.4,15.548078625819018
0081,01,COMFREY PUBLIC SCHOOL DISTRICT,2018,288,32.5,8.861538461538462
0084,01,SLEEPY EYE PUBLIC SCHOOL DISTRICT,2018,1236,91.38,13.525935653315825
0085,01,SPRINGFIELD PUBLIC SCHOOL DISTRICT,2018,1116,84.9,13.144876325088338
0088,01,NEW ULM PUBLIC SCHOOL DISTRICT,2018,4210,292.98,14.369581541402143
0091,01,BARNUM PUBLIC SCHOOL DISTRICT,2018,1504,111.88,13.442974615659637
0093,01,CARLTON PUBLIC SCHOOL DISTRICT,2018,928,81.82,11.34197017844048
0094,01,CLOQUET PUBLIC SCHOOL DISTRICT,2018,5250,344,15.261627906976743
0095,01,CROMWELL-WRIGHT PUBLIC SCHOOLS,2018,642,48.54,13.22620519159456
0097,01,MOOSE LAKE PUBLIC SCHOOL DISTRICT,2018,1340,89.14,15.032533094009423
0099,01,ESKO PUBLIC SCHOOL DISTRICT,2018,2534,144.56,17.529053680132815
0100,01,WRENSHALL PUBLIC SCHOOL DISTRICT,2018,784,62.38,12.568130811157422
0108,01,CENTRAL PUBLIC SCHOOL DISTRICT,2018,2058,138.08,14.904403244495944
0110,01,WACONIA PUBLIC SCHOOL DISTRICT,2018,8168,508.64,16.05850896508336
0111,01,WATERTOWN-MAYER PUBLIC SCHOOL DIST.,2018,3148,190.52,16.52319966407726
0112,01,EASTERN CARVER COUNTY PUBLIC SCHOOL,2018,19694,1186.52,16.598118868624212
0113,01,WALKER-HACKENSACK-AKELEY SCHL. DIST,2018,1608,121.2,13.267326732673267
0115,01,CASS LAKE-BENA PUBLIC SCHOOLS,2018,2414,236.84,10.192535044755953
0116,01,PILLAGER PUBLIC SCHOOL DISTRICT,2018,2224,144.08,15.43586896168795
0118,01,NORTHLAND COMMUNITY SCHOOLS,2018,690,59.7,11.557788944723617
0129,01,MONTEVIDEO PUBLIC SCHOOL DISTRICT,2018,2808,186.12,15.087040618955513
0138,01,NORTH BRANCH PUBLIC SCHOOLS,2018,5916,311.66,18.982224218699862
0139,01,RUSH CITY PUBLIC SCHOOL DISTRICT,2018,1744,104.62,16.669852800611736
0146,01,BARNESVILLE PUBLIC SCHOOL DIST.,2018,1708,110.82,15.412380436744272
0150,01,HAWLEY PUBLIC SCHOOL DISTRICT,2018,1962,123.24,15.920155793573516
0152,01,MOORHEAD PUBLIC SCHOOL DISTRICT,2018,13598,844.62,16.099547725604413
0160,70,MINNESOTA STATE ACADEMIES,2018,318,70,4.542857142857143
0162,01,BAGLEY PUBLIC SCHOOL DISTRICT,2018,2112,143.68,14.699331848552339
0166,01,COOK COUNTY PUBLIC SCHOOLS,2018,1030,76.78,13.414951810367283
0173,01,MOUNTAIN LAKE PUBLIC SCHOOLS,2018,1030,75.04,13.726012793176972
0177,01,WINDOM PUBLIC SCHOOL DISTRICT,2018,2116,158.7,13.333333333333334
0181,01,BRAINERD PUBLIC SCHOOL DISTRICT,2018,13488,834.24,16.16800920598389
0182,01,CROSBY-IRONTON PUBLIC SCHOOL DIST.,2018,2102,136.4,15.410557184750733
0186,01,PEQUOT LAKES PUBLIC SCHOOLS,2018,3412,208.48,16.366078280890253
0191,01,BURNSVILLE PUBLIC SCHOOL DISTRICT,2018,18060,1199.64,15.05451635490647
0192,01,FARMINGTON PUBLIC SCHOOL DISTRICT,2018,14514,878.62,16.519086749675626
0194,01,LAKEVILLE PUBLIC SCHOOL DISTRICT,2018,22200,1191.56,18.631038302729195
0195,01,RANDOLPH PUBLIC SCHOOL DISTRICT,2018,1324,86.34,15.334723187398655
0196,01,ROSEMOUNT-APPLE VALLEY-EAGAN,2018,57604,3454.8,16.67361352321408
0197,01,WEST ST. PAUL-MENDOTA HTS.-EAGAN,2018,10344,657.76,15.726100705424471
0199,01,INVER GROVE HEIGHTS SCHOOLS,2018,7376,357.98,20.60450304486284
0200,01,HASTINGS PUBLIC SCHOOL DISTRICT,2018,8832,493.5,17.896656534954406
0203,01,HAYFIELD PUBLIC SCHOOL DISTRICT,2018,1368,92.2,14.837310195227765
0204,01,KASSON-MANTORVILLE SCHOOL DISTRICT,2018,4356,239.22,18.209179834462002
0206,01,ALEXANDRIA PUBLIC SCHOOL DISTRICT,2018,8460,555.28,15.235556836190751
0213,01,OSAKIS PUBLIC SCHOOL DISTRICT,2018,1632,107.04,15.246636771300448
0227,01,CHATFIELD PUBLIC SCHOOLS,2018,1834,119.14,15.393654524089307
0229,01,LANESBORO PUBLIC SCHOOL DISTRICT,2018,714,54.42,13.120176405733186
0238,01,MABEL-CANTON PUBLIC SCHOOL DIST.,2018,528,47.32,11.158072696534235
0239,01,RUSHFORD-PETERSON PUBLIC SCHOOLS,2018,1312,107.66,12.186513096786179
0241,01,ALBERT LEA PUBLIC SCHOOL DISTRICT,2018,7070,491.24,14.392150476345574
0242,01,ALDEN-CONGER PUBLIC SCHOOL DISTRICT,2018,994,69.82,14.236608421655687
0252,01,CANNON FALLS PUBLIC SCHOOL DISTRICT,2018,2298,158.98,14.454648383444459
0253,01,GOODHUE PUBLIC SCHOOL DISTRICT,2018,1314,87.86,14.955611199635785
0255,01,PINE ISLAND PUBLIC SCHOOL DIST.,2018,2652,173.66,15.271219624553726
0256,01,RED WING PUBLIC SCHOOL DISTRICT,2018,5380,339.94,15.826322292169207
0261,01,ASHBY PUBLIC SCHOOL DISTRICT,2018,520,42.76,12.160898035547241
0264,01,HERMAN-NORCROSS SCHOOL DISTRICT,2018,224,24.56,9.120521172638437
0270,01,HOPKINS PUBLIC SCHOOL DISTRICT,2018,13438,923.14,14.556838616027905
0271,01,BLOOMINGTON PUBLIC SCHOOL DISTRICT,2018,21336,1423.56,14.987777122144484
0272,01,EDEN PRAIRIE PUBLIC SCHOOL DISTRICT,2018,17744,1114.42,15.922183736831714
0273,01,EDINA PUBLIC SCHOOL DISTRICT,2018,17176,988.42,17.377228303757512
0276,01,MINNETONKA PUBLIC SCHOOL DISTRICT,2018,21706,1319.68,16.44792677012609
0277,01,WESTONKA PUBLIC SCHOOL DISTRICT,2018,4784,281,17.02491103202847
0278,01,ORONO PUBLIC SCHOOL DISTRICT,2018,5686,335.36,16.954914122137403
0279,01,OSSEO PUBLIC SCHOOL DISTRICT,2018,42442,2577.82,16.46429929164953
0280,01,RICHFIELD PUBLIC SCHOOL DISTRICT,2018,8822,536.16,16.454043569083858
0281,01,ROBBINSDALE PUBLIC SCHOOL DISTRICT,2018,25106,1523.98,16.473969474665022
0282,01,ST. ANTHONY-NEW BRIGHTON SCHOOLS,2018,3664,209.4,17.49761222540592
0283,01,ST. LOUIS PARK PUBLIC SCHOOL DIST.,2018,9480,610.96,15.516564095849155
0284,01,WAYZATA PUBLIC SCHOOL DISTRICT,2018,23412,1413.5,16.563141139016626
0286,01,BROOKLYN CENTER SCHOOL DISTRICT,2018,5132,305.86,16.77891845942588
0287,06,INTERMEDIATE SCHOOL DISTRICT 287,2018,2310,559.52,4.128538747497855
0288,06,SOUTHWEST METRO INTERMEDIATE 288,2018,574,136.4,4.2082111436950145
0294,01,HOUSTON PUBLIC SCHOOL DISTRICT,2018,4080,233.14,17.500214463412544
0297,01,SPRING GROVE SCHOOL DISTRICT,2018,690,55.82,12.361160874238625
0299,01,CALEDONIA PUBLIC SCHOOL DISTRICT,2018,1380,98.46,14.015843997562463
0300,01,LA CRESCENT-HOKAH SCHOOL DISTRICT,2018,2282,151.18,15.094589231379812
0306,01,LAPORTE PUBLIC SCHOOL DISTRICT,2018,654,48.08,13.602329450915143
0308,01,NEVIS PUBLIC SCHOOL DISTRICT,2018,1258,85.94,14.638119618338376
0309,01,PARK RAPIDS PUBLIC SCHOOL DISTRICT,2018,3348,231.62,14.454710301355668
0314,01,BRAHAM PUBLIC SCHOOL DISTRICT,2018,1476,93.76,15.742320819112628
0316,01,GREENWAY PUBLIC SCHOOL DISTRICT,2018,2174,136.84,15.887167494884537
0317,01,DEER RIVER PUBLIC SCHOOL DISTRICT,2018,1902,146.56,12.977620087336245
0318,01,GRAND RAPIDS PUBLIC SCHOOL DISTRICT,2018,8262,491.78,16.800195209239906
0319,01,NASHWAUK-KEEWATIN SCHOOL DISTRICT,2018,1268,90.42,14.02344614023446
0330,01,HERON LAKE-OKABENA SCHOOL DISTRICT,2018,614,55.6,11.043165467625899
0332,01,MORA PUBLIC SCHOOL DISTRICT,2018,3318,227.22,14.602587800369685
0333,01,OGILVIE PUBLIC SCHOOL DISTRICT,2018,1000,69.4,14.40922190201729
0345,01,NEW LONDON-SPICER SCHOOL DISTRICT,2018,3036,191.04,15.891959798994975
0347,01,WILLMAR PUBLIC SCHOOL DISTRICT,2018,8764,572.18,15.31685833129435
0356,01,LANCASTER PUBLIC SCHOOL DISTRICT,2018,358,36.84,9.717698154180239
0361,01,INTERNATIONAL FALLS SCHOOL DISTRICT,2018,2138,130.76,16.350565922300397
0362,01,LITTLEFORK-BIG FALLS SCHOOL DIST.,2018,678,43.14,15.716272600834492
0363,01,SOUTH KOOCHICHING SCHOOL DISTRICT,2018,580,74.18,7.818819088703154
0378,01,DAWSON-BOYD PUBLIC SCHOOL DISTRICT,2018,1134,84.68,13.391591875295228
0381,01,LAKE SUPERIOR PUBLIC SCHOOL DIST.,2018,2776,206.64,13.43399148277197
0390,01,LAKE OF THE WOODS SCHOOL DISTRICT,2018,902,74.62,12.087912087912088
0391,01,CLEVELAND PUBLIC SCHOOL DISTRICT,2018,1028,69.5,14.79136690647482
0397,52,LAKE AGASSIZ SPECIAL ED. COOP.,2018,138,12.1,11.40495867768595
0398,52,MIDWEST SPECIAL EDUCATION COOP.,2018,40,2.18,18.34862385321101
0402,01,HENDRICKS PUBLIC SCHOOL DISTRICT,2018,264,40.06,6.590114827758362
0403,01,IVANHOE PUBLIC SCHOOL DISTRICT,2018,182,17,10.705882352941176
0404,01,LAKE BENTON PUBLIC SCHOOL DISTRICT,2018,280,24.6,11.38211382113821
0413,01,MARSHALL PUBLIC SCHOOL DISTRICT,2018,5276,393.82,13.39698339342847
0414,01,MINNEOTA PUBLIC SCHOOL DISTRICT,2018,1062,86.58,12.266112266112266
0415,01,LYND PUBLIC SCHOOL DISTRICT,2018,330,43.9,7.517084282460137
0423,01,HUTCHINSON PUBLIC SCHOOL DISTRICT,2018,5916,356.36,16.601189808059264
0424,01,LESTER PRAIRIE PUBLIC SCHOOL DIST.,2018,886,65.28,13.572303921568627
0432,01,MAHNOMEN PUBLIC SCHOOL DISTRICT,2018,1306,112.94,11.563662121480432
0435,01,WAUBUN-OGEMA-WHITE EARTH PUBLIC SCH,2018,1342,117.36,11.43490115882754
0441,01,MARSHALL COUNTY CENTRAL SCHOOLS,2018,808,72.32,11.172566371681418
0447,01,GRYGLA PUBLIC SCHOOL DISTRICT,2018,306,35.92,8.518930957683741
0458,01,TRUMAN PUBLIC SCHOOL DISTRICT,2018,412,40,10.3
0463,01,EDEN VALLEY-WATKINS SCHOOL DISTRICT,2018,1956,130.84,14.949556710486089
0465,01,LITCHFIELD PUBLIC SCHOOL DISTRICT,2018,3110,194.28,16.00782375952234
0466,01,DASSEL-COKATO PUBLIC SCHOOL DIST.,2018,4540,270.26,16.798638348257235
0473,01,ISLE PUBLIC SCHOOL DISTRICT,2018,914,75.82,12.054866789765235
0477,01,PRINCETON PUBLIC SCHOOL DISTRICT,2018,6774,382.74,17.698698855620002
0480,01,ONAMIA PUBLIC SCHOOL DISTRICT,2018,1304,104.82,12.440373974432362
0482,01,LITTLE FALLS PUBLIC SCHOOL DISTRICT,2018,5024,330.86,15.184670253279332
0484,01,PIERZ PUBLIC SCHOOL DISTRICT,2018,2388,153.74,15.532717575126837
0485,01,ROYALTON PUBLIC SCHOOL DISTRICT,2018,1886,123.86,15.226869045696754
0486,01,SWANVILLE PUBLIC SCHOOL DISTRICT,2018,680,50.46,13.476020610384463
0487,01,UPSALA PUBLIC SCHOOL DISTRICT,2018,744,56.76,13.107822410147993
0492,01,AUSTIN PUBLIC SCHOOL DISTRICT,2018,10476,707.02,14.817119742015786
0495,01,GRAND MEADOW PUBLIC SCHOOL DISTRICT,2018,884,79.08,11.178553363682347
0497,01,LYLE PUBLIC SCHOOL DISTRICT,2018,606,45.02,13.460684140382051
0499,01,LEROY-OSTRANDER PUBLIC SCHOOLS,2018,568,51.4,11.050583657587548
0500,01,SOUTHLAND PUBLIC SCHOOL DISTRICT,2018,868,80.7,10.755885997521684
0505,01,FULDA PUBLIC SCHOOL DISTRICT,2018,658,53.2,12.368421052631579
0507,01,NICOLLET PUBLIC SCHOOL DISTRICT,2018,772,54.58,14.14437522902162
0508,01,ST. PETER PUBLIC SCHOOL DISTRICT,2018,4510,272.62,16.543173648301664
0511,01,ADRIAN PUBLIC SCHOOL DISTRICT,2018,1170,82,14.268292682926829
0514,01,ELLSWORTH PUBLIC SCHOOL DISTRICT,2018,278,38.86,7.153885743695317
0518,01,WORTHINGTON PUBLIC SCHOOL DISTRICT,2018,7088,461.32,15.364605913465708
0531,01,BYRON PUBLIC SCHOOL DISTRICT,2018,4158,256.42,16.215583807815303
0533,01,DOVER-EYOTA PUBLIC SCHOOL DISTRICT,2018,2248,151.06,14.881504038130544
0534,01,STEWARTVILLE PUBLIC SCHOOL DISTRICT,2018,4234,269.22,15.726914790877348
0535,01,ROCHESTER PUBLIC SCHOOL DISTRICT,2018,35582,2296.42,15.494552390242202
0542,01,BATTLE LAKE PUBLIC SCHOOL DISTRICT,2018,850,65.64,12.949421084704449
0544,01,FERGUS FALLS PUBLIC SCHOOL DISTRICT,2018,5624,303.64,18.521933869055463
0545,01,HENNING PUBLIC SCHOOL DISTRICT,2018,782,62.48,12.516005121638925
0547,01,PARKERS PRAIRIE PUBLIC SCHOOL DIST.,2018,1116,81.7,13.659730722154222
0548,01,PELICAN RAPIDS PUBLIC SCHOOL DIST.,2018,1760,139.44,12.621916236374068
0549,01,PERHAM-DENT PUBLIC SCHOOL DISTRICT,2018,2938,205.4,14.30379746835443
0550,01,UNDERWOOD PUBLIC SCHOOL DISTRICT,2018,1090,74.48,14.634801288936627
0553,01,NEW YORK MILLS PUBLIC SCHOOL DIST.,2018,1516,97.08,15.61598681499794
0561,01,GOODRIDGE PUBLIC SCHOOL DISTRICT,2018,470,39.86,11.791269443050677
0564,01,THIEF RIVER FALLS SCHOOL DISTRICT,2018,4068,276.5,14.7124773960217
0577,01,WILLOW RIVER PUBLIC SCHOOL DISTRICT,2018,874,77.12,11.33298755186722
0578,01,PINE CITY PUBLIC SCHOOL DISTRICT,2018,3286,239.46,13.722542387037501
0581,01,EDGERTON PUBLIC SCHOOL DISTRICT,2018,846,70.14,12.06159110350727
0592,01,CLIMAX-SHELLY PUBLIC SCHOOLS,2018,452,42.72,10.58052434456929
0593,01,CROOKSTON PUBLIC SCHOOL DISTRICT,2018,2482,178.72,13.887645478961504
0595,01,EAST GRAND FORKS PUBLIC SCHOOL DIST,2018,3834,239.58,16.003005259203604
0599,01,FERTILE-BELTRAMI SCHOOL DISTRICT,2018,920,71.6,12.849162011173185
0600,01,FISHER PUBLIC SCHOOL DISTRICT,2018,544,41.32,13.165537270087125
0601,01,FOSSTON PUBLIC SCHOOL DISTRICT,2018,1284,92.2,13.926247288503253
0621,01,MOUNDS VIEW PUBLIC SCHOOL DISTRICT,2018,23294,1424.22,16.35561921613234
0622,01,NORTH ST PAUL-MAPLEWOOD OAKDALE DIS,2018,21534,1270.82,16.94496466848177
0623,01,ROSEVILLE PUBLIC SCHOOL DISTRICT,2018,15536,954.74,16.272493034752916
0624,01,WHITE BEAR LAKE SCHOOL DISTRICT,2018,17488,1070.54,16.335681058157565
0625,01,ST. PAUL PUBLIC SCHOOL DISTRICT,2018,74594,4919.26,15.163662827335818
0630,01,RED LAKE FALLS PUBLIC SCHOOL DIST.,2018,730,66.36,11.000602772754672
0635,01,MILROY PUBLIC SCHOOL DISTRICT,2018,60,12,5
0640,01,WABASSO PUBLIC SCHOOL DISTRICT,2018,790,68.66,11.505971453539178
0656,01,FARIBAULT PUBLIC SCHOOL DISTRICT,2018,7554,531.16,14.221703441524213
0659,01,NORTHFIELD PUBLIC SCHOOL DISTRICT,2018,8166,502.44,16.252686887986627
0671,01,HILLS-BEAVER CREEK SCHOOL DISTRICT,2018,752,57.88,12.99239806496199
0676,01,BADGER PUBLIC SCHOOL DISTRICT,2018,472,42.08,11.216730038022813
0682,01,ROSEAU PUBLIC SCHOOL DISTRICT,2018,2358,152.74,15.437999214351183
0690,01,WARROAD PUBLIC SCHOOL DISTRICT,2018,1960,112.72,17.38821859474805
0695,01,CHISHOLM PUBLIC SCHOOL DISTRICT,2018,1464,111.04,13.184438040345821
0696,01,ELY PUBLIC SCHOOL DISTRICT,2018,1200,78.16,15.353121801432959
0698,01,FLOODWOOD PUBLIC SCHOOL DISTRICT,2018,500,39.34,12.709710218607015
0700,01,HERMANTOWN PUBLIC SCHOOL DISTRICT,2018,4298,233.88,18.376945442107065
0701,01,HIBBING PUBLIC SCHOOL DISTRICT,2018,4920,292.32,16.83087027914614
0704,01,PROCTOR PUBLIC SCHOOL DISTRICT,2018,3624,218.02,16.622328226768186
0706,01,VIRGINIA PUBLIC SCHOOL DISTRICT,2018,3372,219.9,15.334242837653479
0707,01,NETT LAKE PUBLIC SCHOOL DISTRICT,2018,114,15.4,7.402597402597403
0709,01,DULUTH PUBLIC SCHOOL DISTRICT,2018,17688,1057.44,16.727190195188378
0712,01,MOUNTAIN IRON-BUHL SCHOOL DISTRICT,2018,1014,69.3,14.632034632034634
0716,01,BELLE PLAINE PUBLIC SCHOOL DISTRICT,2018,3308,193.32,17.111524932753984
0717,01,JORDAN PUBLIC SCHOOL DISTRICT,2018,3678,226.72,16.222653493295695
0719,01,PRIOR LAKE-SAVAGE AREA SCHOOLS,2018,17420,948.3,18.36971422545608
0720,01,SHAKOPEE PUBLIC SCHOOL DISTRICT,2018,16760,1033.18,16.221761938868347
0721,01,NEW PRAGUE AREA SCHOOLS,2018,8464,470.16,18.002382167772673
0726,01,BECKER PUBLIC SCHOOL DISTRICT,2018,5804,332.44,17.458789556010107
0727,01,BIG LAKE PUBLIC SCHOOL DISTRICT,2018,6182,339.38,18.215569568035832
0728,01,ELK RIVER PUBLIC SCHOOL DISTRICT,2018,26922,1426.14,18.877529555303123
0738,01,HOLDINGFORD PUBLIC SCHOOL DISTRICT,2018,2170,137.82,15.745174865766943
0739,01,KIMBALL PUBLIC SCHOOL DISTRICT,2018,1496,98.56,15.178571428571429
0740,01,MELROSE PUBLIC SCHOOL DISTRICT,2018,2638,167.96,15.706120504882113
0741,01,PAYNESVILLE PUBLIC SCHOOL DISTRICT,2018,1866,132.34,14.100045337766359
0742,01,ST. CLOUD PUBLIC SCHOOL DISTRICT,2018,20192,1397.7,14.446590827788508
0743,01,SAUK CENTRE PUBLIC SCHOOL DISTRICT,2018,2168,140.32,15.450399087799317
0745,01,ALBANY PUBLIC SCHOOL DISTRICT,2018,3576,244,14.655737704918034
0748,01,SARTELL-ST. STEPHEN SCHOOL DISTRICT,2018,7882,483.58,16.299267959799828
0750,01,ROCORI PUBLIC SCHOOL DISTRICT,2018,4200,259.42,16.189962223421478
0756,01,BLOOMING PRAIRIE PUBLIC SCHOOL DIST,2018,1468,107.56,13.648196355522499
0761,01,OWATONNA PUBLIC SCHOOL DISTRICT,2018,9952,651.84,15.26755031909671
0763,01,MEDFORD PUBLIC SCHOOL DISTRICT,2018,1822,114.28,15.943297164858242
0768,01,HANCOCK PUBLIC SCHOOL DISTRICT,2018,700,58.16,12.03576341127923
0771,01,CHOKIO-ALBERTA PUBLIC SCHOOL DIST.,2018,318,36.12,8.803986710963455
0775,01,KERKHOVEN-MURDOCK-SUNBURG,2018,1442,100.48,14.351114649681529
0777,01,BENSON PUBLIC SCHOOL DISTRICT,2018,1724,124.8,13.814102564102564
0786,01,BERTHA-HEWITT PUBLIC SCHOOL DIST.,2018,956,75.12,12.726304579339722
0787,01,BROWERVILLE PUBLIC SCHOOL DISTRICT,2018,1118,83.8,13.34128878281623
0801,01,BROWNS VALLEY PUBLIC SCHOOL DIST.,2018,328,25.76,12.732919254658384
0803,01,WHEATON AREA PUBLIC SCHOOL DISTRICT,2018,808,69.82,11.572615296476656
0811,01,WABASHA-KELLOGG PUBLIC SCHOOL DIST.,2018,1080,90.3,11.960132890365449
0813,01,LAKE CITY PUBLIC SCHOOL DISTRICT,2018,2486,174.12,14.277509763381575
0818,01,VERNDALE PUBLIC SCHOOL DISTRICT,2018,1102,87.96,12.52842201000455
0820,01,SEBEKA PUBLIC SCHOOL DISTRICT,2018,1028,81.44,12.622789783889981
0821,01,MENAHGA PUBLIC SCHOOL DISTRICT,2018,2030,140.04,14.495858326192517
0829,01,WASECA PUBLIC SCHOOL DISTRICT,2018,3908,254.64,15.347156770342446
0831,01,FOREST LAKE PUBLIC SCHOOL DISTRICT,2018,12522,689.28,18.166782729805014
0832,01,MAHTOMEDI PUBLIC SCHOOL DISTRICT,2018,6610,374.9,17.631368364897305
0833,01,SOUTH WASHINGTON COUNTY SCHOOL DIST,2018,37848,2377.24,15.920983998250072
0834,01,STILLWATER AREA PUBLIC SCHOOL DIST.,2018,16888,931.16,18.136517891662013
0836,01,BUTTERFIELD PUBLIC SCHOOL DISTRICT,2018,408,38.56,10.58091286307054
0837,01,MADELIA PUBLIC SCHOOL DISTRICT,2018,1194,84.78,14.08351026185421
0840,01,ST. JAMES PUBLIC SCHOOL DISTRICT,2018,2130,138.36,15.394622723330441
0846,01,BRECKENRIDGE PUBLIC SCHOOL DISTRICT,2018,1294,101.6,12.736220472440946
0850,01,ROTHSAY PUBLIC SCHOOL DISTRICT,2018,614,48.58,12.638946068340882
0852,01,CAMPBELL-TINTAH PUBLIC SCHOOL DIST.,2018,324,32.94,9.836065573770492
0857,01,LEWISTON-ALTURA PUBLIC SCHOOL DIST.,2018,1466,106.98,13.703495980557113
0858,01,ST. CHARLES PUBLIC SCHOOL DISTRICT,2018,1912,133.46,14.326389929566911
0861,01,WINONA AREA PUBLIC SCHOOL DISTRICT,2018,6180,427.52,14.455464071856287
0876,01,ANNANDALE PUBLIC SCHOOL DISTRICT,2018,3786,219.82,17.223182603948686
0877,01,BUFFALO-HANOVER-MONTROSE PUBLIC SCH,2018,11642,677.5,17.183763837638377
0879,01,DELANO PUBLIC SCHOOL DISTRICT,2018,5042,262.26,19.22519637001449
0881,01,MAPLE LAKE PUBLIC SCHOOL DISTRICT,2018,1694,112.88,15.007087172218286
0882,01,MONTICELLO PUBLIC SCHOOL DISTRICT,2018,8336,498.46,16.723508405890144
0883,01,ROCKFORD PUBLIC SCHOOL DISTRICT,2018,3448,213.08,16.18171578749765
0885,01,ST. MICHAEL-ALBERTVILLE SCHOOL DIST,2018,12670,714.08,17.743110015684515
0891,01,CANBY PUBLIC SCHOOL DISTRICT,2018,1140,79.12,14.408493427704752
0911,01,CAMBRIDGE-ISANTI PUBLIC SCHOOL DIST,2018,9990,564.02,17.71213786745151
0912,01,MILACA PUBLIC SCHOOL DISTRICT,2018,3660,271.58,13.476691950806392
0914,01,ULEN-HITTERDAL PUBLIC SCHOOL DIST,2018,614,54.42,11.282616685042264
0915,52,SOUTHERN PLAINS EDUCATION COOP.,2018,286,38.46,7.436297451898076
0916,06,NORTHEAST METRO 916,2018,1728,330.96,5.221174764321972
0917,06,INTERMEDIATE SCHOOL DISTRICT 917,2018,1408,241.58,5.828297044457322
0926,83,REGION 4-LAKES COUNTRY SERVICE COOP,2018,90,16.18,5.562422744128554
0935,52,FERGUS FALLS AREA SP. ED. COOP.,2018,170,16.46,10.328068043742405
0938,52,MEEKER AND WRIGHT SPECIAL EDUCATION,2018,410,52.04,7.878554957724827
0966,51,WRIGHT TECHNICAL CENTER,2018,188,41.64,4.514889529298751
0991,83,REGION 6 AND 8-SW/WC SERVICE COOP,2018,420,85.86,4.8916841369671555
0998,52,BEMIDJI REGIONAL INTERDIST. COUNCIL,2018,46,13.34,3.4482758620689657
1000,70,PERPICH CENTER FOR ARTS EDUCATION,2018,318,34.36,9.254947613504074
1100,60,MINNESOTA DEPARTMENT OF CORRECTIONS,2018,206,NA,NA
2071,01,LAKE CRYSTAL-WELLCOME MEMORIAL,2018,1826,131.58,13.877488980088158
2125,01,TRITON SCHOOL DISTRICT,2018,2234,163.42,13.670297393219926
2134,01,UNITED SOUTH CENTRAL SCHOOL DIST.,2018,1414,100.4,14.083665338645417
2135,01,MAPLE RIVER SCHOOL DISTRICT,2018,1854,138.74,13.36312527028975
2137,01,KINGSLAND PUBLIC SCHOOL DISTRICT,2018,1114,88.44,12.596110357304388
2142,01,ST. LOUIS COUNTY SCHOOL DISTRICT,2018,4014,313.76,12.793217746047935
2143,01,WATERVILLE-ELYSIAN-MORRISTOWN,2018,1538,122.96,12.508132726089785
2144,01,CHISAGO LAKES SCHOOL DISTRICT,2018,6902,397.38,17.368765413458153
2149,01,MINNEWASKA SCHOOL DISTRICT,2018,2490,179.8,13.848720800889877
2154,01,EVELETH-GILBERT SCHOOL DISTRICT,2018,1888,133.62,14.129621314174525
2155,01,WADENA-DEER CREEK SCHOOL DISTRICT,2018,2084,147.5,14.128813559322033
2159,01,BUFFALO LK-HECTOR-STEWART PUBLIC SC,2018,1050,84.86,12.373320763610653
2164,01,DILWORTH-GLYNDON-FELTON,2018,3296,224.34,14.691985379334938
2165,01,HINCKLEY-FINLAYSON SCHOOL DISTRICT,2018,1992,154.96,12.854930304594733
2167,01,LAKEVIEW SCHOOL DISTRICT,2018,1340,100.62,13.317431922083085
2168,01,NRHEG SCHOOL DISTRICT,2018,1784,133.12,13.401442307692307
2169,01,MURRAY COUNTY CENTRAL SCHOOL DIST.,2018,1478,104.86,14.094983787907687
2170,01,STAPLES-MOTLEY SCHOOL DISTRICT,2018,2238,158.38,14.130572041924486
2171,01,KITTSON CENTRAL SCHOOL DISTRICT,2018,486,46.68,10.411311053984576
2172,01,KENYON-WANAMINGO SCHOOL DISTRICT,2018,1596,93.18,17.128139085640694
2174,01,PINE RIVER-BACKUS SCHOOL DISTRICT,2018,1912,141.52,13.510457885811192
2176,01,WARREN-ALVARADO-OSLO SCHOOL DIST.,2018,986,76.26,12.929451875163911
2180,01,MACCRAY SCHOOL DISTRICT,2018,1434,112.42,12.75573741327166
2184,01,LUVERNE PUBLIC SCHOOL DISTRICT,2018,2530,177.08,14.287327761463745
2190,01,YELLOW MEDICINE EAST,2018,1456,112.66,12.92384164743476
2198,01,FILLMORE CENTRAL,2018,1282,90.26,14.203412364280965
2215,01,NORMAN COUNTY EAST SCHOOL DISTRICT,2018,584,50.02,11.675329868052778
2310,01,SIBLEY EAST SCHOOL DISTRICT,2018,2390,167.78,14.244844439146501
2311,01,CLEARBROOK-GONVICK SCHOOL DISTRICT,2018,900,62.7,14.354066985645932
2342,01,WEST CENTRAL AREA,2018,1512,110.92,13.631446087270104
2358,01,TRI-COUNTY SCHOOL DISTRICT,2018,396,40.48,9.782608695652174
2364,01,BELGRADE-BROOTEN-ELROSA SCHOOL DIST,2018,1316,87.14,15.10213449621299
2365,01,G.F.W.,2018,1418,119.34,11.882017764370705
2396,01,A.C.G.C. PUBLIC SCHOOL DISTRICT,2018,1664,129.26,12.873278663159525
2397,01,LE SUEUR-HENDERSON SCHOOL DISTRICT,2018,2062,129.5,15.922779922779922
2448,01,MARTIN COUNTY WEST SCHOOL DISTRICT,2018,1450,104.96,13.814786585365855
2527,01,NORMAN COUNTY WEST SCHOOL DISTRICT,2018,426,44.04,9.673024523160763
2534,01,BIRD ISLAND-OLIVIA-LAKE LILLIAN,2018,1398,110.4,12.66304347826087
2536,01,GRANADA HUNTLEY-EAST CHAIN,2018,556,36.16,15.376106194690268
2580,01,EAST CENTRAL SCHOOL DISTRICT,2018,1490,107.38,13.875954553920657
2609,01,WIN-E-MAC SCHOOL DISTRICT,2018,962,67.82,14.184606310822767
2683,01,GREENBUSH-MIDDLE RIVER SCHOOL DIST.,2018,662,65.72,10.07303712720633
2687,01,HOWARD LAKE-WAVERLY-WINSTED,2018,2460,159.16,15.456144759989948
2689,01,PIPESTONE AREA SCHOOL DISTRICT,2018,2284,168.24,13.575844032334759
2711,01,MESABI EAST SCHOOL DISTRICT,2018,1984,124.18,15.976807859558704
2752,01,FAIRMONT AREA SCHOOL DISTRICT,2018,3534,203.84,17.33712715855573
2753,01,LONG PRAIRIE-GREY EAGLE SCHOOL DIST,2018,1778,139.62,12.734565248531728
2754,01,CEDAR MOUNTAIN SCHOOL DISTRICT,2018,946,75.3,12.56308100929615
2769,01,MORRIS AREA PUBLIC SCHOOLS,2018,2052,143.34,14.315613227291754
2805,01,ZUMBROTA-MAZEPPA SCHOOL DISTRICT,2018,2448,156.26,15.666197363368745
2835,01,JANESVILLE-WALDORF-PEMBERTON,2018,1358,101.16,13.42427837089759
2853,01,LAC QUI PARLE VALLEY SCHOOL DIST.,2018,1640,122.02,13.440419603343715
2854,01,ADA-BORUP PUBLIC SCHOOL DISTRICT,2018,1206,82.48,14.621726479146458
2856,01,STEPHEN-ARGYLE CENTRAL SCHOOLS,2018,608,44.82,13.56537260151718
2859,01,GLENCOE-SILVER LAKE SCHOOL DISTRICT,2018,3272,205.64,15.911301303248397
2860,01,BLUE EARTH AREA PUBLIC SCHOOL,2018,2244,153.12,14.655172413793103
2884,01,RED ROCK CENTRAL SCHOOL DISTRICT,2018,876,69.9,12.532188841201716
2886,01,GLENVILLE-EMMONS SCHOOL DISTRICT,2018,478,38.58,12.389839294971488
2888,01,CLINTON-GRACEVILLE-BEARDSLEY,2018,682,55.42,12.306026705160592
2889,01,LAKE PARK AUDUBON SCHOOL DISTRICT,2018,1406,112.12,12.540135569033179
2890,01,RENVILLE COUNTY WEST SCHOOL DIST.,2018,1126,88.72,12.691614066726782
2895,01,JACKSON COUNTY CENTRAL SCHOOL DIST.,2018,2254,163.5,13.785932721712538
2897,01,REDWOOD AREA SCHOOL DISTRICT,2018,2292,171.84,13.337988826815643
2898,01,WESTBROOK-WALNUT GROVE SCHOOLS,2018,738,73.8,10
2899,01,PLAINVIEW-ELGIN-MILLVILLE,2018,2956,190.18,15.543169628772741
2902,01,RTR PUBLIC SCHOOLS,2018,1168,94.3,12.386002120890774
2903,01,ORTONVILLE PUBLIC SCHOOLS,2018,996,77.9,12.785622593068036
2904,01,TRACY AREA PUBLIC SCHOOL DISTRICT,2018,1478,111.38,13.269886873765488
2905,01,TRI-CITY UNITED SCHOOL DISTRICT,2018,3850,263.14,14.63099490765372
2906,01,RED LAKE COUNTY CENTRAL PUBLIC SCH,2018,802,67.48,11.885002963841137
2907,01,ROUND LAKE-BREWSTER PUBLIC SCHOOLS,2018,596,45.9,12.984749455337692
2908,01,BRANDON-EVANSVILLE PUBLIC SCHOOLS,2018,930,69.76,13.331422018348622
4000,07,CITY ACADEMY,2018,224,17.6,12.727272727272727
