districtNumber,districtType,districtName,year,totalStudents,totalTeachers,studentTeacherRatio
4100,07,GREAT EXPECTATIONS,2014,172,13.4,12.835820895522387
4102,07,MINNESOTA INTERNSHIP CENTER,2014,494,33.82,14.606741573033707
4103,07,HMONG COLLEGE PREP ACADEMY,2014,2252,163.2,13.799019607843139
4104,07,PALADIN CAREER AND TECH HIGH SCHOOL,2014,532,NA,NA
4105,07,GREAT RIVER SCHOOL,2014,832,55.88,14.889047959914102
4106,07,TREKNORTH HIGH SCHOOL,2014,476,29.68,16.037735849056602
4107,07,VOYAGEURS EXPEDITIONARY,2014,174,15.86,10.970996216897857
4110,07,PIM ARTS HIGH SCHOOL,2014,566,47.98,11.796581909128804
4111,07,AUGSBURG FAIRVIEW ACADEMY,2014,338,26,13
4112,07,ST PAUL CONSERVATORY PERFORMING ART,2014,1220,70.36,17.33939738487777
4113,07,SPERO ACADEMY,2014,154,27.96,5.507868383404864
4116,07,LAKES INTERNATIONAL LANGUAGE ACADEM,2014,1384,92.14,15.02062079444324
4118,07,KALEIDOSCOPE CHARTER SCHOOL,2014,952,71.88,13.244296048970508
4119,07,ACADEMIC ARTS HIGH SCHOOL,2014,152,7.82,19.437340153452684
4120,07,ST. CROIX PREPARATORY ACADEMY,2014,2236,124.52,17.956954706071315
4121,07,UBAH MEDICAL ACADEMY CHARTER SCHOOL,2014,718,37.2,19.301075268817204
4122,07,EAGLE RIDGE ACADEMY CHARTER SCHOOL,2014,1646,104.8,15.706106870229007
4124,07,BEACON ACADEMY,2014,824,65.86,12.51138779228667
4126,07,PRAIRIE SEEDS ACADEMY,2014,1582,73.52,21.517954298150165
4127,07,TEAM ACADEMY,2014,272,24,11.333333333333334
4131,07,METRO SCHOOLS CHARTER,2014,712,42.7,16.674473067915688
4132,07,TWIN CITIES ACADEMY,2014,412,27.56,14.949201741654573
4135,07,ROCHESTER MATH AND SCIENCE ACADEMY,2014,546,30,18.2
4137,07,SWAN RIVER MONTESSORI CHARTER SCH,2014,292,18.1,16.13259668508287
4138,07,MILROY AREA CHARTER SCHOOL,2014,88,7.54,11.671087533156498
4139,07,LOVEWORKS ACADEMY FOR ARTS,2014,562,38,14.789473684210526
4140,07,YINGHUA ACADEMY,2014,1128,70.66,15.963770166996888
4142,07,STRIDE ACADEMY CHARTER SCHOOL,2014,1054,85.62,12.310207895351553
4143,07,NEW MILLENNIUM ACADEMY CHARTER SCH,2014,870,74.64,11.655948553054662
4144,07,GREEN ISLE COMMUNITY SCHOOL,2014,98,7.94,12.34256926952141
4145,07,BIRCH GROVE COMMUNITY SCHOOL,2014,44,6.66,6.606606606606606
4146,07,NORTHERN LIGHTS COMMUNITY SCHOOL,2014,184,19.12,9.623430962343095
4150,07,MINNESOTA ONLINE HIGH SCHOOL,2014,244,20.8,11.73076923076923
4151,07,EDVISIONS OFF CAMPUS SCHOOL,2014,194,19.02,10.199789695057834
4152,07,TWIN CITIES GERMAN IMMERSION CHTR,2014,752,52.3,14.378585086042065
4153,07,DUGSI ACADEMY,2014,712,57.3,12.425828970331589
4155,07,NAYTAHWAUSH COMMUNITY SCHOOL,2014,210,26,8.076923076923077
4159,07,SEVEN HILLS PREPARATORY ACADEMY,2014,946,61.1,15.482815057283142
4160,07,SPECTRUM HIGH SCHOOL,2014,1056,72.12,14.642262895174708
4161,07,NEW DISCOVERIES MONTESSORI ACADEMY,2014,310,24,12.916666666666666
4162,07,SOUTHSIDE FAMILY CHARTER SCHOOL,2014,218,13.58,16.05301914580265
4163,07,LEARNING FOR LEADERSHIP CHARTER,2014,412,36,11.444444444444445
4164,07,LAURA JEFFREY ACADEMY CHARTER,2014,324,28.76,11.265646731571627
4166,07,EAST RANGE ACADEMY OF TECH-SCIENCE,2014,186,14.18,13.11706629055007
4167,07,INTERNATIONAL SPANISH LANGUAGE ACAD,2014,572,30.86,18.535320803629293
4168,07,GLACIAL HILLS ELEMENTARY,2014,248,23.4,10.5982905982906
4169,07,STONEBRIDGE WORLD SCHOOL,2014,406,36.66,11.074740861974906
4170,07,HIAWATHA ACADEMIES,2014,1310,102.32,12.802971071149337
4171,07,NOBLE ACADEMY,2014,952,53.26,17.87457754412317
4172,07,CLARKFIELD CHARTER SCHOOL,2014,112,13.08,8.562691131498472
4177,07,MINISINAAKWAANG LEADERSHIP ACADEMY,2014,78,10.4,7.5
4178,07,LINCOLN INTERNATIONAL SCHOOL,2014,284,21.6,13.148148148148147
4181,07,COMMUNITY SCHOOL OF EXCELLENCE,2014,1950,135.04,14.440165876777252
4183,07,LIONSGATE ACADEMY,2014,322,75.84,4.245780590717299
4184,07,ASPEN ACADEMY,2014,1012,71.36,14.181614349775785
4185,07,DAVINCI ACADEMY,2014,844,59.54,14.175344306348673
4186,07,GLOBAL ACADEMY,2014,854,61.44,13.899739583333334
4187,07,NATURAL SCIENCE ACADEMY,2014,120,7.8,15.384615384615385
4188,07,COLOGNE ACADEMY,2014,922,77.32,11.924469736161408
4189,07,BRIGHT WATER ELEMENTARY,2014,326,13.92,23.419540229885058
4190,07,RIVERS EDGE ACADEMY,2014,158,11.78,13.412563667232599
4191,07,KIPP MINNESOTA CHARTER SCHOOL,2014,398,24.78,16.061339790153347
4192,07,BEST ACADEMY,2014,994,67.08,14.818127608825284
4193,07,COLLEGE PREPARATORY ELEMENTARY,2014,590,46.34,12.731981009926628
4194,07,CANNON RIVER STEM SCHOOL,2014,562,39.46,14.24227065382666
4195,07,OSHKI OGIMAAG CHARTER SCHOOL,2014,82,10.02,8.183632734530939
4198,07,DISCOVERY WOODS,2014,228,14.46,15.767634854771783
4199,07,PARNASSUS PREPARATORY CHARTER SCH,2014,1520,69.28,21.939953810623557
4200,07,STEP ACADEMY CHARTER SCHOOL,2014,340,31.76,10.70528967254408
4201,07,CORNERSTONE MONTESSORI ELEMENTARY,2014,212,13.28,15.963855421686748
4204,07,ROCHESTER STEM ACADEMY,2014,152,14,10.857142857142858
4205,07,HENNEPIN ELEMENTARY SCHOOL,2014,436,34,12.823529411764707
4207,07,VERMILION COUNTRY SCHOOL,2014,128,10.16,12.598425196850393
4208,07,NASHA SHKOLA CHARTER SCHOOL,2014,322,23.32,13.807890222984563
4209,07,MASTERY SCHOOL,2014,398,19.92,19.979919678714857
4210,07,UPPER MISSISSIPPI ACADEMY,2014,340,28.3,12.014134275618375
4212,07,WEST SIDE SUMMIT CHARTER SCHOOL,2014,212,14,15.142857142857142
4213,07,PRODEO ACADEMY,2014,130,7.2,18.055555555555554
4215,07,SEJONG ACADEMY OF MINNESOTA,2014,NA,NA,NA
4217,07,TECHNICAL ACADEMIES OF MINNESOTA,2014,NA,NA,NA
4218,07,VENTURE ACADEMY,2014,236,14,16.857142857142858
4219,07,NORTHEAST COLLEGE PREP,2014,NA,NA,NA
4220,07,AGAMIM CLASSICAL ACADEMY,2014,NA,NA,NA
4221,07,DISCOVERY CHARTER SCHOOL,2014,NA,NA,NA
4223,07,SAINT CLOUD MATH AND SCIENCE ACADEM,2014,NA,NA,NA
4224,07,STAR OF THE NORTH ACADEMY CHARTER S,2014,NA,NA,NA
4225,07,UNIVERSAL ACADEMY CHARTER SCHOOL,2014,NA,NA,NA
4226,07,BDOTE LEARNING CENTER,2014,NA,NA,NA
4227,07,ART AND SCIENCE ACADEMY,2014,NA,NA,NA
4228,07,WOODBURY LEADERSHIP ACADEMY,2014,NA,NA,NA
4229,07,JANE GOODALL ENVIRONMENTAL SCIENCE,2014,NA,NA,NA
4230,07,MINNESOTA EXCELLENCE IN LEARNING AC,2014,NA,NA,NA
4231,07,MINNESOTA MATH AND SCIENCE ACADEMY,2014,NA,NA,NA
4232,07,SUCCESS ACADEMY,2014,NA,NA,NA
4233,07,LEVEL UP ACADEMY,2014,NA,NA,NA
4237,07,CAREER PATHWAYS,2014,NA,NA,NA
4238,07,ROCHESTER BEACON ACADEMY,2014,NA,NA,NA
4239,07,TESFA INTERNATIONAL SCHOOL,2014,NA,NA,NA
4240,07,NEW CENTURY SCHOOL,2014,NA,NA,NA
4243,07,NORTH METRO FLEX ACADEMY,2014,NA,NA,NA
4244,07,FIT ACADEMY,2014,NA,NA,NA
4246,07,BIG PICTURE TWIN CITIES,2014,NA,NA,NA
4250,07,ATHLOS ACADEMY OF SAINT CLOUD,2014,NA,NA,NA
4254,07,MARINE AREA COMMUNITY SCHOOL,2014,NA,NA,NA
6004,61,FRESHWATER ED. DIST.,2014,314,35.74,8.785674314493564
6012,61,ZUMBRO EDUCATION DISTRICT,2014,300,35.7,8.403361344537814
6013,61,HIAWATHA VALLEY ED. DISTRICT,2014,244,31.64,7.711757269279393
6014,61,RUNESTONE AREA ED. DISTRICT,2014,212,10.34,20.502901353965186
6018,61,MN RIVER VALLEY EDUCATION DISTRICT,2014,192,17.68,10.85972850678733
6026,61,WEST CENTRAL EDUCATION DISTRICT,2014,134,11.58,11.57167530224525
6027,61,MN VALLEY EDUCATION DISTRICT,2014,186,19.08,9.748427672955975
6049,61,RIVER BEND EDUCATION DISTRICT,2014,284,33.68,8.43230403800475
6051,61,GOODHUE COUNTY EDUCATION DISTRICT,2014,308,57.46,5.3602506091193876
6074,50,CENTRAL MINNESOTA JT. POWERS DIST.,2014,50,NA,NA
6076,50,NORTHLAND LEARNING CENTER,2014,184,25.64,7.176287051482059
6079,52,RUM RIVER SPECIAL EDUCATION COOP,2014,150,34,4.411764705882353
6083,52,SOUTHERN MN EDUCATION CONSORTIUM,2014,NA,NA,NA
6090,52,SHERBURNE AND NORTHERN WRIGHT SPECI,2014,NA,NA,NA
6094,52,CANNON VALLEY SPECIAL EDUCATION COO,2014,NA,NA,NA
6095,52,AUSTIN ALBERT LEA AREA SPECIAL EDUC,2014,NA,NA,NA
6096,52,NORTHERN LIGHTS ACADEMY COOPERATIVE,2014,NA,NA,NA
6383,61,BENTON-STEARNS ED. DISTRICT,2014,200,35.14,5.691519635742743
6979,61,MID STATE EDUCATION DISTRICT,2014,94,18.96,4.957805907172996
0001,01,AITKIN PUBLIC SCHOOL DISTRICT,2013,2568,160.4,16.00997506234414
0001,03,MINNEAPOLIS PUBLIC SCHOOL DISTRICT,2013,70524,4803.780000000001,14.680938760725926
0002,01,HILL CITY PUBLIC SCHOOL DISTRICT,2013,578,50.260000000000005,11.500198965380022
0004,01,MCGREGOR PUBLIC SCHOOL DISTRICT,2013,798,68.78,11.602209944751381
0006,03,SOUTH ST. PAUL PUBLIC SCHOOL DIST.,2013,6742,419.96000000000004,16.05390989618059
0011,01,ANOKA-HENNEPIN PUBLIC SCHOOL DIST.,2013,76806,4398.3,17.462656026191937
0012,01,CENTENNIAL PUBLIC SCHOOL DISTRICT,2013,13096,719.6800000000001,18.19697643397065
0013,01,COLUMBIA HEIGHTS PUBLIC SCHOOL DIST,2013,6086,435.82,13.964480748933045
0014,01,FRIDLEY PUBLIC SCHOOL DISTRICT,2013,5838,369.62,15.794599859314973
0015,01,ST. FRANCIS PUBLIC SCHOOL DISTRICT,2013,10134,517.36,19.58790783980207
0016,01,SPRING LAKE PARK PUBLIC SCHOOLS,2013,10906,594.9,18.332492855942174
0022,01,DETROIT LAKES PUBLIC SCHOOL DIST.,2013,5884,396.38,14.844341288662395
0023,01,FRAZEE-VERGAS PUBLIC SCHOOL DIST.,2013,1814,131.46,13.798874182260763
0025,01,PINE POINT PUBLIC SCHOOL DISTRICT,2013,106,19.98,5.305305305305305
0031,01,BEMIDJI PUBLIC SCHOOL DISTRICT,2013,10392,676.24,15.367325209984621
0032,01,BLACKDUCK PUBLIC SCHOOL DISTRICT,2013,1228,91.8,13.376906318082789
0036,01,KELLIHER PUBLIC SCHOOL DISTRICT,2013,530,52.42,10.110644792064097
0038,01,RED LAKE PUBLIC SCHOOL DISTRICT,2013,2730,291.08,9.378864916861344
0047,01,SAUK RAPIDS-RICE PUBLIC SCHOOLS,2013,7974,424.32,18.792420814479637
0051,01,FOLEY PUBLIC SCHOOL DISTRICT,2013,3538,208,17.009615384615383
0075,01,ST. CLAIR PUBLIC SCHOOL DISTRICT,2013,1260,74.69999999999999,16.867469879518076
0077,01,MANKATO PUBLIC SCHOOL DISTRICT,2013,15530,1023.9599999999999,15.16660807062776
0081,01,COMFREY PUBLIC SCHOOL DISTRICT,2013,334,35.38,9.440361786319954
0084,01,SLEEPY EYE PUBLIC SCHOOL DISTRICT,2013,1218,88.24000000000001,13.803263825929282
0085,01,SPRINGFIELD PUBLIC SCHOOL DISTRICT,2013,1240,84,14.761904761904763
0088,01,NEW ULM PUBLIC SCHOOL DISTRICT,2013,3834,242.82000000000002,15.789473684210526
0091,01,BARNUM PUBLIC SCHOOL DISTRICT,2013,1604,108.64,14.764359351988217
0093,01,CARLTON PUBLIC SCHOOL DISTRICT,2013,972,67.02,14.503133393017011
0094,01,CLOQUET PUBLIC SCHOOL DISTRICT,2013,4904,295.46,16.597847424355244
0095,01,CROMWELL-WRIGHT PUBLIC SCHOOLS,2013,666,45.06,14.780292942743008
0097,01,MOOSE LAKE PUBLIC SCHOOL DISTRICT,2013,1292,91.56,14.110965487112276
0099,01,ESKO PUBLIC SCHOOL DISTRICT,2013,2484,140.46,17.684750106791967
0100,01,WRENSHALL PUBLIC SCHOOL DISTRICT,2013,646,51.58,12.524234199302056
0108,01,CENTRAL PUBLIC SCHOOL DISTRICT,2013,2042,145.38,14.045948548631173
0110,01,WACONIA PUBLIC SCHOOL DISTRICT,2013,7208,417.21999999999997,17.276257130530656
0111,01,WATERTOWN-MAYER PUBLIC SCHOOL DIST.,2013,3220,196.42000000000002,16.39344262295082
0112,01,EASTERN CARVER COUNTY PUBLIC SCHOOL,2013,18646,1093.42,17.052916537103766
0113,01,WALKER-HACKENSACK-AKELEY SCHL. DIST,2013,1588,104.44,15.20490233626963
0115,01,CASS LAKE-BENA PUBLIC SCHOOLS,2013,2262,193.5,11.689922480620154
0116,01,PILLAGER PUBLIC SCHOOL DISTRICT,2013,1744,116.75999999999999,14.936622130866736
0118,01,NORTHLAND COMMUNITY SCHOOLS,2013,702,59.28,11.842105263157894
0129,01,MONTEVIDEO PUBLIC SCHOOL DISTRICT,2013,2654,177.66,14.93864685354047
0138,01,NORTH BRANCH PUBLIC SCHOOLS,2013,6402,313.12,20.445835462442513
0139,01,RUSH CITY PUBLIC SCHOOL DISTRICT,2013,1792,106.08,16.89291101055807
0146,01,BARNESVILLE PUBLIC SCHOOL DIST.,2013,1726,109.74,15.728084563513761
0150,01,HAWLEY PUBLIC SCHOOL DISTRICT,2013,1876,112.86,16.622363990785043
0152,01,MOORHEAD PUBLIC SCHOOL DISTRICT,2013,11434,668.22,17.111131064619435
0160,70,MINNESOTA STATE ACADEMIES,2013,416,70,5.942857142857143
0162,01,BAGLEY PUBLIC SCHOOL DISTRICT,2013,2032,138.28,14.69482210008678
0166,01,COOK COUNTY PUBLIC SCHOOLS,2013,936,62.300000000000004,15.024077046548955
0173,01,MOUNTAIN LAKE PUBLIC SCHOOLS,2013,976,74.4,13.118279569892472
0177,01,WINDOM PUBLIC SCHOOL DISTRICT,2013,1952,148.35999999999999,13.157185225128067
0181,01,BRAINERD PUBLIC SCHOOL DISTRICT,2013,13100,771.8199999999999,16.97286932186261
0182,01,CROSBY-IRONTON PUBLIC SCHOOL DIST.,2013,2356,137.56,17.12707182320442
0186,01,PEQUOT LAKES PUBLIC SCHOOLS,2013,3278,201.88000000000002,16.237368733901327
0191,01,BURNSVILLE PUBLIC SCHOOL DISTRICT,2013,19420,1248.3,15.557157734518947
0192,01,FARMINGTON PUBLIC SCHOOL DISTRICT,2013,13558,771.86,17.565361594071465
0194,01,LAKEVILLE PUBLIC SCHOOL DISTRICT,2013,21838,1068.76,20.433025188068417
0195,01,RANDOLPH PUBLIC SCHOOL DISTRICT,2013,1156,72.18,16.01551676364644
0196,01,ROSEMOUNT-APPLE VALLEY-EAGAN,2013,54348,3141.56,17.29968550656362
0197,01,WEST ST. PAUL-MENDOTA HTS.-EAGAN,2013,9572,580.4399999999999,16.490937909172352
0199,01,INVER GROVE HEIGHTS SCHOOLS,2013,7596,384.18,19.771981883492113
0200,01,HASTINGS PUBLIC SCHOOL DISTRICT,2013,9318,539.5,17.271547729379055
0203,01,HAYFIELD PUBLIC SCHOOL DISTRICT,2013,1524,97.75999999999999,15.589198036006549
0204,01,KASSON-MANTORVILLE SCHOOL DISTRICT,2013,4182,251.34,16.638815946526616
0206,01,ALEXANDRIA PUBLIC SCHOOL DISTRICT,2013,7886,478.4,16.484113712374583
0213,01,OSAKIS PUBLIC SCHOOL DISTRICT,2013,1722,104.72,16.44385026737968
0227,01,CHATFIELD PUBLIC SCHOOLS,2013,1816,116.5,15.587982832618026
0229,01,LANESBORO PUBLIC SCHOOL DISTRICT,2013,670,56.64,11.82909604519774
0238,01,MABEL-CANTON PUBLIC SCHOOL DIST.,2013,520,47.54,10.93815734118637
0239,01,RUSHFORD-PETERSON PUBLIC SCHOOLS,2013,1328,103.61999999999999,12.816058675931288
0241,01,ALBERT LEA PUBLIC SCHOOL DISTRICT,2013,6670,464.88,14.347788676647736
0242,01,ALDEN-CONGER PUBLIC SCHOOL DISTRICT,2013,1014,74.38000000000001,13.632696961548803
0252,01,CANNON FALLS PUBLIC SCHOOL DISTRICT,2013,2348,155.58,15.09191412777992
0253,01,GOODHUE PUBLIC SCHOOL DISTRICT,2013,1322,81.44,16.232809430255404
0255,01,PINE ISLAND PUBLIC SCHOOL DIST.,2013,2340,162.7,14.382298709280887
0256,01,RED WING PUBLIC SCHOOL DISTRICT,2013,5668,354.86,15.972496195682805
0261,01,ASHBY PUBLIC SCHOOL DISTRICT,2013,494,43.16,11.44578313253012
0264,01,HERMAN-NORCROSS SCHOOL DISTRICT,2013,192,23.56,8.149405772495756
0270,01,HOPKINS PUBLIC SCHOOL DISTRICT,2013,14068,885.22,15.892094620546304
0271,01,BLOOMINGTON PUBLIC SCHOOL DISTRICT,2013,20878,1334.6,15.643638543383787
0272,01,EDEN PRAIRIE PUBLIC SCHOOL DISTRICT,2013,18538,1081.04,17.148301635462147
0273,01,EDINA PUBLIC SCHOOL DISTRICT,2013,16870,995.12,16.952729319077097
0276,01,MINNETONKA PUBLIC SCHOOL DISTRICT,2013,19134,1107.8999999999999,17.27051177904143
0277,01,WESTONKA PUBLIC SCHOOL DISTRICT,2013,4530,241.5,18.757763975155278
0278,01,ORONO PUBLIC SCHOOL DISTRICT,2013,5578,294.74,18.925154373346
0279,01,OSSEO PUBLIC SCHOOL DISTRICT,2013,41246,2438.92,16.911583815787314
0280,01,RICHFIELD PUBLIC SCHOOL DISTRICT,2013,8806,576.22,15.282357432924924
0281,01,ROBBINSDALE PUBLIC SCHOOL DISTRICT,2013,24362,1530.42,15.918506031024162
0282,01,ST. ANTHONY-NEW BRIGHTON SCHOOLS,2013,3524,203.14,17.34764202028158
0283,01,ST. LOUIS PARK PUBLIC SCHOOL DIST.,2013,9210,548.78,16.782681584605854
0284,01,WAYZATA PUBLIC SCHOOL DISTRICT,2013,21244,1304.18,16.289162538913338
0286,01,BROOKLYN CENTER SCHOOL DISTRICT,2013,4354,249.3,17.46490172482952
0287,06,INTERMEDIATE SCHOOL DISTRICT 287,2013,2506,536,4.675373134328358
0288,06,SOUTHWEST METRO INTERMEDIATE 288,2013,NA,NA,NA
0294,01,HOUSTON PUBLIC SCHOOL DISTRICT,2013,5142,234.8,21.899488926746166
0297,01,SPRING GROVE SCHOOL DISTRICT,2013,688,46.28,14.866032843560934
0299,01,CALEDONIA PUBLIC SCHOOL DISTRICT,2013,1398,93.1,15.016111707841032
0300,01,LA CRESCENT-HOKAH SCHOOL DISTRICT,2013,2508,164.04,15.288953913679592
0306,01,LAPORTE PUBLIC SCHOOL DISTRICT,2013,526,43.66,12.047640861200184
0308,01,NEVIS PUBLIC SCHOOL DISTRICT,2013,1084,80,13.55
0309,01,PARK RAPIDS PUBLIC SCHOOL DISTRICT,2013,3076,205.6,14.961089494163424
0314,01,BRAHAM PUBLIC SCHOOL DISTRICT,2013,1704,114.5,14.882096069868995
0316,01,GREENWAY PUBLIC SCHOOL DISTRICT,2013,2104,127.38000000000001,16.517506672947086
0317,01,DEER RIVER PUBLIC SCHOOL DISTRICT,2013,1806,133.52,13.52606351108448
0318,01,GRAND RAPIDS PUBLIC SCHOOL DISTRICT,2013,8070,424.52,19.009705078677094
0319,01,NASHWAUK-KEEWATIN SCHOOL DISTRICT,2013,1110,75.84,14.636075949367088
0330,01,HERON LAKE-OKABENA SCHOOL DISTRICT,2013,708,53.38,13.263394529786437
0332,01,MORA PUBLIC SCHOOL DISTRICT,2013,3566,220.68,16.159144462570236
0333,01,OGILVIE PUBLIC SCHOOL DISTRICT,2013,1110,79.58000000000001,13.948228198039706
0345,01,NEW LONDON-SPICER SCHOOL DISTRICT,2013,2846,177.5,16.03380281690141
0347,01,WILLMAR PUBLIC SCHOOL DISTRICT,2013,8394,570.6800000000001,14.708768486717599
0356,01,LANCASTER PUBLIC SCHOOL DISTRICT,2013,314,37.38,8.400214018191546
0361,01,INTERNATIONAL FALLS SCHOOL DISTRICT,2013,2432,125,19.456
0362,01,LITTLEFORK-BIG FALLS SCHOOL DIST.,2013,622,44.4,14.00900900900901
0363,01,SOUTH KOOCHICHING SCHOOL DISTRICT,2013,698,82.42,8.468818247998058
0378,01,DAWSON-BOYD PUBLIC SCHOOL DISTRICT,2013,1000,75.2,13.297872340425531
0381,01,LAKE SUPERIOR PUBLIC SCHOOL DIST.,2013,2800,186.92000000000002,14.97967044725016
0390,01,LAKE OF THE WOODS SCHOOL DISTRICT,2013,968,77.38000000000001,12.509692426983715
0391,01,CLEVELAND PUBLIC SCHOOL DISTRICT,2013,880,62.44,14.093529788597055
0397,52,LAKE AGASSIZ SPECIAL ED. COOP.,2013,86,6.24,13.782051282051281
0398,52,MIDWEST SPECIAL EDUCATION COOP.,2013,30,6.8,4.411764705882353
0402,01,HENDRICKS PUBLIC SCHOOL DISTRICT,2013,200,25.4,7.874015748031496
0403,01,IVANHOE PUBLIC SCHOOL DISTRICT,2013,400,36.78,10.87547580206634
0404,01,LAKE BENTON PUBLIC SCHOOL DISTRICT,2013,210,23.86,8.801341156747695
0413,01,MARSHALL PUBLIC SCHOOL DISTRICT,2013,4540,332.78000000000003,13.642646793677503
0414,01,MINNEOTA PUBLIC SCHOOL DISTRICT,2013,876,77.28,11.335403726708075
0415,01,LYND PUBLIC SCHOOL DISTRICT,2013,242,42.620000000000005,5.678085405912716
0423,01,HUTCHINSON PUBLIC SCHOOL DISTRICT,2013,5894,350.6,16.811180832857957
0424,01,LESTER PRAIRIE PUBLIC SCHOOL DIST.,2013,820,56.64,14.477401129943503
0432,01,MAHNOMEN PUBLIC SCHOOL DISTRICT,2013,1310,98.12,13.350998777007746
0435,01,WAUBUN-OGEMA-WHITE EARTH PUBLIC SCH,2013,1108,107.06,10.3493368204745
0441,01,MARSHALL COUNTY CENTRAL SCHOOLS,2013,810,67.94,11.922284368560495
0447,01,GRYGLA PUBLIC SCHOOL DISTRICT,2013,330,37.300000000000004,8.847184986595174
0458,01,TRUMAN PUBLIC SCHOOL DISTRICT,2013,514,42.16,12.191650853889945
0463,01,EDEN VALLEY-WATKINS SCHOOL DISTRICT,2013,1874,128.46,14.588198661061808
0465,01,LITCHFIELD PUBLIC SCHOOL DISTRICT,2013,3388,205.16,16.513940339247416
0466,01,DASSEL-COKATO PUBLIC SCHOOL DIST.,2013,4532,262.32,17.276608722171392
0473,01,ISLE PUBLIC SCHOOL DISTRICT,2013,998,72.84,13.701263042284458
0477,01,PRINCETON PUBLIC SCHOOL DISTRICT,2013,6538,394.56,16.570356853203567
0480,01,ONAMIA PUBLIC SCHOOL DISTRICT,2013,1372,127.64,10.748981510498277
0482,01,LITTLE FALLS PUBLIC SCHOOL DISTRICT,2013,5008,314.21999999999997,15.937877919928713
0484,01,PIERZ PUBLIC SCHOOL DISTRICT,2013,2234,142.98000000000002,15.624562875926701
0485,01,ROYALTON PUBLIC SCHOOL DISTRICT,2013,1760,105.1,16.74595623215985
0486,01,SWANVILLE PUBLIC SCHOOL DISTRICT,2013,682,50.88,13.404088050314465
0487,01,UPSALA PUBLIC SCHOOL DISTRICT,2013,762,51.959999999999994,14.66512702078522
0492,01,AUSTIN PUBLIC SCHOOL DISTRICT,2013,9164,627.62,14.601191803957809
0495,01,GRAND MEADOW PUBLIC SCHOOL DISTRICT,2013,804,63.68,12.625628140703517
0497,01,LYLE PUBLIC SCHOOL DISTRICT,2013,480,39.46,12.164216928535225
0499,01,LEROY-OSTRANDER PUBLIC SCHOOLS,2013,588,49.14,11.965811965811966
0500,01,SOUTHLAND PUBLIC SCHOOL DISTRICT,2013,1014,86.18,11.766071014156417
0505,01,FULDA PUBLIC SCHOOL DISTRICT,2013,604,53.74,11.239300334946035
0507,01,NICOLLET PUBLIC SCHOOL DISTRICT,2013,660,49.7,13.279678068410462
0508,01,ST. PETER PUBLIC SCHOOL DISTRICT,2013,3892,256.16,15.19362898188632
0511,01,ADRIAN PUBLIC SCHOOL DISTRICT,2013,1224,81.69999999999999,14.981640146878828
0514,01,ELLSWORTH PUBLIC SCHOOL DISTRICT,2013,336,40.74,8.24742268041237
0518,01,WORTHINGTON PUBLIC SCHOOL DISTRICT,2013,5460,391.36,13.951349141455436
0531,01,BYRON PUBLIC SCHOOL DISTRICT,2013,3712,204.38,18.16224679518544
0533,01,DOVER-EYOTA PUBLIC SCHOOL DISTRICT,2013,2306,153.16,15.056150430921912
0534,01,STEWARTVILLE PUBLIC SCHOOL DISTRICT,2013,3886,236.33999999999997,16.442413472116446
0535,01,ROCHESTER PUBLIC SCHOOL DISTRICT,2013,32882,1952.48,16.841145619929524
0542,01,BATTLE LAKE PUBLIC SCHOOL DISTRICT,2013,894,63.9,13.990610328638498
0544,01,FERGUS FALLS PUBLIC SCHOOL DISTRICT,2013,4990,301.58,16.546190065654223
0545,01,HENNING PUBLIC SCHOOL DISTRICT,2013,752,60.9,12.348111658456487
0547,01,PARKERS PRAIRIE PUBLIC SCHOOL DIST.,2013,1070,82.56,12.960271317829458
0548,01,PELICAN RAPIDS PUBLIC SCHOOL DIST.,2013,1826,133.64,13.663573780305299
0549,01,PERHAM-DENT PUBLIC SCHOOL DISTRICT,2013,2714,194.8,13.93223819301848
0550,01,UNDERWOOD PUBLIC SCHOOL DISTRICT,2013,1202,77.08,15.594187856772185
0553,01,NEW YORK MILLS PUBLIC SCHOOL DIST.,2013,1384,96.22,14.383704011639992
0561,01,GOODRIDGE PUBLIC SCHOOL DISTRICT,2013,350,38.260000000000005,9.147935180345007
0564,01,THIEF RIVER FALLS SCHOOL DISTRICT,2013,3958,265.41999999999996,14.912214603270291
0577,01,WILLOW RIVER PUBLIC SCHOOL DISTRICT,2013,896,71.44,12.541993281075028
0578,01,PINE CITY PUBLIC SCHOOL DISTRICT,2013,3358,239.52,14.019706078824315
0581,01,EDGERTON PUBLIC SCHOOL DISTRICT,2013,686,52.559999999999995,13.051750380517506
0592,01,CLIMAX-SHELLY PUBLIC SCHOOLS,2013,348,42.14,8.258186995728524
0593,01,CROOKSTON PUBLIC SCHOOL DISTRICT,2013,2598,179.28,14.491298527443107
0595,01,EAST GRAND FORKS PUBLIC SCHOOL DIST,2013,3502,216.08,16.206960385042574
0599,01,FERTILE-BELTRAMI SCHOOL DISTRICT,2013,914,75.08,12.173681406499734
0600,01,FISHER PUBLIC SCHOOL DISTRICT,2013,518,40.2,12.885572139303482
0601,01,FOSSTON PUBLIC SCHOOL DISTRICT,2013,1356,88.03999999999999,15.402089959109498
0621,01,MOUNDS VIEW PUBLIC SCHOOL DISTRICT,2013,20960,1258.78,16.651043073452072
0622,01,NORTH ST PAUL-MAPLEWOOD OAKDALE DIS,2013,21430,1256.98,17.048799503572052
0623,01,ROSEVILLE PUBLIC SCHOOL DISTRICT,2013,13996,862.6,16.22536517505217
0624,01,WHITE BEAR LAKE SCHOOL DISTRICT,2013,16294,950,17.15157894736842
0625,01,ST. PAUL PUBLIC SCHOOL DISTRICT,2013,75826,5022.38,15.097623039276199
0630,01,RED LAKE FALLS PUBLIC SCHOOL DIST.,2013,744,67.92,10.954063604240282
0635,01,MILROY PUBLIC SCHOOL DISTRICT,2013,54,10.6,5.09433962264151
0640,01,WABASSO PUBLIC SCHOOL DISTRICT,2013,762,63.660000000000004,11.969839773798302
0656,01,FARIBAULT PUBLIC SCHOOL DISTRICT,2013,7906,521.18,15.16942323189685
0659,01,NORTHFIELD PUBLIC SCHOOL DISTRICT,2013,7802,479,16.288100208768267
0671,01,HILLS-BEAVER CREEK SCHOOL DISTRICT,2013,692,45.300000000000004,15.275938189845473
0676,01,BADGER PUBLIC SCHOOL DISTRICT,2013,514,39.14,13.13234542667348
0682,01,ROSEAU PUBLIC SCHOOL DISTRICT,2013,2476,152.62,16.223299698597824
0690,01,WARROAD PUBLIC SCHOOL DISTRICT,2013,1998,117.46000000000001,17.010045973097224
0695,01,CHISHOLM PUBLIC SCHOOL DISTRICT,2013,1508,100.72,14.972200158856236
0696,01,ELY PUBLIC SCHOOL DISTRICT,2013,1112,70.16,15.849486887115166
0698,01,FLOODWOOD PUBLIC SCHOOL DISTRICT,2013,544,48.559999999999995,11.202635914332784
0700,01,HERMANTOWN PUBLIC SCHOOL DISTRICT,2013,4140,217.66,19.02049067352752
0701,01,HIBBING PUBLIC SCHOOL DISTRICT,2013,4862,267.04,18.207010185739964
0704,01,PROCTOR PUBLIC SCHOOL DISTRICT,2013,3478,177.32,19.614256711030905
0706,01,VIRGINIA PUBLIC SCHOOL DISTRICT,2013,3390,206.54,16.41328556211872
0707,01,NETT LAKE PUBLIC SCHOOL DISTRICT,2013,158,25.64,6.162246489859594
0709,01,DULUTH PUBLIC SCHOOL DISTRICT,2013,18040,1008.66,17.885114904923363
0712,01,MOUNTAIN IRON-BUHL SCHOOL DISTRICT,2013,1148,95.14,12.066428421273912
0716,01,BELLE PLAINE PUBLIC SCHOOL DISTRICT,2013,3260,202.32,16.113088177145116
0717,01,JORDAN PUBLIC SCHOOL DISTRICT,2013,3522,219.24,16.064586754241926
0719,01,PRIOR LAKE-SAVAGE AREA SCHOOLS,2013,14712,743.18,19.79601173336204
0720,01,SHAKOPEE PUBLIC SCHOOL DISTRICT,2013,15228,915.6,16.631716906946263
0721,01,NEW PRAGUE AREA SCHOOLS,2013,7890,450.8,17.502218278615793
0726,01,BECKER PUBLIC SCHOOL DISTRICT,2013,5556,308.70000000000005,17.9980563654033
0727,01,BIG LAKE PUBLIC SCHOOL DISTRICT,2013,6672,335.92,19.861871874255772
0728,01,ELK RIVER PUBLIC SCHOOL DISTRICT,2013,25506,1374.22,18.56034696045757
0738,01,HOLDINGFORD PUBLIC SCHOOL DISTRICT,2013,2006,130.86,15.329359620968972
0739,01,KIMBALL PUBLIC SCHOOL DISTRICT,2013,1342,90.42,14.841849148418492
0740,01,MELROSE PUBLIC SCHOOL DISTRICT,2013,2670,165.16,16.166141922983773
0741,01,PAYNESVILLE PUBLIC SCHOOL DISTRICT,2013,2026,137.08,14.779690691566968
0742,01,ST. CLOUD PUBLIC SCHOOL DISTRICT,2013,19572,1292.9199999999998,15.13782755313554
0743,01,SAUK CENTRE PUBLIC SCHOOL DISTRICT,2013,1944,131.02,14.837429400091589
0745,01,ALBANY PUBLIC SCHOOL DISTRICT,2013,3436,217.06,15.82972450013821
0748,01,SARTELL-ST. STEPHEN SCHOOL DISTRICT,2013,7354,442.1,16.634245645781498
0750,01,ROCORI PUBLIC SCHOOL DISTRICT,2013,4046,205.46,19.69239754696778
0756,01,BLOOMING PRAIRIE PUBLIC SCHOOL DIST,2013,1460,93.61999999999999,15.594958342234566
0761,01,OWATONNA PUBLIC SCHOOL DISTRICT,2013,9786,569.7,17.177461822011583
0763,01,MEDFORD PUBLIC SCHOOL DISTRICT,2013,1750,113.24000000000001,15.453903214411868
0768,01,HANCOCK PUBLIC SCHOOL DISTRICT,2013,574,41.620000000000005,13.791446419990388
0771,01,CHOKIO-ALBERTA PUBLIC SCHOOL DIST.,2013,304,30.86,9.85093972780298
0775,01,KERKHOVEN-MURDOCK-SUNBURG,2013,1218,78.22,15.571465098440298
0777,01,BENSON PUBLIC SCHOOL DISTRICT,2013,1788,129.28,13.830445544554456
0786,01,BERTHA-HEWITT PUBLIC SCHOOL DIST.,2013,826,69,11.971014492753623
0787,01,BROWERVILLE PUBLIC SCHOOL DISTRICT,2013,856,71.22,12.019095759618086
0801,01,BROWNS VALLEY PUBLIC SCHOOL DIST.,2013,196,26.16,7.492354740061162
0803,01,WHEATON AREA PUBLIC SCHOOL DISTRICT,2013,790,64.36,12.274704785581106
0811,01,WABASHA-KELLOGG PUBLIC SCHOOL DIST.,2013,1166,82.36,14.157357940747936
0813,01,LAKE CITY PUBLIC SCHOOL DISTRICT,2013,2472,177.06,13.961369027448322
0818,01,VERNDALE PUBLIC SCHOOL DISTRICT,2013,982,77.8,12.62210796915167
