districtNumber,districtType,districtName,year,percentIdentified
4043,07,MATH AND SCIENCE ACADEMY,2013,0.00244498777506112
4049,07,NORTHWEST PASSAGE HIGH SCHOOL,2013,NA
4050,07,LAFAYETTE PUBLIC CHARTER SCHOOL,2013,NA
4053,07,NORTH LAKES ACADEMY,2013,NA
4054,07,LA CRESCENT MONTESSORI AND STEM SCHOOL,2013,NA
4055,07,NERSTRAND CHARTER SCHOOL,2013,NA
4056,07,ROSA PARKS CHARTER HIGH SCHOOL,2013,NA
4057,07,EL COLEGIO CHARTER SCHOOL,2013,0.528571428571429
4058,07,SCHOOLCRAFT LEARNING COMMUNITY CHARTER,2013,NA
4059,07,CROSSLAKE COMMUNITY CHARTER SCHOOL,2013,NA
4064,07,RIVERWAY LEARNING COMMUNITY CHARTER,2013,NA
4066,07,KATO PUBLIC CHARTER SCHOOL,2013,NA
4067,07,AURORA CHARTER SCHOOL,2013,0.980392156862745
4068,07,EXCELL ACADEMY CHARTER,2013,0.452196382428941
4070,07,HOPE COMMUNITY ACADEMY,2013,0.623700623700624
4073,07,ACADEMIA CESAR CHAVEZ CHARTER SCHOOL,2013,0.781914893617021
4074,07,AFSA HIGH SCHOOL,2013,NA
4075,07,AVALON SCHOOL,2013,0.0109289617486339
4078,07,TWIN CITIES INTERNATIONAL SCHOOLS,2013,0.83289817232376
4079,07,FRIENDSHIP ACADEMY OF FINE ARTS CHARTER,2013,NA
4080,07,PILLAGER AREA CHARTER SCHOOL,2013,NA
4081,07,DISCOVERY PUBLIC SCHOOL FARIBAULT,2013,0.0588235294117647
4082,07,BLUESKY CHARTER SCHOOL,2013,0.00232558139534884
4083,07,RIDGEWAY COMMUNITY SCHOOL,2013,NA
4084,07,NORTH SHORE COMMUNITY SCHOOL,2013,0.00303030303030303
4085,07,HARBOR CITY INTERNATIONAL CHARTER,2013,NA
4087,07,SAGE ACADEMY CHARTER SCHOOL,2013,NA
4088,07,URBAN ACADEMY CHARTER SCHOOL,2013,0.156716417910448
4089,07,NEW CITY SCHOOL,2013,0.0571428571428571
4090,07,PRAIRIE CREEK COMMUNITY SCHOOL,2013,NA
4091,07,ARCADIA CHARTER SCHOOL,2013,NA
4092,07,WATERSHED HIGH SCHOOL,2013,NA
4093,07,NEW CENTURY ACADEMY,2013,NA
4095,07,TRIO WOLF CREEK DISTANCE LEARNING,2013,NA
4097,07,"PARTNERSHIP ACADEMY, INC.",2013,0.857142857142857
4098,07,NOVA CLASSICAL ACADEMY,2013,0.0189798339264531
4100,07,GREAT EXPECTATIONS,2013,NA
4102,07,MINNESOTA INTERNSHIP CENTER,2013,0.00384615384615385
4103,07,HMONG COLLEGE PREP ACADEMY,2013,0.389071038251366
4104,07,PALADIN CAREER AND TECHNICAL HIGH SCHOOL,2013,0.00571428571428571
4105,07,GREAT RIVER SCHOOL,2013,0.0421686746987952
4106,07,TREKNORTH HIGH SCHOOL,2013,NA
4107,07,VOYAGEURS EXPEDITIONARY,2013,NA
4110,07,PIM ARTS HIGH SCHOOL,2013,NA
4111,07,AUGSBURG FAIRVIEW ACADEMY,2013,NA
4112,07,ST. PAUL CONSERVATORY PERFORMING ARTS,2013,NA
4113,07,SPERO ACADEMY,2013,NA
4116,07,LAKES INTERNATIONAL LANGUAGE ACADEMY,2013,NA
4118,07,KALEIDOSCOPE CHARTER SCHOOL,2013,NA
4119,07,ACADEMIC ARTS HIGH SCHOOL,2013,NA
4120,07,ST. CROIX PREPARATORY ACADEMY,2013,0.00465116279069767
4121,07,UBAH MEDICAL ACADEMY CHARTER SCHOOL,2013,0.0971786833855799
4122,07,EAGLE RIDGE ACADEMY CHARTER SCHOOL,2013,NA
4124,07,BEACON ACADEMY,2013,0.0383693045563549
4126,07,PRAIRIE SEEDS ACADEMY,2013,0.370322580645161
4127,07,TEAM ACADEMY,2013,0.00694444444444444
4131,07,METRO SCHOOLS CHARTER,2013,0.936619718309859
4132,07,TWIN CITIES ACADEMY,2013,0.0161290322580645
4135,07,ROCHESTER MATH AND SCIENCE ACADEMY,2013,0.888392857142857
4137,07,SWAN RIVER MONTESSORI CHARTER SCHOOL,2013,NA
4139,07,LOVEWORKS ACADEMY FOR ARTS,2013,NA
4140,07,YINGHUA ACADEMY,2013,0.00199600798403194
4142,07,STRIDE ACADEMY CHARTER SCHOOL,2013,0.00836820083682008
4143,07,NEW MILLENNIUM ACADEMY CHARTER SCHOOL,2013,0.831877729257642
4144,07,GREEN ISLE COMMUNITY SCHOOL,2013,NA
4145,07,BIRCH GROVE COMMUNITY SCHOOL,2013,NA
4146,07,NORTHERN LIGHTS COMMUNITY SCHOOL,2013,NA
4150,07,MINNESOTA ONLINE HIGH SCHOOL,2013,NA
4151,07,EDVISIONS OFF CAMPUS SCHOOL,2013,NA
4152,07,TWIN CITIES GERMAN IMMERSION CHARTER SCHOOL,2013,0.00934579439252336
4153,07,DUGSI ACADEMY,2013,0.722371967654987
4155,07,NAYTAHWAUSH COMMUNITY SCHOOL,2013,NA
4159,07,SEVEN HILLS PREPARATORY ACADEMY,2013,0.0234192037470726
4160,07,SPECTRUM HIGH SCHOOL,2013,NA
4161,07,NEW DISCOVERIES MONTESSORI ACADEMY,2013,NA
4162,07,SOUTHSIDE FAMILY CHARTER SCHOOL,2013,0.0373831775700935
4164,07,LAURA JEFFREY ACADEMY CHARTER,2013,NA
4166,07,EAST RANGE ACADEMY OF TECHNOLOGY AND SCIENCE,2013,NA
4167,07,INTERNATIONAL SPANISH LANGUAGE ACADEMY,2013,NA
4168,07,GLACIAL HILLS ELEMENTARY,2013,NA
4169,07,STONEBRIDGE WORLD SCHOOL,2013,0.161572052401747
4170,07,HIAWATHA ACADEMIES,2013,0.820158102766798
4171,07,NOBLE ACADEMY,2013,0.670940170940171
4172,07,CLARKFIELD CHARTER SCHOOL,2013,NA
4177,07,MINISINAAKWAANG LEADERSHIP ACADEMY,2013,NA
4178,07,LINCOLN INTERNATIONAL SCHOOL,2013,0.966386554621849
4181,07,COMMUNITY SCHOOL OF EXCELLENCE,2013,0.694063926940639
4183,07,LIONSGATE ACADEMY,2013,NA
4184,07,ASPEN ACADEMY,2013,0.0705882352941176
4185,07,DAVINCI ACADEMY,2013,0.016548463356974
4186,07,GLOBAL ACADEMY,2013,0.566666666666667
4187,07,NATURAL SCIENCE ACADEMY,2013,NA
4188,07,COLOGNE ACADEMY,2013,0.0078125
4189,07,BRIGHT WATER ELEMENTARY,2013,0.0422535211267606
4190,07,RIVERS EDGE ACADEMY,2013,0.0153846153846154
4191,07,KIPP MINNESOTA CHARTER SCHOOL,2013,NA
4192,07,BEST ACADEMY,2013,0.368209255533199
4193,07,COLLEGE PREPARATORY ELEMENTARY,2013,0.66030534351145
4194,07,CANNON RIVER STEM SCHOOL,2013,0.0274509803921569
4195,07,OSHKI OGIMAAG CHARTER SCHOOL,2013,NA
4198,07,DISCOVERY WOODS,2013,NA
4199,07,PARNASSUS PREPARATORY CHARTER SCHOOL,2013,0.0327332242225859
4200,07,STEP ACADEMY CHARTER SCHOOL,2013,0.467105263157895
4201,07,CORNERSTONE MONTESSORI ELEMENTARY,2013,0.292682926829268
4204,07,ROCHESTER STEM ACADEMY,2013,0.983050847457627
4205,07,HENNEPIN ELEMENTARY SCHOOL,2013,0.808510638297872
4207,07,VERMILION COUNTRY SCHOOL,2013,NA
4208,07,NASHA SHKOLA CHARTER SCHOOL,2013,0.419354838709677
4209,07,MASTERY SCHOOL,2013,0.00641025641025641
4210,07,UPPER MISSISSIPPI ACADEMY,2013,NA
4212,07,WEST SIDE SUMMIT CHARTER SCHOOL,2013,NA
4213,07,PRODEO ACADEMY,2013,NA
4215,07,SEJONG ACADEMY OF MINNESOTA,2013,NA
4217,07,TECHNICAL ACADEMIES OF MINNESOTA,2013,NA
4218,07,VENTURE ACADEMY,2013,NA
4219,07,NORTHEAST COLLEGE PREP,2013,NA
4220,07,AGAMIM CLASSICAL ACADEMY,2013,NA
4221,07,DISCOVERY CHARTER SCHOOL,2013,NA
4223,07,SAINT CLOUD MATH AND SCIENCE ACADEMY CHARTER SCHOOL,2013,NA
4224,07,STAR OF THE NORTH ACADEMY CHARTER SCHOOL,2013,NA
4225,07,UNIVERSAL ACADEMY CHARTER SCHOOL,2013,NA
4226,07,BDOTE LEARNING CENTER,2013,NA
4227,07,ART AND SCIENCE ACADEMY,2013,NA
4228,07,WOODBURY LEADERSHIP ACADEMY,2013,NA
4229,07,JANE GOODALL ENVIRONMENTAL SCIENCE ACADEMY,2013,NA
4230,07,MINNESOTA EXCELLENCE IN LEARNING ACADEMY,2013,NA
4231,07,MINNESOTA MATH AND SCIENCE ACADEMY,2013,NA
4232,07,SUCCESS ACADEMY,2013,NA
4233,07,LEVEL UP ACADEMY,2013,NA
4237,07,CAREER PATHWAYS,2013,NA
4238,07,ROCHESTER BEACON ACADEMY,2013,NA
4239,07,TESFA INTERNATIONAL SCHOOL,2013,NA
4240,07,NEW CENTURY SCHOOL,2013,NA
4243,07,NORTH METRO FLEX ACADEMY,2013,NA
4244,07,FIT ACADEMY,2013,NA
4250,07,ATHLOS ACADEMY OF SAINT CLOUD,2013,NA
4253,07,PHOENIX ACADEMY CHARTER SCHOOL,2013,NA
4254,07,MARINE AREA COMMUNITY SCHOOL,2013,NA
4255,07,SKYLINE MATH AND SCIENCE ACADEMY,2013,NA
4261,07,SCITECH ACADEMY CHARTER SCHOOL,2013,NA
4264,07,GATEWAY STEM ACADEMY,2013,NA
4265,07,MINNESOTA WILDFLOWER MONTESSORI SCHOOL,2013,NA
6004,61,FRESHWATER EDUCATION DISTRICT,2013,NA
6009,61,ST. CROIX RIVER EDUCATION DISTRICT,2013,NA
6012,61,ZUMBRO EDUCATION DISTRICT,2013,NA
6013,61,HIAWATHA VALLEY EDUCATION DISTRICT,2013,NA
6014,61,RUNESTONE AREA EDUCATION DISTRICT,2013,NA
6018,61,MINNESOTA RIVER VALLEY EDUCATION DISTRICT,2013,NA
6026,61,WEST CENTRAL EDUCATION DISTRICT,2013,NA
6027,61,MINNESOTA VALLEY EDUCATION DISTRICT,2013,NA
6049,61,RIVER BEND EDUCATION DISTRICT,2013,NA
6051,61,GOODHUE COUNTY EDUCATION DISTRICT,2013,NA
6074,50,CENTRAL MINNESOTA JOINT POWERS DISTRICT,2013,NA
6076,50,NORTHLAND LEARNING CENTER,2013,NA
6079,52,RUM RIVER SPECIAL EDUCATION COOPERATIVE,2013,NA
6083,52,SOUTHERN MINNESOTA EDUCATION CONSORTIUM,2013,NA
6090,52,SHERBURNE AND NORTHERN WRIGHT SPECIAL EDUCATION COOPERATIVE,2013,NA
6094,52,CANNON VALLEY SPECIAL EDUCATION COOPERATIVE,2013,NA
6095,52,AUSTIN ALBERT LEA AREA SPECIAL EDUCATION COOPERATIVE (AALASEC),2013,NA
6096,52,NORTHERN LIGHTS ACADEMY COOPERATIVE,2013,NA
6383,61,BENTON-STEARNS EDUCATION DISTRICT,2013,NA
6979,61,MID STATE EDUCATION DISTRICT,2013,NA
0000,01,Minneapolis-St. Paul International Airport,2013,NA
2759,01,Eagle Valley,2013,NA
0323,02,Franconia,2013,NA
0815,02,Prinsburg,2013,NA
0001,01,AITKIN PUBLIC SCHOOL DISTRICT,2012,0.000785545954438335
0001,03,MINNEAPOLIS PUBLIC SCHOOL DISTRICT,2012,0.219973283772796
0002,01,HILL CITY PUBLIC SCHOOL DISTRICT,2012,NA
0004,01,MCGREGOR PUBLIC SCHOOL DISTRICT,2012,NA
0006,03,SOUTH ST. PAUL PUBLIC SCHOOL DISTRICT,2012,0.0647395362842517
0011,01,ANOKA-HENNEPIN PUBLIC SCHOOL DISTRICT,2012,0.0645711626945148
0012,01,CENTENNIAL PUBLIC SCHOOL DISTRICT,2012,0.013249114158065
0013,01,COLUMBIA HEIGHTS PUBLIC SCHOOL DISTRICT,2012,0.274710743801653
0014,01,FRIDLEY PUBLIC SCHOOL DISTRICT,2012,0.148856264936839
0015,01,ST. FRANCIS AREA SCHOOLS,2012,0.026882745471878
0016,01,SPRING LAKE PARK PUBLIC SCHOOLS,2012,0.101102242493349
0022,01,DETROIT LAKES PUBLIC SCHOOL DISTRICT,2012,0.00312283136710618
0023,01,FRAZEE-VERGAS PUBLIC SCHOOL DISTRICT,2012,0.0033003300330033
0025,01,PINE POINT PUBLIC SCHOOL DISTRICT,2012,NA
0031,01,BEMIDJI PUBLIC SCHOOL DISTRICT,2012,0.00234283483014447
0032,01,BLACKDUCK PUBLIC SCHOOL DISTRICT,2012,0.00333889816360601
0036,01,KELLIHER PUBLIC SCHOOL DISTRICT,2012,NA
0038,01,RED LAKE PUBLIC SCHOOL DISTRICT,2012,0.0537400145243283
0047,01,SAUK RAPIDS-RICE PUBLIC SCHOOLS,2012,0.0058405281868969
0051,01,FOLEY PUBLIC SCHOOL DISTRICT,2012,NA
0075,01,ST. CLAIR PUBLIC SCHOOL DISTRICT,2012,NA
0077,01,MANKATO PUBLIC SCHOOL DISTRICT,2012,0.0530590855495873
0081,01,COMFREY PUBLIC SCHOOL DISTRICT,2012,0.0114942528735632
0084,01,SLEEPY EYE PUBLIC SCHOOL DISTRICT,2012,0.0825396825396825
0085,01,SPRINGFIELD PUBLIC SCHOOL DISTRICT,2012,0.00672268907563025
0088,01,NEW ULM PUBLIC SCHOOL DISTRICT,2012,0.0157041540020263
0091,01,BARNUM PUBLIC SCHOOL DISTRICT,2012,0.00259067357512953
0093,01,CARLTON PUBLIC SCHOOL DISTRICT,2012,NA
0094,01,CLOQUET PUBLIC SCHOOL DISTRICT,2012,0.000822368421052632
0095,01,CROMWELL-WRIGHT PUBLIC SCHOOLS,2012,NA
0097,01,MOOSE LAKE PUBLIC SCHOOL DISTRICT,2012,NA
0099,01,ESKO PUBLIC SCHOOL DISTRICT,2012,0.000820344544708778
0100,01,WRENSHALL PUBLIC SCHOOL DISTRICT,2012,NA
0108,01,CENTRAL PUBLIC SCHOOL DISTRICT,2012,0.0189243027888446
0110,01,WACONIA PUBLIC SCHOOL DISTRICT,2012,0.00951831554658206
0111,01,WATERTOWN-MAYER PUBLIC SCHOOL DISTRICT,2012,0.00991325898389095
0112,01,EASTERN CARVER COUNTY PUBLIC SCHOOLS,2012,0.0515124945199474
0113,01,WALKER-HACKENSACK-AKELEY SCHOOL DISTRICT,2012,0.00495049504950495
0115,01,CASS LAKE-BENA PUBLIC SCHOOLS,2012,NA
0116,01,PILLAGER PUBLIC SCHOOL DISTRICT,2012,NA
0118,01,NORTHLAND COMMUNITY SCHOOLS,2012,NA
0129,01,MONTEVIDEO PUBLIC SCHOOL DISTRICT,2012,0.0539730134932534
0138,01,NORTH BRANCH PUBLIC SCHOOLS,2012,0.00985525100092393
0139,01,RUSH CITY PUBLIC SCHOOL DISTRICT,2012,0.00331491712707182
0146,01,BARNESVILLE PUBLIC SCHOOL DISTRICT,2012,NA
0150,01,HAWLEY PUBLIC SCHOOL DISTRICT,2012,0.0577342047930283
0152,01,MOORHEAD PUBLIC SCHOOL DISTRICT,2012,0.062948350071736
0160,70,MINNESOTA STATE ACADEMIES,2012,0.00512820512820513
0162,01,BAGLEY PUBLIC SCHOOL DISTRICT,2012,NA
0166,01,COOK COUNTY PUBLIC SCHOOLS,2012,NA
0173,01,MOUNTAIN LAKE PUBLIC SCHOOLS,2012,0.126315789473684
0177,01,WINDOM PUBLIC SCHOOL DISTRICT,2012,0.0752351097178683
0181,01,BRAINERD PUBLIC SCHOOL DISTRICT,2012,NA
0182,01,CROSBY-IRONTON PUBLIC SCHOOL DISTRICT,2012,NA
0186,01,PEQUOT LAKES PUBLIC SCHOOLS,2012,0.000607533414337789
0191,01,BURNSVILLE PUBLIC SCHOOL DISTRICT,2012,0.153295128939828
0192,01,FARMINGTON PUBLIC SCHOOL DISTRICT,2012,0.0385654261704682
0194,01,LAKEVILLE PUBLIC SCHOOL DISTRICT,2012,0.0275705186533212
0195,01,RANDOLPH PUBLIC SCHOOL DISTRICT,2012,NA
0196,01,ROSEMOUNT-APPLE VALLEY-EAGAN,2012,0.0500783613368809
0197,01,WEST ST. PAUL-MENDOTA HEIGHTS-EAGAN,2012,0.118684153945388
0199,01,INVER GROVE HEIGHTS SCHOOLS,2012,0.0677069558317905
0200,01,HASTINGS PUBLIC SCHOOL DISTRICT,2012,0.0113466067223293
0203,01,HAYFIELD PUBLIC SCHOOL DISTRICT,2012,0.0204865556978233
0204,01,KASSON-MANTORVILLE SCHOOL DISTRICT,2012,0.0125
0206,01,ALEXANDRIA PUBLIC SCHOOL DISTRICT,2012,0.00178753830439224
0213,01,OSAKIS PUBLIC SCHOOL DISTRICT,2012,0.00119189511323004
0227,01,CHATFIELD PUBLIC SCHOOLS,2012,0.00338983050847458
0229,01,LANESBORO PUBLIC SCHOOL DISTRICT,2012,NA
0238,01,MABEL-CANTON PUBLIC SCHOOL DISTRICT,2012,NA
0239,01,RUSHFORD-PETERSON PUBLIC SCHOOLS,2012,NA
0241,01,ALBERT LEA PUBLIC SCHOOL DISTRICT,2012,0.0802563320109857
0242,01,ALDEN-CONGER PUBLIC SCHOOL DISTRICT,2012,NA
0252,01,CANNON FALLS PUBLIC SCHOOL DISTRICT,2012,0.00667779632721202
0253,01,GOODHUE PUBLIC SCHOOL DISTRICT,2012,0.0494590417310665
0255,01,PINE ISLAND PUBLIC SCHOOL DISTRICT,2012,0.00335852225020991
0256,01,RED WING PUBLIC SCHOOL DISTRICT,2012,0.0222608695652174
0261,01,ASHBY PUBLIC SCHOOL DISTRICT,2012,NA
0264,01,HERMAN-NORCROSS SCHOOL DISTRICT,2012,NA
0270,01,HOPKINS PUBLIC SCHOOL DISTRICT,2012,0.0721187508752276
0271,01,BLOOMINGTON PUBLIC SCHOOL DISTRICT,2012,0.117868574656374
0272,01,EDEN PRAIRIE PUBLIC SCHOOL DISTRICT,2012,0.0679209183673469
0273,01,EDINA PUBLIC SCHOOL DISTRICT,2012,0.0337078651685393
0276,01,MINNETONKA PUBLIC SCHOOL DISTRICT,2012,0.0167928877181429
0277,01,WESTONKA PUBLIC SCHOOL DISTRICT,2012,0.00580875781948168
0278,01,ORONO PUBLIC SCHOOL DISTRICT,2012,0.014996342355523
0279,01,OSSEO PUBLIC SCHOOL DISTRICT,2012,0.0903509620032873
0280,01,RICHFIELD PUBLIC SCHOOL DISTRICT,2012,0.319288389513109
0281,01,ROBBINSDALE PUBLIC SCHOOL DISTRICT,2012,0.108688443044271
0282,01,ST. ANTHONY-NEW BRIGHTON SCHOOLS,2012,0.0535815002820079
0283,01,ST. LOUIS PARK PUBLIC SCHOOL DISTRICT,2012,0.0837053571428571
0284,01,WAYZATA PUBLIC SCHOOL DISTRICT,2012,0.0195668693009119
0286,01,BROOKLYN CENTER SCHOOL DISTRICT,2012,0.186344238975818
0287,06,INTERMEDIATE SCHOOL DISTRICT 287,2012,0.0336307481125601
0287,06,INTERMEDIATE SCHOOL DISTRICT 288,2012,0.0336307481125601
0287,06,INTERMEDIATE SCHOOL DISTRICT 289,2012,0.0336307481125601
0287,06,INTERMEDIATE SCHOOL DISTRICT 290,2012,0.0336307481125601
0287,06,INTERMEDIATE SCHOOL DISTRICT 291,2012,0.0336307481125601
0287,06,INTERMEDIATE SCHOOL DISTRICT 292,2012,0.0336307481125601
0287,06,INTERMEDIATE SCHOOL DISTRICT 293,2012,0.0336307481125601
0287,06,INTERMEDIATE SCHOOL DISTRICT 294,2012,0.0336307481125601
0287,06,INTERMEDIATE SCHOOL DISTRICT 295,2012,0.0336307481125601
0287,06,INTERMEDIATE SCHOOL DISTRICT 296,2012,0.0336307481125601
0287,06,INTERMEDIATE SCHOOL DISTRICT 297,2012,0.0336307481125601
0287,06,INTERMEDIATE SCHOOL DISTRICT 298,2012,0.0336307481125601
0287,06,INTERMEDIATE SCHOOL DISTRICT 299,2012,0.0336307481125601
0288,06,SOUTHWEST METRO INTERMEDIATE 288,2012,NA
0294,01,HOUSTON PUBLIC SCHOOL DISTRICT,2012,NA
0297,01,SPRING GROVE SCHOOL DISTRICT,2012,NA
0299,01,CALEDONIA PUBLIC SCHOOL DISTRICT,2012,0.00421940928270042
0300,01,LA CRESCENT-HOKAH SCHOOL DISTRICT,2012,NA
0306,01,LAPORTE PUBLIC SCHOOL DISTRICT,2012,NA
0308,01,NEVIS PUBLIC SCHOOL DISTRICT,2012,NA
0309,01,PARK RAPIDS PUBLIC SCHOOL DISTRICT,2012,0.0045841519318926
0314,01,BRAHAM PUBLIC SCHOOL DISTRICT,2012,0.0155728587319244
0316,01,GREENWAY PUBLIC SCHOOL DISTRICT,2012,NA
0317,01,DEER RIVER PUBLIC SCHOOL DISTRICT,2012,NA
0318,01,GRAND RAPIDS PUBLIC SCHOOL DISTRICT,2012,0.00025419420437214
0319,01,NASHWAUK-KEEWATIN SCHOOL DISTRICT,2012,NA
0330,01,HERON LAKE-OKABENA SCHOOL DISTRICT,2012,0.133522727272727
0332,01,MORA PUBLIC SCHOOL DISTRICT,2012,NA
0333,01,OGILVIE PUBLIC SCHOOL DISTRICT,2012,NA
0345,01,NEW LONDON-SPICER SCHOOL DISTRICT,2012,0.0104384133611691
0347,01,WILLMAR PUBLIC SCHOOL DISTRICT,2012,0.156120205228439
0356,01,LANCASTER PUBLIC SCHOOL DISTRICT,2012,NA
0361,01,INTERNATIONAL FALLS SCHOOL DISTRICT,2012,0.00561797752808989
0362,01,LITTLEFORK-BIG FALLS SCHOOL DISTRICT,2012,NA
0363,01,SOUTH KOOCHICHING SCHOOL DISTRICT,2012,NA
0378,01,DAWSON-BOYD PUBLIC SCHOOL DISTRICT,2012,0.00590551181102362
0381,01,LAKE SUPERIOR PUBLIC SCHOOL DISTRICT,2012,NA
0390,01,LAKE OF THE WOODS SCHOOL DISTRICT,2012,NA
0391,01,CLEVELAND PUBLIC SCHOOL DISTRICT,2012,NA
0397,52,LAKE AGASSIZ EDUCATION COOPERATIVE,2012,NA
0398,52,MIDWEST SPECIAL EDUCATION COOPERATIVE,2012,NA
0402,01,HENDRICKS PUBLIC SCHOOL DISTRICT,2012,0.010752688172043
0403,01,IVANHOE PUBLIC SCHOOL DISTRICT,2012,NA
0404,01,LAKE BENTON PUBLIC SCHOOL DISTRICT,2012,NA
0413,01,MARSHALL PUBLIC SCHOOL DISTRICT,2012,0.0988526037069726
0414,01,MINNEOTA PUBLIC SCHOOL DISTRICT,2012,0.0623556581986143
0415,01,LYND PUBLIC SCHOOL DISTRICT,2012,0.28695652173913
0423,01,HUTCHINSON PUBLIC SCHOOL DISTRICT,2012,0.0230743128605361
0424,01,LESTER PRAIRIE PUBLIC SCHOOL DISTRICT,2012,0.0857843137254902
0432,01,MAHNOMEN PUBLIC SCHOOL DISTRICT,2012,NA
0435,01,WAUBUN-OGEMA-WHITE EARTH PUBLIC SCHOOLS,2012,NA
0441,01,MARSHALL COUNTY CENTRAL SCHOOLS,2012,NA
0447,01,GRYGLA PUBLIC SCHOOL DISTRICT,2012,NA
0458,01,TRUMAN PUBLIC SCHOOL DISTRICT,2012,0.0358565737051793
0463,01,EDEN VALLEY-WATKINS SCHOOL DISTRICT,2012,0.00106723585912487
0465,01,LITCHFIELD PUBLIC SCHOOL DISTRICT,2012,0.0189461219656602
0466,01,DASSEL-COKATO PUBLIC SCHOOL DISTRICT,2012,0.0066607460035524
0473,01,ISLE PUBLIC SCHOOL DISTRICT,2012,NA
0477,01,PRINCETON PUBLIC SCHOOL DISTRICT,2012,0.00412857564140372
0480,01,ONAMIA PUBLIC SCHOOL DISTRICT,2012,NA
0482,01,LITTLE FALLS PUBLIC SCHOOL DISTRICT,2012,0.00767676767676768
0484,01,PERZ PUBLIC SCHOOL DISTRICT,2012,0.00362647325475975
0485,01,ROYALTON PUBLIC SCHOOL DISTRICT,2012,NA
0486,01,SWANVILLE PUBLIC SCHOOL DISTRICT,2012,NA
0487,01,UPSALA PUBLIC SCHOOL DISTRICT,2012,NA
0492,01,AUSTIN PUBLIC SCHOOL DISTRICT,2012,0.138495575221239
0495,01,GRAND MEADOW PUBLIC SCHOOL DISTRICT,2012,NA
0497,01,LYLE PUBLIC SCHOOL DISTRICT,2012,NA
0499,01,LEROY-OSTRANDER PUBLIC SCHOOLS,2012,0.0165562913907285
0500,01,SOUTHLAND PUBLIC SCHOOL DISTRICT,2012,0.0275049115913556
0505,01,FULDA PUBLIC SCHOOL DISTRICT,2012,0.0117994100294985
0507,01,NICOLLET PUBLIC SCHOOL DISTRICT,2012,NA
0508,01,ST. PETER PUBLIC SCHOOL DISTRICT,2012,0.0433873497124935
0511,01,ADRIAN PUBLIC SCHOOL DISTRICT,2012,0.0100502512562814
0514,01,ELLSWORTH PUBLIC SCHOOL DISTRICT,2012,NA
0518,01,WORTHINGTON PUBLIC SCHOOL DISTRICT,2012,0.193978658536585
0531,01,BYRON PUBLIC SCHOOL DISTRICT,2012,NA
0533,01,DOVER-EYOTA PUBLIC SCHOOL DISTRICT,2012,0.000867302688638335
0534,01,STEWARTVILLE PUBLIC SCHOOL DISTRICT,2012,NA
0535,01,ROCHESTER PUBLIC SCHOOL DISTRICT,2012,0.109094254001349
0542,01,BATTLE LAKE PUBLIC SCHOOL DISTRICT,2012,NA
0544,01,FERGUS FALLS PUBLIC SCHOOL DISTRICT,2012,0.00208246563931695
0545,01,HENNING PUBLIC SCHOOL DISTRICT,2012,NA
0547,01,PARKERS PRAIRIE PUBLIC SCHOOL DISTRICT,2012,NA
0548,01,PELICAN RAPIDS PUBLIC SCHOOL DISTRICT,2012,0.187219730941704
0549,01,PERHAM-DENT PUBLIC SCHOOL DISTRICT,2012,0.0229390681003584
0550,01,UNDERWOOD PUBLIC SCHOOL DISTRICT,2012,NA
0553,01,NEW YORK MILLS PUBLIC SCHOOL DISTRICT,2012,NA
0561,01,GOODRIDGE PUBLIC SCHOOL DISTRICT,2012,NA
0564,01,THIEF RIVER FALLS SCHOOL DISTRICT,2012,0.0111223458038423
0577,01,WILLOW RIVER PUBLIC SCHOOL DISTRICT,2012,NA
0578,01,PINE CITY PUBLIC SCHOOL DISTRICT,2012,0.00850546780072904
0581,01,EDGERTON PUBLIC SCHOOL DISTRICT,2012,0.0432098765432099
0592,01,CLIMAX-SHELLY PUBLIC SCHOOLS,2012,NA
0593,01,CROOKSTON PUBLIC SCHOOL DISTRICT,2012,0.0356589147286822
0595,01,EAST GRAND FORKS PUBLIC SCHOOL DISTRICT,2012,0.0139697322467986
0599,01,FERTILE-BELTRAMI SCHOOL DISTRICT,2012,NA
0600,01,FISHER PUBLIC SCHOOL DISTRICT,2012,0.0116731517509728
0601,01,FOSSTON PUBLIC SCHOOL DISTRICT,2012,NA
0621,01,MOUNDS VIEW PUBLIC SCHOOL DISTRICT,2012,0.0451436388508892
0622,01,NORTH ST. PAUL-MAPLEWOOD OAKDALE PUBLIC SCHOOL DISTRICT,2012,0.0739767179872324
0623,01,ROSEVILLE PUBLIC SCHOOL DISTRICT,2012,0.149386682242991
0624,01,WHITE BEAR LAKE SCHOOL DISTRICT,2012,0.0472229018840225
0625,01,ST. PAUL PUBLIC SCHOOL DISTRICT,2012,0.356908937249102
0630,01,RED LAKE FALLS PUBLIC SCHOOL DISTRICT,2012,NA
0635,01,MILROY PUBLIC SCHOOL DISTRICT,2012,NA
0640,01,WABASSO PUBLIC SCHOOL DISTRICT,2012,0.00689655172413793
0656,01,FARIBAULT PUBLIC SCHOOL DISTRICT,2012,0.176381145463761
0659,01,NORTHFIELD PUBLIC SCHOOL DISTRICT,2012,0.0801447776628749
0671,01,HILLS-BEAVER CREEK SCHOOL DISTRICT,2012,NA
0676,01,BADGER PUBLIC SCHOOL DISTRICT,2012,NA
0682,01,ROSEAU PUBLIC SCHOOL DISTRICT,2012,0.00160384923817161
0690,01,WARROAD PUBLIC SCHOOL DISTRICT,2012,0.0164533820840951
0695,01,CHISHOLM PUBLIC SCHOOL DISTRICT,2012,NA
0696,01,ELY PUBLIC SCHOOL DISTRICT,2012,NA
0698,01,FLOODWOOD PUBLIC SCHOOL DISTRICT,2012,NA
0700,01,HERMANTOWN PUBLIC SCHOOL DISTRICT,2012,NA
0701,01,HIBBING PUBLIC SCHOOL DISTRICT,2012,0.00205761316872428
0704,01,PROCTOR PUBLIC SCHOOL DISTRICT,2012,0.00341685649202733
0706,01,VIRGINIA PUBLIC SCHOOL DISTRICT,2012,0.00182704019488429
0707,01,NETT LAKE PUBLIC SCHOOL DISTRICT,2012,NA
0709,01,DULUTH PUBLIC SCHOOL DISTRICT,2012,0.00207809252980422
0712,01,MOUNTAIN IRON-BUHL SCHOOL DISTRICT,2012,NA
0716,01,BELLE PLAINE PUBLIC SCHOOL DISTRICT,2012,0.00614628149969269
0717,01,JORDAN PUBLIC SCHOOL DISTRICT,2012,0.039609644087256
0719,01,PRIOR LAKE-SAVAGE AREA SCHOOLS,2012,0.0260387811634349
0720,01,SHAKOPEE PUBLIC SCHOOL DISTRICT,2012,0.121179480274673
0721,01,NEW PRAGUE AREA SCHOOLS,2012,0.0135584548477872
0726,01,BECKER PUBLIC SCHOOL DISTRICT,2012,0.0141048824593128
0727,01,BIG LAKE PUBLIC SCHOOL DISTRICT,2012,0.0210245780278354
0728,01,ELK RIVER PUBLIC SCHOOL DISTRICT,2012,0.030388250917897
0738,01,HOLDINGFORD PUBLIC SCHOOL DISTRICT,2012,NA
0739,01,KIMBALL PUBLIC SCHOOL DISTRICT,2012,NA
0740,01,MELROSE PUBLIC SCHOOL DISTRICT,2012,0.156412157153447
0741,01,PAYNESVILLE PUBLIC SCHOOL DISTRICT,2012,0.00795228628230616
0742,01,ST. CLOUD PUBLIC SCHOOL DISTRICT,2012,0.114681268726108
0743,01,SAUK CENTRE PUBLIC SCHOOL DISTRICT,2012,0.0365482233502538
0745,01,ALBANY PUBLIC SCHOOL DISTRICT,2012,0.013126491646778
0748,01,SARTELL-ST. STEPHEN SCHOOL DISTRICT,2012,0.00848385331143952
0750,01,ROCORI PUBLIC SCHOOL DISTRICT,2012,0.0271604938271605
0756,01,BLOOMING PRAIRIE PUBLIC SCHOOL DISTRICT,2012,0.0264993026499303
0761,01,OWATONNA PUBLIC SCHOOL DISTRICT,2012,0.0771287535993418
0763,01,MEDFORD PUBLIC SCHOOL DISTRICT,2012,0.0275862068965517
0768,01,HANCOCK PUBLIC SCHOOL DISTRICT,2012,0.0136986301369863
0771,01,CHOKIO-ALBERTA PUBLIC SCHOOL DISTRICT,2012,NA
0775,01,KERKHOVEN-MURDOCK-SUNBURG,2012,0.0417391304347826
0777,01,BENSON PUBLIC SCHOOL DISTRICT,2012,0.00991189427312775
0786,01,BERTHA-HEWITT PUBLIC SCHOOL DISTRICT,2012,NA
0787,01,BROWERVILLE PUBLIC SCHOOL DISTRICT,2012,NA
0801,01,BROWNS VALLEY PUBLIC SCHOOL DISTRICT,2012,NA
0803,01,WHEATON AREA PUBLIC SCHOOL DISTRICT,2012,0.0224438902743142
0811,01,WABASHA-KELLOGG PUBLIC SCHOOL DISTRICT,2012,0.00674536256323777
0813,01,LAKE CITY PUBLIC SCHOOL DISTRICT,2012,0.0186688311688312
0818,01,VERNDALE PUBLIC SCHOOL DISTRICT,2012,NA
0820,01,SEBEKA PUBLIC SCHOOL DISTRICT,2012,NA
0821,01,MENAHGA PUBLIC SCHOOL DISTRICT,2012,NA
0829,01,WASECA PUBLIC SCHOOL DISTRICT,2012,0.0432717678100264
0831,01,FOREST LAKE PUBLIC SCHOOL DISTRICT,2012,0.00955039670878637
0832,01,MAHTOMEDI PUBLIC SCHOOL DISTRICT,2012,0.0133616762830246
0833,01,SOUTH WASHINGTON COUNTY SCHOOL DISTRICT,2012,0.0422551383626134
0834,01,STILLWATER AREA PUBLIC SCHOOL DISTRICT,2012,0.0166305133767173
0836,01,BUTTERFIELD PUBLIC SCHOOL DISTRICT,2012,0.17351598173516
0837,01,MADELIA PUBLIC SCHOOL DISTRICT,2012,0.131274131274131
0840,01,ST. JAMES PUBLIC SCHOOL DISTRICT,2012,0.0970695970695971
0846,01,BRECKENRIDGE PUBLIC SCHOOL DISTRICT,2012,0.0238095238095238
0850,01,ROTHSAY PUBLIC SCHOOL DISTRICT,2012,NA
0852,01,CAMPBELL-TINTAH PUBLIC SCHOOL DISTRICT,2012,0.138461538461538
0857,01,LEWISTON-ALTURA PUBLIC SCHOOL DISTRICT,2012,0.0169934640522876
0858,01,ST. CHARLES PUBLIC SCHOOL DISTRICT,2012,0.0478128179043744
0861,01,WINONA AREA PUBLIC SCHOOL DISTRICT,2012,0.0316630802336305
0876,01,ANNANDALE PUBLIC SCHOOL DISTRICT,2012,0.0105324751316559
0877,01,BUFFALO-HANOVER-MONTROSE PUBLIC SCHOOLS,2012,0.0167406901264093
0879,01,DELANO PUBLIC SCHOOL DISTRICT,2012,0.0034767492394611
0881,01,MAPLE LAKE PUBLIC SCHOOL DISTRICT,2012,NA
0882,01,MONTICELLO PUBLIC SCHOOL DISTRICT,2012,0.0321167883211679
0883,01,ROCKFORD PUBLIC SCHOOL DISTRICT,2012,0.0257861635220126
0885,01,ST. MICHAEL-ALBERTVILLE SCHOOL DISTRICT,2012,0.0278333636529016
0891,01,CANBY PUBLIC SCHOOL DISTRICT,2012,0.001953125
0911,01,CAMBRIDGE-ISANTI PUBLIC SCHOOL DISTRICT,2012,0.0113126584747416
0912,01,MILACA PUBLIC SCHOOL DISTRICT,2012,0.00695187165775401
0914,01,ULEN-HITTERDAL PUBLIC SCHOOL DISTRICT,2012,NA
0915,52,SOUTHERN PLAINS EDUCATION COOPERATIVE,2012,NA
0916,06,NORTHEAST METRO 916,2012,0.00166944908180301
0916,06,NORTHEAST METRO 917,2012,0.00166944908180301
0916,06,NORTHEAST METRO 918,2012,0.00166944908180301
0916,06,NORTHEAST METRO 919,2012,0.00166944908180301
0916,06,NORTHEAST METRO 920,2012,0.00166944908180301
0916,06,NORTHEAST METRO 921,2012,0.00166944908180301
0916,06,NORTHEAST METRO 922,2012,0.00166944908180301
0916,06,NORTHEAST METRO 923,2012,0.00166944908180301
0916,06,NORTHEAST METRO 924,2012,0.00166944908180301
0916,06,NORTHEAST METRO 925,2012,0.00166944908180301
0916,06,NORTHEAST METRO 926,2012,0.00166944908180301
0916,06,NORTHEAST METRO 927,2012,0.00166944908180301
0916,06,NORTHEAST METRO 928,2012,0.00166944908180301
0916,06,NORTHEAST METRO 929,2012,0.00166944908180301
0917,06,INTERMEDIATE SCHOOL DISTRICT 917,2012,NA
0917,06,INTERMEDIATE SCHOOL DISTRICT 918,2012,NA
0917,06,INTERMEDIATE SCHOOL DISTRICT 919,2012,NA
0917,06,INTERMEDIATE SCHOOL DISTRICT 920,2012,NA
0917,06,INTERMEDIATE SCHOOL DISTRICT 921,2012,NA
0917,06,INTERMEDIATE SCHOOL DISTRICT 922,2012,NA
0917,06,INTERMEDIATE SCHOOL DISTRICT 923,2012,NA
0917,06,INTERMEDIATE SCHOOL DISTRICT 924,2012,NA
0917,06,INTERMEDIATE SCHOOL DISTRICT 925,2012,NA
0917,06,INTERMEDIATE SCHOOL DISTRICT 926,2012,NA
0917,06,INTERMEDIATE SCHOOL DISTRICT 927,2012,NA
0917,06,INTERMEDIATE SCHOOL DISTRICT 928,2012,NA
0917,06,INTERMEDIATE SCHOOL DISTRICT 929,2012,NA
