districtNumber,districtType,districtName,year,percentIdentified
0001,01,AITKIN PUBLIC SCHOOL DISTRICT,2019,0.00168634064080944
0001,03,MINNEAPOLIS PUBLIC SCHOOL DISTRICT,2019,0.205199550309162
0002,01,HILL CITY PUBLIC SCHOOL DISTRICT,2019,NA
0004,01,MCGREGOR PUBLIC SCHOOL DISTRICT,2019,0
0006,03,SOUTH ST. PAUL PUBLIC SCHOOL DISTRICT,2019,0.0625704622322435
0011,01,ANOKA-HENNEPIN PUBLIC SCHOOL DISTRICT,2019,0.065692490077831
0012,01,CENTENNIAL PUBLIC SCHOOL DISTRICT,2019,0.028486646884273
0013,01,COLUMBIA HEIGHTS PUBLIC SCHOOL DISTRICT,2019,0.273690406121248
0014,01,FRIDLEY PUBLIC SCHOOL DISTRICT,2019,0.133596577821652
0015,01,ST. FRANCIS AREA SCHOOLS,2019,0.0217725973169123
0016,01,SPRING LAKE PARK PUBLIC SCHOOLS,2019,0.113024934383202
0022,01,DETROIT LAKES PUBLIC SCHOOL DISTRICT,2019,0.00229734164752215
0023,01,FRAZEE-VERGAS PUBLIC SCHOOL DISTRICT,2019,NA
0025,01,PINE POINT PUBLIC SCHOOL DISTRICT,2019,NA
0031,01,BEMIDJI PUBLIC SCHOOL DISTRICT,2019,0.00191204588910134
0032,01,BLACKDUCK PUBLIC SCHOOL DISTRICT,2019,NA
0036,01,KELLIHER PUBLIC SCHOOL DISTRICT,2019,NA
0038,01,RED LAKE PUBLIC SCHOOL DISTRICT,2019,0
0047,01,SAUK RAPIDS-RICE PUBLIC SCHOOLS,2019,0.00860770389498601
0051,01,FOLEY PUBLIC SCHOOL DISTRICT,2019,0.000509164969450102
0075,01,ST. CLAIR PUBLIC SCHOOL DISTRICT,2019,NA
0077,01,MANKATO PUBLIC SCHOOL DISTRICT,2019,0.0584157290601205
0081,01,COMFREY PUBLIC SCHOOL DISTRICT,2019,NA
0084,01,SLEEPY EYE PUBLIC SCHOOL DISTRICT,2019,0.110016420361248
0085,01,SPRINGFIELD PUBLIC SCHOOL DISTRICT,2019,NA
0088,01,NEW ULM PUBLIC SCHOOL DISTRICT,2019,0.0076518412242946
0091,01,BARNUM PUBLIC SCHOOL DISTRICT,2019,NA
0093,01,CARLTON PUBLIC SCHOOL DISTRICT,2019,NA
0094,01,CLOQUET PUBLIC SCHOOL DISTRICT,2019,0.00113036925395629
0095,01,CROMWELL-WRIGHT PUBLIC SCHOOLS,2019,NA
0097,01,MOOSE LAKE PUBLIC SCHOOL DISTRICT,2019,NA
0099,01,ESKO PUBLIC SCHOOL DISTRICT,2019,0.00155884645362432
0100,01,WRENSHALL PUBLIC SCHOOL DISTRICT,2019,NA
0108,01,CENTRAL PUBLIC SCHOOL DISTRICT,2019,0.0212981744421907
0110,01,WACONIA PUBLIC SCHOOL DISTRICT,2019,0.0157652195003638
0111,01,WATERTOWN-MAYER PUBLIC SCHOOL DISTRICT,2019,0.00902061855670103
0112,01,EASTERN CARVER COUNTY PUBLIC SCHOOLS,2019,0.0453759283752162
0113,01,WALKER-HACKENSACK-AKELEY SCHOOL DISTRICT,2019,0.00125156445556946
0115,01,CASS LAKE-BENA PUBLIC SCHOOLS,2019,0
0116,01,PILLAGER PUBLIC SCHOOL DISTRICT,2019,0.000859106529209622
0118,01,NORTHLAND COMMUNITY SCHOOLS,2019,NA
0129,01,MONTEVIDEO PUBLIC SCHOOL DISTRICT,2019,0.0943931866572037
0138,01,NORTH BRANCH PUBLIC SCHOOLS,2019,0.018308311973636
0139,01,RUSH CITY PUBLIC SCHOOL DISTRICT,2019,0.00471698113207547
0146,01,BARNESVILLE PUBLIC SCHOOL DISTRICT,2019,0
0150,01,HAWLEY PUBLIC SCHOOL DISTRICT,2019,0.0205128205128205
0152,01,MOORHEAD PUBLIC SCHOOL DISTRICT,2019,0.0839618613917746
0160,70,MINNESOTA STATE ACADEMIES,2019,NA
0162,01,BAGLEY PUBLIC SCHOOL DISTRICT,2019,0
0166,01,COOK COUNTY PUBLIC SCHOOLS,2019,0
0173,01,MOUNTAIN LAKE PUBLIC SCHOOLS,2019,NA
0177,01,WINDOM PUBLIC SCHOOL DISTRICT,2019,0.0845864661654135
0181,01,BRAINERD PUBLIC SCHOOL DISTRICT,2019,0.00249559600704639
0182,01,CROSBY-IRONTON PUBLIC SCHOOL DISTRICT,2019,0.000954198473282443
0186,01,PEQUOT LAKES PUBLIC SCHOOLS,2019,0.00114481969089868
0191,01,BURNSVILLE PUBLIC SCHOOL DISTRICT,2019,0.173766058147397
0192,01,FARMINGTON PUBLIC SCHOOL DISTRICT,2019,0.0412963216190346
0194,01,LAKEVILLE PUBLIC SCHOOL DISTRICT,2019,0.0298107818636201
0195,01,RANDOLPH PUBLIC SCHOOL DISTRICT,2019,NA
0196,01,ROSEMOUNT-APPLE VALLEY-EAGAN,2019,0.069593406214436
0197,01,WEST ST. PAUL-MENDOTA HEIGHTS-EAGAN,2019,0.116430486403677
0199,01,INVER GROVE HEIGHTS SCHOOLS,2019,0.097440132122213
0200,01,HASTINGS PUBLIC SCHOOL DISTRICT,2019,0.0116146663630153
0203,01,HAYFIELD PUBLIC SCHOOL DISTRICT,2019,NA
0204,01,KASSON-MANTORVILLE SCHOOL DISTRICT,2019,0.0162016201620162
0206,01,ALEXANDRIA PUBLIC SCHOOL DISTRICT,2019,0.00668098305893582
0213,01,OSAKIS PUBLIC SCHOOL DISTRICT,2019,NA
0227,01,CHATFIELD PUBLIC SCHOOLS,2019,0
0229,01,LANESBORO PUBLIC SCHOOL DISTRICT,2019,NA
0238,01,MABEL-CANTON PUBLIC SCHOOL DISTRICT,2019,NA
0239,01,RUSHFORD-PETERSON PUBLIC SCHOOLS,2019,NA
0241,01,ALBERT LEA PUBLIC SCHOOL DISTRICT,2019,0.0840055632823366
0242,01,ALDEN-CONGER PUBLIC SCHOOL DISTRICT,2019,NA
0252,01,CANNON FALLS PUBLIC SCHOOL DISTRICT,2019,0.00431778929188256
0253,01,GOODHUE PUBLIC SCHOOL DISTRICT,2019,0.0490341753343239
0255,01,PINE ISLAND PUBLIC SCHOOL DISTRICT,2019,0
0256,01,RED WING PUBLIC SCHOOL DISTRICT,2019,0.0191226096737908
0261,01,ASHBY PUBLIC SCHOOL DISTRICT,2019,NA
0264,01,HERMAN-NORCROSS SCHOOL DISTRICT,2019,NA
0270,01,HOPKINS PUBLIC SCHOOL DISTRICT,2019,0.0758390236815342
0271,01,BLOOMINGTON PUBLIC SCHOOL DISTRICT,2019,0.138050935062494
0272,01,EDEN PRAIRIE PUBLIC SCHOOL DISTRICT,2019,0.0865265760197775
0273,01,EDINA PUBLIC SCHOOL DISTRICT,2019,0.0529964747356052
0276,01,MINNETONKA PUBLIC SCHOOL DISTRICT,2019,0.0156791248860529
0277,01,WESTONKA PUBLIC SCHOOL DISTRICT,2019,0.00367797302819779
0278,01,ORONO PUBLIC SCHOOL DISTRICT,2019,0.0121317157712305
0279,01,OSSEO PUBLIC SCHOOL DISTRICT,2019,0.104694485842027
0280,01,RICHFIELD PUBLIC SCHOOL DISTRICT,2019,0.251678629312341
0281,01,ROBBINSDALE PUBLIC SCHOOL DISTRICT,2019,0.101147776183644
0282,01,ST. ANTHONY-NEW BRIGHTON SCHOOLS,2019,NA
0283,01,ST. LOUIS PARK PUBLIC SCHOOL DISTRICT,2019,0.09291472210437
0284,01,WAYZATA PUBLIC SCHOOL DISTRICT,2019,0.0331436223635755
0286,01,BROOKLYN CENTER SCHOOL DISTRICT,2019,0.18900481540931
0287,06,INTERMEDIATE SCHOOL DISTRICT 287,2019,NA
0287,06,INTERMEDIATE SCHOOL DISTRICT 288,2019,0
0287,06,INTERMEDIATE SCHOOL DISTRICT 289,2019,NA
0287,06,INTERMEDIATE SCHOOL DISTRICT 290,2019,0.0526315789473684
0287,06,INTERMEDIATE SCHOOL DISTRICT 291,2019,0.130434782608696
0287,06,INTERMEDIATE SCHOOL DISTRICT 292,2019,0.024390243902439
0287,06,INTERMEDIATE SCHOOL DISTRICT 293,2019,0
0287,06,INTERMEDIATE SCHOOL DISTRICT 294,2019,0.0465116279069767
0287,06,INTERMEDIATE SCHOOL DISTRICT 295,2019,0.0394736842105263
0287,06,INTERMEDIATE SCHOOL DISTRICT 296,2019,0.0588235294117647
0287,06,INTERMEDIATE SCHOOL DISTRICT 297,2019,0.0594059405940594
0287,06,INTERMEDIATE SCHOOL DISTRICT 298,2019,0.0476190476190476
0287,06,INTERMEDIATE SCHOOL DISTRICT 299,2019,0.0444874274661509
0288,06,SOUTHWEST METRO INTERMEDIATE 288,2019,NA
0294,01,HOUSTON PUBLIC SCHOOL DISTRICT,2019,0.0106275303643725
0297,01,SPRING GROVE SCHOOL DISTRICT,2019,NA
0299,01,CALEDONIA PUBLIC SCHOOL DISTRICT,2019,0
0300,01,LA CRESCENT-HOKAH SCHOOL DISTRICT,2019,0.000902527075812274
0306,01,LAPORTE PUBLIC SCHOOL DISTRICT,2019,0
0308,01,NEVIS PUBLIC SCHOOL DISTRICT,2019,NA
0309,01,PARK RAPIDS PUBLIC SCHOOL DISTRICT,2019,0.0212765957446809
0314,01,BRAHAM PUBLIC SCHOOL DISTRICT,2019,0.00132450331125828
0316,01,GREENWAY PUBLIC SCHOOL DISTRICT,2019,0.00187441424554827
0317,01,DEER RIVER PUBLIC SCHOOL DISTRICT,2019,0.00205973223480947
0318,01,GRAND RAPIDS PUBLIC SCHOOL DISTRICT,2019,0.000482043865991805
0319,01,NASHWAUK-KEEWATIN SCHOOL DISTRICT,2019,NA
0330,01,HERON LAKE-OKABENA SCHOOL DISTRICT,2019,NA
0332,01,MORA PUBLIC SCHOOL DISTRICT,2019,0.00121728545343883
0333,01,OGILVIE PUBLIC SCHOOL DISTRICT,2019,0
0345,01,NEW LONDON-SPICER SCHOOL DISTRICT,2019,0.0199228791773779
0347,01,WILLMAR PUBLIC SCHOOL DISTRICT,2019,0.24586869138008
0356,01,LANCASTER PUBLIC SCHOOL DISTRICT,2019,NA
0361,01,INTERNATIONAL FALLS SCHOOL DISTRICT,2019,0.00692383778437191
0362,01,LITTLEFORK-BIG FALLS SCHOOL DISTRICT,2019,0
0363,01,SOUTH KOOCHICHING SCHOOL DISTRICT,2019,NA
0378,01,DAWSON-BOYD PUBLIC SCHOOL DISTRICT,2019,NA
0381,01,LAKE SUPERIOR PUBLIC SCHOOL DISTRICT,2019,0
0390,01,LAKE OF THE WOODS SCHOOL DISTRICT,2019,NA
0391,01,CLEVELAND PUBLIC SCHOOL DISTRICT,2019,NA
0397,52,LAKE AGASSIZ EDUCATION COOPERATIVE,2019,NA
0398,52,MIDWEST SPECIAL EDUCATION COOPERATIVE,2019,0
0402,01,HENDRICKS PUBLIC SCHOOL DISTRICT,2019,NA
0403,01,IVANHOE PUBLIC SCHOOL DISTRICT,2019,NA
0404,01,LAKE BENTON PUBLIC SCHOOL DISTRICT,2019,NA
0413,01,MARSHALL PUBLIC SCHOOL DISTRICT,2019,0.152380952380952
0414,01,MINNEOTA PUBLIC SCHOOL DISTRICT,2019,NA
0415,01,LYND PUBLIC SCHOOL DISTRICT,2019,NA
0423,01,HUTCHINSON PUBLIC SCHOOL DISTRICT,2019,0.0370244565217391
0424,01,LESTER PRAIRIE PUBLIC SCHOOL DISTRICT,2019,NA
0432,01,MAHNOMEN PUBLIC SCHOOL DISTRICT,2019,0
0435,01,WAUBUN-OGEMA-WHITE EARTH PUBLIC SCHOOLS,2019,NA
0441,01,MARSHALL COUNTY CENTRAL SCHOOLS,2019,NA
0447,01,GRYGLA PUBLIC SCHOOL DISTRICT,2019,NA
0458,01,TRUMAN PUBLIC SCHOOL DISTRICT,2019,NA
0463,01,EDEN VALLEY-WATKINS SCHOOL DISTRICT,2019,0.00720906282183316
0465,01,LITCHFIELD PUBLIC SCHOOL DISTRICT,2019,0.023447401774398
0466,01,DASSEL-COKATO PUBLIC SCHOOL DISTRICT,2019,0.008
0473,01,ISLE PUBLIC SCHOOL DISTRICT,2019,NA
0477,01,PRINCETON PUBLIC SCHOOL DISTRICT,2019,0.00492325514045757
0480,01,ONAMIA PUBLIC SCHOOL DISTRICT,2019,0
0482,01,LITTLE FALLS PUBLIC SCHOOL DISTRICT,2019,0.0244479495268139
0484,01,PERZ PUBLIC SCHOOL DISTRICT,2019,0.00753138075313808
0485,01,ROYALTON PUBLIC SCHOOL DISTRICT,2019,NA
0486,01,SWANVILLE PUBLIC SCHOOL DISTRICT,2019,NA
0487,01,UPSALA PUBLIC SCHOOL DISTRICT,2019,0
0492,01,AUSTIN PUBLIC SCHOOL DISTRICT,2019,0.186850557339883
0495,01,GRAND MEADOW PUBLIC SCHOOL DISTRICT,2019,NA
0497,01,LYLE PUBLIC SCHOOL DISTRICT,2019,NA
0499,01,LEROY-OSTRANDER PUBLIC SCHOOLS,2019,NA
0500,01,SOUTHLAND PUBLIC SCHOOL DISTRICT,2019,0.0261780104712042
0505,01,FULDA PUBLIC SCHOOL DISTRICT,2019,NA
0507,01,NICOLLET PUBLIC SCHOOL DISTRICT,2019,NA
0508,01,ST. PETER PUBLIC SCHOOL DISTRICT,2019,0.0868210151380231
0511,01,ADRIAN PUBLIC SCHOOL DISTRICT,2019,NA
0514,01,ELLSWORTH PUBLIC SCHOOL DISTRICT,2019,NA
0518,01,WORTHINGTON PUBLIC SCHOOL DISTRICT,2019,0.282786885245902
0531,01,BYRON PUBLIC SCHOOL DISTRICT,2019,0.00851466414380322
0533,01,DOVER-EYOTA PUBLIC SCHOOL DISTRICT,2019,NA
0534,01,STEWARTVILLE PUBLIC SCHOOL DISTRICT,2019,0.00521821631878558
0535,01,ROCHESTER PUBLIC SCHOOL DISTRICT,2019,0.104301970580072
0542,01,BATTLE LAKE PUBLIC SCHOOL DISTRICT,2019,0.00233644859813084
0544,01,FERGUS FALLS PUBLIC SCHOOL DISTRICT,2019,0.0124567474048443
0545,01,HENNING PUBLIC SCHOOL DISTRICT,2019,NA
0547,01,PARKERS PRAIRIE PUBLIC SCHOOL DISTRICT,2019,0
0548,01,PELICAN RAPIDS PUBLIC SCHOOL DISTRICT,2019,NA
0549,01,PERHAM-DENT PUBLIC SCHOOL DISTRICT,2019,0.0445317616240995
0550,01,UNDERWOOD PUBLIC SCHOOL DISTRICT,2019,NA
0553,01,NEW YORK MILLS PUBLIC SCHOOL DISTRICT,2019,0
0561,01,GOODRIDGE PUBLIC SCHOOL DISTRICT,2019,NA
0564,01,THIEF RIVER FALLS SCHOOL DISTRICT,2019,0.0103960396039604
0577,01,WILLOW RIVER PUBLIC SCHOOL DISTRICT,2019,NA
0578,01,PINE CITY PUBLIC SCHOOL DISTRICT,2019,0.00376411543287327
0581,01,EDGERTON PUBLIC SCHOOL DISTRICT,2019,0.0819672131147541
0592,01,CLIMAX-SHELLY PUBLIC SCHOOLS,2019,NA
0593,01,CROOKSTON PUBLIC SCHOOL DISTRICT,2019,0.0394626364399664
0595,01,EAST GRAND FORKS PUBLIC SCHOOL DISTRICT,2019,0.0854961832061069
0599,01,FERTILE-BELTRAMI SCHOOL DISTRICT,2019,0
0600,01,FISHER PUBLIC SCHOOL DISTRICT,2019,NA
0601,01,FOSSTON PUBLIC SCHOOL DISTRICT,2019,0.00162866449511401
0621,01,MOUNDS VIEW PUBLIC SCHOOL DISTRICT,2019,0.0536923977586351
0622,01,NORTH ST. PAUL-MAPLEWOOD OAKDALE PUBLIC SCHOOL DISTRICT,2019,0.122871946706144
0623,01,ROSEVILLE PUBLIC SCHOOL DISTRICT,2019,0.14800783801437
0624,01,WHITE BEAR LAKE SCHOOL DISTRICT,2019,0.0364559819413093
0625,01,ST. PAUL PUBLIC SCHOOL DISTRICT,2019,0.297034265885925
0630,01,RED LAKE FALLS PUBLIC SCHOOL DISTRICT,2019,NA
0635,01,MILROY PUBLIC SCHOOL DISTRICT,2019,NA
0640,01,WABASSO PUBLIC SCHOOL DISTRICT,2019,NA
0656,01,FARIBAULT PUBLIC SCHOOL DISTRICT,2019,0.228368017524644
0659,01,NORTHFIELD PUBLIC SCHOOL DISTRICT,2019,0.0619621342512909
0671,01,HILLS-BEAVER CREEK SCHOOL DISTRICT,2019,NA
0676,01,BADGER PUBLIC SCHOOL DISTRICT,2019,NA
0682,01,ROSEAU PUBLIC SCHOOL DISTRICT,2019,0.00338123415046492
0690,01,WARROAD PUBLIC SCHOOL DISTRICT,2019,0.029940119760479
0695,01,CHISHOLM PUBLIC SCHOOL DISTRICT,2019,NA
0696,01,ELY PUBLIC SCHOOL DISTRICT,2019,NA
0698,01,FLOODWOOD PUBLIC SCHOOL DISTRICT,2019,NA
0700,01,HERMANTOWN PUBLIC SCHOOL DISTRICT,2019,0.004739336492891
0701,01,HIBBING PUBLIC SCHOOL DISTRICT,2019,0.00166181969256336
0704,01,PROCTOR PUBLIC SCHOOL DISTRICT,2019,0.000554323725055432
0706,01,VIRGINIA PUBLIC SCHOOL DISTRICT,2019,0.00169971671388102
0707,01,NETT LAKE PUBLIC SCHOOL DISTRICT,2019,NA
0709,01,DULUTH PUBLIC SCHOOL DISTRICT,2019,0.00631748219618654
0712,01,MOUNTAIN IRON-BUHL SCHOOL DISTRICT,2019,0
0716,01,BELLE PLAINE PUBLIC SCHOOL DISTRICT,2019,0.0129071911493546
0717,01,JORDAN PUBLIC SCHOOL DISTRICT,2019,0.0393081761006289
0719,01,PRIOR LAKE-SAVAGE AREA SCHOOLS,2019,0.0286642033366924
0720,01,SHAKOPEE PUBLIC SCHOOL DISTRICT,2019,0.117081379973555
0721,01,NEW PRAGUE AREA SCHOOLS,2019,0.0058465855940131
0726,01,BECKER PUBLIC SCHOOL DISTRICT,2019,0.0101971447994562
0727,01,BIG LAKE PUBLIC SCHOOL DISTRICT,2019,0.0176701570680628
0728,01,ELK RIVER PUBLIC SCHOOL DISTRICT,2019,0.0209217264081931
0738,01,HOLDINGFORD PUBLIC SCHOOL DISTRICT,2019,0.00281954887218045
0739,01,KIMBALL PUBLIC SCHOOL DISTRICT,2019,NA
0740,01,MELROSE PUBLIC SCHOOL DISTRICT,2019,0.148009015777611
0741,01,PAYNESVILLE PUBLIC SCHOOL DISTRICT,2019,0.00754310344827586
0742,01,ST. CLOUD PUBLIC SCHOOL DISTRICT,2019,0.239603575592693
0743,01,SAUK CENTRE PUBLIC SCHOOL DISTRICT,2019,0.0446265938069217
0745,01,ALBANY PUBLIC SCHOOL DISTRICT,2019,0.00735294117647059
0748,01,SARTELL-ST. STEPHEN SCHOOL DISTRICT,2019,0.0103092783505155
0750,01,ROCORI PUBLIC SCHOOL DISTRICT,2019,0.0585480093676815
0756,01,BLOOMING PRAIRIE PUBLIC SCHOOL DISTRICT,2019,0.0118577075098814
0761,01,OWATONNA PUBLIC SCHOOL DISTRICT,2019,0.0836606441476826
0763,01,MEDFORD PUBLIC SCHOOL DISTRICT,2019,0.0280583613916947
0768,01,HANCOCK PUBLIC SCHOOL DISTRICT,2019,NA
0771,01,CHOKIO-ALBERTA PUBLIC SCHOOL DISTRICT,2019,NA
0775,01,KERKHOVEN-MURDOCK-SUNBURG,2019,NA
0777,01,BENSON PUBLIC SCHOOL DISTRICT,2019,0.0214797136038186
0786,01,BERTHA-HEWITT PUBLIC SCHOOL DISTRICT,2019,NA
0787,01,BROWERVILLE PUBLIC SCHOOL DISTRICT,2019,NA
0801,01,BROWNS VALLEY PUBLIC SCHOOL DISTRICT,2019,NA
0803,01,WHEATON AREA PUBLIC SCHOOL DISTRICT,2019,NA
0811,01,WABASHA-KELLOGG PUBLIC SCHOOL DISTRICT,2019,NA
0813,01,LAKE CITY PUBLIC SCHOOL DISTRICT,2019,0.0271348762968875
0818,01,VERNDALE PUBLIC SCHOOL DISTRICT,2019,NA
0820,01,SEBEKA PUBLIC SCHOOL DISTRICT,2019,NA
0821,01,MENAHGA PUBLIC SCHOOL DISTRICT,2019,NA
0829,01,WASECA PUBLIC SCHOOL DISTRICT,2019,0.0406169665809769
0831,01,FOREST LAKE PUBLIC SCHOOL DISTRICT,2019,0.0217957059206246
0832,01,MAHTOMEDI PUBLIC SCHOOL DISTRICT,2019,0.0149611011370437
0833,01,SOUTH WASHINGTON COUNTY SCHOOL DISTRICT,2019,0.0515132342085838
0834,01,STILLWATER AREA PUBLIC SCHOOL DISTRICT,2019,0.0240823006780454
0836,01,BUTTERFIELD PUBLIC SCHOOL DISTRICT,2019,NA
0837,01,MADELIA PUBLIC SCHOOL DISTRICT,2019,NA
0840,01,ST. JAMES PUBLIC SCHOOL DISTRICT,2019,0.145873320537428
0846,01,BRECKENRIDGE PUBLIC SCHOOL DISTRICT,2019,NA
0850,01,ROTHSAY PUBLIC SCHOOL DISTRICT,2019,NA
0852,01,CAMPBELL-TINTAH PUBLIC SCHOOL DISTRICT,2019,NA
0857,01,LEWISTON-ALTURA PUBLIC SCHOOL DISTRICT,2019,0.0134228187919463
0858,01,ST. CHARLES PUBLIC SCHOOL DISTRICT,2019,NA
0861,01,WINONA AREA PUBLIC SCHOOL DISTRICT,2019,0.0316649642492339
0876,01,ANNANDALE PUBLIC SCHOOL DISTRICT,2019,0.00557244174265451
0877,01,BUFFALO-HANOVER-MONTROSE PUBLIC SCHOOLS,2019,0.0131399317406143
0879,01,DELANO PUBLIC SCHOOL DISTRICT,2019,0.0079968012794882
0881,01,MAPLE LAKE PUBLIC SCHOOL DISTRICT,2019,0.00588235294117647
0882,01,MONTICELLO PUBLIC SCHOOL DISTRICT,2019,0.0232727272727273
0883,01,ROCKFORD PUBLIC SCHOOL DISTRICT,2019,0.0495716034271726
0885,01,ST. MICHAEL-ALBERTVILLE SCHOOL DISTRICT,2019,0.0167105059569859
0891,01,CANBY PUBLIC SCHOOL DISTRICT,2019,NA
0911,01,CAMBRIDGE-ISANTI PUBLIC SCHOOL DISTRICT,2019,0.00912698412698413
0912,01,MILACA PUBLIC SCHOOL DISTRICT,2019,0.0022075055187638
0914,01,ULEN-HITTERDAL PUBLIC SCHOOL DISTRICT,2019,0.0033003300330033
0915,52,SOUTHERN PLAINS EDUCATION COOPERATIVE,2019,NA
0916,06,NORTHEAST METRO 916,2019,NA
0916,06,NORTHEAST METRO 917,2019,NA
0916,06,NORTHEAST METRO 918,2019,0.294117647058824
0916,06,NORTHEAST METRO 919,2019,0.241379310344828
0916,06,NORTHEAST METRO 920,2019,0.0344827586206897
0916,06,NORTHEAST METRO 921,2019,0.03125
0916,06,NORTHEAST METRO 922,2019,0.111111111111111
0916,06,NORTHEAST METRO 923,2019,0.027027027027027
0916,06,NORTHEAST METRO 924,2019,0.027027027027027
0916,06,NORTHEAST METRO 925,2019,0.0952380952380952
0916,06,NORTHEAST METRO 926,2019,0
0916,06,NORTHEAST METRO 927,2019,0.0172413793103448
0916,06,NORTHEAST METRO 928,2019,0.0983606557377049
0916,06,NORTHEAST METRO 929,2019,0.110539845758355
0917,06,INTERMEDIATE SCHOOL DISTRICT 917,2019,0
0917,06,INTERMEDIATE SCHOOL DISTRICT 918,2019,NA
0917,06,INTERMEDIATE SCHOOL DISTRICT 919,2019,0
0917,06,INTERMEDIATE SCHOOL DISTRICT 920,2019,NA
0917,06,INTERMEDIATE SCHOOL DISTRICT 921,2019,0
0917,06,INTERMEDIATE SCHOOL DISTRICT 922,2019,0
0917,06,INTERMEDIATE SCHOOL DISTRICT 923,2019,0
0917,06,INTERMEDIATE SCHOOL DISTRICT 924,2019,0
0917,06,INTERMEDIATE SCHOOL DISTRICT 925,2019,0
0917,06,INTERMEDIATE SCHOOL DISTRICT 926,2019,0
0917,06,INTERMEDIATE SCHOOL DISTRICT 927,2019,0
0917,06,INTERMEDIATE SCHOOL DISTRICT 928,2019,0
0917,06,INTERMEDIATE SCHOOL DISTRICT 929,2019,0.0206185567010309
0917,06,INTERMEDIATE SCHOOL DISTRICT 930,2019,0.0220994475138122
0926,83,REGION 4-LAKES COUNTRY SERVICE COOPERATIVE,2019,NA
0935,52,FERGUS FALLS AREA SPECIAL EDUCATION COOPERATIVE,2019,NA
0938,52,MEEKER AND WRIGHT SPECIAL EDUCATION,2019,NA
0966,51,WRIGHT TECHNICAL CENTER,2019,NA
0991,83,REGION 6 AND 8-SW/WC SERVICE COOPERATIVE,2019,NA
0998,52,BEMIDJI REGIONAL INTERDISTRICT COUNCIL,2019,0
1000,70,PERPICH CENTER FOR ARTS EDUCATION,2019,0
1100,60,MINNESOTA DEPARTMENT OF CORRECTIONS,2019,NA
2071,01,LAKE CRYSTAL-WELLCOME MEMORIAL,2019,0.00546448087431694
2125,01,TRITON SCHOOL DISTRICT,2019,0.0548837209302326
2134,01,UNITED SOUTH CENTRAL SCHOOL DISTRICT,2019,NA
2135,01,MAPLE RIVER SCHOOL DISTRICT,2019,0
2137,01,KINGSLAND PUBLIC SCHOOL DISTRICT,2019,0
2142,01,ST. LOUIS COUNTY SCHOOL DISTRICT,2019,0
2143,01,WATERVILLE-ELYSIAN-MORRISTOWN PUBLIC SCHOOL DISTRICT,2019,NA
2144,01,CHISAGO LAKES SCHOOL DISTRICT,2019,0.00517985611510791
2149,01,MINNEWASKA SCHOOL DISTRICT,2019,0.00460122699386503
2154,01,EVELETH-GILBERT SCHOOL DISTRICT,2019,NA
2155,01,WADENA-DEER CREEK SCHOOL DISTRICT,2019,0.00480769230769231
2159,01,BUFFALO LAKE-HECTOR-STEWART PUBLIC SCHOOLS,2019,0.0357142857142857
2164,01,DILWORTH-GLYNDON-FELTON,2019,0.0170523751522534
2165,01,HINCKLEY-FINLAYSON SCHOOL DISTRICT,2019,NA
2167,01,LAKEVIEW SCHOOL DISTRICT,2019,NA
2168,01,NRHEG SCHOOL DISTRICT,2019,0.00333704115684093
2169,01,MURRAY COUNTY CENTRAL SCHOOL DISTRICT,2019,0.00535475234270415
2170,01,STAPLES-MOTLEY SCHOOL DISTRICT,2019,0.0036231884057971
2171,01,KITTSON CENTRAL SCHOOL DISTRICT,2019,NA
2172,01,KENYON-WANAMINGO SCHOOL DISTRICT,2019,0.0337662337662338
2174,01,PINE RIVER-BACKUS SCHOOL DISTRICT,2019,0.00317796610169492
2176,01,WARREN-ALVARADO-OSLO SCHOOL DISTRICT,2019,0.0228136882129278
2180,01,MACCRAY SCHOOL DISTRICT,2019,0.0137174211248285
2184,01,LUVERNE PUBLIC SCHOOL DISTRICT,2019,0.0204724409448819
2190,01,YELLOW MEDICINE EAST,2019,0.0272988505747126
2198,01,FILLMORE CENTRAL,2019,NA
2215,01,NORMAN COUNTY EAST SCHOOL DISTRICT,2019,0.0116279069767442
2310,01,SIBLEY EAST SCHOOL DISTRICT,2019,0.122608695652174
2311,01,CLEARBROOK-GONVICK SCHOOL DISTRICT,2019,0
2342,01,WEST CENTRAL AREA,2019,0.0101781170483461
2358,01,TRI-COUNTY SCHOOL DISTRICT,2019,NA
2364,01,BELGRADE-BROOTEN-ELROSA PUBLIC SCHOOL DISTRICT,2019,0.0580152671755725
2365,01,G.F.W. PUBLIC SCHOOL DISTRICT,2019,0.0497159090909091
2396,01,A.C.G.C. PUBLIC SCHOOL DISTRICT,2019,0.0159118727050184
2397,01,LE SUEUR-HENDERSON SCHOOL DISTRICT,2019,0.050682261208577
2448,01,MARTIN COUNTY WEST SCHOOL DISTRICT,2019,NA
2527,01,NORMAN COUNTY WEST SCHOOL DISTRICT,2019,NA
2534,01,BIRD ISLAND-OLIVIA-LAKE LILLIAN PUBLIC SCHOOL DISTRICT,2019,0.0380116959064327
2536,01,GRANADA HUNTLEY EAST CHAIN,2019,NA
2580,01,EAST CENTRAL SCHOOL DISTRICT,2019,0
2609,01,WIN-E-MAC SCHOOL DISTRICT,2019,NA
2683,01,GREENBUSH-MIDDLE RIVER SCHOOL DISTRICT,2019,NA
2687,01,HOWARD LAKE-WAVERLY-WINSTED,2019,0.00878594249201278
2689,01,PIPESTONE AREA SCHOOL DISTRICT,2019,0.0680628272251309
2711,01,MESABI EAST SCHOOL DISTRICT,2019,0
2752,01,FAIRMONT AREA SCHOOL DISTRICT,2019,0.0573248407643312
2753,01,LONG PRAIRIE-GREY EAGLE SCHOOL DISTRICT,2019,0.242489270386266
2754,01,CEDAR MOUNTAIN SCHOOL DISTRICT,2019,0
2769,01,MORRIS AREA PUBLIC SCHOOLS,2019,0.0593301435406699
2805,01,ZUMBROTA-MAZEPPA SCHOOL DISTRICT,2019,0.00581395348837209
2835,01,JANESVILLE-WALDORF-PEMBERTON,2019,0
2853,01,LAC QUI PARLE VALLEY SCHOOL DISTRICT,2019,0.0907960199004975
2854,01,ADA-BORUP PUBLIC SCHOOL DISTRICT,2019,0.0126939351198872
2856,01,STEPHEN-ARGYLE CENTRAL SCHOOLS,2019,NA
2859,01,GLENCOE-SILVER LAKE SCHOOL DISTRICT,2019,0.0584255842558426
2860,01,BLUE EARTH AREA PUBLIC SCHOOL,2019,NA
2884,01,RED ROCK CENTRAL SCHOOL DISTRICT,2019,NA
2886,01,GLENVILLE-EMMONS SCHOOL DISTRICT,2019,NA
2888,01,CLINTON-GRACEVILLE-BEARDSLEY,2019,NA
2889,01,LAKE PARK AUDUBON SCHOOL DISTRICT,2019,0.00279329608938547
2890,01,RENVILLE COUNTY WEST SCHOOL DISTRICT,2019,NA
2895,01,JACKSON COUNTY CENTRAL SCHOOL DISTRICT,2019,0.00677966101694915
2897,01,REDWOOD AREA SCHOOL DISTRICT,2019,0.00967458223394899
2898,01,WESTBROOK-WALNUT GROVE SCHOOLS,2019,NA
2899,01,PLAINVIEW-ELGIN-MILLVILLE,2019,0.0264550264550265
2902,01,RTR PUBLIC SCHOOLS,2019,NA
2903,01,ORTONVILLE PUBLIC SCHOOLS,2019,0.0191204588910134
2904,01,TRACY AREA PUBLIC SCHOOL DISTRICT,2019,NA
2905,01,TRI-CITY UNITED SCHOOL DISTRICT,2019,0.076882569773565
2906,01,RED LAKE COUNTY CENTRAL PUBLIC SCHOOLS,2019,NA
2907,01,ROUND LAKE-BREWSTER PUBLIC SCHOOLS,2019,NA
2908,01,BRANDON-EVANSVILLE PUBLIC SCHOOLS,2019,0
4000,07,CITY ACADEMY,2019,NA
4001,07,BLUFFVIEW MONTESSORI,2019,0.0231481481481481
4003,07,"NEW HEIGHTS SCHOOL, INC.",2019,NA
4004,07,CEDAR RIVERSIDE COMMUNITY SCHOOL,2019,NA
4005,07,METRO DEAF SCHOOL,2019,NA
4007,07,MINNESOTA NEW COUNTRY SCHOOL,2019,0
4008,07,PACT CHARTER SCHOOL,2019,0.0504587155963303
4011,07,ATHLOS LEADERSHIP ACADEMY,2019,0.0723025583982203
4015,07,COMMUNITY OF PEACE ACADEMY,2019,NA
4016,07,WORLD LEARNER CHARTER SCHOOL,2019,0.0141509433962264
4017,07,MINNESOTA TRANSITIONS CHARTER SCHOOL,2019,0.102249488752556
4018,07,ACHIEVE LANGUAGE ACADEMY,2019,0.402654867256637
4020,07,DULUTH PUBLIC SCHOOLS ACADEMY,2019,0.00293685756240822
4025,07,CYBER VILLAGE ACADEMY,2019,NA
4026,07,E.C.H.O. CHARTER SCHOOL,2019,NA
4027,07,HIGHER GROUND ACADEMY,2019,0.117948717948718
4029,07,ST. PAUL CITY SCHOOL,2019,NA
4031,07,JENNINGS COMMUNITY SCHOOL,2019,NA
4035,07,LIFE PREP,2019,0.112179487179487
4036,07,FACE TO FACE ACADEMY,2019,NA
4038,07,SOJOURNER TRUTH ACADEMY,2019,0.133676092544987
4039,07,HIGH SCHOOL FOR RECORDING ARTS,2019,NA
4043,07,MATH AND SCIENCE ACADEMY,2019,0.00760456273764259
4049,07,NORTHWEST PASSAGE HIGH SCHOOL,2019,0
4050,07,LAFAYETTE PUBLIC CHARTER SCHOOL,2019,NA
4053,07,NORTH LAKES ACADEMY,2019,0.0124378109452736
4054,07,LA CRESCENT MONTESSORI AND STEM SCHOOL,2019,NA
4055,07,NERSTRAND CHARTER SCHOOL,2019,0.00671140939597315
4056,07,ROSA PARKS CHARTER HIGH SCHOOL,2019,NA
4057,07,EL COLEGIO CHARTER SCHOOL,2019,0.705263157894737
4058,07,SCHOOLCRAFT LEARNING COMMUNITY CHARTER,2019,0
4059,07,CROSSLAKE COMMUNITY CHARTER SCHOOL,2019,NA
4064,07,RIVERWAY LEARNING COMMUNITY CHARTER,2019,NA
4066,07,KATO PUBLIC CHARTER SCHOOL,2019,NA
4067,07,AURORA CHARTER SCHOOL,2019,NA
4068,07,EXCELL ACADEMY CHARTER,2019,0.232394366197183
4070,07,HOPE COMMUNITY ACADEMY,2019,0.540485829959514
4073,07,ACADEMIA CESAR CHAVEZ CHARTER SCHOOL,2019,NA
4074,07,AFSA HIGH SCHOOL,2019,0
4075,07,AVALON SCHOOL,2019,0.00418410041841004
4078,07,TWIN CITIES INTERNATIONAL SCHOOLS,2019,0.479921645445642
4079,07,FRIENDSHIP ACADEMY OF FINE ARTS CHARTER,2019,0
4080,07,PILLAGER AREA CHARTER SCHOOL,2019,NA
4081,07,DISCOVERY PUBLIC SCHOOL FARIBAULT,2019,NA
4082,07,BLUESKY CHARTER SCHOOL,2019,NA
4083,07,RIDGEWAY COMMUNITY SCHOOL,2019,0.0202020202020202
4084,07,NORTH SHORE COMMUNITY SCHOOL,2019,0
4085,07,HARBOR CITY INTERNATIONAL CHARTER,2019,0
4087,07,SAGE ACADEMY CHARTER SCHOOL,2019,NA
4088,07,URBAN ACADEMY CHARTER SCHOOL,2019,NA
4089,07,NEW CITY SCHOOL,2019,0.0588235294117647
4090,07,PRAIRIE CREEK COMMUNITY SCHOOL,2019,0
4091,07,ARCADIA CHARTER SCHOOL,2019,0
4092,07,WATERSHED HIGH SCHOOL,2019,NA
4093,07,NEW CENTURY ACADEMY,2019,0
4095,07,TRIO WOLF CREEK DISTANCE LEARNING,2019,NA
4097,07,"PARTNERSHIP ACADEMY, INC.",2019,0.751592356687898
4098,07,NOVA CLASSICAL ACADEMY,2019,0.0412890231621349
4100,07,GREAT EXPECTATIONS,2019,NA
4102,07,MINNESOTA INTERNSHIP CENTER,2019,NA
4103,07,HMONG COLLEGE PREP ACADEMY,2019,0.334847796456156
4104,07,PALADIN CAREER AND TECHNICAL HIGH SCHOOL,2019,NA
4105,07,GREAT RIVER SCHOOL,2019,0.00613496932515337
4106,07,TREKNORTH HIGH SCHOOL,2019,0
4107,07,VOYAGEURS EXPEDITIONARY,2019,0
4110,07,PIM ARTS HIGH SCHOOL,2019,0
4111,07,AUGSBURG FAIRVIEW ACADEMY,2019,NA
4112,07,ST. PAUL CONSERVATORY PERFORMING ARTS,2019,0
4113,07,SPERO ACADEMY,2019,0.0708661417322835
4116,07,LAKES INTERNATIONAL LANGUAGE ACADEMY,2019,NA
4118,07,KALEIDOSCOPE CHARTER SCHOOL,2019,0
4119,07,ACADEMIC ARTS HIGH SCHOOL,2019,NA
4120,07,ST. CROIX PREPARATORY ACADEMY,2019,0.0161839863713799
4121,07,UBAH MEDICAL ACADEMY CHARTER SCHOOL,2019,0.256410256410256
4122,07,EAGLE RIDGE ACADEMY CHARTER SCHOOL,2019,0.0745614035087719
4124,07,BEACON ACADEMY,2019,0.0475382003395586
4126,07,PRAIRIE SEEDS ACADEMY,2019,0.427374301675978
4127,07,TEAM ACADEMY,2019,0.1796875
4131,07,METRO SCHOOLS CHARTER,2019,0.696103896103896
4132,07,TWIN CITIES ACADEMY,2019,0.0545746388443018
4135,07,ROCHESTER MATH AND SCIENCE ACADEMY,2019,0.268011527377522
4137,07,SWAN RIVER MONTESSORI CHARTER SCHOOL,2019,0
4139,07,LOVEWORKS ACADEMY FOR ARTS,2019,NA
4140,07,YINGHUA ACADEMY,2019,0.0705596107055961
