districtNumber,districtType,districtName,year,percentTakers
0001,01,AITKIN PUBLIC SCHOOL DISTRICT,2018,0.34297520661157027
0002,01,HILL CITY PUBLIC SCHOOL DISTRICT,2018,0.27419354838709675
0004,01,MCGREGOR PUBLIC SCHOOL DISTRICT,2018,0.35802469135802467
0006,03,SOUTH ST. PAUL PUBLIC SCHOOL DIST.,2018,0.29653401797175866
0011,01,ANOKA-HENNEPIN PUBLIC SCHOOL DIST.,2018,0.2885899040467251
0012,01,CENTENNIAL PUBLIC SCHOOL DISTRICT,2018,0.29473039215686275
0013,01,COLUMBIA HEIGHTS PUBLIC SCHOOL DIST,2018,0.25925925925925924
0014,01,FRIDLEY PUBLIC SCHOOL DISTRICT,2018,0.25166444740346205
0015,01,ST. FRANCIS PUBLIC SCHOOL DISTRICT,2018,0.2695729537366548
0016,01,SPRING LAKE PARK PUBLIC SCHOOLS,2018,0.31329113924050633
0022,01,DETROIT LAKES PUBLIC SCHOOL DIST.,2018,0.29239766081871343
0023,01,FRAZEE-VERGAS PUBLIC SCHOOL DIST.,2018,0.28365384615384615
0031,01,BEMIDJI PUBLIC SCHOOL DISTRICT,2018,0.2508620689655172
0032,01,BLACKDUCK PUBLIC SCHOOL DISTRICT,2018,0.2571428571428571
0036,01,KELLIHER PUBLIC SCHOOL DISTRICT,2018,0.21568627450980393
0038,01,RED LAKE PUBLIC SCHOOL DISTRICT,2018,0.16260162601626016
0047,01,SAUK RAPIDS-RICE PUBLIC SCHOOLS,2018,0.30373360242179614
0051,01,FOLEY PUBLIC SCHOOL DISTRICT,2018,0.29436325678496866
0075,01,ST. CLAIR PUBLIC SCHOOL DISTRICT,2018,0.32142857142857145
0077,01,MANKATO PUBLIC SCHOOL DISTRICT,2018,0.28649535265172227
0081,01,COMFREY PUBLIC SCHOOL DISTRICT,2018,0.23076923076923078
0084,01,SLEEPY EYE PUBLIC SCHOOL DISTRICT,2018,0.272
0085,01,SPRINGFIELD PUBLIC SCHOOL DISTRICT,2018,0.34328358208955223
0088,01,NEW ULM PUBLIC SCHOOL DISTRICT,2018,0.2310838445807771
0091,01,BARNUM PUBLIC SCHOOL DISTRICT,2018,0.29651162790697677
0093,01,CARLTON PUBLIC SCHOOL DISTRICT,2018,0.2672413793103448
0094,01,CLOQUET PUBLIC SCHOOL DISTRICT,2018,0.2071917808219178
0095,01,CROMWELL-WRIGHT PUBLIC SCHOOLS,2018,0.23684210526315788
0097,01,MOOSE LAKE PUBLIC SCHOOL DISTRICT,2018,0.1836734693877551
0099,01,ESKO PUBLIC SCHOOL DISTRICT,2018,0.2977941176470588
0100,01,WRENSHALL PUBLIC SCHOOL DISTRICT,2018,0.25882352941176473
0108,01,CENTRAL PUBLIC SCHOOL DISTRICT,2018,0.38095238095238093
0110,01,WACONIA PUBLIC SCHOOL DISTRICT,2018,0.27447023208879917
0111,01,WATERTOWN-MAYER PUBLIC SCHOOL DIST.,2018,0.27559055118110237
0112,01,EASTERN CARVER COUNTY PUBLIC SCHOOL,2018,0.3098820658804392
0113,01,WALKER-HACKENSACK-AKELEY SCHL. DIST,2018,0.21839080459770116
0115,01,CASS LAKE-BENA PUBLIC SCHOOLS,2018,0.19480519480519481
0116,01,PILLAGER PUBLIC SCHOOL DISTRICT,2018,0.2422907488986784
0118,01,NORTHLAND COMMUNITY SCHOOLS,2018,0.30434782608695654
0129,01,MONTEVIDEO PUBLIC SCHOOL DISTRICT,2018,0.3487544483985765
0138,01,NORTH BRANCH PUBLIC SCHOOLS,2018,0.30952380952380953
0139,01,RUSH CITY PUBLIC SCHOOL DISTRICT,2018,0.3193717277486911
0146,01,BARNESVILLE PUBLIC SCHOOL DIST.,2018,0.281767955801105
0150,01,HAWLEY PUBLIC SCHOOL DISTRICT,2018,0.29245283018867924
0152,01,MOORHEAD PUBLIC SCHOOL DISTRICT,2018,0.28113879003558717
0162,01,BAGLEY PUBLIC SCHOOL DISTRICT,2018,0.31336405529953915
0166,01,COOK COUNTY PUBLIC SCHOOLS,2018,0.3221476510067114
0173,01,MOUNTAIN LAKE PUBLIC SCHOOLS,2018,0.2540983606557377
0177,01,WINDOM PUBLIC SCHOOL DISTRICT,2018,0.27601809954751133
0181,01,BRAINERD PUBLIC SCHOOL DISTRICT,2018,0.21308290155440415
0182,01,CROSBY-IRONTON PUBLIC SCHOOL DIST.,2018,0.3048780487804878
0186,01,PEQUOT LAKES PUBLIC SCHOOLS,2018,0.27680798004987534
0191,01,BURNSVILLE PUBLIC SCHOOL DISTRICT,2018,0.2906145783706527
0192,01,FARMINGTON PUBLIC SCHOOL DISTRICT,2018,0.28110896196002577
0194,01,LAKEVILLE PUBLIC SCHOOL DISTRICT,2018,0.32483847810480976
0195,01,RANDOLPH PUBLIC SCHOOL DISTRICT,2018,0.3157894736842105
0196,01,ROSEMOUNT-APPLE VALLEY-EAGAN,2018,0.3108430145963658
0197,01,WEST ST. PAUL-MENDOTA HTS.-EAGAN,2018,0.29560336763330214
0199,01,INVER GROVE HEIGHTS SCHOOLS,2018,0.3234597156398104
0200,01,HASTINGS PUBLIC SCHOOL DISTRICT,2018,0.3087557603686636
0203,01,HAYFIELD PUBLIC SCHOOL DISTRICT,2018,0.3224043715846995
0204,01,KASSON-MANTORVILLE SCHOOL DISTRICT,2018,0.29637526652452023
0206,01,ALEXANDRIA PUBLIC SCHOOL DISTRICT,2018,0.31216931216931215
0213,01,OSAKIS PUBLIC SCHOOL DISTRICT,2018,0.29310344827586204
0227,01,CHATFIELD PUBLIC SCHOOLS,2018,0.3333333333333333
0229,01,LANESBORO PUBLIC SCHOOL DISTRICT,2018,0.3968253968253968
0238,01,MABEL-CANTON PUBLIC SCHOOL DIST.,2018,0.3114754098360656
0239,01,RUSHFORD-PETERSON PUBLIC SCHOOLS,2018,0.2348993288590604
0241,01,ALBERT LEA PUBLIC SCHOOL DISTRICT,2018,0.29383313180169285
0242,01,ALDEN-CONGER PUBLIC SCHOOL DISTRICT,2018,0.2857142857142857
0252,01,CANNON FALLS PUBLIC SCHOOL DISTRICT,2018,0.34099616858237547
0253,01,GOODHUE PUBLIC SCHOOL DISTRICT,2018,0.19863013698630136
0255,01,PINE ISLAND PUBLIC SCHOOL DIST.,2018,0.3254901960784314
0256,01,RED WING PUBLIC SCHOOL DISTRICT,2018,0.303886925795053
0261,01,ASHBY PUBLIC SCHOOL DISTRICT,2018,0.30434782608695654
0264,01,HERMAN-NORCROSS SCHOOL DISTRICT,2018,0.3333333333333333
0270,01,HOPKINS PUBLIC SCHOOL DISTRICT,2018,0.29148805878750766
0271,01,BLOOMINGTON PUBLIC SCHOOL DISTRICT,2018,0.2793168880455408
0272,01,EDEN PRAIRIE PUBLIC SCHOOL DISTRICT,2018,0.3094928478543563
0273,01,EDINA PUBLIC SCHOOL DISTRICT,2018,0.3260340632603406
0276,01,MINNETONKA PUBLIC SCHOOL DISTRICT,2018,0.314874696847211
0277,01,WESTONKA PUBLIC SCHOOL DISTRICT,2018,0.26380368098159507
0278,01,ORONO PUBLIC SCHOOL DISTRICT,2018,0.33613445378151263
0279,01,OSSEO PUBLIC SCHOOL DISTRICT,2018,0.29917455204348703
0280,01,RICHFIELD PUBLIC SCHOOL DISTRICT,2018,0.2902519167579409
0281,01,ROBBINSDALE PUBLIC SCHOOL DISTRICT,2018,0.2897588255854596
0282,01,ST. ANTHONY-NEW BRIGHTON SCHOOLS,2018,0.3370998116760829
0283,01,ST. LOUIS PARK PUBLIC SCHOOL DIST.,2018,0.32594644506001846
0284,01,WAYZATA PUBLIC SCHOOL DISTRICT,2018,0.33046202036021927
0286,01,BROOKLYN CENTER SCHOOL DISTRICT,2018,0.18614130434782608
0294,01,HOUSTON PUBLIC SCHOOL DISTRICT,2018,0.11662198391420911
0297,01,SPRING GROVE SCHOOL DISTRICT,2018,0.2976190476190476
0299,01,CALEDONIA PUBLIC SCHOOL DISTRICT,2018,0.3181818181818182
0300,01,LA CRESCENT-HOKAH SCHOOL DISTRICT,2018,0.29491525423728815
0306,01,LAPORTE PUBLIC SCHOOL DISTRICT,2018,0.2830188679245283
0308,01,NEVIS PUBLIC SCHOOL DISTRICT,2018,0.31343283582089554
0309,01,PARK RAPIDS PUBLIC SCHOOL DISTRICT,2018,0.2471590909090909
0314,01,BRAHAM PUBLIC SCHOOL DISTRICT,2018,0.3221476510067114
0316,01,GREENWAY PUBLIC SCHOOL DISTRICT,2018,0.28879310344827586
0317,01,DEER RIVER PUBLIC SCHOOL DISTRICT,2018,0.26380368098159507
0318,01,GRAND RAPIDS PUBLIC SCHOOL DISTRICT,2018,0.225
0319,01,NASHWAUK-KEEWATIN SCHOOL DISTRICT,2018,0.23846153846153847
0330,01,HERON LAKE-OKABENA SCHOOL DISTRICT,2018,0.4430379746835443
0332,01,MORA PUBLIC SCHOOL DISTRICT,2018,0.24296675191815856
0333,01,OGILVIE PUBLIC SCHOOL DISTRICT,2018,0.18269230769230768
0345,01,NEW LONDON-SPICER SCHOOL DISTRICT,2018,0.26006191950464397
0347,01,WILLMAR PUBLIC SCHOOL DISTRICT,2018,0.27505112474437626
0356,01,LANCASTER PUBLIC SCHOOL DISTRICT,2018,0.3684210526315789
0361,01,INTERNATIONAL FALLS SCHOOL DISTRICT,2018,0.3333333333333333
0362,01,LITTLEFORK-BIG FALLS SCHOOL DIST.,2018,0.3116883116883117
0363,01,SOUTH KOOCHICHING SCHOOL DISTRICT,2018,0.25806451612903225
0378,01,DAWSON-BOYD PUBLIC SCHOOL DISTRICT,2018,0.26356589147286824
0381,01,LAKE SUPERIOR PUBLIC SCHOOL DIST.,2018,0.25146198830409355
0390,01,LAKE OF THE WOODS SCHOOL DISTRICT,2018,0.3404255319148936
0391,01,CLEVELAND PUBLIC SCHOOL DISTRICT,2018,0.29457364341085274
0402,01,HENDRICKS PUBLIC SCHOOL DISTRICT,2018,0.15625
0413,01,MARSHALL PUBLIC SCHOOL DISTRICT,2018,0.28840579710144926
0414,01,MINNEOTA PUBLIC SCHOOL DISTRICT,2018,0.2986111111111111
0423,01,HUTCHINSON PUBLIC SCHOOL DISTRICT,2018,0.265389876880985
0424,01,LESTER PRAIRIE PUBLIC SCHOOL DIST.,2018,0.3655913978494624
0432,01,MAHNOMEN PUBLIC SCHOOL DISTRICT,2018,0.19285714285714287
0435,01,WAUBUN-OGEMA-WHITE EARTH PUBLIC SCH,2018,0.22807017543859648
0441,01,MARSHALL COUNTY CENTRAL SCHOOLS,2018,0.4125
0447,01,GRYGLA PUBLIC SCHOOL DISTRICT,2018,0.20588235294117646
0458,01,TRUMAN PUBLIC SCHOOL DISTRICT,2018,0.4594594594594595
0463,01,EDEN VALLEY-WATKINS SCHOOL DISTRICT,2018,0.31627906976744186
0465,01,LITCHFIELD PUBLIC SCHOOL DISTRICT,2018,0.17784256559766765
0466,01,DASSEL-COKATO PUBLIC SCHOOL DIST.,2018,0.28294573643410853
0473,01,ISLE PUBLIC SCHOOL DISTRICT,2018,0.384
0477,01,PRINCETON PUBLIC SCHOOL DISTRICT,2018,0.28797083839611176
0480,01,ONAMIA PUBLIC SCHOOL DISTRICT,2018,0.2753623188405797
0482,01,LITTLE FALLS PUBLIC SCHOOL DISTRICT,2018,0.2012779552715655
0484,01,PIERZ PUBLIC SCHOOL DISTRICT,2018,0.24482758620689654
0485,01,ROYALTON PUBLIC SCHOOL DISTRICT,2018,0.1736842105263158
0486,01,SWANVILLE PUBLIC SCHOOL DISTRICT,2018,0.28125
0487,01,UPSALA PUBLIC SCHOOL DISTRICT,2018,0.26136363636363635
0492,01,AUSTIN PUBLIC SCHOOL DISTRICT,2018,0.25284339457567806
0495,01,GRAND MEADOW PUBLIC SCHOOL DISTRICT,2018,0.32
0497,01,LYLE PUBLIC SCHOOL DISTRICT,2018,0.20967741935483872
0499,01,LEROY-OSTRANDER PUBLIC SCHOOLS,2018,0.3584905660377358
0500,01,SOUTHLAND PUBLIC SCHOOL DISTRICT,2018,0.4132231404958678
0505,01,FULDA PUBLIC SCHOOL DISTRICT,2018,0.32098765432098764
0507,01,NICOLLET PUBLIC SCHOOL DISTRICT,2018,0.25609756097560976
0508,01,ST. PETER PUBLIC SCHOOL DISTRICT,2018,0.2962962962962963
0511,01,ADRIAN PUBLIC SCHOOL DISTRICT,2018,0.22972972972972974
0514,01,ELLSWORTH PUBLIC SCHOOL DISTRICT,2018,0.15625
0518,01,WORTHINGTON PUBLIC SCHOOL DISTRICT,2018,0.1868279569892473
0531,01,BYRON PUBLIC SCHOOL DISTRICT,2018,0.324582338902148
0533,01,DOVER-EYOTA PUBLIC SCHOOL DISTRICT,2018,0.2833333333333333
0534,01,STEWARTVILLE PUBLIC SCHOOL DISTRICT,2018,0.3
0535,01,ROCHESTER PUBLIC SCHOOL DISTRICT,2018,0.280688622754491
0542,01,BATTLE LAKE PUBLIC SCHOOL DISTRICT,2018,0.3185840707964602
0544,01,FERGUS FALLS PUBLIC SCHOOL DISTRICT,2018,0.23065693430656933
0545,01,HENNING PUBLIC SCHOOL DISTRICT,2018,0.23529411764705882
0547,01,PARKERS PRAIRIE PUBLIC SCHOOL DIST.,2018,0.23770491803278687
0548,01,PELICAN RAPIDS PUBLIC SCHOOL DIST.,2018,0.32160804020100503
0549,01,PERHAM-DENT PUBLIC SCHOOL DISTRICT,2018,0.2644628099173554
0550,01,UNDERWOOD PUBLIC SCHOOL DISTRICT,2018,0.21818181818181817
0553,01,NEW YORK MILLS PUBLIC SCHOOL DIST.,2018,0.2620689655172414
0561,01,GOODRIDGE PUBLIC SCHOOL DISTRICT,2018,0.2222222222222222
0564,01,THIEF RIVER FALLS SCHOOL DISTRICT,2018,0.30066815144766146
0577,01,WILLOW RIVER PUBLIC SCHOOL DISTRICT,2018,0.3269230769230769
0578,01,PINE CITY PUBLIC SCHOOL DISTRICT,2018,0.2682926829268293
0581,01,EDGERTON PUBLIC SCHOOL DISTRICT,2018,0.33766233766233766
0592,01,CLIMAX-SHELLY PUBLIC SCHOOLS,2018,0.25
0593,01,CROOKSTON PUBLIC SCHOOL DISTRICT,2018,0.2866666666666667
0595,01,EAST GRAND FORKS PUBLIC SCHOOL DIST,2018,0.2909930715935335
0599,01,FERTILE-BELTRAMI SCHOOL DISTRICT,2018,0.2761904761904762
0600,01,FISHER PUBLIC SCHOOL DISTRICT,2018,0.25
0601,01,FOSSTON PUBLIC SCHOOL DISTRICT,2018,0.3416149068322981
0621,01,MOUNDS VIEW PUBLIC SCHOOL DISTRICT,2018,0.3007142857142857
0622,01,NORTH ST PAUL-MAPLEWOOD OAKDALE DIS,2018,0.2791636096845194
0623,01,ROSEVILLE PUBLIC SCHOOL DISTRICT,2018,0.29615384615384616
0624,01,WHITE BEAR LAKE SCHOOL DISTRICT,2018,0.27532327586206895
0625,01,ST. PAUL PUBLIC SCHOOL DISTRICT,2018,0.26307506053268764
0630,01,RED LAKE FALLS PUBLIC SCHOOL DIST.,2018,0.36
0640,01,WABASSO PUBLIC SCHOOL DISTRICT,2018,0.308411214953271
0656,01,FARIBAULT PUBLIC SCHOOL DISTRICT,2018,0.2538910505836576
0659,01,NORTHFIELD PUBLIC SCHOOL DISTRICT,2018,0.29651162790697677
0671,01,HILLS-BEAVER CREEK SCHOOL DISTRICT,2018,0.4142857142857143
0676,01,BADGER PUBLIC SCHOOL DISTRICT,2018,0.36
0682,01,ROSEAU PUBLIC SCHOOL DISTRICT,2018,0.34814814814814815
0690,01,WARROAD PUBLIC SCHOOL DISTRICT,2018,0.2384937238493724
0695,01,CHISHOLM PUBLIC SCHOOL DISTRICT,2018,0.22929936305732485
0696,01,ELY PUBLIC SCHOOL DISTRICT,2018,0.29770992366412213
0698,01,FLOODWOOD PUBLIC SCHOOL DISTRICT,2018,0.28125
0700,01,HERMANTOWN PUBLIC SCHOOL DISTRICT,2018,0.282
0701,01,HIBBING PUBLIC SCHOOL DISTRICT,2018,0.2309278350515464
0704,01,PROCTOR PUBLIC SCHOOL DISTRICT,2018,0.23342175066312998
0706,01,VIRGINIA PUBLIC SCHOOL DISTRICT,2018,0.22839506172839505
0709,01,DULUTH PUBLIC SCHOOL DISTRICT,2018,0.2317790855590765
0712,01,MOUNTAIN IRON-BUHL SCHOOL DISTRICT,2018,0.2857142857142857
0716,01,BELLE PLAINE PUBLIC SCHOOL DISTRICT,2018,0.29069767441860467
0717,01,JORDAN PUBLIC SCHOOL DISTRICT,2018,0.25245098039215685
0719,01,PRIOR LAKE-SAVAGE AREA SCHOOLS,2018,0.3243110236220472
0720,01,SHAKOPEE PUBLIC SCHOOL DISTRICT,2018,0.2992738589211618
0721,01,NEW PRAGUE AREA SCHOOLS,2018,0.29289940828402367
0726,01,BECKER PUBLIC SCHOOL DISTRICT,2018,0.3092006033182504
0727,01,BIG LAKE PUBLIC SCHOOL DISTRICT,2018,0.35987748851454826
0728,01,ELK RIVER PUBLIC SCHOOL DISTRICT,2018,0.31040157998683343
0738,01,HOLDINGFORD PUBLIC SCHOOL DISTRICT,2018,0.3576923076923077
0739,01,KIMBALL PUBLIC SCHOOL DISTRICT,2018,0.2122905027932961
0740,01,MELROSE PUBLIC SCHOOL DISTRICT,2018,0.26277372262773724
0741,01,PAYNESVILLE PUBLIC SCHOOL DISTRICT,2018,0.28888888888888886
0742,01,ST. CLOUD PUBLIC SCHOOL DISTRICT,2018,0.21608231707317074
0743,01,SAUK CENTRE PUBLIC SCHOOL DISTRICT,2018,0.2623574144486692
0745,01,ALBANY PUBLIC SCHOOL DISTRICT,2018,0.2864450127877238
0748,01,SARTELL-ST. STEPHEN SCHOOL DISTRICT,2018,0.30385487528344673
0750,01,ROCORI PUBLIC SCHOOL DISTRICT,2018,0.2631578947368421
0756,01,BLOOMING PRAIRIE PUBLIC SCHOOL DIST,2018,0.3008130081300813
0761,01,OWATONNA PUBLIC SCHOOL DISTRICT,2018,0.3359307359307359
0763,01,MEDFORD PUBLIC SCHOOL DISTRICT,2018,0.36097560975609755
0768,01,HANCOCK PUBLIC SCHOOL DISTRICT,2018,0.19402985074626866
0771,01,CHOKIO-ALBERTA PUBLIC SCHOOL DIST.,2018,0.25
0775,01,KERKHOVEN-MURDOCK-SUNBURG,2018,0.25892857142857145
0777,01,BENSON PUBLIC SCHOOL DISTRICT,2018,0.2422680412371134
0786,01,BERTHA-HEWITT PUBLIC SCHOOL DIST.,2018,0.33962264150943394
0787,01,BROWERVILLE PUBLIC SCHOOL DISTRICT,2018,0.26153846153846155
0803,01,WHEATON AREA PUBLIC SCHOOL DISTRICT,2018,0.3218390804597701
0811,01,WABASHA-KELLOGG PUBLIC SCHOOL DIST.,2018,0.3219178082191781
0813,01,LAKE CITY PUBLIC SCHOOL DISTRICT,2018,0.28762541806020064
0818,01,VERNDALE PUBLIC SCHOOL DISTRICT,2018,0.3170731707317073
0820,01,SEBEKA PUBLIC SCHOOL DISTRICT,2018,0.23529411764705882
0821,01,MENAHGA PUBLIC SCHOOL DISTRICT,2018,0.21965317919075145
0829,01,WASECA PUBLIC SCHOOL DISTRICT,2018,0.2891089108910891
0831,01,FOREST LAKE PUBLIC SCHOOL DISTRICT,2018,0.2818411097099622
0832,01,MAHTOMEDI PUBLIC SCHOOL DISTRICT,2018,0.31767337807606266
0833,01,SOUTH WASHINGTON COUNTY SCHOOL DIST,2018,0.30828292228943693
0834,01,STILLWATER AREA PUBLIC SCHOOL DIST.,2018,0.31091662828189776
0836,01,BUTTERFIELD PUBLIC SCHOOL DISTRICT,2018,0.1864406779661017
0837,01,MADELIA PUBLIC SCHOOL DISTRICT,2018,0.25517241379310346
0840,01,ST. JAMES PUBLIC SCHOOL DISTRICT,2018,0.2764227642276423
0846,01,BRECKENRIDGE PUBLIC SCHOOL DISTRICT,2018,0.2849740932642487
0850,01,ROTHSAY PUBLIC SCHOOL DISTRICT,2018,0.3448275862068966
0852,01,CAMPBELL-TINTAH PUBLIC SCHOOL DIST.,2018,0.36363636363636365
0857,01,LEWISTON-ALTURA PUBLIC SCHOOL DIST.,2018,0.20603015075376885
0858,01,ST. CHARLES PUBLIC SCHOOL DISTRICT,2018,0.2971698113207547
0861,01,WINONA AREA PUBLIC SCHOOL DISTRICT,2018,0.2743362831858407
0876,01,ANNANDALE PUBLIC SCHOOL DISTRICT,2018,0.2817955112219451
0877,01,BUFFALO-HANOVER-MONTROSE PUBLIC SCH,2018,0.2795470629865534
0879,01,DELANO PUBLIC SCHOOL DISTRICT,2018,0.3142857142857143
0881,01,MAPLE LAKE PUBLIC SCHOOL DISTRICT,2018,0.27802690582959644
0882,01,MONTICELLO PUBLIC SCHOOL DISTRICT,2018,0.2448087431693989
0883,01,ROCKFORD PUBLIC SCHOOL DISTRICT,2018,0.3064066852367688
0885,01,ST. MICHAEL-ALBERTVILLE SCHOOL DIST,2018,0.28336755646817247
0891,01,CANBY PUBLIC SCHOOL DISTRICT,2018,0.3381294964028777
0911,01,CAMBRIDGE-ISANTI PUBLIC SCHOOL DIST,2018,0.28730703259005147
0912,01,MILACA PUBLIC SCHOOL DISTRICT,2018,0.28603603603603606
0914,01,ULEN-HITTERDAL PUBLIC SCHOOL DIST,2018,0.2459016393442623
0966,51,WRIGHT TECHNICAL CENTER,2018,0.08602150537634409
2071,01,LAKE CRYSTAL-WELLCOME MEMORIAL,2018,0.291005291005291
2125,01,TRITON SCHOOL DISTRICT,2018,0.26422764227642276
2134,01,UNITED SOUTH CENTRAL SCHOOL DIST.,2018,0.36220472440944884
2135,01,MAPLE RIVER SCHOOL DISTRICT,2018,0.3442622950819672
2137,01,KINGSLAND PUBLIC SCHOOL DISTRICT,2018,0.2608695652173913
2142,01,ST. LOUIS COUNTY SCHOOL DISTRICT,2018,0.20286396181384247
2143,01,WATERVILLE-ELYSIAN-MORRISTOWN,2018,0.304635761589404
2144,01,CHISAGO LAKES SCHOOL DISTRICT,2018,0.35970333745364647
2149,01,MINNEWASKA SCHOOL DISTRICT,2018,0.29880478087649404
2154,01,EVELETH-GILBERT SCHOOL DISTRICT,2018,0.2815533980582524
2155,01,WADENA-DEER CREEK SCHOOL DISTRICT,2018,0.2995391705069124
2159,01,BUFFALO LK-HECTOR-STEWART PUBLIC SC,2018,0.23636363636363636
2164,01,DILWORTH-GLYNDON-FELTON,2018,0.3554006968641115
2165,01,HINCKLEY-FINLAYSON SCHOOL DISTRICT,2018,0.2028985507246377
2167,01,LAKEVIEW SCHOOL DISTRICT,2018,0.3522727272727273
2168,01,NRHEG SCHOOL DISTRICT,2018,0.3401015228426396
2169,01,MURRAY COUNTY CENTRAL SCHOOL DIST.,2018,0.2484472049689441
2170,01,STAPLES-MOTLEY SCHOOL DISTRICT,2018,0.1948529411764706
2171,01,KITTSON CENTRAL SCHOOL DISTRICT,2018,0.38095238095238093
2172,01,KENYON-WANAMINGO SCHOOL DISTRICT,2018,0.25380710659898476
2174,01,PINE RIVER-BACKUS SCHOOL DISTRICT,2018,0.21428571428571427
2176,01,WARREN-ALVARADO-OSLO SCHOOL DIST.,2018,0.25842696629213485
2180,01,MACCRAY SCHOOL DISTRICT,2018,0.33613445378151263
2184,01,LUVERNE PUBLIC SCHOOL DISTRICT,2018,0.281786941580756
2190,01,YELLOW MEDICINE EAST,2018,0.38650306748466257
2198,01,FILLMORE CENTRAL,2018,0.32666666666666666
2215,01,NORMAN COUNTY EAST SCHOOL DISTRICT,2018,0.25
2310,01,SIBLEY EAST SCHOOL DISTRICT,2018,0.34275618374558303
2311,01,CLEARBROOK-GONVICK SCHOOL DISTRICT,2018,0.2777777777777778
2342,01,WEST CENTRAL AREA,2018,0.34
2358,01,TRI-COUNTY SCHOOL DISTRICT,2018,0.38
2364,01,BELGRADE-BROOTEN-ELROSA SCHOOL DIST,2018,0.3141025641025641
2365,01,G.F.W.,2018,0.2937853107344633
2396,01,A.C.G.C. PUBLIC SCHOOL DISTRICT,2018,0.23809523809523808
2397,01,LE SUEUR-HENDERSON SCHOOL DISTRICT,2018,0.2375
2448,01,MARTIN COUNTY WEST SCHOOL DISTRICT,2018,0.32972972972972975
2527,01,NORMAN COUNTY WEST SCHOOL DISTRICT,2018,0.25
2534,01,BIRD ISLAND-OLIVIA-LAKE LILLIAN,2018,0.2857142857142857
2536,01,GRANADA HUNTLEY-EAST CHAIN,2018,0.21052631578947367
2580,01,EAST CENTRAL SCHOOL DISTRICT,2018,0.2254335260115607
2609,01,WIN-E-MAC SCHOOL DISTRICT,2018,0.3684210526315789
2683,01,GREENBUSH-MIDDLE RIVER SCHOOL DIST.,2018,0.21359223300970873
2687,01,HOWARD LAKE-WAVERLY-WINSTED,2018,0.2674897119341564
2689,01,PIPESTONE AREA SCHOOL DISTRICT,2018,0.2088888888888889
2711,01,MESABI EAST SCHOOL DISTRICT,2018,0.26146788990825687
2752,01,FAIRMONT AREA SCHOOL DISTRICT,2018,0.3076923076923077
2753,01,LONG PRAIRIE-GREY EAGLE SCHOOL DIST,2018,0.2
2754,01,CEDAR MOUNTAIN SCHOOL DISTRICT,2018,0.3181818181818182
2769,01,MORRIS AREA PUBLIC SCHOOLS,2018,0.31555555555555553
2805,01,ZUMBROTA-MAZEPPA SCHOOL DISTRICT,2018,0.2723735408560311
2835,01,JANESVILLE-WALDORF-PEMBERTON,2018,0.3128834355828221
2853,01,LAC QUI PARLE VALLEY SCHOOL DIST.,2018,0.32142857142857145
2854,01,ADA-BORUP PUBLIC SCHOOL DISTRICT,2018,0.1888111888111888
2856,01,STEPHEN-ARGYLE CENTRAL SCHOOLS,2018,0.38571428571428573
2859,01,GLENCOE-SILVER LAKE SCHOOL DISTRICT,2018,0.232620320855615
2860,01,BLUE EARTH AREA PUBLIC SCHOOL,2018,0.3293172690763052
2884,01,RED ROCK CENTRAL SCHOOL DISTRICT,2018,0.2830188679245283
2886,01,GLENVILLE-EMMONS SCHOOL DISTRICT,2018,0.2765957446808511
2888,01,CLINTON-GRACEVILLE-BEARDSLEY,2018,0.3076923076923077
2889,01,LAKE PARK AUDUBON SCHOOL DISTRICT,2018,0.2905405405405405
2890,01,RENVILLE COUNTY WEST SCHOOL DIST.,2018,0.297029702970297
2895,01,JACKSON COUNTY CENTRAL SCHOOL DIST.,2018,0.2956204379562044
2897,01,REDWOOD AREA SCHOOL DISTRICT,2018,0.24535315985130113
2898,01,WESTBROOK-WALNUT GROVE SCHOOLS,2018,0.37037037037037035
2899,01,PLAINVIEW-ELGIN-MILLVILLE,2018,0.2364217252396166
2902,01,RTR PUBLIC SCHOOLS,2018,0.27350427350427353
2903,01,ORTONVILLE PUBLIC SCHOOLS,2018,0.25757575757575757
2904,01,TRACY AREA PUBLIC SCHOOL DISTRICT,2018,0.26519337016574585
2906,01,RED LAKE COUNTY CENTRAL PUBLIC SCH,2018,0.3037974683544304
2908,01,BRANDON-EVANSVILLE PUBLIC SCHOOLS,2018,0.3333333333333333
0001,03,MINNEAPOLIS PUBLIC SCHOOL DISTRICT,2018,0.07478614847209616
0001,01,AITKIN PUBLIC SCHOOL DISTRICT,2017,0.32209737827715357
0002,01,HILL CITY PUBLIC SCHOOL DISTRICT,2017,0.2833333333333333
0004,01,MCGREGOR PUBLIC SCHOOL DISTRICT,2017,0.25609756097560976
0006,03,SOUTH ST. PAUL PUBLIC SCHOOL DIST.,2017,0.25785340314136124
0011,01,ANOKA-HENNEPIN PUBLIC SCHOOL DIST.,2017,0.2926065162907268
0012,01,CENTENNIAL PUBLIC SCHOOL DISTRICT,2017,0.3284132841328413
0013,01,COLUMBIA HEIGHTS PUBLIC SCHOOL DIST,2017,0.2857142857142857
0014,01,FRIDLEY PUBLIC SCHOOL DISTRICT,2017,0.2567204301075269
0015,01,ST. FRANCIS PUBLIC SCHOOL DISTRICT,2017,0.3304867634500427
0016,01,SPRING LAKE PARK PUBLIC SCHOOLS,2017,0.2701342281879195
0022,01,DETROIT LAKES PUBLIC SCHOOL DIST.,2017,0.27204783258594917
0023,01,FRAZEE-VERGAS PUBLIC SCHOOL DIST.,2017,0.2677595628415301
0031,01,BEMIDJI PUBLIC SCHOOL DISTRICT,2017,0.23324851569126379
0032,01,BLACKDUCK PUBLIC SCHOOL DISTRICT,2017,0.2733812949640288
0036,01,KELLIHER PUBLIC SCHOOL DISTRICT,2017,0.34146341463414637
0038,01,RED LAKE PUBLIC SCHOOL DISTRICT,2017,0.20481927710843373
0047,01,SAUK RAPIDS-RICE PUBLIC SCHOOLS,2017,0.28527291452111225
0051,01,FOLEY PUBLIC SCHOOL DISTRICT,2017,0.2751004016064257
0075,01,ST. CLAIR PUBLIC SCHOOL DISTRICT,2017,0.23841059602649006
0077,01,MANKATO PUBLIC SCHOOL DISTRICT,2017,0.300768386388584
0081,01,COMFREY PUBLIC SCHOOL DISTRICT,2017,0.4
0084,01,SLEEPY EYE PUBLIC SCHOOL DISTRICT,2017,0.248
0085,01,SPRINGFIELD PUBLIC SCHOOL DISTRICT,2017,0.3284671532846715
0088,01,NEW ULM PUBLIC SCHOOL DISTRICT,2017,0.2242798353909465
0091,01,BARNUM PUBLIC SCHOOL DISTRICT,2017,0.23563218390804597
0093,01,CARLTON PUBLIC SCHOOL DISTRICT,2017,0.36538461538461536
0094,01,CLOQUET PUBLIC SCHOOL DISTRICT,2017,0.2255772646536412
0095,01,CROMWELL-WRIGHT PUBLIC SCHOOLS,2017,0.25301204819277107
0097,01,MOOSE LAKE PUBLIC SCHOOL DISTRICT,2017,0.31333333333333335
0099,01,ESKO PUBLIC SCHOOL DISTRICT,2017,0.28
0100,01,WRENSHALL PUBLIC SCHOOL DISTRICT,2017,0.2898550724637681
0108,01,CENTRAL PUBLIC SCHOOL DISTRICT,2017,0.24302788844621515
0110,01,WACONIA PUBLIC SCHOOL DISTRICT,2017,0.2840043525571273
0111,01,WATERTOWN-MAYER PUBLIC SCHOOL DIST.,2017,0.29110512129380056
0112,01,EASTERN CARVER COUNTY PUBLIC SCHOOL,2017,0.3211120064464142
0113,01,WALKER-HACKENSACK-AKELEY SCHL. DIST,2017,0.2125
0115,01,CASS LAKE-BENA PUBLIC SCHOOLS,2017,0.26666666666666666
0116,01,PILLAGER PUBLIC SCHOOL DISTRICT,2017,0.32
0118,01,NORTHLAND COMMUNITY SCHOOLS,2017,0.2702702702702703
0129,01,MONTEVIDEO PUBLIC SCHOOL DISTRICT,2017,0.30201342281879195
0138,01,NORTH BRANCH PUBLIC SCHOOLS,2017,0.2681704260651629
0139,01,RUSH CITY PUBLIC SCHOOL DISTRICT,2017,0.30412371134020616
0146,01,BARNESVILLE PUBLIC SCHOOL DIST.,2017,0.2554347826086957
0150,01,HAWLEY PUBLIC SCHOOL DISTRICT,2017,0.1935483870967742
0152,01,MOORHEAD PUBLIC SCHOOL DISTRICT,2017,0.2871217452498241
0162,01,BAGLEY PUBLIC SCHOOL DISTRICT,2017,0.2777777777777778
0166,01,COOK COUNTY PUBLIC SCHOOLS,2017,0.2676056338028169
0173,01,MOUNTAIN LAKE PUBLIC SCHOOLS,2017,0.32231404958677684
0177,01,WINDOM PUBLIC SCHOOL DISTRICT,2017,0.3024390243902439
0181,01,BRAINERD PUBLIC SCHOOL DISTRICT,2017,0.24067796610169492
0182,01,CROSBY-IRONTON PUBLIC SCHOOL DIST.,2017,0.26587301587301587
0186,01,PEQUOT LAKES PUBLIC SCHOOLS,2017,0.24813895781637718
0191,01,BURNSVILLE PUBLIC SCHOOL DISTRICT,2017,0.25630252100840334
0192,01,FARMINGTON PUBLIC SCHOOL DISTRICT,2017,0.2994467496542185
0194,01,LAKEVILLE PUBLIC SCHOOL DISTRICT,2017,0.3047550432276657
0195,01,RANDOLPH PUBLIC SCHOOL DISTRICT,2017,0.23809523809523808
0196,01,ROSEMOUNT-APPLE VALLEY-EAGAN,2017,0.30136377112362883
0197,01,WEST ST. PAUL-MENDOTA HTS.-EAGAN,2017,0.2817574021012416
0199,01,INVER GROVE HEIGHTS SCHOOLS,2017,0.26215895610913403
0200,01,HASTINGS PUBLIC SCHOOL DISTRICT,2017,0.3318223028105168
0203,01,HAYFIELD PUBLIC SCHOOL DISTRICT,2017,0.2289156626506024
0204,01,KASSON-MANTORVILLE SCHOOL DISTRICT,2017,0.31767337807606266
0206,01,ALEXANDRIA PUBLIC SCHOOL DISTRICT,2017,0.2983783783783784
0213,01,OSAKIS PUBLIC SCHOOL DISTRICT,2017,0.2553191489361702
0227,01,CHATFIELD PUBLIC SCHOOLS,2017,0.3128205128205128
0229,01,LANESBORO PUBLIC SCHOOL DISTRICT,2017,0.35135135135135137
0238,01,MABEL-CANTON PUBLIC SCHOOL DIST.,2017,0.203125
0239,01,RUSHFORD-PETERSON PUBLIC SCHOOLS,2017,0.35714285714285715
0241,01,ALBERT LEA PUBLIC SCHOOL DISTRICT,2017,0.24246395806028834
0242,01,ALDEN-CONGER PUBLIC SCHOOL DISTRICT,2017,0.36
0252,01,CANNON FALLS PUBLIC SCHOOL DISTRICT,2017,0.2862595419847328
0253,01,GOODHUE PUBLIC SCHOOL DISTRICT,2017,0.20915032679738563
0255,01,PINE ISLAND PUBLIC SCHOOL DIST.,2017,0.37050359712230213
0256,01,RED WING PUBLIC SCHOOL DISTRICT,2017,0.26024955436720143
0261,01,ASHBY PUBLIC SCHOOL DISTRICT,2017,0.3877551020408163
0264,01,HERMAN-NORCROSS SCHOOL DISTRICT,2017,0.3
0270,01,HOPKINS PUBLIC SCHOOL DISTRICT,2017,0.27731591448931114
0271,01,BLOOMINGTON PUBLIC SCHOOL DISTRICT,2017,0.2897473997028232
0272,01,EDEN PRAIRIE PUBLIC SCHOOL DISTRICT,2017,0.31492666091458155
0273,01,EDINA PUBLIC SCHOOL DISTRICT,2017,0.29853658536585365
0276,01,MINNETONKA PUBLIC SCHOOL DISTRICT,2017,0.27843803056027167
0277,01,WESTONKA PUBLIC SCHOOL DISTRICT,2017,0.3220338983050847
0278,01,ORONO PUBLIC SCHOOL DISTRICT,2017,0.32916666666666666
0279,01,OSSEO PUBLIC SCHOOL DISTRICT,2017,0.3031161473087819
0280,01,RICHFIELD PUBLIC SCHOOL DISTRICT,2017,0.2944507361268403
0281,01,ROBBINSDALE PUBLIC SCHOOL DISTRICT,2017,0.2889508539560823
0282,01,ST. ANTHONY-NEW BRIGHTON SCHOOLS,2017,0.3143939393939394
