districtName,actCode,year,score
Ada-Borup School District 2854,247550,2018,21.4
Adrian Ind School District 511,247544,2018,21.3
Aitkin Ind School District 1,247002,2018,19.8
Albany Area Sch District 745,247788,2018,20.6
Albert Lea Area Schools,247246,2018,19
Alden-Conger Ind Sch Dist 242,247248,2018,19.9
Alexandria Ind School Dist 206,247200,2018,21.1
Annandale Ind School Dist 876,247906,2018,21.7
Anoka-Hennepin Ind Sch Dist 11,247008,2018,20.4
Ashby Ind School District 261,247270,2018,19.2
Atwater-Cosmos-Grove City Sd,247358,2018,20.5
Austin Ind School District 492,247518,2018,18.9
Badger Ind School District 676,247716,2018,21.3
Bagley Ind School District 162,247146,2018,18.8
Barnesville Ind Sch Dist 146,247132,2018,20.5
Barnum Ind School District 91,247076,2018,20.9
Battle Lake Ind Sch Dist 542,247572,2018,20.2
Becker Ind School District 726,247770,2018,20.8
Belgrade-Brootn-Elrosa Sd 2364,247790,2018,19
Belle Plaine Ind Sch Dist 716,247760,2018,20.5
Bemidji Ind School District 31,247030,2018,21.5
Benson Ind School District 777,247826,2018,17.4
Bertha-Hewitt Ind Sch Dist 786,247830,2018,17.9
Big Lake Ind School Dist 727,247772,2018,20.1
Blackduck Ind School Dist 32,247032,2018,18.7
Blooming Prairie Ind Sd 756,247810,2018,20.5
Bloomington Pub Sch Dist 271,247280,2018,21.5
Blue Earth Area Ind Sd 2860,247210,2018,19.8
Bold School District,247682,2018,20.8
Braham Ind School District 314,247332,2018,19.5
Brainerd Ind School Dist 181,247162,2018,22.4
Brandon-Evansville Isd 2908,247202,2018,21.2
Breckenridge Ind Sch Dist 846,247892,2018,20.8
Brooklyn Center Ind Sd 286,247282,2018,16.7
Browerville Ind Sch Dist 787,247832,2018,19.4
Buffalo Hanover Montrose Sd,247908,2018,21.2
Buffalo Lake-Hector Isd 2159,247692,2018,19.9
Burnsville-Eagan-Savage Sd 191,247170,2018,20.3
Butterfield-Odin Ind Sd 836,247886,2018,20.6
Byron Ind School District 531,247562,2018,22.9
Caledonia Ind School Dist 299,247316,2018,21
Cambridge-Isanti Sch Dist 911,247334,2018,19.9
Campbell-Tintah Ind Sd 852,247894,2018,15.8
Canby Ind School District 891,247922,2018,19.7
Cannon Falls Ind Sch Dist 252,247256,2018,21.7
Carlton Ind School District 93,247078,2018,20.6
Cass Lake-Bena Ind Sd 115,247106,2018,14
Cedar Mountain Sch Dist 2754,247672,2018,19.2
Centennial Ind School Dist 12,247010,2018,21.6
Central School District 108,247094,2018,21.1
Chatfield Pub School Dist 227,247570,2018,20.1
Chisago Lakes Isd 2144,247124,2018,21.8
Chisholm Ind School Dist 695,247728,2018,18.3
Chokio-Alberta Ind Sd 771,247822,2018,NA
Clearbrook-Gonvick Sd 2311,247148,2018,18.5
Cleveland Public Sch Dist 391,247396,2018,20.9
Climax-Shelly Ind Sch Dist 592,247618,2018,17.2
Clnton-Gracevl-Brdsley Sd 2888,247046,2018,19.2
Cloquet Ind School District 94,247080,2018,21.6
Columbia Heights Isd 13,247012,2018,17
Comfrey Ind School District 81,247064,2018,NA
Cook Co Sch Dist 166,247152,2018,20.9
Cromwell-Wright Ind Sd 95,247082,2018,18.4
Crookston Ind School Dist 593,247620,2018,18.8
Crosby-Ironton School Dist 182,247164,2018,20.5
Dassel-Cokato Ind Sch Dist 466,247486,2018,20.7
Dawson-Boyd Isd 378,247388,2018,21.1
Deer River Ind School Dist 317,247340,2018,18.3
Delano Ind School District 879,247910,2018,22.6
Detroit Lakes Ind Sch Dist 22,247022,2018,20.3
Dilworth-Glyndn-Feltn Isd 2164,247134,2018,20.5
Dover-Eyota Ind Sch Dist 533,247564,2018,20.7
Duluth Ind School District 709,247730,2018,21.3
East Central Isd 2580,247604,2018,18
East Grand Forks Ind Sd 595,247622,2018,19.6
Eastern Carver Co Schools,247092,2018,22.9
Eden Prairie Ind Sch Dist 272,247284,2018,24.1
Eden Valley-Watkins Ind Sd 463,247488,2018,21.9
Edgerton Ind School Dist 581,247610,2018,19.7
Edina Public School Dist 273,247286,2018,25.8
Elk River Ind School Dist 728,247774,2018,21.8
Ellsworth Ind School Dist 514,247540,2018,NA
Ely Ind School District 696,247732,2018,23
Esko Ind School District 99,247086,2018,23.4
Eveleth-Gilbert Sch Dist 2154,247734,2018,19.6
Fairmont Area School Dist 2752,247466,2018,20.3
Faribault Ind School Dist 656,247702,2018,19.3
Farmington Ind School Dist 192,247172,2018,21
Fergus Falls Ind Sch Dist 544,247576,2018,20.6
Fertile-Beltrami Ind Sd 599,247626,2018,20.7
Fillmore Central Sch Dist 2198,247238,2018,19.3
Fisher Ind School District 600,247628,2018,20.8
Floodwood Ind School Dist 698,247736,2018,17.8
Foley Ind School District 51,247040,2018,20.6
Forest Lake Ind Sch Dist 831,247878,2018,21.7
Fosston Ind School Dist 601,247630,2018,19.6
Frazee-Vergas Ind Sch Dist 23,247024,2018,19
Fridley Ind School District 14,247014,2018,18.2
Fulda Ind School District 505,247528,2018,18.2
Gfw Public School Dist 2365,247688,2018,18.5
Glencoe Silver Lake Isd 2859,247432,2018,21.5
Glenville-Emmons Isd 2886,247250,2018,16.9
Goodhue Ind School Dist 253,247258,2018,20.8
Goodridge Ind School Dist 561,247590,2018,NA
Granada-Huntley-East Chain Sd,247470,2018,18.8
Grand Meadow Pub Sch Dist 495,247520,2018,19.3
Grand Rapids Ind Sch Dist 318,247342,2018,20.6
Greenbush-Middle River Sd 2683,247718,2018,22.1
Greenway Ind School Dist 316,247338,2018,20.3
Grygla Ind School District 447,247458,2018,NA
Hancock Ind Sch Dist 768,247818,2018,23
Hastings Ind School Dist 200,247174,2018,22
Hawley Ind School District 150,247138,2018,21.3
Hayfield Ind School Dist 203,247194,2018,20.4
Hendricks Ind School Dist 402,247406,2018,NA
Henning Ind School Dist 545,247578,2018,21.4
Herman-Norcross Cmty Sd 264,247278,2018,NA
Hermantown Ind School Dist 700,247740,2018,22.1
Heron Lake-Okabena Isd 330,247346,2018,18.7
Hibbing Ind School Dist 701,247742,2018,21.6
Hill City Ind School Dist 2,247004,2018,17.4
Hills-Beaver Creek Ind Sd 671,247708,2018,20.7
Hinckley-Finlayson Psd 2165,247600,2018,20.4
Holdingford Ind Sch Dist 738,247794,2018,19.5
Hopkins Ind School Dist 270,247288,2018,22.1
Houston Ind School Dist 294,247318,2018,22.3
Hutchinson Ind School Dist 423,247434,2018,22.5
Independent School District 15,247016,2018,19.2
Independent Sd 2687,247912,2018,20.4
International Falls Ind Sd 361,247380,2018,20.2
Inver Grove Heights Isd 199,247186,2018,21.4
Isle Ind School District 473,247494,2018,18.1
Jackson Co Central Sd 2895,247348,2018,19.6
Janesvle-Wldrf-Pmbrtn Isd 2835,247870,2018,19.6
Jordan Ind School District 717,247762,2018,21.5
Kasson-Mantorville Ind Sd 204,247196,2018,21.4
Kelliher School Dist 36,247034,2018,21.5
Kenyon-Wanamingo Sd 2172,247260,2018,20.1
Kerkhoven-Murdck-Sunbrg Sd 775,247828,2018,20.7
Kimball Ind School Dist 739,247796,2018,22.6
Kingsland Public Sch Dist 2137,247242,2018,21
Kittson Central Sch Dist 2171,247366,2018,21.3
La Crescent-Hokah Ind Sd 300,247320,2018,21.7
Lac Qui Parle Vly Isd 2853,247934,2018,20
Lake City Ind School Dist 813,247852,2018,20.8
Lake Crystal-Wellcome Mem 2071,247056,2018,19.7
Lake Of The Woods Isd 390,247394,2018,20.1
Lake Park-Audubon Isd 2889,247020,2018,19.3
Lake Superior Ind Sch Dist 381,247392,2018,20.7
Lakeview Ind School Dist 2167,247418,2018,18.2
Lakeville Ind School Dist 194,247176,2018,22.8
Lancaster Ind School Dist 356,247374,2018,20.1
Lanesboro Ind School Dist 229,247232,2018,20.6
Laporte Ind School Dist 306,247328,2018,18.7
Le Center Ind School Dist 392,247398,2018,19.2
Le Sueur-Henderson Isd 2397,247400,2018,20
Leroy-Ostrander Ind Sd 499,247516,2018,18.7
Lester Prairie Ind Sd 424,247436,2018,19.8
Lewiston-Altura Isd 857,247898,2018,20
Litchfield Ind School Dist 465,247492,2018,21.4
Little Falls Ind Sch Dist 482,247502,2018,21.7
Littlefork-Big Falls Sd 362,247378,2018,19.3
Long Prairie-Grey Eagle 2753,247840,2018,21
Luverne Ind School Dist 2184,247710,2018,22.1
Lyle Ind School District 497,247522,2018,21.5
Mabel-Canton Ind Sch Dist 238,247234,2018,19.4
Maccray Ind School Dist 2180,247114,2018,19.1
Madelia Ind School Dist 837,247888,2018,21.6
Mahnomen Ind School Dist 432,247444,2018,18.6
Mahtomedi Ind School Dist 832,247880,2018,24.8
Mankato Area Public Schs,247060,2018,21.9
Maple Lake Ind School Dist 881,247914,2018,21.5
Maple River School Dist 2135,247058,2018,21.1
Marshall Co Central Isd 441,247454,2018,19.4
Marshall Ind School Dist 413,247422,2018,20.5
Martin Co West Sch Dist 2448,247472,2018,19.5
Mcgregor Ind School Dist 4,247006,2018,19.3
Medford Ind School Dist 763,247814,2018,20
Melrose Area Ind Sd 740,247798,2018,21.1
Menahga Ind School Dist 821,247860,2018,19.6
Mesabi East Ind Sch Dist 2711,247724,2018,18.1
Milaca Ind School District 912,247496,2018,19.4
Minneapolis Public Sch Dist,247310,2018,19
Minneota Public Schools,247424,2018,20.8
Minnetonka Isd 276,247292,2018,26
Minnewaska Area Sch Dist 2149,247642,2018,20.4
Montevideo Ind School Dist 129,247120,2018,20.2
Monticello Ind School Dist 882,247904,2018,21
Moorhead Ind School Dist 152,247140,2018,19.8
Moose Lake Ind School Dist 97,247084,2018,22
Mora Ind School Dist 332,247354,2018,19.3
Morris Ind School Dist 2769,247820,2018,20.9
Mounds View Ind Sch Dist 621,247648,2018,23.6
Mountain Iron-Buhl Isd 712,247746,2018,19.1
Mountain Lake Ind Sch Dist 173,247154,2018,19.9
Murray Co Central Isd 2169,247530,2018,21.2
N St Paul Mplwd Oakdale Sd 622,247650,2018,19.7
Nashwauk-Keewatin Ind Sd 319,247344,2018,19.4
Nevis Ind School District 308,247326,2018,19
New London-Spicer Ind Sd 0345,247360,2018,21.4
New Prague Ind Sch Dist 721,247764,2018,21.4
New Ulm Pub Sch District 88,247066,2018,22
New York Mills Ind Sd 553,247580,2018,19.7
Nicollet Ind School Dist 507,247532,2018,21.8
Norman Co East Isd 2215,247560,2018,19.3
Norman Co West Isd 2527,247556,2018,19.2
North Branch Ind Sch Dist 138,247126,2018,20.7
Northfield Ind School Dist 659,247706,2018,22
Northland Cmty Sd 118,247110,2018,16
Nrheg Ind Sch Dist 2168,247874,2018,20.1
Ogilvie Ind School Dist 333,247356,2018,17.9
Onamia Ind School Dist 480,247498,2018,18.6
Orono Ind School District 278,247296,2018,25
Ortonville Ind Sch Dist 2903,247050,2018,19.6
Osakis Ind School District 213,247208,2018,21.9
Osseo Ind School District 279,247298,2018,19.9
Owatonna School Dist 761,247816,2018,20
Park Rapids Ind Sch Dist 309,247330,2018,19.5
Parkers Prairie Ind Sd 547,247582,2018,22.5
Paynesville Ind Sch Dist 741,247800,2018,18.9
Pelican Rapids Ind Sd 548,247584,2018,18.4
Pequot Lakes Ind Sch Dist 186,247166,2018,21.6
Perham-Dent Ind Sch Dist 549,247586,2018,20.6
Pierz School District 484,247508,2018,19.9
Pillager Ind School Dist 116,247108,2018,21.5
Pine City Sch District 578,247602,2018,20.4
Pine Island School Dist 255,247262,2018,22.1
Pine River-Backus Ind Sd 2174,247104,2018,20.3
Pipestone Area Sch Dist 2689,247614,2018,20.6
Plainview Elgin Millville Sd,247856,2018,20.7
Princeton Public Sch Dist 477,247500,2018,20.2
Prior Lake-Savage Area Sd 719,247766,2018,22.9
Proctor Ind School Dist 704,247748,2018,21.1
Randolph School District 195,247178,2018,21.1
Red Lake Co Central Isd 2906,247658,2018,16.6
Red Lake Falls Sch Dist 630,247662,2018,19.1
Red Lake Independent Sd 38,247036,2018,14.6
Red Rock Central Ind Sd 2884,247668,2018,21.2
Red Wing School District 256,247264,2018,20.8
Redwood Falls Sch Dist 2897,247674,2018,20.4
Renville Co West Sch Dist 2890,247698,2018,18.8
Richfield School District 280,247300,2018,18.3
Robbinsdale Ind Sch Dist 281,247302,2018,19.1
Rochester School District 535,247566,2018,22.3
Rockford School District 883,247918,2018,20.7
Rocori Ind Sch Dist 750,247808,2018,22.3
Roseau School District 682,247720,2018,20.8
Rosemount-Apple Vly-Eagan 196,247180,2018,23.1
Roseville Area Sch Dist 623,247652,2018,20.8
Rothsay School District 850,247896,2018,21
Royalton School District 485,247512,2018,21.5
Rush City Ind School Dist 139,247128,2018,20.3
Rushford-Peterson Isd 239,247240,2018,22.3
Russell Tyler Ruthton Sd 2902,247412,2018,21.3
Sartell-St Stephen Isd 748,247804,2018,23.2
Sauk Centre School Dist 743,247806,2018,20
Sauk Rapids-Rice Sch Dist 47,247042,2018,20.7
Sebeka Ind School District 820,247866,2018,20.1
Shakopee School District 720,247768,2018,21.2
Sibley East Ind Sch Dist 2310,247782,2018,20.7
Sleepy Eye School District 84,247068,2018,21
South Koochiching Sd 363,247382,2018,17.9
South St Paul Special Sd 6,247182,2018,20.5
South Washington Co Sd 833,247882,2018,22.4
Southland School District 500,247524,2018,19.9
Spring Grove School Dist 297,247322,2018,20.4
Spring Lake Park Sd 16,247018,2018,19.5
Springfield School District 85,247070,2018,21.6
St Anthony-New Brighton Sd 282,247304,2018,22.9
St Charles Ind School Dist 858,247900,2018,20.8
St Clair School District 75,247062,2018,21.3
St Cloud Ind Sch Dist 742,247802,2018,19.1
St James School District 840,247890,2018,17.6
St Louis Co Isd 2142,247756,2018,20.1
St Louis Park School Dist 283,247306,2018,21.6
St Michael-Albertville Sd 885,247916,2018,23.3
St Paul Independent Sd 625,247656,2018,18.1
St Peter Ind School Dist 508,247534,2018,21.8
Staples-Motley Isd 2170,247842,2018,19.8
Stephen-Argyle Central Sd 2856,247460,2018,21.1
Stewartville School Dist 534,247568,2018,21.7
Stillwater School Dist 834,247884,2018,23
Swanville School District 486,247504,2018,17.6
Thief River Falls Sd 564,247592,2018,20.1
Tracy Ind School District 2904,247428,2018,21
Tri-County Ind Sch Dist 2358,247372,2018,19.7
Triton Ind School Dist 2125,247192,2018,19.8
Truman School District 458,247474,2018,16.7
Ulen-Hitterdal Sch Dist 914,247142,2018,20.2
Underwood School District 550,247588,2018,21.7
United South Central Isd 2134,247222,2018,20.5
Upsala Area School Dist 487,247506,2018,17.4
Verndale Ind School Dist 818,247862,2018,17.9
Virginia Public Sch Dist 706,247752,2018,20.7
W St Paul-Mendota-Eagan Sd 197,247184,2018,21.2
Wabasha-Kellogg Isd 811,247858,2018,21.8
Wabasso School District 640,247678,2018,21.2
Waconia School District 110,247096,2018,23.1
Wadena-Deer Creek Sd 2155,247864,2018,19.7
Walker-Hackensack-Akeley 113,247112,2018,22
Warren-Alvarado-Oslo Sd 2176,247464,2018,19.3
Warroad School District 690,247722,2018,20
Waseca Public School Dist,247876,2018,21.3
Watertown-Mayer Sch Dist 111,247098,2018,21.2
Watrvle-Elysian-Mrstwn Sd 2143,247404,2018,19.1
Waubun-Ogema-White Earth Psd,247446,2018,19.3
Wayzata School District 284,247308,2018,25.6
West Central Area Sd 2342,247206,2018,20.4
Westbrook-Walnut Grove Sd 2898,247158,2018,19.3
Westonka Ind School Dist 277,247294,2018,24.1
Wheaton School District 803,247848,2018,20.9
White Bear Lake Area Isd 624,247654,2018,21.8
Willmar School District 347,247364,2018,18.7
Willow River School Dist 577,247606,2018,17.4
Win-E-Mac School Dist 2609,247632,2018,19.5
Windom School District 177,247160,2018,20
Winona Area Public School Dist,247902,2018,19.3
Worthington School Dist 518,247542,2018,18.7
Wrenshall School District 100,247088,2018,19.9
Wright School District 966,247920,2018,NA
Yellow Medicine East Sd 2190,247928,2018,18.6
Zumbrota-Mazeppa Isd 2805,247854,2018,20.3
Ada-Borup School District 2854,247550,2017,21.2
Adrian Ind School District 511,247544,2017,21.2
Aitkin Ind School District 1,247002,2017,21.2
Albany Area Sch District 745,247788,2017,22
Albert Lea Area Schools,247246,2017,19.8
Alden-Conger Ind Sch Dist 242,247248,2017,19.7
Alexandria Ind School Dist 206,247200,2017,21.3
Annandale Ind School Dist 876,247906,2017,21.8
Anoka-Hennepin Ind Sch Dist 11,247008,2017,20.8
Ashby Ind School District 261,247270,2017,19.5
Atwater-Cosmos-Grove City Sd,247358,2017,19.3
Austin Ind School District 492,247518,2017,19.7
Badger Ind School District 676,247716,2017,19.4
Bagley Ind School District 162,247146,2017,19.2
Barnesville Ind Sch Dist 146,247132,2017,21.7
Barnum Ind School District 91,247076,2017,18.5
Battle Lake Ind Sch Dist 542,247572,2017,22
Becker Ind School District 726,247770,2017,20.7
Belgrade-Brootn-Elrosa Sd 2364,247790,2017,19.5
Belle Plaine Ind Sch Dist 716,247760,2017,20.7
Bemidji Ind School District 31,247030,2017,21.7
Benson Ind School District 777,247826,2017,21.4
Bertha-Hewitt Ind Sch Dist 786,247830,2017,18.7
Big Lake Ind School Dist 727,247772,2017,20.3
Blackduck Ind School Dist 32,247032,2017,18.7
Blooming Prairie Ind Sd 756,247810,2017,20.3
Bloomington Pub Sch Dist 271,247280,2017,22.1
Blue Earth Area Ind Sd 2860,247210,2017,20.3
Bold School District,247682,2017,19.6
Braham Ind School District 314,247332,2017,20
Brainerd Ind School Dist 181,247162,2017,21.9
Brandon-Evansville Isd 2908,247202,2017,19.7
Breckenridge Ind Sch Dist 846,247892,2017,20.4
Brooklyn Center Ind Sd 286,247282,2017,17.2
Browerville Ind Sch Dist 787,247832,2017,18.7
Buffalo Hanover Montrose Sd,247908,2017,21.1
Buffalo Lake-Hector Isd 2159,247692,2017,19
Burnsville-Eagan-Savage Sd 191,247170,2017,21.2
Butterfield-Odin Ind Sd 836,247886,2017,19.2
Byron Ind School District 531,247562,2017,22.1
Caledonia Ind School Dist 299,247316,2017,21.6
Cambridge-Isanti Sch Dist 911,247334,2017,20.2
Campbell-Tintah Ind Sd 852,247894,2017,NA
Canby Ind School District 891,247922,2017,21
Cannon Falls Ind Sch Dist 252,247256,2017,21.5
Carlton Ind School District 93,247078,2017,19.7
Cass Lake-Bena Ind Sd 115,247106,2017,16.9
Cedar Mountain Sch Dist 2754,247672,2017,18.7
Centennial Ind School Dist 12,247010,2017,22.5
Central School District 108,247094,2017,20.8
Chatfield Pub School Dist 227,247570,2017,20.1
Chisago Lakes Isd 2144,247124,2017,21.3
Chisholm Ind School Dist 695,247728,2017,20.8
Chokio-Alberta Ind Sd 771,247822,2017,19.1
Clearbrook-Gonvick Sd 2311,247148,2017,18.8
Cleveland Public Sch Dist 391,247396,2017,20.1
Climax-Shelly Ind Sch Dist 592,247618,2017,19.3
Clnton-Gracevl-Brdsley Sd 2888,247046,2017,19.3
Cloquet Ind School District 94,247080,2017,22.1
Columbia Heights Isd 13,247012,2017,17.6
Comfrey Ind School District 81,247064,2017,19.1
Cook Co Sch Dist 166,247152,2017,19.7
Cromwell-Wright Ind Sd 95,247082,2017,21.1
Crookston Ind School Dist 593,247620,2017,19.9
Crosby-Ironton School Dist 182,247164,2017,21.6
Dassel-Cokato Ind Sch Dist 466,247486,2017,20.8
Dawson-Boyd Isd 378,247388,2017,22
Deer River Ind School Dist 317,247340,2017,18.6
Delano Ind School District 879,247910,2017,23.5
Detroit Lakes Ind Sch Dist 22,247022,2017,20.8
Dilworth-Glyndn-Feltn Isd 2164,247134,2017,20.7
Dover-Eyota Ind Sch Dist 533,247564,2017,21.8
Duluth Ind School District 709,247730,2017,21.7
East Central Isd 2580,247604,2017,21.3
East Grand Forks Ind Sd 595,247622,2017,20
Eastern Carver Co Schools,247092,2017,23
Eden Prairie Ind Sch Dist 272,247284,2017,24
Eden Valley-Watkins Ind Sd 463,247488,2017,20.3
Edgerton Ind School Dist 581,247610,2017,19
Edina Public School Dist 273,247286,2017,26.3
Elk River Ind School Dist 728,247774,2017,21.9
Ellsworth Ind School Dist 514,247540,2017,NA
Ely Ind School District 696,247732,2017,22.4
Esko Ind School District 99,247086,2017,22.5
Eveleth-Gilbert Sch Dist 2154,247734,2017,19.9
Fairmont Area School Dist 2752,247466,2017,20.5
Faribault Ind School Dist 656,247702,2017,19.4
Farmington Ind School Dist 192,247172,2017,21.1
Fergus Falls Ind Sch Dist 544,247576,2017,20.8
Fertile-Beltrami Ind Sd 599,247626,2017,21.2
Fillmore Central Sch Dist 2198,247238,2017,20.7
Fisher Ind School District 600,247628,2017,21.2
Floodwood Ind School Dist 698,247736,2017,17.9
Foley Ind School District 51,247040,2017,20.9
Forest Lake Ind Sch Dist 831,247878,2017,21.7
Fosston Ind School Dist 601,247630,2017,19.2
Frazee-Vergas Ind Sch Dist 23,247024,2017,19.6
Fridley Ind School District 14,247014,2017,19
Fulda Ind School District 505,247528,2017,22.4
Gfw Public School Dist 2365,247688,2017,19.1
Glencoe Silver Lake Isd 2859,247432,2017,20.7
Glenville-Emmons Isd 2886,247250,2017,18.7
Goodhue Ind School Dist 253,247258,2017,21.9
Goodridge Ind School Dist 561,247590,2017,18.8
Granada-Huntley-East Chain Sd,247470,2017,16.8
Grand Meadow Pub Sch Dist 495,247520,2017,19
Grand Rapids Ind Sch Dist 318,247342,2017,21.3
Greenbush-Middle River Sd 2683,247718,2017,21.1
Greenway Ind School Dist 316,247338,2017,19
Grygla Ind School District 447,247458,2017,NA
Hancock Ind Sch Dist 768,247818,2017,20.6
Hastings Ind School Dist 200,247174,2017,21.9
Hawley Ind School District 150,247138,2017,23.7
Hayfield Ind School Dist 203,247194,2017,19.9
Hendricks Ind School Dist 402,247406,2017,NA
Henning Ind School Dist 545,247578,2017,21.1
Herman-Norcross Cmty Sd 264,247278,2017,NA
Hermantown Ind School Dist 700,247740,2017,23.1
Heron Lake-Okabena Isd 330,247346,2017,18.4
Hibbing Ind School Dist 701,247742,2017,22
Hill City Ind School Dist 2,247004,2017,18.8
Hills-Beaver Creek Ind Sd 671,247708,2017,22.3
Hinckley-Finlayson Psd 2165,247600,2017,20.1
Holdingford Ind Sch Dist 738,247794,2017,19.5
Hopkins Ind School Dist 270,247288,2017,22.1
Houston Ind School Dist 294,247318,2017,20.8
Hutchinson Ind School Dist 423,247434,2017,20.9
Independent School District 15,247016,2017,20.2
Independent Sd 2687,247912,2017,20.7
International Falls Ind Sd 361,247380,2017,19
Inver Grove Heights Isd 199,247186,2017,21.4
Isle Ind School District 473,247494,2017,18.6
Jackson Co Central Sd 2895,247348,2017,22
Janesvle-Wldrf-Pmbrtn Isd 2835,247870,2017,19.6
Jordan Ind School District 717,247762,2017,21.2
Kasson-Mantorville Ind Sd 204,247196,2017,22.6
Kelliher School Dist 36,247034,2017,20.9
Kenyon-Wanamingo Sd 2172,247260,2017,20.3
Kerkhoven-Murdck-Sunbrg Sd 775,247828,2017,20.7
Kimball Ind School Dist 739,247796,2017,22.9
Kingsland Public Sch Dist 2137,247242,2017,20.7
Kittson Central Sch Dist 2171,247366,2017,23.1
La Crescent-Hokah Ind Sd 300,247320,2017,22.8
Lac Qui Parle Vly Isd 2853,247934,2017,20.6
Lake City Ind School Dist 813,247852,2017,20.2
Lake Crystal-Wellcome Mem 2071,247056,2017,20.7
Lake Of The Woods Isd 390,247394,2017,21.7
Lake Park-Audubon Isd 2889,247020,2017,18.8
Lake Superior Ind Sch Dist 381,247392,2017,20.2
Lakeview Ind School Dist 2167,247418,2017,20
Lakeville Ind School Dist 194,247176,2017,23
Lancaster Ind School Dist 356,247374,2017,NA
Lanesboro Ind School Dist 229,247232,2017,22.4
Laporte Ind School Dist 306,247328,2017,19.9
Le Center Ind School Dist 392,247398,2017,19.7
Le Sueur-Henderson Isd 2397,247400,2017,20.4
Leroy-Ostrander Ind Sd 499,247516,2017,19.5
Lester Prairie Ind Sd 424,247436,2017,19.1
Lewiston-Altura Isd 857,247898,2017,21.3
Litchfield Ind School Dist 465,247492,2017,21.8
Little Falls Ind Sch Dist 482,247502,2017,20.7
Littlefork-Big Falls Sd 362,247378,2017,19.8
Long Prairie-Grey Eagle 2753,247840,2017,21.4
Luverne Ind School Dist 2184,247710,2017,22.1
Lyle Ind School District 497,247522,2017,NA
Mabel-Canton Ind Sch Dist 238,247234,2017,19.5
Maccray Ind School Dist 2180,247114,2017,19.1
Madelia Ind School Dist 837,247888,2017,19.5
Mahnomen Ind School Dist 432,247444,2017,17.8
Mahtomedi Ind School Dist 832,247880,2017,25
Mankato Area Public Schs,247060,2017,21.5
Maple Lake Ind School Dist 881,247914,2017,22.3
Maple River School Dist 2135,247058,2017,22
Marshall Co Central Isd 441,247454,2017,19.5
Marshall Ind School Dist 413,247422,2017,21.9
Martin Co West Sch Dist 2448,247472,2017,19.8
Mcgregor Ind School Dist 4,247006,2017,22
Medford Ind School Dist 763,247814,2017,19.8
Melrose Area Ind Sd 740,247798,2017,20.6
Menahga Ind School Dist 821,247860,2017,20.9
Mesabi East Ind Sch Dist 2711,247724,2017,20.2
Milaca Ind School District 912,247496,2017,19.3
Minneapolis Public Sch Dist,247310,2017,19.1
Minneota Public Schools,247424,2017,20.8
Minnetonka Isd 276,247292,2017,25.7
Minnewaska Area Sch Dist 2149,247642,2017,20.5
Montevideo Ind School Dist 129,247120,2017,20
Monticello Ind School Dist 882,247904,2017,21.7
Moorhead Ind School Dist 152,247140,2017,20.8
Moose Lake Ind School Dist 97,247084,2017,21.6
Mora Ind School Dist 332,247354,2017,18.9
Morris Ind School Dist 2769,247820,2017,21.5
Mounds View Ind Sch Dist 621,247648,2017,23.5
Mountain Iron-Buhl Isd 712,247746,2017,18.1
Mountain Lake Ind Sch Dist 173,247154,2017,20.4
Murray Co Central Isd 2169,247530,2017,21.7
N St Paul Mplwd Oakdale Sd 622,247650,2017,20.2
Nashwauk-Keewatin Ind Sd 319,247344,2017,18.6
Nevis Ind School District 308,247326,2017,20.6
New London-Spicer Ind Sd 0345,247360,2017,20.9
New Prague Ind Sch Dist 721,247764,2017,22.2
New Ulm Pub Sch District 88,247066,2017,22.5
New York Mills Ind Sd 553,247580,2017,21.5
Nicollet Ind School Dist 507,247532,2017,21.2
Norman Co East Isd 2215,247560,2017,20
Norman Co West Isd 2527,247556,2017,19.2
North Branch Ind Sch Dist 138,247126,2017,19.9
Northfield Ind School Dist 659,247706,2017,22.6
Northland Cmty Sd 118,247110,2017,18
Nrheg Ind Sch Dist 2168,247874,2017,20.5
Ogilvie Ind School Dist 333,247356,2017,16.7
Onamia Ind School Dist 480,247498,2017,18.8
Orono Ind School District 278,247296,2017,25.1
Ortonville Ind Sch Dist 2903,247050,2017,20.8
Osakis Ind School District 213,247208,2017,21.3
Osseo Ind School District 279,247298,2017,20.3
Owatonna School Dist 761,247816,2017,20.8
Park Rapids Ind Sch Dist 309,247330,2017,21.4
Parkers Prairie Ind Sd 547,247582,2017,20.8
Paynesville Ind Sch Dist 741,247800,2017,19.5
Pelican Rapids Ind Sd 548,247584,2017,17.9
Pequot Lakes Ind Sch Dist 186,247166,2017,22.7
Perham-Dent Ind Sch Dist 549,247586,2017,19.7
Pierz School District 484,247508,2017,20.2
Pillager Ind School Dist 116,247108,2017,19
Pine City Sch District 578,247602,2017,19.7
Pine Island School Dist 255,247262,2017,23
Pine River-Backus Ind Sd 2174,247104,2017,19.7
Pipestone Area Sch Dist 2689,247614,2017,20.6
Plainview Elgin Millville Sd,247856,2017,21.7
Princeton Public Sch Dist 477,247500,2017,19.9
Prior Lake-Savage Area Sd 719,247766,2017,23.5
Proctor Ind School Dist 704,247748,2017,21.5
Randolph School District 195,247178,2017,22.7
Red Lake Co Central Isd 2906,247658,2017,19.4
Red Lake Falls Sch Dist 630,247662,2017,19.2
Red Lake Independent Sd 38,247036,2017,14.9
Red Rock Central Ind Sd 2884,247668,2017,21.3
Red Wing School District 256,247264,2017,22
Redwood Falls Sch Dist 2897,247674,2017,20.4
Renville Co West Sch Dist 2890,247698,2017,20.6
Richfield School District 280,247300,2017,18
Robbinsdale Ind Sch Dist 281,247302,2017,19.4
Rochester School District 535,247566,2017,22.2
Rockford School District 883,247918,2017,20.9
Rocori Ind Sch Dist 750,247808,2017,22.5
Roseau School District 682,247720,2017,19.7
Rosemount-Apple Vly-Eagan 196,247180,2017,23.1
Roseville Area Sch Dist 623,247652,2017,21.1
Rothsay School District 850,247896,2017,20
