districtNumber,districtType,districtName,year,averageScore,percentPassed
0001,01,AITKIN PUBLIC SCHOOL DISTRICT,2012,56.5,80.6
0001,03,MINNEAPOLIS PUBLIC SCHOOL DIST.,2012,52.1,61.8
0002,01,HILL CITY PUBLIC SCHOOL DISTRICT,2012,50.5,68.4
0004,01,MCGREGOR PUBLIC SCHOOL DISTRICT,2012,56.7,75
0006,03,SOUTH ST. PAUL PUBLIC SCHOOL DIST.,2012,55.6,81.1
0011,01,ANOKA-HENNEPIN PUBLIC SCHOOL DIST.,2012,58.1,85.9
0012,01,CENTENNIAL PUBLIC SCHOOL DISTRICT,2012,58.4,88.2
0013,01,COLUMBIA HEIGHTS PUBLIC SCHOOL DIST,2012,49.1,58.7
0014,01,FRIDLEY PUBLIC SCHOOL DISTRICT,2012,54.5,72.9
0015,01,ST. FRANCIS PUBLIC SCHOOL DISTRICT,2012,55.8,80.1
0016,01,SPRING LAKE PARK PUBLIC SCHOOLS,2012,55.1,76.8
0022,01,DETROIT LAKES PUBLIC SCHOOL DIST.,2012,56.6,81.3
0023,01,FRAZEE-VERGAS PUBLIC SCHOOL DIST.,2012,56.5,87.3
0031,01,BEMIDJI PUBLIC SCHOOL DISTRICT,2012,57,81.8
0032,01,BLACKDUCK PUBLIC SCHOOL DISTRICT,2012,57.8,81.4
0036,01,KELLIHER PUBLIC SCHOOL DISTRICT,2012,52.6,64.3
0038,01,RED LAKE PUBLIC SCHOOL DISTRICT,2012,45,32
0047,01,SAUK RAPIDS-RICE PUBLIC SCHOOLS,2012,57.4,83.4
0051,01,FOLEY PUBLIC SCHOOL DISTRICT,2012,56.3,84.5
0075,01,ST. CLAIR PUBLIC SCHOOL DISTRICT,2012,57.8,79.2
0077,01,MANKATO PUBLIC SCHOOL DISTRICT,2012,58,82.7
0081,01,COMFREY PUBLIC SCHOOL DISTRICT,2012,60.9,100
0084,01,SLEEPY EYE PUBLIC SCHOOL DISTRICT,2012,52.4,69.8
0085,01,SPRINGFIELD PUBLIC SCHOOL DISTRICT,2012,56,78.4
0088,01,NEW ULM PUBLIC SCHOOL DISTRICT,2012,55.9,80.1
0091,01,BARNUM PUBLIC SCHOOL DISTRICT,2012,56.8,77.6
0093,01,CARLTON PUBLIC SCHOOL DISTRICT,2012,56.9,85
0094,01,CLOQUET PUBLIC SCHOOL DISTRICT,2012,56,79.4
0095,01,CROMWELL-WRIGHT PUBLIC SCHOOLS,2012,55.2,76.9
0097,01,MOOSE LAKE PUBLIC SCHOOL DISTRICT,2012,59.3,91.7
0099,01,ESKO PUBLIC SCHOOL DISTRICT,2012,60.4,94.8
0100,01,WRENSHALL PUBLIC SCHOOL DISTRICT,2012,56.2,79.3
0108,01,CENTRAL PUBLIC SCHOOL DISTRICT,2012,57.8,80.7
0110,01,WACONIA PUBLIC SCHOOL DISTRICT,2012,56.9,83
0111,01,WATERTOWN-MAYER PUBLIC SCHOOL DIST.,2012,58.9,85
0112,01,EASTERN CARVER COUNTY PUBLIC SCHOOL,2012,59.3,89.9
0113,01,WALKER-HACKENSACK-AKELEY SCHL. DIST,2012,55.2,76.7
0115,01,CASS LAKE-BENA PUBLIC SCHOOLS,2012,48.7,55.9
0116,01,PILLAGER PUBLIC SCHOOL DISTRICT,2012,58,83.3
0118,01,NORTHLAND COMMUNITY SCHOOLS,2012,56.1,75.7
0129,01,MONTEVIDEO PUBLIC SCHOOL DISTRICT,2012,56,77.1
0138,01,NORTH BRANCH PUBLIC SCHOOLS,2012,58.9,85.9
0139,01,RUSH CITY PUBLIC SCHOOL DISTRICT,2012,53.3,74.6
0146,01,BARNESVILLE PUBLIC SCHOOL DIST.,2012,58.7,84.1
0150,01,HAWLEY PUBLIC SCHOOL DISTRICT,2012,56.6,85.1
0152,01,MOORHEAD PUBLIC SCHOOL DISTRICT,2012,55.5,74.1
0160,70,MINNESOTA STATE ACADEMIES,2012,37.8,23.5
0162,01,BAGLEY PUBLIC SCHOOL DISTRICT,2012,55.8,79.4
0166,01,COOK COUNTY PUBLIC SCHOOLS,2012,60.4,90.9
0173,01,MOUNTAIN LAKE PUBLIC SCHOOLS,2012,53.8,73
0177,01,WINDOM PUBLIC SCHOOL DISTRICT,2012,56.4,74.6
0181,01,BRAINERD PUBLIC SCHOOL DISTRICT,2012,59.3,86.5
0182,01,CROSBY-IRONTON PUBLIC SCHOOL DIST.,2012,57.2,83.7
0186,01,PEQUOT LAKES PUBLIC SCHOOLS,2012,57.7,85.5
0191,01,BURNSVILLE PUBLIC SCHOOL DISTRICT,2012,55.4,77.5
0192,01,FARMINGTON PUBLIC SCHOOL DISTRICT,2012,56.2,82.9
0194,01,LAKEVILLE PUBLIC SCHOOL DISTRICT,2012,60.9,91.9
0195,01,RANDOLPH PUBLIC SCHOOL DISTRICT,2012,57.4,78.8
0196,01,ROSEMOUNT-APPLE VALLEY-EAGAN,2012,60.1,89.4
0197,01,WEST ST. PAUL-MENDOTA HTS.-EAGAN,2012,56.6,76.1
0199,01,INVER GROVE HEIGHTS SCHOOLS,2012,56.1,79.5
0200,01,HASTINGS PUBLIC SCHOOL DISTRICT,2012,58.3,88.2
0203,01,HAYFIELD PUBLIC SCHOOL DISTRICT,2012,55.9,78.6
0204,01,KASSON-MANTORVILLE SCHOOL DISTRICT,2012,60.1,96.3
0206,01,ALEXANDRIA PUBLIC SCHOOL DISTRICT,2012,59.2,87.5
0207,01,BRANDON PUBLIC SCHOOL DISTRICT,2012,54.9,77.8
0208,01,EVANSVILLE PUBLIC SCHOOL DISTRICT,2012,NA,NA
0213,01,OSAKIS PUBLIC SCHOOL DISTRICT,2012,58.6,80
0227,01,CHATFIELD PUBLIC SCHOOLS,2012,55,75.4
0229,01,LANESBORO PUBLIC SCHOOL DISTRICT,2012,60.1,100
0238,01,MABEL-CANTON PUBLIC SCHOOL DIST.,2012,57.4,93.3
0239,01,RUSHFORD-PETERSON PUBLIC SCHOOLS,2012,60.8,95
0241,01,ALBERT LEA PUBLIC SCHOOL DISTRICT,2012,54.8,76.4
0242,01,ALDEN-CONGER PUBLIC SCHOOL DISTRICT,2012,57.3,92.3
0252,01,CANNON FALLS PUBLIC SCHOOL DISTRICT,2012,56,82.8
0253,01,GOODHUE PUBLIC SCHOOL DISTRICT,2012,52.7,72
0255,01,PINE ISLAND PUBLIC SCHOOL DIST.,2012,60.7,87.3
0256,01,RED WING PUBLIC SCHOOL DISTRICT,2012,57,83.7
0261,01,ASHBY PUBLIC SCHOOL DISTRICT,2012,56.3,83.3
0264,01,HERMAN-NORCROSS SCHOOL DISTRICT,2012,NA,NA
0270,01,HOPKINS PUBLIC SCHOOL DISTRICT,2012,60,87.2
0271,01,BLOOMINGTON PUBLIC SCHOOL DISTRICT,2012,57.6,82.4
0272,01,EDEN PRAIRIE PUBLIC SCHOOL DISTRICT,2012,60.3,89.3
0273,01,EDINA PUBLIC SCHOOL DISTRICT,2012,64.4,96.6
0276,01,MINNETONKA PUBLIC SCHOOL DISTRICT,2012,62.6,95.7
0277,01,WESTONKA PUBLIC SCHOOL DISTRICT,2012,61.7,94.8
0278,01,ORONO PUBLIC SCHOOL DISTRICT,2012,63.4,97.9
0279,01,OSSEO PUBLIC SCHOOL DISTRICT,2012,57.3,83.2
0280,01,RICHFIELD PUBLIC SCHOOL DISTRICT,2012,51.3,60.9
0281,01,ROBBINSDALE PUBLIC SCHOOL DISTRICT,2012,54,72.8
0282,01,ST. ANTHONY-NEW BRIGHTON SCHOOLS,2012,60.9,89.9
0283,01,ST. LOUIS PARK PUBLIC SCHOOL DIST.,2012,58.6,84.5
0284,01,WAYZATA PUBLIC SCHOOL DISTRICT,2012,62.8,93.8
0286,01,BROOKLYN CENTER SCHOOL DISTRICT,2012,49.7,55.1
0287,06,INTERMEDIATE SCHOOL DISTRICT 287,2012,44.6,40.2
0294,01,HOUSTON PUBLIC SCHOOL DISTRICT,2012,55.5,75.6
0297,01,SPRING GROVE SCHOOL DISTRICT,2012,57.9,84.4
0299,01,CALEDONIA PUBLIC SCHOOL DISTRICT,2012,57.4,85.3
0300,01,LA CRESCENT-HOKAH SCHOOL DISTRICT,2012,58.3,84.9
0306,01,LAPORTE PUBLIC SCHOOL DISTRICT,2012,55.3,84.2
0308,01,NEVIS PUBLIC SCHOOL DISTRICT,2012,56.5,83.3
0309,01,PARK RAPIDS PUBLIC SCHOOL DISTRICT,2012,56.3,81.2
0314,01,BRAHAM PUBLIC SCHOOL DISTRICT,2012,56.3,76.4
0316,01,GREENWAY PUBLIC SCHOOL DISTRICT,2012,54.3,74.2
0317,01,DEER RIVER PUBLIC SCHOOL DISTRICT,2012,50.8,71
0318,01,GRAND RAPIDS PUBLIC SCHOOL DISTRICT,2012,55.5,79.1
0319,01,NASHWAUK-KEEWATIN SCHOOL DISTRICT,2012,52.5,68.4
0330,01,HERON LAKE-OKABENA SCHOOL DISTRICT,2012,54.6,80.6
0332,01,MORA PUBLIC SCHOOL DISTRICT,2012,56.1,78.3
0333,01,OGILVIE PUBLIC SCHOOL DISTRICT,2012,55.8,74.3
0345,01,NEW LONDON-SPICER SCHOOL DISTRICT,2012,55.8,80.5
0347,01,WILLMAR PUBLIC SCHOOL DISTRICT,2012,53.9,70.9
0356,01,LANCASTER PUBLIC SCHOOL DISTRICT,2012,59.7,90
0361,01,INTERNATIONAL FALLS SCHOOL DISTRICT,2012,56.3,82.2
0362,01,LITTLEFORK-BIG FALLS SCHOOL DIST.,2012,59.5,86.7
0363,01,SOUTH KOOCHICHING SCHOOL DISTRICT,2012,53.6,71.4
0378,01,DAWSON-BOYD PUBLIC SCHOOL DISTRICT,2012,59.6,91.9
0381,01,LAKE SUPERIOR PUBLIC SCHOOL DIST.,2012,55,73.9
0390,01,LAKE OF THE WOODS SCHOOL DISTRICT,2012,57,82.4
0391,01,CLEVELAND PUBLIC SCHOOL DISTRICT,2012,57.8,76.5
0392,01,LE CENTER PUBLIC SCHOOL DISTRICT,2012,57.1,84.1
0394,01,MONTGOMERY-LONSDALE SCHOOL DISTRICT,2012,55.9,80
0402,01,HENDRICKS PUBLIC SCHOOL DISTRICT,2012,NA,NA
0403,01,IVANHOE PUBLIC SCHOOL DISTRICT,2012,53.1,67.9
0413,01,MARSHALL PUBLIC SCHOOL DISTRICT,2012,55.7,77
0414,01,MINNEOTA PUBLIC SCHOOL DISTRICT,2012,58,84.6
0423,01,HUTCHINSON PUBLIC SCHOOL DISTRICT,2012,55.2,76.9
0424,01,LESTER PRAIRIE PUBLIC SCHOOL DIST.,2012,58,86.7
0432,01,MAHNOMEN PUBLIC SCHOOL DISTRICT,2012,56.3,79.6
0435,01,WAUBUN-OGEMA-WHITE EARTH PUBLIC SCH,2012,51.9,74.3
0441,01,MARSHALL COUNTY CENTRAL SCHOOLS,2012,54.7,69
0447,01,GRYGLA PUBLIC SCHOOL DISTRICT,2012,53.9,65
0458,01,TRUMAN PUBLIC SCHOOL DISTRICT,2012,55.5,75
0463,01,EDEN VALLEY-WATKINS SCHOOL DISTRICT,2012,57.2,89.3
0465,01,LITCHFIELD PUBLIC SCHOOL DISTRICT,2012,55.6,76.9
0466,01,DASSEL-COKATO PUBLIC SCHOOL DIST.,2012,57.5,85.2
0473,01,ISLE PUBLIC SCHOOL DISTRICT,2012,53.1,72.5
0477,01,PRINCETON PUBLIC SCHOOL DISTRICT,2012,55.7,82.5
0480,01,ONAMIA PUBLIC SCHOOL DISTRICT,2012,48.3,55.3
0482,01,LITTLE FALLS PUBLIC SCHOOL DISTRICT,2012,57.2,81.9
0484,01,PIERZ PUBLIC SCHOOL DISTRICT,2012,52.1,66.7
0485,01,ROYALTON PUBLIC SCHOOL DISTRICT,2012,57.1,84.4
0486,01,SWANVILLE PUBLIC SCHOOL DISTRICT,2012,51.8,64.5
0487,01,UPSALA PUBLIC SCHOOL DISTRICT,2012,57.6,77.8
0492,01,AUSTIN PUBLIC SCHOOL DISTRICT,2012,54.5,73.9
0495,01,GRAND MEADOW PUBLIC SCHOOL DISTRICT,2012,53,65
0497,01,LYLE PUBLIC SCHOOL DISTRICT,2012,NA,NA
0499,01,LEROY-OSTRANDER PUBLIC SCHOOLS,2012,55.8,82.6
0500,01,SOUTHLAND PUBLIC SCHOOL DISTRICT,2012,58.5,83.3
0505,01,FULDA PUBLIC SCHOOL DISTRICT,2012,61,100
0507,01,NICOLLET PUBLIC SCHOOL DISTRICT,2012,51.9,61.1
0508,01,ST. PETER PUBLIC SCHOOL DISTRICT,2012,59.5,87.3
0511,01,ADRIAN PUBLIC SCHOOL DISTRICT,2012,57.5,82.9
0514,01,ELLSWORTH PUBLIC SCHOOL DISTRICT,2012,56.2,88.2
0516,01,ROUND LAKE PUBLIC SCHOOL DISTRICT,2012,NA,NA
0518,01,WORTHINGTON PUBLIC SCHOOL DISTRICT,2012,49.9,62.4
0531,01,BYRON PUBLIC SCHOOL DISTRICT,2012,60.9,91.7
0533,01,DOVER-EYOTA PUBLIC SCHOOL DISTRICT,2012,56.6,84.4
0534,01,STEWARTVILLE PUBLIC SCHOOL DISTRICT,2012,57.4,84.1
0535,01,ROCHESTER PUBLIC SCHOOL DISTRICT,2012,57.8,81.1
0542,01,BATTLE LAKE PUBLIC SCHOOL DISTRICT,2012,59.6,90
0544,01,FERGUS FALLS PUBLIC SCHOOL DISTRICT,2012,54.9,73.4
0545,01,HENNING PUBLIC SCHOOL DISTRICT,2012,60.2,94.4
0547,01,PARKERS PRAIRIE PUBLIC SCHOOL DIST.,2012,57.9,84.6
0548,01,PELICAN RAPIDS PUBLIC SCHOOL DIST.,2012,52.1,66.7
0549,01,PERHAM-DENT PUBLIC SCHOOL DISTRICT,2012,58.7,87.9
0550,01,UNDERWOOD PUBLIC SCHOOL DISTRICT,2012,59.1,81.4
0553,01,NEW YORK MILLS PUBLIC SCHOOL DIST.,2012,57,80
0561,01,GOODRIDGE PUBLIC SCHOOL DISTRICT,2012,NA,NA
0564,01,THIEF RIVER FALLS SCHOOL DISTRICT,2012,54.8,73.8
0577,01,WILLOW RIVER PUBLIC SCHOOL DISTRICT,2012,52.9,74.4
0578,01,PINE CITY PUBLIC SCHOOL DISTRICT,2012,57.6,78.3
0581,01,EDGERTON PUBLIC SCHOOL DISTRICT,2012,56.8,85.7
0592,01,CLIMAX-SHELLY PUBLIC SCHOOLS,2012,NA,NA
0593,01,CROOKSTON PUBLIC SCHOOL DISTRICT,2012,50.6,61.1
0595,01,EAST GRAND FORKS PUBLIC SCHOOL DIST,2012,55.5,84.2
0599,01,FERTILE-BELTRAMI SCHOOL DISTRICT,2012,53.6,73.3
0600,01,FISHER PUBLIC SCHOOL DISTRICT,2012,58,86.4
0601,01,FOSSTON PUBLIC SCHOOL DISTRICT,2012,59.7,92
0621,01,MOUNDS VIEW PUBLIC SCHOOL DISTRICT,2012,60.9,89.9
0622,01,NORTH ST PAUL-MAPLEWOOD SCHOOL DIST,2012,54.3,76.2
0623,01,ROSEVILLE PUBLIC SCHOOL DISTRICT,2012,56.8,78.4
0624,01,WHITE BEAR LAKE SCHOOL DISTRICT,2012,58,82.4
0625,01,ST. PAUL PUBLIC SCHOOL DISTRICT,2012,49.8,60.8
0627,01,OKLEE PUBLIC SCHOOL DISTRICT,2012,54.4,81
0630,01,RED LAKE FALLS PUBLIC SCHOOL DIST.,2012,57.5,89.3
0640,01,WABASSO PUBLIC SCHOOL DISTRICT,2012,57.7,89.5
0656,01,FARIBAULT PUBLIC SCHOOL DISTRICT,2012,53.1,70.4
0659,01,NORTHFIELD PUBLIC SCHOOL DISTRICT,2012,59.2,82.6
0671,01,HILLS-BEAVER CREEK SCHOOL DISTRICT,2012,54,86.4
0676,01,BADGER PUBLIC SCHOOL DISTRICT,2012,59,82.4
0682,01,ROSEAU PUBLIC SCHOOL DISTRICT,2012,56,84.4
0690,01,WARROAD PUBLIC SCHOOL DISTRICT,2012,54.9,80.5
0695,01,CHISHOLM PUBLIC SCHOOL DISTRICT,2012,55,76.2
0696,01,ELY PUBLIC SCHOOL DISTRICT,2012,53,74.4
0698,01,FLOODWOOD PUBLIC SCHOOL DISTRICT,2012,54.1,68.2
0700,01,HERMANTOWN PUBLIC SCHOOL DISTRICT,2012,57.4,83.2
0701,01,HIBBING PUBLIC SCHOOL DISTRICT,2012,56.9,79.9
0704,01,PROCTOR PUBLIC SCHOOL DISTRICT,2012,55.9,80.3
0706,01,VIRGINIA PUBLIC SCHOOL DISTRICT,2012,58.5,91.3
0709,01,DULUTH PUBLIC SCHOOL DISTRICT,2012,56.8,80.2
0712,01,MOUNTAIN IRON-BUHL SCHOOL DISTRICT,2012,55.8,80
0716,01,BELLE PLAINE PUBLIC SCHOOL DISTRICT,2012,54.1,75
0717,01,JORDAN PUBLIC SCHOOL DISTRICT,2012,58,85.7
0719,01,PRIOR LAKE-SAVAGE AREA SCHOOLS,2012,58.5,87.2
0720,01,SHAKOPEE PUBLIC SCHOOL DISTRICT,2012,55.9,77.8
0721,01,NEW PRAGUE AREA SCHOOLS,2012,59,86.7
0726,01,BECKER PUBLIC SCHOOL DISTRICT,2012,57.5,85.3
0727,01,BIG LAKE PUBLIC SCHOOL DISTRICT,2012,57,83.6
0728,01,ELK RIVER PUBLIC SCHOOL DISTRICT,2012,58,87.2
0738,01,HOLDINGFORD PUBLIC SCHOOL DISTRICT,2012,61.1,91.9
0739,01,KIMBALL PUBLIC SCHOOL DISTRICT,2012,56.2,82.6
0740,01,MELROSE PUBLIC SCHOOL DISTRICT,2012,57,83.2
0741,01,PAYNESVILLE PUBLIC SCHOOL DISTRICT,2012,58.2,88.6
0742,01,ST. CLOUD PUBLIC SCHOOL DISTRICT,2012,53,69.7
0743,01,SAUK CENTRE PUBLIC SCHOOL DISTRICT,2012,59.1,85.7
0745,01,ALBANY PUBLIC SCHOOL DISTRICT,2012,58.4,92.3
0748,01,SARTELL-ST. STEPHEN SCHOOL DISTRICT,2012,59.9,88.3
0750,01,ROCORI PUBLIC SCHOOL DISTRICT,2012,58.3,92.3
0756,01,BLOOMING PRAIRIE PUBLIC SCHOOL DIST,2012,57,90.9
0761,01,OWATONNA PUBLIC SCHOOL DISTRICT,2012,57.4,83.8
0763,01,MEDFORD PUBLIC SCHOOL DISTRICT,2012,59.2,77.4
0768,01,HANCOCK PUBLIC SCHOOL DISTRICT,2012,57.6,93.8
0769,01,MORRIS PUBLIC SCHOOL DISTRICT,2012,59.7,93.8
0771,01,CHOKIO-ALBERTA PUBLIC SCHOOL DIST.,2012,57.8,80
0775,01,KERKHOVEN-MURDOCK-SUNBURG,2012,56.5,85.4
0777,01,BENSON PUBLIC SCHOOL DISTRICT,2012,56.7,79.7
0786,01,BERTHA-HEWITT PUBLIC SCHOOL DIST.,2012,54.6,76.5
0787,01,BROWERVILLE PUBLIC SCHOOL DISTRICT,2012,60.3,88.2
0803,01,WHEATON AREA PUBLIC SCHOOL DISTRICT,2012,57.2,83.3
0811,01,WABASHA-KELLOGG PUBLIC SCHOOL DIST.,2012,55.4,81.3
0813,01,LAKE CITY PUBLIC SCHOOL DISTRICT,2012,58.8,95.2
0818,01,VERNDALE PUBLIC SCHOOL DISTRICT,2012,53,85.7
0820,01,SEBEKA PUBLIC SCHOOL DISTRICT,2012,59.7,90.9
0821,01,MENAHGA PUBLIC SCHOOL DISTRICT,2012,57.3,82
0829,01,WASECA PUBLIC SCHOOL DISTRICT,2012,57,84.4
0831,01,FOREST LAKE PUBLIC SCHOOL DISTRICT,2012,57.3,87.5
0832,01,MAHTOMEDI PUBLIC SCHOOL DISTRICT,2012,62.7,97.3
0833,01,SOUTH WASHINGTON COUNTY SCHOOL DIST,2012,60.3,90.2
0834,01,STILLWATER AREA PUBLIC SCHOOL DIST.,2012,60.9,91.9
0836,01,BUTTERFIELD PUBLIC SCHOOL DISTRICT,2012,53.3,73.3
0837,01,MADELIA PUBLIC SCHOOL DISTRICT,2012,50.8,61.8
0840,01,ST. JAMES PUBLIC SCHOOL DISTRICT,2012,51.9,64.6
0846,01,BRECKENRIDGE PUBLIC SCHOOL DISTRICT,2012,54.6,73.1
0850,01,ROTHSAY PUBLIC SCHOOL DISTRICT,2012,65.3,90
0852,01,CAMPBELL-TINTAH PUBLIC SCHOOL DIST.,2012,NA,NA
0857,01,LEWISTON-ALTURA PUBLIC SCHOOL DIST.,2012,53.7,70.1
0858,01,ST. CHARLES PUBLIC SCHOOL DISTRICT,2012,59.7,88.9
0861,01,WINONA AREA PUBLIC SCHOOL DISTRICT,2012,55.9,77.4
0876,01,ANNANDALE PUBLIC SCHOOL DISTRICT,2012,59.2,92.4
0877,01,BUFFALO-HANOVER-MONTROSE PUBLIC SCH,2012,58.5,88.3
0879,01,DELANO PUBLIC SCHOOL DISTRICT,2012,59.5,89.4
0881,01,MAPLE LAKE PUBLIC SCHOOL DISTRICT,2012,59,89.4
0882,01,MONTICELLO PUBLIC SCHOOL DISTRICT,2012,57.7,86.8
0883,01,ROCKFORD PUBLIC SCHOOL DISTRICT,2012,56.2,82.7
0885,01,ST. MICHAEL-ALBERTVILLE SCHOOL DIST,2012,58.8,88.7
0891,01,CANBY PUBLIC SCHOOL DISTRICT,2012,54.8,76.1
0911,01,CAMBRIDGE-ISANTI PUBLIC SCHOOL DIST,2012,57.3,81.5
0912,01,MILACA PUBLIC SCHOOL DISTRICT,2012,56.2,82.9
0914,01,ULEN-HITTERDAL PUBLIC SCHOOL DIST,2012,53,87.5
0915,52,SOUTHERN PLAINS EDUCATION COOP.,2012,38.8,10
0916,06,NORTHEAST METRO 916,2012,42,29.4
0917,06,INTERMEDIATE SCHOOL DISTRICT 917,2012,46.9,41.2
0926,83,REGION 4-LAKES COUNTRY SERVICE COOP,2012,NA,NA
0930,53,CARVER-SCOTT EDUCATIONAL COOP.,2012,45,33.3
0938,52,MEEKER AND WRIGHT SPECIAL EDUCATION,2012,NA,NA
0957,51,OAK LAND VOCATIONAL COOPERATVE,2012,46.1,44.4
0966,51,WRIGHT TECHNICAL CENTER,2012,46.1,44.4
0991,83,REGN 6 AND 8-SW/WC SRV COOPERATIVE,2012,45.4,42.9
0993,52,MN RIVER VALLEY SPECIAL ED. COOP.,2012,42.9,23.5
2071,01,LAKE CRYSTAL-WELLCOME MEMORIAL,2012,57.7,88
2125,01,TRITON SCHOOL DISTRICT,2012,57.7,76.7
2134,01,UNITED SOUTH CENTRAL SCHOOL DIST.,2012,56.9,80.8
2135,01,MAPLE RIVER SCHOOL DISTRICT,2012,57.9,87.3
2137,01,KINGSLAND PUBLIC SCHOOL DISTRICT,2012,56.4,84
2142,01,ST. LOUIS COUNTY SCHOOL DISTRICT,2012,54,72.8
2143,01,WATERVILLE-ELYSIAN-MORRISTOWN,2012,55.5,78.7
2144,01,CHISAGO LAKES SCHOOL DISTRICT,2012,59.1,87.3
2149,01,MINNEWASKA SCHOOL DISTRICT,2012,57.4,84.8
2154,01,EVELETH-GILBERT SCHOOL DISTRICT,2012,57.4,88.3
2155,01,WADENA-DEER CREEK SCHOOL DISTRICT,2012,57.5,80.9
2159,01,BUFFALO LK-HECTOR-STEWART PUBLIC SC,2012,54.6,78.9
2164,01,DILWORTH-GLYNDON-FELTON,2012,58.8,86.4
2165,01,HINCKLEY-FINLAYSON SCHOOL DISTRICT,2012,54.3,77.8
2167,01,LAKEVIEW SCHOOL DISTRICT,2012,56.8,82.9
2168,01,NRHEG SCHOOL DISTRICT,2012,56.2,82.3
2169,01,MURRAY COUNTY CENTRAL SCHOOL DIST.,2012,59.2,84.4
2170,01,STAPLES-MOTLEY SCHOOL DISTRICT,2012,54.6,78.2
2171,01,KITTSON CENTRAL SCHOOL DISTRICT,2012,58.1,90.5
2172,01,KENYON-WANAMINGO SCHOOL DISTRICT,2012,57.7,89.3
2174,01,PINE RIVER-BACKUS SCHOOL DISTRICT,2012,55.2,81
2176,01,WARREN-ALVARADO-OSLO SCHOOL DIST.,2012,61.5,100
2180,01,M.A.C.C.R.A.Y. SCHOOL DISTRICT,2012,56,67.3
2184,01,LUVERNE PUBLIC SCHOOL DISTRICT,2012,57.8,91.1
2190,01,YELLOW MEDICINE EAST,2012,55.8,78.8
2198,01,FILLMORE CENTRAL,2012,57.9,92.3
2215,01,NORMAN COUNTY EAST SCHOOL DISTRICT,2012,58.6,78.3
2310,01,SIBLEY EAST SCHOOL DISTRICT,2012,56,82.3
2311,01,CLEARBROOK-GONVICK SCHOOL DISTRICT,2012,48.1,42.9
2342,01,WEST CENTRAL AREA,2012,60.4,94.8
2358,01,TRI-COUNTY SCHOOL DISTRICT,2012,56.4,83.3
2364,01,BELGRADE-BROOTEN-ELROSA SCHOOL DIST,2012,57,88.9
2365,01,G.F.W.,2012,55.9,78.3
2396,01,A.C.G.C.,2012,56.9,85.4
2397,01,LE SUEUR-HENDERSON SCHOOL DISTRICT,2012,54.7,78.1
2448,01,MARTIN COUNTY WEST SCHOOL DISTRICT,2012,55.1,69.4
2527,01,NORMAN COUNTY WEST SCHOOL DISTRICT,2012,59.7,93.3
2534,01,BIRD ISLAND-OLIVIA-LAKE LILLIAN,2012,56.4,86.4
2536,01,GRANADA HUNTLEY-EAST CHAIN,2012,54.1,86.4
2580,01,EAST CENTRAL SCHOOL DISTRICT,2012,54.5,81.4
2609,01,WIN-E-MAC SCHOOL DISTRICT,2012,55.9,86.4
2683,01,GREENBUSH-MIDDLE RIVER SCHOOL DIST.,2012,60.2,90.6
2687,01,HOWARD LAKE-WAVERLY-WINSTED,2012,55.9,78.6
2689,01,PIPESTONE AREA SCHOOL DISTRICT,2012,55.7,81
2711,01,MESABI EAST SCHOOL DISTRICT,2012,58.3,84.2
2752,01,FAIRMONT AREA SCHOOL DISTRICT,2012,57.7,82.4
2753,01,LONG PRAIRIE-GREY EAGLE SCHOOL DIST,2012,55.1,73.1
2754,01,CEDAR MOUNTAIN SCHOOL DISTRICT,2012,56.3,83.8
2759,01,EAGLE VALLEY PUBLIC SCHOOL DISTRICT,2012,45.8,41.7
2805,01,ZUMBROTA-MAZEPPA SCHOOL DISTRICT,2012,60.5,92
2835,01,JANESVILLE-WALDORF-PEMBERTON,2012,57.5,87.2
2853,01,LAC QUI PARLE VALLEY SCHOOL DIST.,2012,55.2,67.5
2854,01,ADA-BORUP PUBLIC SCHOOL DISTRICT,2012,55.9,80.4
2856,01,STEPHEN-ARGYLE CENTRAL SCHOOLS,2012,62.6,86.2
2859,01,GLENCOE-SILVER LAKE SCHOOL DISTRICT,2012,58.1,83.6
2860,01,BLUE EARTH AREA PUBLIC SCHOOL,2012,59.1,86.4
2884,01,RED ROCK CENTRAL SCHOOL DISTRICT,2012,59.7,100
2886,01,GLENVILLE-EMMONS SCHOOL DISTRICT,2012,50.3,58.3
2888,01,CLINTON-GRACEVILLE-BEARDSLEY,2012,57.9,87.9
2889,01,LAKE PARK AUDUBON SCHOOL DISTRICT,2012,57.7,81
2890,01,RENVILLE COUNTY WEST SCHOOL DIST.,2012,54.3,71.4
2895,01,JACKSON COUNTY CENTRAL SCHOOL DIST.,2012,55.4,79.1
2897,01,REDWOOD AREA SCHOOL DISTRICT,2012,57.9,84.7
2898,01,WESTBROOK-WALNUT GROVE SCHOOLS,2012,48.8,57.1
2899,01,PLAINVIEW-ELGIN-MILLVILLE,2012,57.6,85
2902,01,RTR PUBLIC SCHOOLS,2012,58.6,90.2
2903,01,ORTONVILLE PUBLIC SCHOOLS,2012,58.2,84
2904,01,TRACY AREA PUBLIC SCHOOL DISTRICT,2012,54.6,75
4000,07,CITY ACADEMY,2012,NA,NA
4003,07,"NEW HEIGHTS SCHOOL, INC.",2012,49.1,43.8
4005,07,METRO DEAF SCHOOL,2012,NA,NA
4007,07,MINNESOTA NEW COUNTRY SCHOOL,2012,51.8,64.7
4008,07,PACT CHARTER SCHOOL,2012,56.8,77.6
4015,07,COMMUNITY OF PEACE ACADEMY,2012,50,50.8
4017,07,MINNESOTA TRANSITIONS CHARTER SCH,2012,52.4,65.6
4025,07,CYBER VILLAGE ACADEMY,2012,NA,NA
4026,07,E.C.H.O. CHARTER SCHOOL,2012,52,72.7
4027,07,HIGHER GROUND ACADEMY,2012,52.6,68
4031,07,JENNINGS COMMUNITY LEARNING CENTER,2012,NA,NA
4036,07,FACE TO FACE ACADEMY,2012,52.2,83.3
4039,07,HIGH SCHOOL FOR RECORDING ARTS,2012,41.7,35.3
4043,07,MATH AND SCIENCE ACADEMY,2012,63.5,100
4045,07,LAKES AREA CHARTER SCHOOL,2012,46.6,33.3
4049,07,NORTHWEST PASSAGE HIGH SCHOOL,2012,50.9,52.9
4052,07,FOUR DIRECTIONS CHARTER SCHOOLS,2012,NA,NA
4053,07,NORTH LAKES ACADEMY,2012,57.1,81.6
4056,07,ROCHESTER OFF-CAMPUS CHARTER HIGH,2012,47.6,54.5
4057,07,EL COLEGIO CHARTER SCHOOL,2012,43.8,9.1
4064,07,RIVERWAY LEARNING COMMUNITY CHTR,2012,NA,NA
4066,07,RIVERBEND ACADEMY,2012,NA,NA
4074,07,AFSA HIGH SCHOOL,2012,53.8,68
4075,07,AVALON SCHOOL,2012,59.4,86.8
4080,07,PILLAGER AREA CHARTER SCHOOL,2012,NA,NA
4081,07,DISCOVERY PUBLIC SCHOOL FARIBAULT,2012,47.2,50
4082,07,BLUESKY CHARTER SCHOOL,2012,48.9,50.7
4085,07,HARBOR CITY INTERNATIONAL CHARTER,2012,58.9,80.4
4087,07,SAGE ACADEMY CHARTER SCHOOL,2012,46.9,36.8
4091,07,ARTECH,2012,58.1,93.8
4092,07,WATERSHED HIGH SCHOOL,2012,49.5,45.5
4093,07,NEW CENTURY CHARTER SCHOOL,2012,59.6,92.9
4095,07,TRIO WOLF CREEK DISTANCE LEARNING,2012,53.8,81.8
4098,07,NOVA CLASSICAL ACADEMY,2012,69.3,100
4102,07,MINNESOTA INTERNSHIP CENTER,2012,39.6,6.3
4103,07,HMONG COLLEGE PREP ACADEMY,2012,45.3,42.1
4104,07,PALADIN ACADEMY,2012,48.2,36.4
4105,07,GREAT RIVER SCHOOL,2012,62.4,93.5
4106,07,TREKNORTH HIGH SCHOOL,2012,63.5,92.3
4107,07,VOYAGEURS EXPEDITIONARY,2012,47.1,27.3
4109,07,SOBRIETY HIGH,2012,46.2,50
4110,07,MAIN STREET SCHOOL PERFORMING ARTS,2012,57.2,84.3
4111,07,AUGSBURG FAIRVIEW ACADEMY,2012,NA,NA
4112,07,ST PAUL CONSERVATORY PERFORMING ART,2012,60,91
4119,07,ACADEMIC ARTS HIGH SCHOOL,2012,44.8,38.1
4120,07,ST. CROIX PREPARATORY ACADEMY,2012,63.8,94.6
4121,07,UBAH MEDICAL ACADEMY CHARTER SCHOOL,2012,49.1,51.9
4122,07,EAGLE RIDGE ACADEMY CHARTER SCHOOL,2012,63.1,97.8
4126,07,PRAIRIE SEEDS ACADEMY,2012,49.3,57.8
4131,07,LIGHTHOUSE ACADEMY OF NATIONS,2012,37.3,26.1
4132,07,TWIN CITIES ACADEMY HIGH SCHOOL,2012,59,86
4146,07,NORTHERN LIGHTS COMMUNITY SCHOOL,2012,44.1,42.3
4150,07,MINNESOTA ONLINE HIGH SCHOOL,2012,50,57.1
4151,07,EDVISIONS OFF CAMPUS SCHOOL,2012,54.2,71.4
4160,07,SPECTRUM HIGH SCHOOL,2012,60.5,90.3
4163,07,LEARNING FOR LEADERSHIP CHARTER,2012,47.8,46.2
4166,07,EAST RANGE ACADEMY OF TECH-SCIENCE,2012,47.2,51.7
4173,07,METRO TECH ACADEMY,2012,46.4,53.8
4177,07,MINISINAAKWAANG LEADERSHIP ACADEMY,2012,NA,NA
4178,07,LINCOLN INTERNATIONAL SCHOOL,2012,31.3,0
4182,07,QUEST ACADEMY,2012,NA,NA
4183,07,LIONSGATE ACADEMY,2012,46.4,55
4190,07,RIVER'S EDGE ACADEMY,2012,53.5,84.6
4200,07,STEP ACADEMY CHARTER SCHOOL,2012,47.9,58.3
4204,07,ROCHESTER STEM ACADEMY,2012,48.9,60.9
6004,61,FRESHWATER ED. DIST.,2012,41.9,31.6
6012,61,ZUMBRO EDUCATION DISTRICT,2012,44.7,34.5
6013,61,HIAWATHA VALLEY ED. DISTRICT,2012,49.5,60
6014,61,RUNESTONE AREA ED. DISTRICT,2012,53.2,80
6018,61,MN RIVER VALLEY EDUCATION DISTRICT,2012,47.2,46.2
6026,61,WEST CENTRAL EDUCATION DISTRICT,2012,NA,NA
6027,61,MN VALLEY EDUCATION DISTRICT,2012,NA,NA
6049,61,RIVER BEND EDUCATION DISTRICT,2012,48.1,36.8
6051,61,GOODHUE COUNTY EDUCATION  DIST.,2012,NA,NA
6065,62,METROPOLITAN LEARNING ALLIANCE,2012,44.3,50
6067,62,EAST METRO INTEGRATION DISTRICT,2012,55,71
6069,62,WEST METRO EDUCATION PROGRAM,2012,57.6,77.8
6076,50,NORTHLAND LEARNING CENTER,2012,38.6,21.4
6079,52,RUM RIVER SPECIAL EDUCATION COOP,2012,NA,NA
6383,61,BENTON-STEARNS ED. DISTRICT,2012,NA,NA
6979,61,MID STATE EDUCATION DISTRICT,2012,NA,NA
0001,01,AITKIN PUBLIC SCHOOL DISTRICT,2011,57,83
0001,03,MINNEAPOLIS PUBLIC SCHOOL DIST.,2011,51.1,58.1
0002,01,HILL CITY PUBLIC SCHOOL DISTRICT,2011,50.2,63.6
0004,01,MCGREGOR PUBLIC SCHOOL DISTRICT,2011,52,62.5
0006,03,SOUTH ST. PAUL PUBLIC SCHOOL DIST.,2011,55,77
0011,01,ANOKA-HENNEPIN PUBLIC SCHOOL DIST.,2011,57.2,82.7
0012,01,CENTENNIAL PUBLIC SCHOOL DISTRICT,2011,57.9,85.7
0013,01,COLUMBIA HEIGHTS PUBLIC SCHOOL DIST,2011,49.9,55
0014,01,FRIDLEY PUBLIC SCHOOL DISTRICT,2011,54.2,69.8
0015,01,ST. FRANCIS PUBLIC SCHOOL DISTRICT,2011,55.8,81.6
0016,01,SPRING LAKE PARK PUBLIC SCHOOLS,2011,53.3,71.2
0022,01,DETROIT LAKES PUBLIC SCHOOL DIST.,2011,55.8,77.5
0023,01,FRAZEE-VERGAS PUBLIC SCHOOL DIST.,2011,57.5,77.2
0031,01,BEMIDJI PUBLIC SCHOOL DISTRICT,2011,55.3,76.6
0032,01,BLACKDUCK PUBLIC SCHOOL DISTRICT,2011,57,81
0036,01,KELLIHER PUBLIC SCHOOL DISTRICT,2011,56.4,75
0038,01,RED LAKE PUBLIC SCHOOL DISTRICT,2011,41.8,29.9
0047,01,SAUK RAPIDS-RICE PUBLIC SCHOOLS,2011,56.7,79.3
0051,01,FOLEY PUBLIC SCHOOL DISTRICT,2011,56.3,78.6
0075,01,ST. CLAIR PUBLIC SCHOOL DISTRICT,2011,57.8,95.7
0077,01,MANKATO PUBLIC SCHOOL DISTRICT,2011,57.2,83.2
0081,01,COMFREY PUBLIC SCHOOL DISTRICT,2011,NA,NA
0084,01,SLEEPY EYE PUBLIC SCHOOL DISTRICT,2011,52.2,58.5
0085,01,SPRINGFIELD PUBLIC SCHOOL DISTRICT,2011,55.5,72.2
0088,01,NEW ULM PUBLIC SCHOOL DISTRICT,2011,57.1,82.2
0091,01,BARNUM PUBLIC SCHOOL DISTRICT,2011,58.7,78.7
0093,01,CARLTON PUBLIC SCHOOL DISTRICT,2011,57.9,86
0094,01,CLOQUET PUBLIC SCHOOL DISTRICT,2011,58.1,84.5
0095,01,CROMWELL-WRIGHT PUBLIC SCHOOLS,2011,59.4,95.2
0097,01,MOOSE LAKE PUBLIC SCHOOL DISTRICT,2011,57.4,85.7
0099,01,ESKO PUBLIC SCHOOL DISTRICT,2011,60.9,86.7
0100,01,WRENSHALL PUBLIC SCHOOL DISTRICT,2011,51.1,65.4
0108,01,CENTRAL PUBLIC SCHOOL DISTRICT,2011,57.8,85.2
0110,01,WACONIA PUBLIC SCHOOL DISTRICT,2011,57.3,85.3
0111,01,WATERTOWN-MAYER PUBLIC SCHOOL DIST.,2011,58.5,87.2
0112,01,EASTERN CARVER COUNTY PUBLIC SCHOOL,2011,60.9,90.1
0113,01,WALKER-HACKENSACK-AKELEY SCHL. DIST,2011,56.9,81.4
0115,01,CASS LAKE-BENA PUBLIC SCHOOLS,2011,47.5,52.5
0116,01,PILLAGER PUBLIC SCHOOL DISTRICT,2011,57.3,82.1
0118,01,NORTHLAND COMMUNITY SCHOOLS,2011,51.4,71.9
0129,01,MONTEVIDEO PUBLIC SCHOOL DISTRICT,2011,55.9,75.2
0138,01,NORTH BRANCH PUBLIC SCHOOLS,2011,58.3,84.6
0139,01,RUSH CITY PUBLIC SCHOOL DISTRICT,2011,55.3,76.8
0146,01,BARNESVILLE PUBLIC SCHOOL DIST.,2011,55,82.1
0150,01,HAWLEY PUBLIC SCHOOL DISTRICT,2011,56.6,88.7
0152,01,MOORHEAD PUBLIC SCHOOL DISTRICT,2011,55.4,74.9
0160,70,MINNESOTA STATE ACADEMIES,2011,41.6,37.5
0162,01,BAGLEY PUBLIC SCHOOL DISTRICT,2011,54.1,75.4
0166,01,COOK COUNTY PUBLIC SCHOOLS,2011,60.8,90.9
0173,01,MOUNTAIN LAKE PUBLIC SCHOOLS,2011,54.6,80.6
0177,01,WINDOM PUBLIC SCHOOL DISTRICT,2011,52.5,64.9
0181,01,BRAINERD PUBLIC SCHOOL DISTRICT,2011,59.2,86.7
0182,01,CROSBY-IRONTON PUBLIC SCHOOL DIST.,2011,58.8,87.5
0186,01,PEQUOT LAKES PUBLIC SCHOOLS,2011,57.5,82.1
0191,01,BURNSVILLE PUBLIC SCHOOL DISTRICT,2011,57.4,81.1
0192,01,FARMINGTON PUBLIC SCHOOL DISTRICT,2011,57.2,85.4
0194,01,LAKEVILLE PUBLIC SCHOOL DISTRICT,2011,59.4,89.6
0195,01,RANDOLPH PUBLIC SCHOOL DISTRICT,2011,55.9,78.8
0196,01,ROSEMOUNT-APPLE VALLEY-EAGAN,2011,59.3,86.2
0197,01,WEST ST. PAUL-MENDOTA HTS.-EAGAN,2011,56,76
0199,01,INVER GROVE HEIGHTS SCHOOLS,2011,56.2,75.7
0200,01,HASTINGS PUBLIC SCHOOL DISTRICT,2011,57.5,84.3
0203,01,HAYFIELD PUBLIC SCHOOL DISTRICT,2011,54.8,83.3
0204,01,KASSON-MANTORVILLE SCHOOL DISTRICT,2011,59.2,90.4
0206,01,ALEXANDRIA PUBLIC SCHOOL DISTRICT,2011,59.4,87.6
0207,01,BRANDON PUBLIC SCHOOL DISTRICT,2011,57.4,78.9
0208,01,EVANSVILLE PUBLIC SCHOOL DISTRICT,2011,51.4,62.5
