districtNumber,districtType,districtName,year,gradRate
0001,01,AITKIN PUBLIC SCHOOL DISTRICT,2012,72.785
0001,03,MINNEAPOLIS PUBLIC SCHOOL DISTRICT,2012,44.25
0002,01,HILL CITY PUBLIC SCHOOL DISTRICT,2012,87.615
0004,01,MCGREGOR PUBLIC SCHOOL DISTRICT,2012,60.608333333333334
0006,03,SOUTH ST. PAUL PUBLIC SCHOOL DIST.,2012,63.84777777777778
0011,01,ANOKA-HENNEPIN PUBLIC SCHOOL DISTRICT,2012,62.63461538461539
0012,01,CENTENNIAL PUBLIC SCHOOL DISTRICT,2012,92.36
0013,01,COLUMBIA HEIGHTS PUBLIC SCHOOL DIST,2012,74.28090909090909
0014,01,FRIDLEY PUBLIC SCHOOL DISTRICT,2012,71.16
0015,01,ST. FRANCIS PUBLIC SCHOOL DISTRICT,2012,83.25285714285714
0016,01,SPRING LAKE PARK PUBLIC SCHOOLS,2012,70.36636363636363
0022,01,DETROIT LAKES PUBLIC SCHOOL DIST.,2012,74.94714285714286
0023,01,FRAZEE-VERGAS PUBLIC SCHOOL DIST.,2012,86.67833333333333
0031,01,BEMIDJI PUBLIC SCHOOL DISTRICT,2012,62.621249999999996
0032,01,BLACKDUCK PUBLIC SCHOOL DISTRICT,2012,94.152
0036,01,KELLIHER PUBLIC SCHOOL DISTRICT,2012,76.68
0038,01,RED LAKE PUBLIC SCHOOL DISTRICT,2012,22.943333333333335
0047,01,SAUK RAPIDS-RICE PUBLIC SCHOOLS,2012,87.80166666666666
0051,01,FOLEY PUBLIC SCHOOL DISTRICT,2012,93.08
0075,01,ST. CLAIR PUBLIC SCHOOL DISTRICT,2012,94.185
0077,01,MANKATO PUBLIC SCHOOL DISTRICT,2012,73.36363636363636
0081,01,COMFREY PUBLIC SCHOOL DISTRICT,2012,83.80666666666666
0084,01,SLEEPY EYE PUBLIC SCHOOL DISTRICT,2012,95.65
0085,01,SPRINGFIELD PUBLIC SCHOOL DISTRICT,2012,96.924
0088,01,NEW ULM PUBLIC SCHOOL DISTRICT,2012,86.48833333333333
0091,01,BARNUM PUBLIC SCHOOL DISTRICT,2012,90.08833333333334
0093,01,CARLTON PUBLIC SCHOOL DISTRICT,2012,77.148
0094,01,CLOQUET PUBLIC SCHOOL DISTRICT,2012,71.465
0095,01,CROMWELL-WRIGHT PUBLIC SCHOOLS,2012,88.6625
0097,01,MOOSE LAKE PUBLIC SCHOOL DISTRICT,2012,88.238
0099,01,ESKO PUBLIC SCHOOL DISTRICT,2012,97.57666666666667
0100,01,WRENSHALL PUBLIC SCHOOL DISTRICT,2012,65.2875
0108,01,CENTRAL PUBLIC SCHOOL DISTRICT,2012,89.47166666666666
0110,01,WACONIA PUBLIC SCHOOL DISTRICT,2012,89.66142857142857
0111,01,WATERTOWN-MAYER PUBLIC SCHOOL DIST.,2012,91.402
0112,01,EASTERN CARVER COUNTY PUBLIC SCHOOL,2012,80.08500000000001
0113,01,WALKER-HACKENSACK-AKELEY SCHL. DIST,2012,70.57833333333333
0115,01,CASS LAKE-BENA PUBLIC SCHOOLS,2012,47.794285714285714
0116,01,PILLAGER PUBLIC SCHOOL DISTRICT,2012,97.906
0118,01,NORTHLAND COMMUNITY SCHOOLS,2012,94.98
0129,01,MONTEVIDEO PUBLIC SCHOOL DISTRICT,2012,97.624
0138,01,NORTH BRANCH PUBLIC SCHOOLS,2012,74.18
0139,01,RUSH CITY PUBLIC SCHOOL DISTRICT,2012,92.54
0146,01,BARNESVILLE PUBLIC SCHOOL DISTRICT,2012,95.47800000000001
0150,01,HAWLEY PUBLIC SCHOOL DISTRICT,2012,86.71833333333333
0152,01,MOORHEAD PUBLIC SCHOOL DISTRICT,2012,62.684444444444445
0160,70,MINNESOTA STATE ACADEMIES,2012,62.065
0162,01,BAGLEY PUBLIC SCHOOL DISTRICT,2012,70.27142857142857
0166,01,COOK COUNTY PUBLIC SCHOOLS,2012,78.826
0173,01,MOUNTAIN LAKE PUBLIC SCHOOLS,2012,86.50999999999999
0177,01,WINDOM PUBLIC SCHOOL DISTRICT,2012,92.88166666666666
0181,01,BRAINERD PUBLIC SCHOOL DISTRICT,2012,74.83833333333334
0182,01,CROSBY-IRONTON PUBLIC SCHOOL DIST.,2012,80.735
0186,01,PEQUOT LAKES PUBLIC SCHOOLS,2012,93.17
0191,01,BURNSVILLE PUBLIC SCHOOL DISTRICT,2012,64.88583333333334
0192,01,FARMINGTON PUBLIC SCHOOL DISTRICT,2012,86.17444444444445
0194,01,LAKEVILLE PUBLIC SCHOOL DISTRICT,2012,84.049
0195,01,RANDOLPH PUBLIC SCHOOL DISTRICT,2012,97.56
0196,01,ROSEMOUNT-APPLE VALLEY-EAGAN,2012,78.77416666666667
0197,01,WEST ST. PAUL-MENDOTA HTS.-EAGAN,2012,80.58666666666667
0199,01,INVER GROVE HEIGHTS SCHOOLS,2012,78.06444444444445
0200,01,HASTINGS PUBLIC SCHOOL DISTRICT,2012,86.24428571428571
0203,01,HAYFIELD PUBLIC SCHOOL DISTRICT,2012,80.292
0204,01,KASSON-MANTORVILLE SCHOOL DISTRICT,2012,93.61333333333333
0206,01,ALEXANDRIA PUBLIC SCHOOL DISTRICT,2012,89.83166666666666
0213,01,OSAKIS PUBLIC SCHOOL DISTRICT,2012,93.932
0227,01,CHATFIELD PUBLIC SCHOOLS,2012,91.476
0229,01,LANESBORO PUBLIC SCHOOL DISTRICT,2012,90.402
0238,01,MABEL-CANTON PUBLIC SCHOOL DIST.,2012,81.166
0239,01,RUSHFORD-PETERSON PUBLIC SCHOOLS,2012,100
0241,01,ALBERT LEA PUBLIC SCHOOL DISTRICT,2012,52.44625
0242,01,ALDEN-CONGER PUBLIC SCHOOL DISTRICT,2012,77.63
0252,01,CANNON FALLS PUBLIC SCHOOL DISTRICT,2012,82.27833333333334
0253,01,GOODHUE PUBLIC SCHOOL DISTRICT,2012,86.35
0255,01,PINE ISLAND PUBLIC SCHOOL DIST.,2012,92
0256,01,RED WING PUBLIC SCHOOL DISTRICT,2012,80.27571428571429
0261,01,ASHBY PUBLIC SCHOOL DISTRICT,2012,88.33333333333333
0270,01,HOPKINS PUBLIC SCHOOL DISTRICT,2012,69.561
0271,01,BLOOMINGTON PUBLIC SCHOOL DISTRICT,2012,70.22769230769231
0272,01,EDEN PRAIRIE PUBLIC SCHOOL DISTRICT,2012,66.83454545454545
0273,01,EDINA PUBLIC SCHOOL DISTRICT,2012,86.58
0276,01,MINNETONKA PUBLIC SCHOOL DISTRICT,2012,92.30666666666666
0277,01,WESTONKA PUBLIC SCHOOL DISTRICT,2012,79.935
0278,01,ORONO PUBLIC SCHOOL DISTRICT,2012,91.16666666666666
0279,01,OSSEO PUBLIC SCHOOL DISTRICT,2012,69.0425
0280,01,RICHFIELD PUBLIC SCHOOL DISTRICT,2012,54.868
0281,01,ROBBINSDALE PUBLIC SCHOOL DISTRICT,2012,64.80538461538461
0282,01,ST. ANTHONY-NEW BRIGHTON SCHOOLS,2012,77.92
0283,01,ST. LOUIS PARK PUBLIC SCHOOL DIST.,2012,75.11909090909091
0284,01,WAYZATA PUBLIC SCHOOL DISTRICT,2012,78.919
0286,01,BROOKLYN CENTER SCHOOL DISTRICT,2012,52.663
0287,06,INTERMEDIATE SCHOOL DISTRICT 287,2012,5.053333333333333
0288,06,SOUTHWEST METRO INTERMEDIATE 288,2012,NA
0294,01,HOUSTON PUBLIC SCHOOL DISTRICT,2012,44.22
0297,01,SPRING GROVE SCHOOL DISTRICT,2012,95.068
0299,01,CALEDONIA PUBLIC SCHOOL DISTRICT,2012,92.822
0300,01,LA CRESCENT-HOKAH SCHOOL DISTRICT,2012,86.425
0306,01,LAPORTE PUBLIC SCHOOL DISTRICT,2012,82.888
0308,01,NEVIS PUBLIC SCHOOL DISTRICT,2012,72.42
0309,01,PARK RAPIDS PUBLIC SCHOOL DISTRICT,2012,66.75666666666666
0314,01,BRAHAM PUBLIC SCHOOL DISTRICT,2012,87.51333333333334
0316,01,GREENWAY PUBLIC SCHOOL DISTRICT,2012,83.03999999999999
0317,01,DEER RIVER PUBLIC SCHOOL DISTRICT,2012,80.95714285714286
0318,01,GRAND RAPIDS PUBLIC SCHOOL DISTRICT,2012,77.16222222222223
0319,01,NASHWAUK-KEEWATIN SCHOOL DISTRICT,2012,76.962
0330,01,HERON LAKE-OKABENA SCHOOL DISTRICT,2012,100
0332,01,MORA PUBLIC SCHOOL DISTRICT,2012,84.482
0333,01,OGILVIE PUBLIC SCHOOL DISTRICT,2012,85.06166666666667
0345,01,NEW LONDON-SPICER SCHOOL DISTRICT,2012,86.45833333333333
0347,01,WILLMAR PUBLIC SCHOOL DISTRICT,2012,51.675
0356,01,LANCASTER PUBLIC SCHOOL DISTRICT,2012,100
0361,01,INTERNATIONAL FALLS SCHOOL DISTRICT,2012,77.36666666666666
0362,01,LITTLEFORK-BIG FALLS SCHOOL DIST.,2012,90.87
0363,01,SOUTH KOOCHICHING SCHOOL DISTRICT,2012,79.826
0378,01,DAWSON-BOYD PUBLIC SCHOOL DISTRICT,2012,87.224
0381,01,LAKE SUPERIOR PUBLIC SCHOOL DIST.,2012,77.46333333333334
0390,01,LAKE OF THE WOODS SCHOOL DISTRICT,2012,91.32166666666667
0391,01,CLEVELAND PUBLIC SCHOOL DISTRICT,2012,100
0402,01,HENDRICKS PUBLIC SCHOOL DISTRICT,2012,NA
0413,01,MARSHALL PUBLIC SCHOOL DISTRICT,2012,65.34875
0414,01,MINNEOTA PUBLIC SCHOOL DISTRICT,2012,97.6775
0423,01,HUTCHINSON PUBLIC SCHOOL DISTRICT,2012,80.60166666666667
0424,01,LESTER PRAIRIE PUBLIC SCHOOL DIST.,2012,86.52799999999999
0432,01,MAHNOMEN PUBLIC SCHOOL DISTRICT,2012,40.235
0435,01,WAUBUN-OGEMA-WHITE EARTH PUBLIC SCH,2012,54.38
0441,01,MARSHALL COUNTY CENTRAL SCHOOLS,2012,97.18599999999999
0447,01,GRYGLA PUBLIC SCHOOL DISTRICT,2012,100
0458,01,TRUMAN PUBLIC SCHOOL DISTRICT,2012,60.76
0463,01,EDEN VALLEY-WATKINS SCHOOL DISTRICT,2012,96.402
0465,01,LITCHFIELD PUBLIC SCHOOL DISTRICT,2012,85.95333333333333
0466,01,DASSEL-COKATO PUBLIC SCHOOL DIST.,2012,84.81
0473,01,ISLE PUBLIC SCHOOL DISTRICT,2012,60.641999999999996
0477,01,PRINCETON PUBLIC SCHOOL DISTRICT,2012,89.34833333333333
0480,01,ONAMIA PUBLIC SCHOOL DISTRICT,2012,61.41285714285714
0482,01,LITTLE FALLS PUBLIC SCHOOL DISTRICT,2012,83.45166666666667
0484,01,PIERZ PUBLIC SCHOOL DISTRICT,2012,84.45666666666666
0485,01,ROYALTON PUBLIC SCHOOL DISTRICT,2012,90.034
0486,01,SWANVILLE PUBLIC SCHOOL DISTRICT,2012,64.71000000000001
0487,01,UPSALA PUBLIC SCHOOL DISTRICT,2012,100
0492,01,AUSTIN PUBLIC SCHOOL DISTRICT,2012,67.80333333333333
0495,01,GRAND MEADOW PUBLIC SCHOOL DISTRICT,2012,81.918
0497,01,LYLE PUBLIC SCHOOL DISTRICT,2012,69.16499999999999
0499,01,LEROY-OSTRANDER PUBLIC SCHOOLS,2012,75.4175
0500,01,SOUTHLAND PUBLIC SCHOOL DISTRICT,2012,96.72333333333333
0505,01,FULDA PUBLIC SCHOOL DISTRICT,2012,92.15
0507,01,NICOLLET PUBLIC SCHOOL DISTRICT,2012,90.115
0508,01,ST. PETER PUBLIC SCHOOL DISTRICT,2012,84.98571428571428
0511,01,ADRIAN PUBLIC SCHOOL DISTRICT,2012,100
0514,01,ELLSWORTH PUBLIC SCHOOL DISTRICT,2012,93.46333333333332
0518,01,WORTHINGTON PUBLIC SCHOOL DISTRICT,2012,67.325
0531,01,BYRON PUBLIC SCHOOL DISTRICT,2012,90.718
0533,01,DOVER-EYOTA PUBLIC SCHOOL DISTRICT,2012,91.784
0534,01,STEWARTVILLE PUBLIC SCHOOL DISTRICT,2012,79.41833333333334
0535,01,ROCHESTER PUBLIC SCHOOL DISTRICT,2012,69.61749999999999
0542,01,BATTLE LAKE PUBLIC SCHOOL DISTRICT,2012,97.666
0544,01,FERGUS FALLS PUBLIC SCHOOL DISTRICT,2012,55.52125
0545,01,HENNING PUBLIC SCHOOL DISTRICT,2012,95.282
0547,01,PARKERS PRAIRIE PUBLIC SCHOOL DIST.,2012,100
0548,01,PELICAN RAPIDS PUBLIC SCHOOL DIST.,2012,86.35857142857142
0549,01,PERHAM-DENT PUBLIC SCHOOL DISTRICT,2012,74.58500000000001
0550,01,UNDERWOOD PUBLIC SCHOOL DISTRICT,2012,88.188
0553,01,NEW YORK MILLS PUBLIC SCHOOL DIST.,2012,84.98166666666667
0561,01,GOODRIDGE PUBLIC SCHOOL DISTRICT,2012,94.9775
0564,01,THIEF RIVER FALLS SCHOOL DISTRICT,2012,83.545
0577,01,WILLOW RIVER PUBLIC SCHOOL DISTRICT,2012,79.88
0578,01,PINE CITY PUBLIC SCHOOL DISTRICT,2012,81.03999999999999
0581,01,EDGERTON PUBLIC SCHOOL DISTRICT,2012,84.68599999999999
0592,01,CLIMAX-SHELLY PUBLIC SCHOOLS,2012,91.67
0593,01,CROOKSTON PUBLIC SCHOOL DISTRICT,2012,76.13571428571429
0595,01,EAST GRAND FORKS PUBLIC SCHOOL DIST,2012,80.71833333333333
0599,01,FERTILE-BELTRAMI SCHOOL DISTRICT,2012,93.474
0600,01,FISHER PUBLIC SCHOOL DISTRICT,2012,95.2875
0601,01,FOSSTON PUBLIC SCHOOL DISTRICT,2012,94.39999999999999
0621,01,MOUNDS VIEW PUBLIC SCHOOL DISTRICT,2012,77.57
0622,01,NORTH ST PAUL-MAPLEWOOD OAKDALE PUBLIC SCHOOL DISTRICT,2012,65.94538461538461
0623,01,ROSEVILLE PUBLIC SCHOOL DISTRICT,2012,65.63454545454546
0624,01,WHITE BEAR LAKE SCHOOL DISTRICT,2012,84.51818181818182
0625,01,ST. PAUL PUBLIC SCHOOL DISTRICT,2012,62.033846153846156
0630,01,RED LAKE FALLS PUBLIC SCHOOL DIST.,2012,76.25999999999999
0640,01,WABASSO PUBLIC SCHOOL DISTRICT,2012,85.89
0656,01,FARIBAULT PUBLIC SCHOOL DISTRICT,2012,56.76888888888889
0659,01,NORTHFIELD PUBLIC SCHOOL DISTRICT,2012,84.4675
0671,01,HILLS-BEAVER CREEK SCHOOL DISTRICT,2012,91.268
0676,01,BADGER PUBLIC SCHOOL DISTRICT,2012,80.84666666666666
0682,01,ROSEAU PUBLIC SCHOOL DISTRICT,2012,92.29166666666667
0690,01,WARROAD PUBLIC SCHOOL DISTRICT,2012,87.40333333333334
0695,01,CHISHOLM PUBLIC SCHOOL DISTRICT,2012,80.528
0696,01,ELY PUBLIC SCHOOL DISTRICT,2012,96.726
0698,01,FLOODWOOD PUBLIC SCHOOL DISTRICT,2012,91.5475
0700,01,HERMANTOWN PUBLIC SCHOOL DISTRICT,2012,90.24833333333333
0701,01,HIBBING PUBLIC SCHOOL DISTRICT,2012,69.215
0704,01,PROCTOR PUBLIC SCHOOL DISTRICT,2012,81.46666666666667
0706,01,VIRGINIA PUBLIC SCHOOL DISTRICT,2012,85.29333333333334
0709,01,DULUTH PUBLIC SCHOOL DISTRICT,2012,65.13
0712,01,MOUNTAIN IRON-BUHL SCHOOL DISTRICT,2012,92.472
0716,01,BELLE PLAINE PUBLIC SCHOOL DISTRICT,2012,89.235
0717,01,JORDAN PUBLIC SCHOOL DISTRICT,2012,87.38333333333334
0719,01,PRIOR LAKE-SAVAGE AREA SCHOOLS,2012,76.43
0720,01,SHAKOPEE PUBLIC SCHOOL DISTRICT,2012,68.4225
0721,01,NEW PRAGUE AREA SCHOOLS,2012,85.9
0726,01,BECKER PUBLIC SCHOOL DISTRICT,2012,89.89
0727,01,BIG LAKE PUBLIC SCHOOL DISTRICT,2012,82.97
0728,01,ELK RIVER PUBLIC SCHOOL DISTRICT,2012,80.94166666666666
0738,01,HOLDINGFORD PUBLIC SCHOOL DISTRICT,2012,95.742
0739,01,KIMBALL PUBLIC SCHOOL DISTRICT,2012,87.345
0740,01,MELROSE PUBLIC SCHOOL DISTRICT,2012,95.52875
0741,01,PAYNESVILLE PUBLIC SCHOOL DISTRICT,2012,98.908
0742,01,ST. CLOUD PUBLIC SCHOOL DISTRICT,2012,62.69833333333333
0743,01,SAUK CENTRE PUBLIC SCHOOL DISTRICT,2012,92.51666666666667
0745,01,ALBANY PUBLIC SCHOOL DISTRICT,2012,80.63833333333334
0748,01,SARTELL-ST. STEPHEN SCHOOL DISTRICT,2012,93.26166666666667
0750,01,ROCORI PUBLIC SCHOOL DISTRICT,2012,89.59666666666666
0756,01,BLOOMING PRAIRIE PUBLIC SCHOOL DIST,2012,89.24
0761,01,OWATONNA PUBLIC SCHOOL DISTRICT,2012,72.196
0763,01,MEDFORD PUBLIC SCHOOL DISTRICT,2012,98.508
0768,01,HANCOCK PUBLIC SCHOOL DISTRICT,2012,90.8025
0771,01,CHOKIO-ALBERTA PUBLIC SCHOOL DIST.,2012,83.33
0775,01,KERKHOVEN-MURDOCK-SUNBURG,2012,71.832
0777,01,BENSON PUBLIC SCHOOL DISTRICT,2012,87.488
0786,01,BERTHA-HEWITT PUBLIC SCHOOL DISTRICT,2012,85.492
0787,01,BROWERVILLE PUBLIC SCHOOL DISTRICT,2012,94.976
0803,01,WHEATON AREA PUBLIC SCHOOL DISTRICT,2012,96.656
0811,01,WABASHA-KELLOGG PUBLIC SCHOOL DIST.,2012,92.674
0813,01,LAKE CITY PUBLIC SCHOOL DISTRICT,2012,94.47333333333333
0818,01,VERNDALE PUBLIC SCHOOL DISTRICT,2012,70.304
0820,01,SEBEKA PUBLIC SCHOOL DISTRICT,2012,100
0821,01,MENAHGA PUBLIC SCHOOL DISTRICT,2012,91.384
0829,01,WASECA PUBLIC SCHOOL DISTRICT,2012,82.44285714285714
0831,01,FOREST LAKE PUBLIC SCHOOL DISTRICT,2012,77.86571428571429
0832,01,MAHTOMEDI PUBLIC SCHOOL DISTRICT,2012,94.88333333333333
0833,01,SOUTH WASHINGTON COUNTY SCHOOL DIST,2012,83.705
0834,01,STILLWATER AREA PUBLIC SCHOOL DIST.,2012,79.14444444444445
0836,01,BUTTERFIELD PUBLIC SCHOOL DISTRICT,2012,95.01
0837,01,MADELIA PUBLIC SCHOOL DISTRICT,2012,74.745
0840,01,ST. JAMES PUBLIC SCHOOL DISTRICT,2012,89.51833333333333
0846,01,BRECKENRIDGE PUBLIC SCHOOL DISTRICT,2012,88.60333333333332
0850,01,ROTHSAY PUBLIC SCHOOL DISTRICT,2012,85.60666666666667
0852,01,CAMPBELL-TINTAH PUBLIC SCHOOL DIST.,2012,NaN
0857,01,LEWISTON-ALTURA PUBLIC SCHOOL DIST.,2012,86.198
0858,01,ST. CHARLES PUBLIC SCHOOL DISTRICT,2012,92.586
0861,01,WINONA AREA PUBLIC SCHOOL DISTRICT,2012,76.33625
0876,01,ANNANDALE PUBLIC SCHOOL DISTRICT,2012,87.72666666666666
0877,01,BUFFALO-HANOVER-MONTROSE PUBLIC SCH,2012,82.39
0879,01,DELANO PUBLIC SCHOOL DISTRICT,2012,87.01
0881,01,MAPLE LAKE PUBLIC SCHOOL DISTRICT,2012,90.46
0882,01,MONTICELLO PUBLIC SCHOOL DISTRICT,2012,88.965
0883,01,ROCKFORD PUBLIC SCHOOL DISTRICT,2012,73.88166666666666
0885,01,ST. MICHAEL-ALBERTVILLE SCHOOL DIST,2012,77.4
0891,01,CANBY PUBLIC SCHOOL DISTRICT,2012,100
0911,01,CAMBRIDGE-ISANTI PUBLIC SCHOOL DIST,2012,84.24833333333333
0912,01,MILACA PUBLIC SCHOOL DISTRICT,2012,76.67833333333333
0914,01,ULEN-HITTERDAL PUBLIC SCHOOL DIST,2012,93.15666666666667
0915,52,SOUTHERN PLAINS EDUCATION COOP.,2012,37.14
0916,06,NORTHEAST METRO 916,2012,12.879090909090909
0917,06,INTERMEDIATE SCHOOL DISTRICT 917,2012,23.086666666666666
0926,83,REGION 4-LAKES COUNTRY SERVICE COOP,2012,8.514
0938,52,MEEKER AND WRIGHT SPECIAL EDUCATION,2012,NaN
0966,51,WRIGHT TECHNICAL CENTER,2012,38.27333333333333
0991,83,REGION 6 AND 8-SW/WC SERVICE COOPERATIVE,2012,43.24
1000,70,PERPICH CENTER FOR ARTS EDUCATION,2012,100
1094,34,FOND DU LAC OJIBWE,2012,64.105
1115,34,BUG-O-NAY-GE-SHIG,2012,84.25
1435,34,CIRCLE OF LIFE,2012,NaN
1480,34,NAY-AH-SHING,2012,NaN
2071,01,LAKE CRYSTAL-WELLCOME MEMORIAL,2012,97.58
2125,01,TRITON SCHOOL DISTRICT,2012,84.01714285714286
2134,01,UNITED SOUTH CENTRAL SCHOOL DIST.,2012,80.952
2135,01,MAPLE RIVER SCHOOL DISTRICT,2012,83.945
2137,01,KINGSLAND PUBLIC SCHOOL DISTRICT,2012,90.288
2142,01,ST. LOUIS COUNTY SCHOOL DISTRICT,2012,82.82857142857144
2143,01,WATERVILLE-ELYSIAN-MORRISTOWN PUBLIC SCHOOL DISTRICT,2012,95.33200000000001
2144,01,CHISAGO LAKES SCHOOL DISTRICT,2012,83.78999999999999
2149,01,MINNEWASKA SCHOOL DISTRICT,2012,78.91666666666667
2154,01,EVELETH-GILBERT SCHOOL DISTRICT,2012,88.735
2155,01,WADENA-DEER CREEK SCHOOL DISTRICT,2012,77.145
2159,01,BUFFALO LK-HECTOR-STEWART PUBLIC SC,2012,89.425
2164,01,DILWORTH-GLYNDON-FELTON,2012,89.01166666666667
2165,01,HINCKLEY-FINLAYSON SCHOOL DISTRICT,2012,80.85
2167,01,LAKEVIEW SCHOOL DISTRICT,2012,86.442
2168,01,NRHEG SCHOOL DISTRICT,2012,93.87833333333333
2169,01,MURRAY COUNTY CENTRAL SCHOOL DIST.,2012,87.175
2170,01,STAPLES-MOTLEY SCHOOL DISTRICT,2012,87.18666666666667
2171,01,KITTSON CENTRAL SCHOOL DISTRICT,2012,93.2075
2172,01,KENYON-WANAMINGO SCHOOL DISTRICT,2012,84.72999999999999
2174,01,PINE RIVER-BACKUS SCHOOL DISTRICT,2012,56.37
2176,01,WARREN-ALVARADO-OSLO SCHOOL DIST.,2012,84.39833333333334
2180,01,MACCRAY SCHOOL DISTRICT,2012,91.726
2184,01,LUVERNE PUBLIC SCHOOL DISTRICT,2012,77.92833333333333
2190,01,YELLOW MEDICINE EAST,2012,96.28666666666666
2198,01,FILLMORE CENTRAL,2012,90.098
2215,01,NORMAN COUNTY EAST SCHOOL DISTRICT,2012,83.03999999999999
2310,01,SIBLEY EAST SCHOOL DISTRICT,2012,90.95166666666667
2311,01,CLEARBROOK-GONVICK SCHOOL DISTRICT,2012,83.624
2342,01,WEST CENTRAL AREA,2012,92.14333333333333
2358,01,TRI-COUNTY SCHOOL DISTRICT,2012,100
2364,01,BELGRADE-BROOTEN-ELROSA PUBLIC SCHOOL DISTRICT,2012,92.89833333333334
2365,01,G.F.W. PUBLIC SCHOOL DISTRICT,2012,73.75
2396,01,A.C.G.C. PUBLIC SCHOOL DISTRICT,2012,84.26333333333334
2397,01,LE SUEUR-HENDERSON SCHOOL DISTRICT,2012,93.39333333333333
2448,01,MARTIN COUNTY WEST SCHOOL DISTRICT,2012,83.18833333333333
2527,01,NORMAN COUNTY WEST SCHOOL DISTRICT,2012,90.27199999999999
2534,01,BIRD ISLAND-OLIVIA-LAKE LILLIAN PUBLIC SCHOOL DISTRICT,2012,83.508
2536,01,GRANADA HUNTLEY-EAST CHAIN,2012,87.066
2580,01,EAST CENTRAL SCHOOL DISTRICT,2012,61.70857142857143
2609,01,WIN-E-MAC SCHOOL DISTRICT,2012,69.71166666666667
2683,01,GREENBUSH-MIDDLE RIVER SCHOOL DIST.,2012,100
2687,01,HOWARD LAKE-WAVERLY-WINSTED,2012,93.244
2689,01,PIPESTONE AREA SCHOOL DISTRICT,2012,87.98166666666667
2711,01,MESABI EAST SCHOOL DISTRICT,2012,85.164
2752,01,FAIRMONT AREA SCHOOL DISTRICT,2012,89.75166666666667
2753,01,LONG PRAIRIE-GREY EAGLE SCHOOL DISTRICT,2012,70.645
2754,01,CEDAR MOUNTAIN SCHOOL DISTRICT,2012,87.266
2769,01,MORRIS AREA PUBLIC SCHOOLS,2012,92.84833333333333
2805,01,ZUMBROTA-MAZEPPA SCHOOL DISTRICT,2012,87.804
2835,01,JANESVILLE-WALDORF-PEMBERTON,2012,90.58
2853,01,LAC QUI PARLE VALLEY SCHOOL DIST.,2012,91.908
2854,01,ADA-BORUP PUBLIC SCHOOL DISTRICT,2012,80.598
2856,01,STEPHEN-ARGYLE CENTRAL SCHOOLS,2012,91.115
2859,01,GLENCOE-SILVER LAKE SCHOOL DISTRICT,2012,83.94714285714286
2860,01,BLUE EARTH AREA PUBLIC SCHOOL,2012,77.73666666666666
2884,01,RED ROCK CENTRAL SCHOOL DISTRICT,2012,100
2886,01,GLENVILLE-EMMONS SCHOOL DISTRICT,2012,84.64
2888,01,CLINTON-GRACEVILLE-BEARDSLEY,2012,95.484
2889,01,LAKE PARK AUDUBON SCHOOL DISTRICT,2012,95.19800000000001
2890,01,RENVILLE COUNTY WEST SCHOOL DIST.,2012,75.815
2895,01,JACKSON COUNTY CENTRAL SCHOOL DIST.,2012,91.52666666666667
2897,01,REDWOOD AREA SCHOOL DISTRICT,2012,83.62714285714286
2898,01,WESTBROOK-WALNUT GROVE SCHOOLS,2012,83.92714285714285
2899,01,PLAINVIEW-ELGIN-MILLVILLE,2012,88.762
2902,01,RTR PUBLIC SCHOOLS,2012,85.974
2903,01,ORTONVILLE PUBLIC SCHOOLS,2012,89.054
2904,01,TRACY AREA PUBLIC SCHOOL DISTRICT,2012,82.72428571428571
2905,01,TRI-CITY UNITED SCHOOL DISTRICT,2012,NA
2906,01,RED LAKE COUNTY CENTRAL PUBLIC SCHOOLS,2012,NA
2908,01,BRANDON-EVANSVILLE PUBLIC SCHOOLS,2012,NA
4000,07,CITY ACADEMY,2012,63.98833333333333
4003,07,"NEW HEIGHTS SCHOOL, INC.",2012,62.35666666666667
4007,07,MINNESOTA NEW COUNTRY SCHOOL,2012,47.41
4008,07,PACT CHARTER SCHOOL,2012,68.94833333333334
4015,07,COMMUNITY OF PEACE ACADEMY,2012,83.615
4017,07,MINNESOTA TRANSITIONS CHARTER SCHOOL,2012,18.409285714285716
4025,07,CYBER VILLAGE ACADEMY,2012,NA
4026,07,E.C.H.O. CHARTER SCHOOL,2012,93.265
4027,07,HIGHER GROUND ACADEMY,2012,71.40666666666667
4031,07,JENNINGS COMMUNITY SCHOOL,2012,20.677142857142858
4036,07,FACE TO FACE ACADEMY,2012,10
4039,07,HIGH SCHOOL FOR RECORDING ARTS,2012,28.8225
4043,07,MATH AND SCIENCE ACADEMY,2012,86.68666666666667
4049,07,NORTHWEST PASSAGE HIGH SCHOOL,2012,21.166666666666668
4053,07,NORTH LAKES ACADEMY,2012,69.572
4056,07,ROSA PARKS CHARTER HIGH SCHOOL,2012,27.384
4057,07,EL COLEGIO CHARTER SCHOOL,2012,6.555
4059,07,CROSSLAKE COMMUNITY CHARTER SCHOOL,2012,NA
4066,07,KATO PUBLIC CHARTER SCHOOL,2012,27.586666666666666
4074,07,AFSA HIGH SCHOOL,2012,65.94666666666666
4075,07,AVALON SCHOOL,2012,66.32333333333334
4080,07,PILLAGER AREA CHARTER SCHOOL,2012,18.18
4081,07,DISCOVERY PUBLIC SCHOOL FARIBAULT,2012,57.95
4082,07,BLUESKY CHARTER SCHOOL,2012,22.087142857142858
4085,07,HARBOR CITY INTERNATIONAL CHARTER,2012,77.45
4087,07,SAGE ACADEMY CHARTER SCHOOL,2012,18.883333333333333
4091,07,ARCADIA CHARTER SCHOOL,2012,85.71
4092,07,WATERSHED HIGH SCHOOL,2012,39.656
4093,07,NEW CENTURY ACADEMY,2012,60.168
4095,07,TRIO WOLF CREEK DISTANCE LEARNING,2012,24.02
4098,07,NOVA CLASSICAL ACADEMY,2012,NA
4102,07,MINNESOTA INTERNSHIP CENTER,2012,9.28
4103,07,HMONG COLLEGE PREP ACADEMY,2012,62.642857142857146
4104,07,PALADIN CAREER AND TECHNICAL HIGH SCHOOL,2012,14.84375
4105,07,GREAT RIVER SCHOOL,2012,84.3375
4106,07,TREKNORTH HIGH SCHOOL,2012,48.024
4107,07,VOYAGEURS EXPEDITIONARY,2012,28.414
4110,07,PIM ARTS HIGH SCHOOL,2012,71.44857142857143
4111,07,AUGSBURG FAIRVIEW ACADEMY,2012,19.151666666666667
4112,07,ST PAUL CONSERVATORY PERFORMING ART,2012,71.57666666666667
4118,07,KALEIDOSCOPE CHARTER SCHOOL,2012,NA
4119,07,ACADEMIC ARTS HIGH SCHOOL,2012,4.332
4120,07,ST. CROIX PREPARATORY ACADEMY,2012,72.04333333333334
4121,07,UBAH MEDICAL ACADEMY CHARTER SCHOOL,2012,66.765
4122,07,EAGLE RIDGE ACADEMY CHARTER SCHOOL,2012,83.97
4126,07,PRAIRIE SEEDS ACADEMY,2012,75.13714285714286
4131,07,METRO SCHOOLS CHARTER,2012,18.098333333333333
4132,07,TWIN CITIES ACADEMY,2012,100
4146,07,NORTHERN LIGHTS COMMUNITY SCHOOL,2012,50.16166666666667
4150,07,MINNESOTA ONLINE HIGH SCHOOL,2012,25.856
4151,07,EDVISIONS OFF CAMPUS SCHOOL,2012,15.078
4160,07,SPECTRUM HIGH SCHOOL,2012,86.618
4163,07,LEARNING FOR LEADERSHIP CHARTER,2012,NaN
4166,07,EAST RANGE ACADEMY OF TECH-SCIENCE,2012,60.266666666666666
4178,07,LINCOLN INTERNATIONAL SCHOOL,2012,23.77857142857143
4183,07,LIONSGATE ACADEMY,2012,7.2025
4190,07,RIVERS EDGE ACADEMY,2012,6.483333333333333
4200,07,STEP ACADEMY CHARTER SCHOOL,2012,NA
4204,07,ROCHESTER STEM ACADEMY,2012,NA
4207,07,VERMILION COUNTRY SCHOOL,2012,NA
4210,07,UPPER MISSISSIPPI ACADEMY,2012,NA
4217,07,TECHNICAL ACADEMIES OF MINNESOTA,2012,NA
4237,07,CAREER PATHWAYS,2012,NA
6004,61,FRESHWATER ED. DIST.,2012,41.9
6012,61,ZUMBRO EDUCATION DISTRICT,2012,32.455
6013,61,HIAWATHA VALLEY ED. DISTRICT,2012,0
6014,61,RUNESTONE AREA ED. DISTRICT,2012,23.376666666666665
6018,61,MN RIVER VALLEY EDUCATION DISTRICT,2012,41.98285714285714
6026,61,WEST CENTRAL EDUCATION DISTRICT,2012,59.776
6049,61,RIVER BEND EDUCATION DISTRICT,2012,31.613333333333333
6051,61,GOODHUE COUNTY EDUCATION DISTRICT,2012,21.54
6074,50,CENTRAL MINNESOTA JT. POWERS DIST.,2012,57.980000000000004
6076,50,NORTHLAND LEARNING CENTER,2012,42.34
6079,52,RUM RIVER SPECIAL EDUCATION COOP,2012,NA
6083,52,SOUTHERN MN EDUCATION CONSORTIUM,2012,NA
6094,52,CANNON VALLEY SPECIAL EDUCATION COOPERATIVE,2012,NA
6383,61,BENTON-STEARNS ED. DISTRICT,2012,NA
0001,01,AITKIN PUBLIC SCHOOL DISTRICT,2013,76.63
0001,03,MINNEAPOLIS PUBLIC SCHOOL DISTRICT,2013,48.6325
0002,01,HILL CITY PUBLIC SCHOOL DISTRICT,2013,89.3475
0004,01,MCGREGOR PUBLIC SCHOOL DISTRICT,2013,63.415
0006,03,SOUTH ST. PAUL PUBLIC SCHOOL DIST.,2013,72.25333333333333
0011,01,ANOKA-HENNEPIN PUBLIC SCHOOL DISTRICT,2013,67.20769230769231
0012,01,CENTENNIAL PUBLIC SCHOOL DISTRICT,2013,89.88111111111111
0013,01,COLUMBIA HEIGHTS PUBLIC SCHOOL DIST,2013,72.86222222222223
0014,01,FRIDLEY PUBLIC SCHOOL DISTRICT,2013,74.5
0015,01,ST. FRANCIS PUBLIC SCHOOL DISTRICT,2013,84.175
0016,01,SPRING LAKE PARK PUBLIC SCHOOLS,2013,73.52
0022,01,DETROIT LAKES PUBLIC SCHOOL DIST.,2013,77.03285714285714
0023,01,FRAZEE-VERGAS PUBLIC SCHOOL DIST.,2013,87.574
0031,01,BEMIDJI PUBLIC SCHOOL DISTRICT,2013,63.43625
0032,01,BLACKDUCK PUBLIC SCHOOL DISTRICT,2013,90.42
0036,01,KELLIHER PUBLIC SCHOOL DISTRICT,2013,91.91
0038,01,RED LAKE PUBLIC SCHOOL DISTRICT,2013,30.321666666666665
0047,01,SAUK RAPIDS-RICE PUBLIC SCHOOLS,2013,89.43166666666667
0051,01,FOLEY PUBLIC SCHOOL DISTRICT,2013,92.235
0075,01,ST. CLAIR PUBLIC SCHOOL DISTRICT,2013,96.3425
0077,01,MANKATO PUBLIC SCHOOL DISTRICT,2013,76.75272727272727
0081,01,COMFREY PUBLIC SCHOOL DISTRICT,2013,90
0084,01,SLEEPY EYE PUBLIC SCHOOL DISTRICT,2013,81.64
0085,01,SPRINGFIELD PUBLIC SCHOOL DISTRICT,2013,100
0088,01,NEW ULM PUBLIC SCHOOL DISTRICT,2013,87.13166666666666
0091,01,BARNUM PUBLIC SCHOOL DISTRICT,2013,85.96833333333333
0093,01,CARLTON PUBLIC SCHOOL DISTRICT,2013,94.542
0094,01,CLOQUET PUBLIC SCHOOL DISTRICT,2013,71.62625
0095,01,CROMWELL-WRIGHT PUBLIC SCHOOLS,2013,89.30799999999999
0097,01,MOOSE LAKE PUBLIC SCHOOL DISTRICT,2013,97.40333333333334
0099,01,ESKO PUBLIC SCHOOL DISTRICT,2013,100
0100,01,WRENSHALL PUBLIC SCHOOL DISTRICT,2013,86.78
0108,01,CENTRAL PUBLIC SCHOOL DISTRICT,2013,93.20166666666667
0110,01,WACONIA PUBLIC SCHOOL DISTRICT,2013,82.23285714285714
0111,01,WATERTOWN-MAYER PUBLIC SCHOOL DIST.,2013,96.13333333333333
0112,01,EASTERN CARVER COUNTY PUBLIC SCHOOL,2013,83.436
0113,01,WALKER-HACKENSACK-AKELEY SCHL. DIST,2013,71.412
0115,01,CASS LAKE-BENA PUBLIC SCHOOLS,2013,40.07
0116,01,PILLAGER PUBLIC SCHOOL DISTRICT,2013,84.04833333333333
0118,01,NORTHLAND COMMUNITY SCHOOLS,2013,79.87666666666667
0129,01,MONTEVIDEO PUBLIC SCHOOL DISTRICT,2013,89.06
0138,01,NORTH BRANCH PUBLIC SCHOOLS,2013,79.24833333333333
0139,01,RUSH CITY PUBLIC SCHOOL DISTRICT,2013,87.308
0146,01,BARNESVILLE PUBLIC SCHOOL DISTRICT,2013,90.032
0150,01,HAWLEY PUBLIC SCHOOL DISTRICT,2013,93.902
0152,01,MOORHEAD PUBLIC SCHOOL DISTRICT,2013,62.32833333333333
0160,70,MINNESOTA STATE ACADEMIES,2013,53.6
0162,01,BAGLEY PUBLIC SCHOOL DISTRICT,2013,78.24428571428571
0166,01,COOK COUNTY PUBLIC SCHOOLS,2013,90.75
0173,01,MOUNTAIN LAKE PUBLIC SCHOOLS,2013,89.998
0177,01,WINDOM PUBLIC SCHOOL DISTRICT,2013,98.39333333333333
0181,01,BRAINERD PUBLIC SCHOOL DISTRICT,2013,79.31666666666666
0182,01,CROSBY-IRONTON PUBLIC SCHOOL DIST.,2013,91.11833333333334
0186,01,PEQUOT LAKES PUBLIC SCHOOLS,2013,90.32166666666666
