DistrictNumber,DistrictType,districtName,year,percentLunch
0273,01,EDINA PUBLIC SCHOOL DISTRICT,2015,0.0819574771350517
0276,01,MINNETONKA PUBLIC SCHOOL DISTRICT,2015,0.0721012658227848
0277,01,WESTONKA PUBLIC SCHOOL DISTRICT,2015,0.197519522278365
0278,01,ORONO PUBLIC SCHOOL DISTRICT,2015,0.0736879942487419
0279,01,OSSEO PUBLIC SCHOOL DISTRICT,2015,0.426831712939761
0280,01,RICHFIELD PUBLIC SCHOOL DISTRICT,2015,0.662102576003713
0281,01,ROBBINSDALE PUBLIC SCHOOL DISTRICT,2015,0.510026298487837
0282,01,ST. ANTHONY-NEW BRIGHTON SCHOOLS,2015,0.221175166297118
0283,01,ST. LOUIS PARK PUBLIC SCHOOL DIST.,2015,0.35656894679696
0284,01,WAYZATA PUBLIC SCHOOL DISTRICT,2015,0.124541435424701
0286,01,BROOKLYN CENTER SCHOOL DISTRICT,2015,0.750312630262609
0287,06,INTERMEDIATE SCHOOL DISTRICT 287,2015,0.613579212070411
0288,06,SOUTHWEST METRO INTERMEDIATE 288,2015,NA
0294,01,HOUSTON PUBLIC SCHOOL DISTRICT,2015,0.299440772750381
0297,01,SPRING GROVE SCHOOL DISTRICT,2015,0.307462686567164
0299,01,CALEDONIA PUBLIC SCHOOL DISTRICT,2015,0.273846153846154
0300,01,LA CRESCENT-HOKAH SCHOOL DISTRICT,2015,0.198426573426573
0306,01,LAPORTE PUBLIC SCHOOL DISTRICT,2015,0.704626334519573
0308,01,NEVIS PUBLIC SCHOOL DISTRICT,2015,0.539115646258503
0309,01,PARK RAPIDS PUBLIC SCHOOL DISTRICT,2015,0.517426273458445
0314,01,BRAHAM PUBLIC SCHOOL DISTRICT,2015,0.46356783919598
0316,01,GREENWAY PUBLIC SCHOOL DISTRICT,2015,0.502868068833652
0317,01,DEER RIVER PUBLIC SCHOOL DISTRICT,2015,0.687363834422658
0318,01,GRAND RAPIDS PUBLIC SCHOOL DISTRICT,2015,0.40541859897486
0319,01,NASHWAUK-KEEWATIN SCHOOL DISTRICT,2015,0.534013605442177
0330,01,HERON LAKE-OKABENA SCHOOL DISTRICT,2015,0.331168831168831
0332,01,MORA PUBLIC SCHOOL DISTRICT,2015,0.415197568389058
0333,01,OGILVIE PUBLIC SCHOOL DISTRICT,2015,0.46257197696737
0345,01,NEW LONDON-SPICER SCHOOL DISTRICT,2015,0.289455060155697
0347,01,WILLMAR PUBLIC SCHOOL DISTRICT,2015,0.583783783783784
0356,01,LANCASTER PUBLIC SCHOOL DISTRICT,2015,0.380645161290323
0361,01,INTERNATIONAL FALLS SCHOOL DISTRICT,2015,0.377737226277372
0362,01,LITTLEFORK-BIG FALLS SCHOOL DIST.,2015,0.49041095890411
0363,01,SOUTH KOOCHICHING SCHOOL DISTRICT,2015,0.555891238670695
0378,01,DAWSON-BOYD PUBLIC SCHOOL DISTRICT,2015,0.426326129666012
0381,01,LAKE SUPERIOR PUBLIC SCHOOL DIST.,2015,0.335260115606936
0390,01,LAKE OF THE WOODS SCHOOL DISTRICT,2015,0.485714285714286
0391,01,CLEVELAND PUBLIC SCHOOL DISTRICT,2015,0.273563218390805
0397,52,LAKE AGASSIZ SPECIAL ED. COOP.,2015,0.4
0398,52,MIDWEST SPECIAL EDUCATION COOP.,2015,NaN
0402,01,HENDRICKS PUBLIC SCHOOL DISTRICT,2015,0.5
0403,01,IVANHOE PUBLIC SCHOOL DISTRICT,2015,0.325581395348837
0404,01,LAKE BENTON PUBLIC SCHOOL DISTRICT,2015,0.390625
0413,01,MARSHALL PUBLIC SCHOOL DISTRICT,2015,0.398796733992265
0414,01,MINNEOTA PUBLIC SCHOOL DISTRICT,2015,0.379182156133829
0415,01,LYND PUBLIC SCHOOL DISTRICT,2015,0.66887417218543
0423,01,HUTCHINSON PUBLIC SCHOOL DISTRICT,2015,0.273510161901481
0424,01,LESTER PRAIRIE PUBLIC SCHOOL DIST.,2015,0.330210772833724
0432,01,MAHNOMEN PUBLIC SCHOOL DISTRICT,2015,0.780096308186196
0435,01,WAUBUN-OGEMA-WHITE EARTH PUBLIC SCH,2015,0.698324022346369
0441,01,MARSHALL COUNTY CENTRAL SCHOOLS,2015,0.370843989769821
0447,01,GRYGLA PUBLIC SCHOOL DISTRICT,2015,0.483443708609272
0458,01,TRUMAN PUBLIC SCHOOL DISTRICT,2015,0.437837837837838
0463,01,EDEN VALLEY-WATKINS SCHOOL DISTRICT,2015,0.38655462184874
0465,01,LITCHFIELD PUBLIC SCHOOL DISTRICT,2015,0.370731707317073
0466,01,DASSEL-COKATO PUBLIC SCHOOL DIST.,2015,0.297394429469901
0473,01,ISLE PUBLIC SCHOOL DISTRICT,2015,0.527593818984547
0477,01,PRINCETON PUBLIC SCHOOL DISTRICT,2015,0.311000311623559
0480,01,ONAMIA PUBLIC SCHOOL DISTRICT,2015,0.666163141993958
0482,01,LITTLE FALLS PUBLIC SCHOOL DISTRICT,2015,0.455421686746988
0484,01,PIERZ PUBLIC SCHOOL DISTRICT,2015,0.414398595258999
0485,01,ROYALTON PUBLIC SCHOOL DISTRICT,2015,0.298129812981298
0486,01,SWANVILLE PUBLIC SCHOOL DISTRICT,2015,0.439252336448598
0487,01,UPSALA PUBLIC SCHOOL DISTRICT,2015,0.329787234042553
0492,01,AUSTIN PUBLIC SCHOOL DISTRICT,2015,0.574242745181106
0495,01,GRAND MEADOW PUBLIC SCHOOL DISTRICT,2015,0.357308584686775
0497,01,LYLE PUBLIC SCHOOL DISTRICT,2015,0.542857142857143
0499,01,LEROY-OSTRANDER PUBLIC SCHOOLS,2015,0.358361774744027
0500,01,SOUTHLAND PUBLIC SCHOOL DISTRICT,2015,0.253897550111359
0505,01,FULDA PUBLIC SCHOOL DISTRICT,2015,0.36144578313253
0507,01,NICOLLET PUBLIC SCHOOL DISTRICT,2015,0.193181818181818
0508,01,ST. PETER PUBLIC SCHOOL DISTRICT,2015,0.394519131334023
0511,01,ADRIAN PUBLIC SCHOOL DISTRICT,2015,0.345811051693405
0514,01,ELLSWORTH PUBLIC SCHOOL DISTRICT,2015,0.492957746478873
0518,01,WORTHINGTON PUBLIC SCHOOL DISTRICT,2015,0.705266711681296
0531,01,BYRON PUBLIC SCHOOL DISTRICT,2015,0.158704883227176
0533,01,DOVER-EYOTA PUBLIC SCHOOL DISTRICT,2015,0.218978102189781
0534,01,STEWARTVILLE PUBLIC SCHOOL DISTRICT,2015,0.247474747474747
0535,01,ROCHESTER PUBLIC SCHOOL DISTRICT,2015,0.389032374316776
0542,01,BATTLE LAKE PUBLIC SCHOOL DISTRICT,2015,0.347345132743363
0544,01,FERGUS FALLS PUBLIC SCHOOL DISTRICT,2015,0.334216502649508
0545,01,HENNING PUBLIC SCHOOL DISTRICT,2015,0.446194225721785
0547,01,PARKERS PRAIRIE PUBLIC SCHOOL DIST.,2015,0.322834645669291
0548,01,PELICAN RAPIDS PUBLIC SCHOOL DIST.,2015,0.532276330690827
0549,01,PERHAM-DENT PUBLIC SCHOOL DISTRICT,2015,0.361233480176211
0550,01,UNDERWOOD PUBLIC SCHOOL DISTRICT,2015,0.494880546075085
0553,01,NEW YORK MILLS PUBLIC SCHOOL DIST.,2015,0.408571428571429
0561,01,GOODRIDGE PUBLIC SCHOOL DISTRICT,2015,0.465686274509804
0564,01,THIEF RIVER FALLS SCHOOL DISTRICT,2015,0.338129496402878
0577,01,WILLOW RIVER PUBLIC SCHOOL DISTRICT,2015,0.433179723502304
0578,01,PINE CITY PUBLIC SCHOOL DISTRICT,2015,0.442098914354644
0581,01,EDGERTON PUBLIC SCHOOL DISTRICT,2015,0.466307277628032
0592,01,CLIMAX-SHELLY PUBLIC SCHOOLS,2015,0.573604060913706
0593,01,CROOKSTON PUBLIC SCHOOL DISTRICT,2015,0.4281098546042
0595,01,EAST GRAND FORKS PUBLIC SCHOOL DIST,2015,0.327693175408911
0599,01,FERTILE-BELTRAMI SCHOOL DISTRICT,2015,0.329545454545455
0600,01,FISHER PUBLIC SCHOOL DISTRICT,2015,0.389105058365759
0601,01,FOSSTON PUBLIC SCHOOL DISTRICT,2015,0.424
0621,01,MOUNDS VIEW PUBLIC SCHOOL DISTRICT,2015,0.317165909301679
0622,01,NORTH ST PAUL-MAPLEWOOD OAKDALE DIS,2015,0.524033839646222
0623,01,ROSEVILLE PUBLIC SCHOOL DISTRICT,2015,0.473825864621182
0624,01,WHITE BEAR LAKE SCHOOL DISTRICT,2015,0.286833271167475
0625,01,ST. PAUL PUBLIC SCHOOL DISTRICT,2015,0.725542012727861
0630,01,RED LAKE FALLS PUBLIC SCHOOL DIST.,2015,0.342776203966006
0635,01,MILROY PUBLIC SCHOOL DISTRICT,2015,0.538461538461538
0640,01,WABASSO PUBLIC SCHOOL DISTRICT,2015,0.300275482093664
0656,01,FARIBAULT PUBLIC SCHOOL DISTRICT,2015,0.587645195353749
0659,01,NORTHFIELD PUBLIC SCHOOL DISTRICT,2015,0.280679187033702
0671,01,HILLS-BEAVER CREEK SCHOOL DISTRICT,2015,0.275862068965517
0676,01,BADGER PUBLIC SCHOOL DISTRICT,2015,0.460629921259843
0682,01,ROSEAU PUBLIC SCHOOL DISTRICT,2015,0.251497005988024
0690,01,WARROAD PUBLIC SCHOOL DISTRICT,2015,0.408548707753479
0695,01,CHISHOLM PUBLIC SCHOOL DISTRICT,2015,0.447902571041949
0696,01,ELY PUBLIC SCHOOL DISTRICT,2015,0.35036496350365
0698,01,FLOODWOOD PUBLIC SCHOOL DISTRICT,2015,0.452674897119342
0700,01,HERMANTOWN PUBLIC SCHOOL DISTRICT,2015,0.152003910068426
0701,01,HIBBING PUBLIC SCHOOL DISTRICT,2015,0.44077834179357
0704,01,PROCTOR PUBLIC SCHOOL DISTRICT,2015,0.330717488789238
0706,01,VIRGINIA PUBLIC SCHOOL DISTRICT,2015,0.398058252427184
0707,01,NETT LAKE PUBLIC SCHOOL DISTRICT,2015,0.788888888888889
0709,01,DULUTH PUBLIC SCHOOL DISTRICT,2015,0.468702996644684
0712,01,MOUNTAIN IRON-BUHL SCHOOL DISTRICT,2015,0.540106951871658
0716,01,BELLE PLAINE PUBLIC SCHOOL DISTRICT,2015,0.197236180904523
0717,01,JORDAN PUBLIC SCHOOL DISTRICT,2015,0.244977678571429
0719,01,PRIOR LAKE-SAVAGE AREA SCHOOLS,2015,0.137151865475565
0720,01,SHAKOPEE PUBLIC SCHOOL DISTRICT,2015,0.335769230769231
0721,01,NEW PRAGUE AREA SCHOOLS,2015,0.141409021794222
0726,01,BECKER PUBLIC SCHOOL DISTRICT,2015,0.180870190578928
0727,01,BIG LAKE PUBLIC SCHOOL DISTRICT,2015,0.270303781773094
0728,01,ELK RIVER PUBLIC SCHOOL DISTRICT,2015,0.193435209730235
0738,01,HOLDINGFORD PUBLIC SCHOOL DISTRICT,2015,0.259920634920635
0739,01,KIMBALL PUBLIC SCHOOL DISTRICT,2015,0.265395894428152
0740,01,MELROSE PUBLIC SCHOOL DISTRICT,2015,0.419807834441981
0741,01,PAYNESVILLE PUBLIC SCHOOL DISTRICT,2015,0.346723044397463
0742,01,ST. CLOUD PUBLIC SCHOOL DISTRICT,2015,0.566922081799184
0743,01,SAUK CENTRE PUBLIC SCHOOL DISTRICT,2015,0.353535353535354
0745,01,ALBANY PUBLIC SCHOOL DISTRICT,2015,0.247349823321555
0748,01,SARTELL-ST. STEPHEN SCHOOL DISTRICT,2015,0.156978301634074
0750,01,ROCORI PUBLIC SCHOOL DISTRICT,2015,0.256523879862137
0756,01,BLOOMING PRAIRIE PUBLIC SCHOOL DIST,2015,0.371104815864023
0761,01,OWATONNA PUBLIC SCHOOL DISTRICT,2015,0.431537828947368
0763,01,MEDFORD PUBLIC SCHOOL DISTRICT,2015,0.339600470035253
0768,01,HANCOCK PUBLIC SCHOOL DISTRICT,2015,0.158227848101266
0771,01,CHOKIO-ALBERTA PUBLIC SCHOOL DIST.,2015,0.405882352941176
0775,01,KERKHOVEN-MURDOCK-SUNBURG,2015,0.408653846153846
0777,01,BENSON PUBLIC SCHOOL DISTRICT,2015,0.341491841491841
0786,01,BERTHA-HEWITT PUBLIC SCHOOL DIST.,2015,0.54278728606357
0787,01,BROWERVILLE PUBLIC SCHOOL DISTRICT,2015,0.536340852130326
0801,01,BROWNS VALLEY PUBLIC SCHOOL DIST.,2015,0.7
0803,01,WHEATON AREA PUBLIC SCHOOL DISTRICT,2015,0.347394540942928
0811,01,WABASHA-KELLOGG PUBLIC SCHOOL DIST.,2015,0.340619307832423
0813,01,LAKE CITY PUBLIC SCHOOL DISTRICT,2015,0.2904
0818,01,VERNDALE PUBLIC SCHOOL DISTRICT,2015,0.598076923076923
0820,01,SEBEKA PUBLIC SCHOOL DISTRICT,2015,0.510593220338983
0821,01,MENAHGA PUBLIC SCHOOL DISTRICT,2015,0.509947643979058
0829,01,WASECA PUBLIC SCHOOL DISTRICT,2015,0.448385389094759
0831,01,FOREST LAKE PUBLIC SCHOOL DISTRICT,2015,0.237734706238643
0832,01,MAHTOMEDI PUBLIC SCHOOL DISTRICT,2015,0.0897201946472019
0833,01,SOUTH WASHINGTON COUNTY SCHOOL DIST,2015,0.200057520851309
0834,01,STILLWATER AREA PUBLIC SCHOOL DIST.,2015,0.165179677819083
0836,01,BUTTERFIELD PUBLIC SCHOOL DISTRICT,2015,0.524444444444444
0837,01,MADELIA PUBLIC SCHOOL DISTRICT,2015,0.519607843137255
0840,01,ST. JAMES PUBLIC SCHOOL DISTRICT,2015,0.547692307692308
0846,01,BRECKENRIDGE PUBLIC SCHOOL DISTRICT,2015,0.363777089783282
0850,01,ROTHSAY PUBLIC SCHOOL DISTRICT,2015,0.422222222222222
0852,01,CAMPBELL-TINTAH PUBLIC SCHOOL DIST.,2015,0.550335570469799
0857,01,LEWISTON-ALTURA PUBLIC SCHOOL DIST.,2015,0.359116022099448
0858,01,ST. CHARLES PUBLIC SCHOOL DISTRICT,2015,0.311926605504587
0861,01,WINONA AREA PUBLIC SCHOOL DISTRICT,2015,0.368404118404118
0876,01,ANNANDALE PUBLIC SCHOOL DISTRICT,2015,0.249564712710389
0877,01,BUFFALO-HANOVER-MONTROSE PUBLIC SCH,2015,0.249565821465787
0879,01,DELANO PUBLIC SCHOOL DISTRICT,2015,0.124158249158249
0881,01,MAPLE LAKE PUBLIC SCHOOL DISTRICT,2015,0.21566401816118
0882,01,MONTICELLO PUBLIC SCHOOL DISTRICT,2015,0.272415482606565
0883,01,ROCKFORD PUBLIC SCHOOL DISTRICT,2015,0.262589928057554
0885,01,ST. MICHAEL-ALBERTVILLE SCHOOL DIST,2015,0.126474106990258
0891,01,CANBY PUBLIC SCHOOL DISTRICT,2015,0.348514851485148
0911,01,CAMBRIDGE-ISANTI PUBLIC SCHOOL DIST,2015,0.351046368485843
0912,01,MILACA PUBLIC SCHOOL DISTRICT,2015,0.447507953340403
0914,01,ULEN-HITTERDAL PUBLIC SCHOOL DIST,2015,0.302931596091205
0915,52,SOUTHERN PLAINS EDUCATION COOP.,2015,0.722222222222222
0916,06,NORTHEAST METRO 916,2015,0.603580562659846
0917,06,INTERMEDIATE SCHOOL DISTRICT 917,2015,0.410296411856474
0926,83,REGION 4-LAKES COUNTRY SERVICE COOP,2015,0.487179487179487
0935,52,FERGUS FALLS AREA SP. ED. COOP.,2015,0.785714285714286
0938,52,MEEKER AND WRIGHT SPECIAL EDUCATION,2015,0.757142857142857
0966,51,WRIGHT TECHNICAL CENTER,2015,0.384057971014493
0991,83,REGION 6 AND 8-SW/WC SERVICE COOP,2015,0.602739726027397
0998,52,BEMIDJI REGIONAL INTERDIST. COUNCIL,2015,NaN
1000,70,PERPICH CENTER FOR ARTS EDUCATION,2015,0.0646551724137931
1100,60,MINNESOTA DEPARTMENT OF CORRECTIONS,2015,1
2071,01,LAKE CRYSTAL-WELLCOME MEMORIAL,2015,0.299763033175355
2125,01,TRITON SCHOOL DISTRICT,2015,0.402631578947368
2134,01,UNITED SOUTH CENTRAL SCHOOL DIST.,2015,0.47209653092006
2135,01,MAPLE RIVER SCHOOL DISTRICT,2015,0.372651356993737
2137,01,KINGSLAND PUBLIC SCHOOL DISTRICT,2015,0.315525876460768
2142,01,ST. LOUIS COUNTY SCHOOL DISTRICT,2015,0.479811221814368
2143,01,WATERVILLE-ELYSIAN-MORRISTOWN,2015,0.325637910085055
2144,01,CHISAGO LAKES SCHOOL DISTRICT,2015,0.225203497135966
2149,01,MINNEWASKA SCHOOL DISTRICT,2015,0.355098389982111
2154,01,EVELETH-GILBERT SCHOOL DISTRICT,2015,0.411428571428571
2155,01,WADENA-DEER CREEK SCHOOL DISTRICT,2015,0.521694214876033
2159,01,BUFFALO LK-HECTOR-STEWART PUBLIC SC,2015,0.404293381037567
2164,01,DILWORTH-GLYNDON-FELTON,2015,0.262857142857143
2165,01,HINCKLEY-FINLAYSON SCHOOL DISTRICT,2015,0.586134453781513
2167,01,LAKEVIEW SCHOOL DISTRICT,2015,0.338345864661654
2168,01,NRHEG SCHOOL DISTRICT,2015,0.381997804610318
2169,01,MURRAY COUNTY CENTRAL SCHOOL DIST.,2015,0.329715061058345
2170,01,STAPLES-MOTLEY SCHOOL DISTRICT,2015,0.550214592274678
2171,01,KITTSON CENTRAL SCHOOL DISTRICT,2015,0.27831715210356
2172,01,KENYON-WANAMINGO SCHOOL DISTRICT,2015,0.318840579710145
2174,01,PINE RIVER-BACKUS SCHOOL DISTRICT,2015,0.633037694013304
2176,01,WARREN-ALVARADO-OSLO SCHOOL DIST.,2015,0.457399103139013
2180,01,MACCRAY SCHOOL DISTRICT,2015,0.492647058823529
2184,01,LUVERNE PUBLIC SCHOOL DISTRICT,2015,0.321877619446773
2190,01,YELLOW MEDICINE EAST,2015,0.447798742138365
2198,01,FILLMORE CENTRAL,2015,0.380305602716469
2215,01,NORMAN COUNTY EAST SCHOOL DISTRICT,2015,0.466666666666667
2310,01,SIBLEY EAST SCHOOL DISTRICT,2015,0.426506024096386
2311,01,CLEARBROOK-GONVICK SCHOOL DISTRICT,2015,0.521739130434783
2342,01,WEST CENTRAL AREA,2015,0.369958275382476
2358,01,TRI-COUNTY SCHOOL DISTRICT,2015,0.489473684210526
2364,01,BELGRADE-BROOTEN-ELROSA SCHOOL DIST,2015,0.294025157232704
2365,01,G.F.W.,2015,0.439414114513981
2396,01,A.C.G.C. PUBLIC SCHOOL DISTRICT,2015,0.438735177865613
2397,01,LE SUEUR-HENDERSON SCHOOL DISTRICT,2015,0.390384615384615
2448,01,MARTIN COUNTY WEST SCHOOL DISTRICT,2015,0.409438775510204
2527,01,NORMAN COUNTY WEST SCHOOL DISTRICT,2015,0.508474576271186
2534,01,BIRD ISLAND-OLIVIA-LAKE LILLIAN,2015,0.471671388101983
2536,01,GRANADA HUNTLEY-EAST CHAIN,2015,0.439153439153439
2580,01,EAST CENTRAL SCHOOL DISTRICT,2015,0.569083447332421
2609,01,WIN-E-MAC SCHOOL DISTRICT,2015,0.447916666666667
2683,01,GREENBUSH-MIDDLE RIVER SCHOOL DIST.,2015,0.284009546539379
2687,01,HOWARD LAKE-WAVERLY-WINSTED,2015,0.300551470588235
2689,01,PIPESTONE AREA SCHOOL DISTRICT,2015,0.471698113207547
2711,01,MESABI EAST SCHOOL DISTRICT,2015,0.439824945295405
2752,01,FAIRMONT AREA SCHOOL DISTRICT,2015,0.443473193473193
2753,01,LONG PRAIRIE-GREY EAGLE SCHOOL DIST,2015,0.598631698973774
2754,01,CEDAR MOUNTAIN SCHOOL DISTRICT,2015,0.463362068965517
2769,01,MORRIS AREA PUBLIC SCHOOLS,2015,0.278978388998035
2805,01,ZUMBROTA-MAZEPPA SCHOOL DISTRICT,2015,0.215616681455191
2835,01,JANESVILLE-WALDORF-PEMBERTON,2015,0.27906976744186
2853,01,LAC QUI PARLE VALLEY SCHOOL DIST.,2015,0.430609597924773
2854,01,ADA-BORUP PUBLIC SCHOOL DISTRICT,2015,0.402105263157895
2856,01,STEPHEN-ARGYLE CENTRAL SCHOOLS,2015,0.412844036697248
2859,01,GLENCOE-SILVER LAKE SCHOOL DISTRICT,2015,0.357188498402556
2860,01,BLUE EARTH AREA PUBLIC SCHOOL,2015,0.462624584717608
2884,01,RED ROCK CENTRAL SCHOOL DISTRICT,2015,0.423684210526316
2886,01,GLENVILLE-EMMONS SCHOOL DISTRICT,2015,0.346846846846847
2888,01,CLINTON-GRACEVILLE-BEARDSLEY,2015,0.463636363636364
2889,01,LAKE PARK AUDUBON SCHOOL DISTRICT,2015,0.408759124087591
2890,01,RENVILLE COUNTY WEST SCHOOL DIST.,2015,0.530451866404715
2895,01,JACKSON COUNTY CENTRAL SCHOOL DIST.,2015,0.368465430016863
2897,01,REDWOOD AREA SCHOOL DISTRICT,2015,0.416896235078053
2898,01,WESTBROOK-WALNUT GROVE SCHOOLS,2015,0.526717557251908
2899,01,PLAINVIEW-ELGIN-MILLVILLE,2015,0.288474810213941
2902,01,RTR PUBLIC SCHOOLS,2015,0.298093587521664
2903,01,ORTONVILLE PUBLIC SCHOOLS,2015,0.397089397089397
2904,01,TRACY AREA PUBLIC SCHOOL DISTRICT,2015,0.532279314888011
2905,01,TRI-CITY UNITED SCHOOL DISTRICT,2015,0.385066666666667
2906,01,RED LAKE COUNTY CENTRAL PUBLIC SCH,2015,0.513227513227513
2907,01,ROUND LAKE-BREWSTER PUBLIC SCHOOLS,2015,0.775401069518717
2908,01,BRANDON-EVANSVILLE PUBLIC SCHOOLS,2015,0.342789598108747
4000,07,CITY ACADEMY,2015,0.594827586206897
4001,07,BLUFFVIEW MONTESSORI,2015,0.28042328042328
4003,07,"NEW HEIGHTS SCHOOL, INC.",2015,0.607142857142857
4004,07,CEDAR RIVERSIDE COMMUNITY SCHOOL,2015,0.956521739130435
4005,07,METRO DEAF SCHOOL,2015,0.684210526315789
4007,07,MINNESOTA NEW COUNTRY SCHOOL,2015,0.339712918660287
4008,07,PACT CHARTER SCHOOL,2015,0.139784946236559
4011,07,ATHLOS LEADERSHIP ACADEMY,2015,0.543710021321962
4015,07,COMMUNITY OF PEACE ACADEMY,2015,0.836340206185567
4016,07,WORLD LEARNER CHARTER SCHOOL,2015,0.0956937799043062
4017,07,MINNESOTA TRANSITIONS CHARTER SCH,2015,0.490027510316369
4018,07,ACHIEVE LANGUAGE ACADEMY,2015,0.795348837209302
4020,07,DULUTH PUBLIC SCHOOLS ACADEMY,2015,0.388597149287322
4025,07,CYBER VILLAGE ACADEMY,2015,0.258620689655172
4026,07,E.C.H.O. CHARTER SCHOOL,2015,0.6
4027,07,HIGHER GROUND ACADEMY,2015,0.965181058495822
4029,07,ST. PAUL CITY SCHOOL,2015,0.985576923076923
4031,07,JENNINGS COMMUNITY SCHOOL,2015,0.714285714285714
4032,07,HARVEST PREPARATORY SCHOOL,2015,0.929411764705882
4035,07,LIFE PREP,2015,0.767801857585139
4036,07,FACE TO FACE ACADEMY,2015,0.921052631578947
4038,07,SOJOURNER TRUTH ACADEMY,2015,0.957605985037406
4039,07,HIGH SCHOOL FOR RECORDING ARTS,2015,0.985611510791367
4043,07,MATH AND SCIENCE ACADEMY,2015,0.0188284518828452
4049,07,NORTHWEST PASSAGE HIGH SCHOOL,2015,0.358974358974359
4050,07,LAFAYETTE PUBLIC CHARTER SCHOOL,2015,0.595505617977528
4053,07,NORTH LAKES ACADEMY,2015,0.262086513994911
4054,07,LA CRESCENT MONTESSORI & STEM SCHOO,2015,0.524590163934426
4055,07,NERSTRAND CHARTER SCHOOL,2015,0.164473684210526
4056,07,ROSA PARKS CHARTER HIGH SCHOOL,2015,0.598214285714286
4057,07,EL COLEGIO CHARTER SCHOOL,2015,0.947916666666667
4058,07,SCHOOLCRAFT LEARNING COMMUNITY CHTR,2015,0.524064171122995
4059,07,CROSSLAKE COMMUNITY CHARTER SCHOOL,2015,0.418439716312057
4064,07,RIVERWAY LEARNING COMMUNITY CHTR,2015,0.762886597938144
4066,07,KATO PUBLIC CHARTER SCHOOL,2015,0.590361445783133
4067,07,AURORA CHARTER SCHOOL,2015,0.945454545454545
4068,07,EXCELL ACADEMY CHARTER,2015,0.955307262569832
4070,07,HOPE COMMUNITY ACADEMY,2015,0.811440677966102
4073,07,ACADEMIA CESAR CHAVEZ CHARTER SCH.,2015,0.954674220963173
4074,07,AFSA HIGH SCHOOL,2015,0.369791666666667
4075,07,AVALON SCHOOL,2015,0.242424242424242
4077,07,TWIN CITIES INTERNATIONAL ELEM SCH,2015,0.966666666666667
4078,07,MINNESOTA INTERNATIONAL MIDDLE CHTR,2015,0.966587112171838
4079,07,FRIENDSHIP ACDMY OF FINE ARTS CHTR.,2015,0.933823529411765
4080,07,PILLAGER AREA CHARTER SCHOOL,2015,0.755555555555556
4081,07,DISCOVERY PUBLIC SCHOOL FARIBAULT,2015,0.709090909090909
4082,07,BLUESKY CHARTER SCHOOL,2015,0.34375
4083,07,RIDGEWAY COMMUNITY SCHOOL,2015,0.236559139784946
4084,07,NORTH SHORE COMMUNITY SCHOOL,2015,0.343373493975904
4085,07,HARBOR CITY INTERNATIONAL CHARTER,2015,0.424528301886792
4087,07,SAGE ACADEMY CHARTER SCHOOL,2015,0.662921348314607
4088,07,URBAN ACADEMY CHARTER SCHOOL,2015,0.96830985915493
4089,07,NEW CITY SCHOOL,2015,0.419811320754717
4090,07,PRAIRIE CREEK COMMUNITY SCHOOL,2015,0.143646408839779
4091,07,ARCADIA CHARTER SCHOOL,2015,0.23015873015873
4092,07,WATERSHED HIGH SCHOOL,2015,0.725490196078431
4093,07,NEW CENTURY ACADEMY,2015,0.604651162790698
4095,07,TRIO WOLF CREEK DISTANCE LEARNING,2015,0.245033112582781
4097,07,"PARTNERSHIP ACADEMY, INC.",2015,0.98989898989899
4098,07,NOVA CLASSICAL ACADEMY,2015,0.121012101210121
4100,07,GREAT EXPECTATIONS,2015,0.423076923076923
4102,07,MINNESOTA INTERNSHIP CENTER,2015,0.945652173913043
4103,07,HMONG COLLEGE PREP ACADEMY,2015,0.872217642209398
4104,07,PALADIN CAREER AND TECH HIGH SCHOOL,2015,0.879858657243816
4105,07,GREAT RIVER SCHOOL,2015,0.0971563981042654
4106,07,TREKNORTH HIGH SCHOOL,2015,0.550200803212851
4107,07,VOYAGEURS EXPEDITIONARY,2015,0.8
4110,07,PIM ARTS HIGH SCHOOL,2015,0.264705882352941
4111,07,AUGSBURG FAIRVIEW ACADEMY,2015,0.875862068965517
4112,07,ST PAUL CONSERVATORY PERFORMING ART,2015,0.169354838709677
4113,07,SPERO ACADEMY,2015,0.425
4116,07,LAKES INTERNATIONAL LANGUAGE ACADEM,2015,0.112925170068027
4118,07,KALEIDOSCOPE CHARTER SCHOOL,2015,0.197211155378486
4119,07,ACADEMIC ARTS HIGH SCHOOL,2015,0.556962025316456
4120,07,ST. CROIX PREPARATORY ACADEMY,2015,0.0794066317626527
4121,07,UBAH MEDICAL ACADEMY CHARTER SCHOOL,2015,0.997289972899729
4122,07,EAGLE RIDGE ACADEMY CHARTER SCHOOL,2015,0.178654292343387
4124,07,BEACON ACADEMY,2015,0.169117647058824
4126,07,PRAIRIE SEEDS ACADEMY,2015,0.768152866242038
4127,07,TEAM ACADEMY,2015,0.739130434782609
4131,07,METRO SCHOOLS CHARTER,2015,0.822916666666667
4132,07,TWIN CITIES ACADEMY,2015,0.456896551724138
4135,07,ROCHESTER MATH AND SCIENCE ACADEMY,2015,0.96830985915493
4137,07,SWAN RIVER MONTESSORI CHARTER SCH,2015,0.0939597315436242
4138,07,MILROY AREA CHARTER SCHOOL,2015,0.306122448979592
4139,07,LOVEWORKS ACADEMY FOR ARTS,2015,0.895454545454546
4140,07,YINGHUA ACADEMY,2015,0.139430284857571
4142,07,STRIDE ACADEMY CHARTER SCHOOL,2015,0.476190476190476
4143,07,NEW MILLENNIUM ACADEMY CHARTER SCH,2015,0.850931677018634
4144,07,GREEN ISLE COMMUNITY SCHOOL,2015,0.410714285714286
4145,07,BIRCH GROVE COMMUNITY SCHOOL,2015,0.545454545454545
4146,07,NORTHERN LIGHTS COMMUNITY SCHOOL,2015,0.806818181818182
4150,07,MINNESOTA ONLINE HIGH SCHOOL,2015,0.123188405797101
4151,07,EDVISIONS OFF CAMPUS SCHOOL,2015,0.306122448979592
4152,07,TWIN CITIES GERMAN IMMERSION CHTR,2015,0.0835266821345708
4153,07,DUGSI ACADEMY,2015,0.907142857142857
4155,07,NAYTAHWAUSH COMMUNITY SCHOOL,2015,0.943089430894309
4159,07,SEVEN HILLS PREPARATORY ACADEMY,2015,0.205056179775281
4160,07,SPECTRUM HIGH SCHOOL,2015,0.171334431630972
4161,07,NEW DISCOVERIES MONTESSORI ACADEMY,2015,0.55
4162,07,SOUTHSIDE FAMILY CHARTER SCHOOL,2015,0.532110091743119
4163,07,LEARNING FOR LEADERSHIP CHARTER,2015,0.866952789699571
4164,07,LAURA JEFFREY ACADEMY CHARTER,2015,0.466666666666667
4166,07,EAST RANGE ACADEMY OF TECH-SCIENCE,2015,0.816793893129771
4167,07,INTERNATIONAL SPANISH LANGUAGE ACAD,2015,0.0702341137123746
4168,07,GLACIAL HILLS ELEMENTARY,2015,0.56
4169,07,STONEBRIDGE WORLD SCHOOL,2015,0.8984375
4170,07,HIAWATHA ACADEMIES,2015,0.946172248803828
4171,07,NOBLE ACADEMY,2015,0.749460043196544
4172,07,CLARKFIELD CHARTER SCHOOL,2015,0.566666666666667
4177,07,MINISINAAKWAANG LEADERSHIP ACADEMY,2015,0.615384615384615
4178,07,LINCOLN INTERNATIONAL SCHOOL,2015,1
4181,07,COMMUNITY SCHOOL OF EXCELLENCE,2015,0.908324552160169
4183,07,LIONSGATE ACADEMY,2015,0.137724550898204
4184,07,ASPEN ACADEMY,2015,0.126159554730983
4185,07,DAVINCI ACADEMY,2015,0.172749391727494
4186,07,GLOBAL ACADEMY,2015,0.911627906976744
4187,07,NATURAL SCIENCE ACADEMY,2015,0.129032258064516
4188,07,COLOGNE ACADEMY,2015,0.163021868787276
4189,07,BRIGHT WATER ELEMENTARY,2015,0.493827160493827
4190,07,RIVERS EDGE ACADEMY,2015,0.642857142857143
4191,07,KIPP MINNESOTA CHARTER SCHOOL,2015,0.917647058823529
4192,07,BEST ACADEMY,2015,0.927051671732523
4193,07,COLLEGE PREPARATORY ELEMENTARY,2015,0.929936305732484
4194,07,CANNON RIVER STEM SCHOOL,2015,0.312925170068027
4195,07,OSHKI OGIMAAG CHARTER SCHOOL,2015,0.903225806451613
4198,07,DISCOVERY WOODS,2015,0.628571428571429
4199,07,PARNASSUS PREPARATORY CHARTER SCH,2015,0.177278401997503
4200,07,STEP ACADEMY CHARTER SCHOOL,2015,0.973484848484849
4201,07,CORNERSTONE MONTESSORI ELEMENTARY,2015,0.588709677419355
4204,07,ROCHESTER STEM ACADEMY,2015,0.95
4205,07,HENNEPIN ELEMENTARY SCHOOL,2015,0.956692913385827
4207,07,VERMILION COUNTRY SCHOOL,2015,0.5
4208,07,NASHA SHKOLA CHARTER SCHOOL,2015,0.6953125
4209,07,MASTERY SCHOOL,2015,0.931174089068826
4210,07,UPPER MISSISSIPPI ACADEMY,2015,0.143478260869565
4212,07,WEST SIDE SUMMIT CHARTER SCHOOL,2015,0.929824561403509
4213,07,PRODEO ACADEMY,2015,0.968253968253968
4215,07,SEJONG ACADEMY OF MINNESOTA,2015,0.433333333333333
4217,07,TECHNICAL ACADEMIES OF MINNESOTA,2015,0.503759398496241
4218,07,VENTURE ACADEMY,2015,0.902702702702703
4219,07,NORTHEAST COLLEGE PREP,2015,0.924137931034483
4220,07,AGAMIM CLASSICAL ACADEMY,2015,NA
4221,07,DISCOVERY CHARTER SCHOOL,2015,NA
4223,07,SAINT CLOUD MATH AND SCIENCE ACADEM,2015,0.985507246376812
4224,07,STAR OF THE NORTH ACADEMY CHARTER S,2015,0.684782608695652
4225,07,UNIVERSAL ACADEMY CHARTER SCHOOL,2015,0.994011976047904
4226,07,BDOTE LEARNING CENTER,2015,0.830508474576271
4227,07,ART AND SCIENCE ACADEMY,2015,0.134615384615385
4228,07,WOODBURY LEADERSHIP ACADEMY,2015,0.0564102564102564
4229,07,JANE GOODALL ENVIRONMENTAL SCIENCE,2015,NA
4230,07,MINNESOTA EXCELLENCE IN LEARNING AC,2015,NA
4231,07,MINNESOTA MATH AND SCIENCE ACADEMY,2015,0.939622641509434
4232,07,SUCCESS ACADEMY,2015,NA
4233,07,LEVEL UP ACADEMY,2015,NA
4237,07,CAREER PATHWAYS,2015,NA
4238,07,ROCHESTER BEACON ACADEMY,2015,NA
4239,07,TESFA INTERNATIONAL SCHOOL,2015,NA
4240,07,NEW CENTURY SCHOOL,2015,NA
4243,07,NORTH METRO FLEX ACADEMY,2015,NA
4244,07,FIT ACADEMY,2015,NA
4246,07,BIG PICTURE TWIN CITIES,2015,NA
4250,07,ATHLOS ACADEMY OF SAINT CLOUD,2015,NA
4254,07,MARINE AREA COMMUNITY SCHOOL,2015,NA
6004,61,FRESHWATER ED. DIST.,2015,0.733333333333333
6012,61,ZUMBRO EDUCATION DISTRICT,2015,0.753968253968254
6013,61,HIAWATHA VALLEY ED. DISTRICT,2015,0.608108108108108
6014,61,RUNESTONE AREA ED. DISTRICT,2015,0.571428571428571
6018,61,MN RIVER VALLEY EDUCATION DISTRICT,2015,0.55
6026,61,WEST CENTRAL EDUCATION DISTRICT,2015,0.205128205128205
6027,61,MN VALLEY EDUCATION DISTRICT,2015,0.72
6049,61,RIVER BEND EDUCATION DISTRICT,2015,0.655555555555556
6051,61,GOODHUE COUNTY EDUCATION DISTRICT,2015,0.4765625
