DistrictNumber,DistrictType,districtName,year,percentLunch
0001,01,AITKIN PUBLIC SCHOOL DISTRICT,2006,0.37070938215103
0001,03,MINNEAPOLIS PUBLIC SCHOOL DISTRICT,2006,0.66788821513314
0002,01,HILL CITY PUBLIC SCHOOL DISTRICT,2006,0.551829268292683
0004,01,MCGREGOR PUBLIC SCHOOL DISTRICT,2006,0.608407079646018
0006,03,SOUTH ST. PAUL PUBLIC SCHOOL DIST.,2006,0.340319049108539
0011,01,ANOKA-HENNEPIN PUBLIC SCHOOL DIST.,2006,0.22919768605531
0012,01,CENTENNIAL PUBLIC SCHOOL DISTRICT,2006,0.108478983099812
0013,01,COLUMBIA HEIGHTS PUBLIC SCHOOL DIST,2006,0.588315681585241
0014,01,FRIDLEY PUBLIC SCHOOL DISTRICT,2006,0.437125748502994
0015,01,ST. FRANCIS PUBLIC SCHOOL DISTRICT,2006,0.199207135777998
0016,01,SPRING LAKE PARK PUBLIC SCHOOLS,2006,0.270484581497797
0022,01,DETROIT LAKES PUBLIC SCHOOL DIST.,2006,0.347072419106317
0023,01,FRAZEE-VERGAS PUBLIC SCHOOL DIST.,2006,0.438709677419355
0025,01,PINE POINT PUBLIC SCHOOL DISTRICT,2006,0.96875
0031,01,BEMIDJI PUBLIC SCHOOL DISTRICT,2006,0.447545111204364
0032,01,BLACKDUCK PUBLIC SCHOOL DISTRICT,2006,0.516901408450704
0036,01,KELLIHER PUBLIC SCHOOL DISTRICT,2006,0.778210116731518
0038,01,RED LAKE PUBLIC SCHOOL DISTRICT,2006,0.814627081824765
0047,01,SAUK RAPIDS-RICE PUBLIC SCHOOLS,2006,0.263739224137931
0051,01,FOLEY PUBLIC SCHOOL DISTRICT,2006,0.252707581227437
0075,01,ST. CLAIR PUBLIC SCHOOL DISTRICT,2006,0.209702660406886
0077,01,MANKATO PUBLIC SCHOOL DISTRICT,2006,0.281614996395097
0081,01,COMFREY PUBLIC SCHOOL DISTRICT,2006,0.384105960264901
0084,01,SLEEPY EYE PUBLIC SCHOOL DISTRICT,2006,0.484760522496372
0085,01,SPRINGFIELD PUBLIC SCHOOL DISTRICT,2006,0.296474358974359
0088,01,NEW ULM PUBLIC SCHOOL DISTRICT,2006,0.169898430286242
0091,01,BARNUM PUBLIC SCHOOL DISTRICT,2006,0.360824742268041
0093,01,CARLTON PUBLIC SCHOOL DISTRICT,2006,0.300518134715026
0094,01,CLOQUET PUBLIC SCHOOL DISTRICT,2006,0.345662703654778
0095,01,CROMWELL-WRIGHT PUBLIC SCHOOLS,2006,0.408945686900958
0097,01,MOOSE LAKE PUBLIC SCHOOL DISTRICT,2006,0.295945945945946
0099,01,ESKO PUBLIC SCHOOL DISTRICT,2006,0.089126559714795
0100,01,WRENSHALL PUBLIC SCHOOL DISTRICT,2006,0.346153846153846
0108,01,CENTRAL PUBLIC SCHOOL DISTRICT,2006,0.186094069529652
0110,01,WACONIA PUBLIC SCHOOL DISTRICT,2006,0.0838852097130243
0111,01,WATERTOWN-MAYER PUBLIC SCHOOL DIST.,2006,0.143894389438944
0112,01,EASTERN CARVER COUNTY PUBLIC SCHOOL,2006,0.138271311377957
0113,01,WALKER-HACKENSACK-AKELEY SCHL. DIST,2006,0.435602094240838
0115,01,CASS LAKE-BENA PUBLIC SCHOOLS,2006,0.701904761904762
0116,01,PILLAGER PUBLIC SCHOOL DISTRICT,2006,0.46978021978022
0118,01,NORTHLAND COMMUNITY SCHOOLS,2006,0.632887189292543
0129,01,MONTEVIDEO PUBLIC SCHOOL DISTRICT,2006,0.380555555555556
0138,01,NORTH BRANCH PUBLIC SCHOOLS,2006,0.214465092918132
0139,01,RUSH CITY PUBLIC SCHOOL DISTRICT,2006,0.279306829765545
0146,01,BARNESVILLE PUBLIC SCHOOL DIST.,2006,0.231754161331626
0150,01,HAWLEY PUBLIC SCHOOL DISTRICT,2006,0.183537263626251
0152,01,MOORHEAD PUBLIC SCHOOL DISTRICT,2006,0.288057993132392
0160,70,MINNESOTA STATE ACADEMIES,2006,0.808743169398907
0162,01,BAGLEY PUBLIC SCHOOL DISTRICT,2006,0.532894736842105
0166,01,COOK COUNTY PUBLIC SCHOOLS,2006,0.279461279461279
0173,01,MOUNTAIN LAKE PUBLIC SCHOOLS,2006,0.454361054766734
0177,01,WINDOM PUBLIC SCHOOL DISTRICT,2006,0.290288153681964
0181,01,BRAINERD PUBLIC SCHOOL DISTRICT,2006,0.348252344416027
0182,01,CROSBY-IRONTON PUBLIC SCHOOL DIST.,2006,0.414944356120827
0186,01,PEQUOT LAKES PUBLIC SCHOOLS,2006,0.306982872200263
0191,01,BURNSVILLE PUBLIC SCHOOL DISTRICT,2006,0.241737308315078
0192,01,FARMINGTON PUBLIC SCHOOL DISTRICT,2006,0.124025636584098
0194,01,LAKEVILLE PUBLIC SCHOOL DISTRICT,2006,0.0682756722033587
0195,01,RANDOLPH PUBLIC SCHOOL DISTRICT,2006,0.133891213389121
0196,01,ROSEMOUNT-APPLE VALLEY-EAGAN,2006,0.121446008041356
0197,01,WEST ST. PAUL-MENDOTA HTS.-EAGAN,2006,0.295252547149361
0199,01,INVER GROVE HEIGHTS SCHOOLS,2006,0.214766909188898
0200,01,HASTINGS PUBLIC SCHOOL DISTRICT,2006,0.170746150809317
0203,01,HAYFIELD PUBLIC SCHOOL DISTRICT,2006,0.257491675915649
0204,01,KASSON-MANTORVILLE SCHOOL DISTRICT,2006,0.105715730905412
0206,01,ALEXANDRIA PUBLIC SCHOOL DISTRICT,2006,0.25056832533468
0213,01,OSAKIS PUBLIC SCHOOL DISTRICT,2006,0.307042253521127
0227,01,CHATFIELD PUBLIC SCHOOLS,2006,0.147345612134345
0229,01,LANESBORO PUBLIC SCHOOL DISTRICT,2006,0.382920110192837
0238,01,MABEL-CANTON PUBLIC SCHOOL DIST.,2006,0.292753623188406
0239,01,RUSHFORD-PETERSON PUBLIC SCHOOLS,2006,0.352220520673813
0241,01,ALBERT LEA PUBLIC SCHOOL DISTRICT,2006,0.380373303167421
0242,01,ALDEN-CONGER PUBLIC SCHOOL DISTRICT,2006,0.29656862745098
0252,01,CANNON FALLS PUBLIC SCHOOL DISTRICT,2006,0.178807947019868
0253,01,GOODHUE PUBLIC SCHOOL DISTRICT,2006,0.171009771986971
0255,01,PINE ISLAND PUBLIC SCHOOL DIST.,2006,0.175324675324675
0256,01,RED WING PUBLIC SCHOOL DISTRICT,2006,0.205020920502092
0261,01,ASHBY PUBLIC SCHOOL DISTRICT,2006,0.251798561151079
0264,01,HERMAN-NORCROSS SCHOOL DISTRICT,2006,0.571428571428571
0270,01,HOPKINS PUBLIC SCHOOL DISTRICT,2006,0.194157642911106
0271,01,BLOOMINGTON PUBLIC SCHOOL DISTRICT,2006,0.285238729313297
0272,01,EDEN PRAIRIE PUBLIC SCHOOL DISTRICT,2006,0.103486722075816
0273,01,EDINA PUBLIC SCHOOL DISTRICT,2006,0.0675422138836773
0276,01,MINNETONKA PUBLIC SCHOOL DISTRICT,2006,0.0553951168285639
0277,01,WESTONKA PUBLIC SCHOOL DISTRICT,2006,0.116383169203223
0278,01,ORONO PUBLIC SCHOOL DISTRICT,2006,0.0478579698957931
0279,01,OSSEO PUBLIC SCHOOL DISTRICT,2006,0.288108762454605
0280,01,RICHFIELD PUBLIC SCHOOL DISTRICT,2006,0.489180646729881
0281,01,ROBBINSDALE PUBLIC SCHOOL DISTRICT,2006,0.348006958626428
0282,01,ST. ANTHONY-NEW BRIGHTON SCHOOLS,2006,0.136310223266745
0283,01,ST. LOUIS PARK PUBLIC SCHOOL DIST.,2006,0.26512832587709
0284,01,WAYZATA PUBLIC SCHOOL DISTRICT,2006,0.10080313014827
0286,01,BROOKLYN CENTER SCHOOL DISTRICT,2006,0.644484412470024
0287,06,INTERMEDIATE SCHOOL DISTRICT 287,2006,0.264254385964912
0288,06,SOUTHWEST METRO INTERMEDIATE 288,2006,NA
0294,01,HOUSTON PUBLIC SCHOOL DISTRICT,2006,0.153144940747493
0297,01,SPRING GROVE SCHOOL DISTRICT,2006,0.29940119760479
0299,01,CALEDONIA PUBLIC SCHOOL DISTRICT,2006,0.278362573099415
0300,01,LA CRESCENT-HOKAH SCHOOL DISTRICT,2006,0.150102810143934
0306,01,LAPORTE PUBLIC SCHOOL DISTRICT,2006,0.529411764705882
0308,01,NEVIS PUBLIC SCHOOL DISTRICT,2006,0.458984375
0309,01,PARK RAPIDS PUBLIC SCHOOL DISTRICT,2006,0.41169076052797
0314,01,BRAHAM PUBLIC SCHOOL DISTRICT,2006,0.345514950166113
0316,01,GREENWAY PUBLIC SCHOOL DISTRICT,2006,0.441362916006339
0317,01,DEER RIVER PUBLIC SCHOOL DISTRICT,2006,0.568041237113402
0318,01,GRAND RAPIDS PUBLIC SCHOOL DISTRICT,2006,0.324896694214876
0319,01,NASHWAUK-KEEWATIN SCHOOL DISTRICT,2006,0.456
0330,01,HERON LAKE-OKABENA SCHOOL DISTRICT,2006,0.276527331189711
0332,01,MORA PUBLIC SCHOOL DISTRICT,2006,0.331917153478492
0333,01,OGILVIE PUBLIC SCHOOL DISTRICT,2006,0.45718901453958
0345,01,NEW LONDON-SPICER SCHOOL DISTRICT,2006,0.182734719596723
0347,01,WILLMAR PUBLIC SCHOOL DISTRICT,2006,0.445024934694847
0356,01,LANCASTER PUBLIC SCHOOL DISTRICT,2006,0.524509803921569
0361,01,INTERNATIONAL FALLS SCHOOL DISTRICT,2006,0.311649016641452
0362,01,LITTLEFORK-BIG FALLS SCHOOL DIST.,2006,0.377245508982036
0363,01,SOUTH KOOCHICHING SCHOOL DISTRICT,2006,0.531506849315069
0378,01,DAWSON-BOYD PUBLIC SCHOOL DISTRICT,2006,0.345794392523364
0381,01,LAKE SUPERIOR PUBLIC SCHOOL DIST.,2006,0.257777777777778
0390,01,LAKE OF THE WOODS SCHOOL DISTRICT,2006,0.410742496050553
0391,01,CLEVELAND PUBLIC SCHOOL DISTRICT,2006,0.224938875305623
0397,52,LAKE AGASSIZ SPECIAL ED. COOP.,2006,NaN
0398,52,MIDWEST SPECIAL EDUCATION COOP.,2006,NaN
0402,01,HENDRICKS PUBLIC SCHOOL DISTRICT,2006,0.491620111731844
0403,01,IVANHOE PUBLIC SCHOOL DISTRICT,2006,0.303191489361702
0404,01,LAKE BENTON PUBLIC SCHOOL DISTRICT,2006,0.531914893617021
0413,01,MARSHALL PUBLIC SCHOOL DISTRICT,2006,0.265753424657534
0414,01,MINNEOTA PUBLIC SCHOOL DISTRICT,2006,0.325056433408578
0415,01,LYND PUBLIC SCHOOL DISTRICT,2006,0.666666666666667
0423,01,HUTCHINSON PUBLIC SCHOOL DISTRICT,2006,0.229125575279421
0424,01,LESTER PRAIRIE PUBLIC SCHOOL DIST.,2006,0.25
0432,01,MAHNOMEN PUBLIC SCHOOL DISTRICT,2006,0.582831325301205
0435,01,WAUBUN-OGEMA-WHITE EARTH PUBLIC SCH,2006,0.602310231023102
0441,01,MARSHALL COUNTY CENTRAL SCHOOLS,2006,0.464788732394366
0447,01,GRYGLA PUBLIC SCHOOL DISTRICT,2006,0.552631578947368
0458,01,TRUMAN PUBLIC SCHOOL DISTRICT,2006,0.473829201101928
0463,01,EDEN VALLEY-WATKINS SCHOOL DISTRICT,2006,0.382248520710059
0465,01,LITCHFIELD PUBLIC SCHOOL DISTRICT,2006,0.277777777777778
0466,01,DASSEL-COKATO PUBLIC SCHOOL DIST.,2006,0.261978021978022
0473,01,ISLE PUBLIC SCHOOL DISTRICT,2006,0.505067567567568
0477,01,PRINCETON PUBLIC SCHOOL DISTRICT,2006,0.21
0480,01,ONAMIA PUBLIC SCHOOL DISTRICT,2006,0.575155279503106
0482,01,LITTLE FALLS PUBLIC SCHOOL DISTRICT,2006,0.383623957543594
0484,01,PIERZ PUBLIC SCHOOL DISTRICT,2006,0.42488038277512
0485,01,ROYALTON PUBLIC SCHOOL DISTRICT,2006,0.338192419825073
0486,01,SWANVILLE PUBLIC SCHOOL DISTRICT,2006,0.473087818696884
0487,01,UPSALA PUBLIC SCHOOL DISTRICT,2006,0.242894056847545
0492,01,AUSTIN PUBLIC SCHOOL DISTRICT,2006,0.411583194873012
0495,01,GRAND MEADOW PUBLIC SCHOOL DISTRICT,2006,0.269662921348315
0497,01,LYLE PUBLIC SCHOOL DISTRICT,2006,0.473684210526316
0499,01,LEROY-OSTRANDER PUBLIC SCHOOLS,2006,0.404129793510324
0500,01,SOUTHLAND PUBLIC SCHOOL DISTRICT,2006,0.187800963081862
0505,01,FULDA PUBLIC SCHOOL DISTRICT,2006,0.305732484076433
0507,01,NICOLLET PUBLIC SCHOOL DISTRICT,2006,0.1875
0508,01,ST. PETER PUBLIC SCHOOL DISTRICT,2006,0.295161290322581
0511,01,ADRIAN PUBLIC SCHOOL DISTRICT,2006,0.364069952305246
0514,01,ELLSWORTH PUBLIC SCHOOL DISTRICT,2006,0.32258064516129
0518,01,WORTHINGTON PUBLIC SCHOOL DISTRICT,2006,0.507093821510297
0531,01,BYRON PUBLIC SCHOOL DISTRICT,2006,0.0995589161940769
0533,01,DOVER-EYOTA PUBLIC SCHOOL DISTRICT,2006,0.141592920353982
0534,01,STEWARTVILLE PUBLIC SCHOOL DISTRICT,2006,0.168688619295205
0535,01,ROCHESTER PUBLIC SCHOOL DISTRICT,2006,0.271443945052858
0542,01,BATTLE LAKE PUBLIC SCHOOL DISTRICT,2006,0.391385767790262
0544,01,FERGUS FALLS PUBLIC SCHOOL DISTRICT,2006,0.241353663071774
0545,01,HENNING PUBLIC SCHOOL DISTRICT,2006,0.421787709497207
0547,01,PARKERS PRAIRIE PUBLIC SCHOOL DIST.,2006,0.352941176470588
0548,01,PELICAN RAPIDS PUBLIC SCHOOL DIST.,2006,0.41214351425943
0549,01,PERHAM-DENT PUBLIC SCHOOL DISTRICT,2006,0.373570520965692
0550,01,UNDERWOOD PUBLIC SCHOOL DISTRICT,2006,0.429447852760736
0553,01,NEW YORK MILLS PUBLIC SCHOOL DIST.,2006,0.441379310344828
0561,01,GOODRIDGE PUBLIC SCHOOL DISTRICT,2006,0.541899441340782
0564,01,THIEF RIVER FALLS SCHOOL DISTRICT,2006,0.316361838853188
0577,01,WILLOW RIVER PUBLIC SCHOOL DISTRICT,2006,0.551162790697674
0578,01,PINE CITY PUBLIC SCHOOL DISTRICT,2006,0.355983162958509
0581,01,EDGERTON PUBLIC SCHOOL DISTRICT,2006,0.397111913357401
0592,01,CLIMAX-SHELLY PUBLIC SCHOOLS,2006,0.564625850340136
0593,01,CROOKSTON PUBLIC SCHOOL DISTRICT,2006,0.422206506364922
0595,01,EAST GRAND FORKS PUBLIC SCHOOL DIST,2006,0.328969834945931
0599,01,FERTILE-BELTRAMI SCHOOL DISTRICT,2006,0.412
0600,01,FISHER PUBLIC SCHOOL DISTRICT,2006,0.345394736842105
0601,01,FOSSTON PUBLIC SCHOOL DISTRICT,2006,0.434439178515008
0621,01,MOUNDS VIEW PUBLIC SCHOOL DISTRICT,2006,0.182066543077373
0622,01,NORTH ST PAUL-MAPLEWOOD OAKDALE DIS,2006,0.287485188223498
0623,01,ROSEVILLE PUBLIC SCHOOL DISTRICT,2006,0.276440785307156
0624,01,WHITE BEAR LAKE SCHOOL DISTRICT,2006,0.21222053142924
0625,01,ST. PAUL PUBLIC SCHOOL DISTRICT,2006,0.70964646837405
0630,01,RED LAKE FALLS PUBLIC SCHOOL DIST.,2006,0.403061224489796
0635,01,MILROY PUBLIC SCHOOL DISTRICT,2006,0.459459459459459
0640,01,WABASSO PUBLIC SCHOOL DISTRICT,2006,0.354523227383863
0656,01,FARIBAULT PUBLIC SCHOOL DISTRICT,2006,0.379
0659,01,NORTHFIELD PUBLIC SCHOOL DISTRICT,2006,0.167964693665628
0671,01,HILLS-BEAVER CREEK SCHOOL DISTRICT,2006,0.359223300970874
0676,01,BADGER PUBLIC SCHOOL DISTRICT,2006,0.552380952380952
0682,01,ROSEAU PUBLIC SCHOOL DISTRICT,2006,0.260144927536232
0690,01,WARROAD PUBLIC SCHOOL DISTRICT,2006,0.316895715440582
0695,01,CHISHOLM PUBLIC SCHOOL DISTRICT,2006,0.377837116154873
0696,01,ELY PUBLIC SCHOOL DISTRICT,2006,0.281004709576138
0698,01,FLOODWOOD PUBLIC SCHOOL DISTRICT,2006,0.460759493670886
0700,01,HERMANTOWN PUBLIC SCHOOL DISTRICT,2006,0.122868605817452
0701,01,HIBBING PUBLIC SCHOOL DISTRICT,2006,0.366135458167331
0704,01,PROCTOR PUBLIC SCHOOL DISTRICT,2006,0.235461801596351
0706,01,VIRGINIA PUBLIC SCHOOL DISTRICT,2006,0.350350989151244
0707,01,NETT LAKE PUBLIC SCHOOL DISTRICT,2006,0.746478873239437
0709,01,DULUTH PUBLIC SCHOOL DISTRICT,2006,0.3819384526891
0712,01,MOUNTAIN IRON-BUHL SCHOOL DISTRICT,2006,0.419871794871795
0716,01,BELLE PLAINE PUBLIC SCHOOL DISTRICT,2006,0.105227427019688
0717,01,JORDAN PUBLIC SCHOOL DISTRICT,2006,0.184940554821664
0719,01,PRIOR LAKE-SAVAGE AREA SCHOOLS,2006,0.0759961439588689
0720,01,SHAKOPEE PUBLIC SCHOOL DISTRICT,2006,0.252478883584282
0721,01,NEW PRAGUE AREA SCHOOLS,2006,0.103867747972551
0726,01,BECKER PUBLIC SCHOOL DISTRICT,2006,0.161452298184627
0727,01,BIG LAKE PUBLIC SCHOOL DISTRICT,2006,0.172312223858616
0728,01,ELK RIVER PUBLIC SCHOOL DISTRICT,2006,0.132371170533026
0738,01,HOLDINGFORD PUBLIC SCHOOL DISTRICT,2006,0.199052132701422
0739,01,KIMBALL PUBLIC SCHOOL DISTRICT,2006,0.240105540897098
0740,01,MELROSE PUBLIC SCHOOL DISTRICT,2006,0.294989414255469
0741,01,PAYNESVILLE PUBLIC SCHOOL DISTRICT,2006,0.333946642134315
0742,01,ST. CLOUD PUBLIC SCHOOL DISTRICT,2006,0.357772522038271
0743,01,SAUK CENTRE PUBLIC SCHOOL DISTRICT,2006,0.292220113851992
0745,01,ALBANY PUBLIC SCHOOL DISTRICT,2006,0.178685386088066
0748,01,SARTELL-ST. STEPHEN SCHOOL DISTRICT,2006,0.110887772194305
0750,01,ROCORI PUBLIC SCHOOL DISTRICT,2006,0.204055220017256
0756,01,BLOOMING PRAIRIE PUBLIC SCHOOL DIST,2006,0.229485396383866
0761,01,OWATONNA PUBLIC SCHOOL DISTRICT,2006,0.286177543575193
0763,01,MEDFORD PUBLIC SCHOOL DISTRICT,2006,0.209078404401651
0768,01,HANCOCK PUBLIC SCHOOL DISTRICT,2006,0.334801762114537
0771,01,CHOKIO-ALBERTA PUBLIC SCHOOL DIST.,2006,0.401098901098901
0775,01,KERKHOVEN-MURDOCK-SUNBURG,2006,0.345486111111111
0777,01,BENSON PUBLIC SCHOOL DISTRICT,2006,0.31700288184438
0786,01,BERTHA-HEWITT PUBLIC SCHOOL DIST.,2006,0.659663865546218
0787,01,BROWERVILLE PUBLIC SCHOOL DISTRICT,2006,0.455445544554455
0801,01,BROWNS VALLEY PUBLIC SCHOOL DIST.,2006,0.589928057553957
0803,01,WHEATON AREA PUBLIC SCHOOL DISTRICT,2006,0.309417040358744
0811,01,WABASHA-KELLOGG PUBLIC SCHOOL DIST.,2006,0.280966767371601
0813,01,LAKE CITY PUBLIC SCHOOL DISTRICT,2006,0.169504071058475
0818,01,VERNDALE PUBLIC SCHOOL DISTRICT,2006,0.559090909090909
0820,01,SEBEKA PUBLIC SCHOOL DISTRICT,2006,0.576576576576577
0821,01,MENAHGA PUBLIC SCHOOL DISTRICT,2006,0.506172839506173
0829,01,WASECA PUBLIC SCHOOL DISTRICT,2006,0.274291497975709
0831,01,FOREST LAKE PUBLIC SCHOOL DISTRICT,2006,0.176691225720027
0832,01,MAHTOMEDI PUBLIC SCHOOL DISTRICT,2006,0.0646944083224967
0833,01,SOUTH WASHINGTON COUNTY SCHOOL DIST,2006,0.129855577689243
0834,01,STILLWATER AREA PUBLIC SCHOOL DIST.,2006,0.0955406654343808
0836,01,BUTTERFIELD PUBLIC SCHOOL DISTRICT,2006,0.478672985781991
0837,01,MADELIA PUBLIC SCHOOL DISTRICT,2006,0.405545927209705
0840,01,ST. JAMES PUBLIC SCHOOL DISTRICT,2006,0.456239870340357
0846,01,BRECKENRIDGE PUBLIC SCHOOL DISTRICT,2006,0.313703284258211
0850,01,ROTHSAY PUBLIC SCHOOL DISTRICT,2006,0.393665158371041
0852,01,CAMPBELL-TINTAH PUBLIC SCHOOL DIST.,2006,0.513274336283186
0857,01,LEWISTON-ALTURA PUBLIC SCHOOL DIST.,2006,0.340080971659919
0858,01,ST. CHARLES PUBLIC SCHOOL DISTRICT,2006,0.251193887297039
0861,01,WINONA AREA PUBLIC SCHOOL DISTRICT,2006,0.342644320297952
0876,01,ANNANDALE PUBLIC SCHOOL DISTRICT,2006,0.203831825439063
0877,01,BUFFALO-HANOVER-MONTROSE PUBLIC SCH,2006,0.198637702503682
0879,01,DELANO PUBLIC SCHOOL DISTRICT,2006,0.115121951219512
0881,01,MAPLE LAKE PUBLIC SCHOOL DISTRICT,2006,0.161943319838057
0882,01,MONTICELLO PUBLIC SCHOOL DISTRICT,2006,0.18448098663926
0883,01,ROCKFORD PUBLIC SCHOOL DISTRICT,2006,0.235257985257985
0885,01,ST. MICHAEL-ALBERTVILLE SCHOOL DIST,2006,0.0820537428023033
0891,01,CANBY PUBLIC SCHOOL DISTRICT,2006,0.451557093425606
0911,01,CAMBRIDGE-ISANTI PUBLIC SCHOOL DIST,2006,0.248647565618113
0912,01,MILACA PUBLIC SCHOOL DISTRICT,2006,0.268703898840885
0914,01,ULEN-HITTERDAL PUBLIC SCHOOL DIST,2006,0.348432055749129
0915,52,SOUTHERN PLAINS EDUCATION COOP.,2006,0.435294117647059
0916,06,NORTHEAST METRO 916,2006,0.282828282828283
0917,06,INTERMEDIATE SCHOOL DISTRICT 917,2006,0.219298245614035
0926,83,REGION 4-LAKES COUNTRY SERVICE COOP,2006,0.257142857142857
0935,52,FERGUS FALLS AREA SP. ED. COOP.,2006,0.481481481481481
0938,52,MEEKER AND WRIGHT SPECIAL EDUCATION,2006,0.797752808988764
0966,51,WRIGHT TECHNICAL CENTER,2006,0.0122699386503067
0991,83,REGION 6 AND 8-SW/WC SERVICE COOP,2006,0.439393939393939
0998,52,BEMIDJI REGIONAL INTERDIST. COUNCIL,2006,NaN
1000,70,PERPICH CENTER FOR ARTS EDUCATION,2006,0.0809061488673139
1100,60,MINNESOTA DEPARTMENT OF CORRECTIONS,2006,1
2071,01,LAKE CRYSTAL-WELLCOME MEMORIAL,2006,0.27496757457847
2125,01,TRITON SCHOOL DISTRICT,2006,0.306976744186047
2134,01,UNITED SOUTH CENTRAL SCHOOL DIST.,2006,0.454337899543379
2135,01,MAPLE RIVER SCHOOL DISTRICT,2006,0.321108394458028
2137,01,KINGSLAND PUBLIC SCHOOL DISTRICT,2006,0.21358024691358
2142,01,ST. LOUIS COUNTY SCHOOL DISTRICT,2006,0.401777777777778
2143,01,WATERVILLE-ELYSIAN-MORRISTOWN,2006,0.236180904522613
2144,01,CHISAGO LAKES SCHOOL DISTRICT,2006,0.155505743905856
2149,01,MINNEWASKA SCHOOL DISTRICT,2006,0.360642570281125
2154,01,EVELETH-GILBERT SCHOOL DISTRICT,2006,0.3293142426526
2155,01,WADENA-DEER CREEK SCHOOL DISTRICT,2006,0.510356255178128
2159,01,BUFFALO LK-HECTOR-STEWART PUBLIC SC,2006,0.35
2164,01,DILWORTH-GLYNDON-FELTON,2006,0.280597014925373
2165,01,HINCKLEY-FINLAYSON SCHOOL DISTRICT,2006,0.434823977164605
2167,01,LAKEVIEW SCHOOL DISTRICT,2006,0.263772954924875
2168,01,NRHEG SCHOOL DISTRICT,2006,0.268518518518519
2169,01,MURRAY COUNTY CENTRAL SCHOOL DIST.,2006,0.317744154057772
2170,01,STAPLES-MOTLEY SCHOOL DISTRICT,2006,0.56980056980057
2171,01,KITTSON CENTRAL SCHOOL DISTRICT,2006,0.332402234636872
2172,01,KENYON-WANAMINGO SCHOOL DISTRICT,2006,0.209276018099548
2174,01,PINE RIVER-BACKUS SCHOOL DISTRICT,2006,0.482857142857143
2176,01,WARREN-ALVARADO-OSLO SCHOOL DIST.,2006,0.413385826771654
2180,01,MACCRAY SCHOOL DISTRICT,2006,0.288831835686778
2184,01,LUVERNE PUBLIC SCHOOL DISTRICT,2006,0.317014446227929
2190,01,YELLOW MEDICINE EAST,2006,0.422932330827068
2198,01,FILLMORE CENTRAL,2006,0.2890625
2215,01,NORMAN COUNTY EAST SCHOOL DISTRICT,2006,0.542936288088643
2310,01,SIBLEY EAST SCHOOL DISTRICT,2006,0.342084327764519
2311,01,CLEARBROOK-GONVICK SCHOOL DISTRICT,2006,0.460743801652893
2342,01,WEST CENTRAL AREA,2006,0.357320099255583
2358,01,TRI-COUNTY SCHOOL DISTRICT,2006,0.50965250965251
2364,01,BELGRADE-BROOTEN-ELROSA SCHOOL DIST,2006,0.422459893048128
2365,01,G.F.W.,2006,0.341523341523342
2396,01,A.C.G.C. PUBLIC SCHOOL DISTRICT,2006,0.379432624113475
2397,01,LE SUEUR-HENDERSON SCHOOL DISTRICT,2006,0.304625199362041
2448,01,MARTIN COUNTY WEST SCHOOL DISTRICT,2006,0.360277136258661
2527,01,NORMAN COUNTY WEST SCHOOL DISTRICT,2006,0.476635514018692
2534,01,BIRD ISLAND-OLIVIA-LAKE LILLIAN,2006,0.342690058479532
2536,01,GRANADA HUNTLEY-EAST CHAIN,2006,0.407407407407407
2580,01,EAST CENTRAL SCHOOL DISTRICT,2006,0.490058479532164
2609,01,WIN-E-MAC SCHOOL DISTRICT,2006,0.32391713747646
2683,01,GREENBUSH-MIDDLE RIVER SCHOOL DIST.,2006,0.423076923076923
2687,01,HOWARD LAKE-WAVERLY-WINSTED,2006,0.224899598393574
2689,01,PIPESTONE AREA SCHOOL DISTRICT,2006,0.381434599156118
2711,01,MESABI EAST SCHOOL DISTRICT,2006,0.386666666666667
2752,01,FAIRMONT AREA SCHOOL DISTRICT,2006,0.384
2753,01,LONG PRAIRIE-GREY EAGLE SCHOOL DIST,2006,0.499217527386541
2754,01,CEDAR MOUNTAIN SCHOOL DISTRICT,2006,0.368159203980099
2769,01,MORRIS AREA PUBLIC SCHOOLS,2006,0.232464929859719
2805,01,ZUMBROTA-MAZEPPA SCHOOL DISTRICT,2006,0.1940818102698
2835,01,JANESVILLE-WALDORF-PEMBERTON,2006,0.25414364640884
2853,01,LAC QUI PARLE VALLEY SCHOOL DIST.,2006,0.369323915237134
2854,01,ADA-BORUP PUBLIC SCHOOL DISTRICT,2006,0.407678244972578
2856,01,STEPHEN-ARGYLE CENTRAL SCHOOLS,2006,0.424870466321244
2859,01,GLENCOE-SILVER LAKE SCHOOL DISTRICT,2006,0.316576900059844
2860,01,BLUE EARTH AREA PUBLIC SCHOOL,2006,0.397012578616352
2884,01,RED ROCK CENTRAL SCHOOL DISTRICT,2006,0.463114754098361
2886,01,GLENVILLE-EMMONS SCHOOL DISTRICT,2006,0.320441988950276
2888,01,CLINTON-GRACEVILLE-BEARDSLEY,2006,0.484777517564403
2889,01,LAKE PARK AUDUBON SCHOOL DISTRICT,2006,0.317683881064163
2890,01,RENVILLE COUNTY WEST SCHOOL DIST.,2006,0.41358024691358
2895,01,JACKSON COUNTY CENTRAL SCHOOL DIST.,2006,0.34901625320787
2897,01,REDWOOD AREA SCHOOL DISTRICT,2006,0.33433734939759
2898,01,WESTBROOK-WALNUT GROVE SCHOOLS,2006,0.497363796133568
2899,01,PLAINVIEW-ELGIN-MILLVILLE,2006,NA
2902,01,RTR PUBLIC SCHOOLS,2006,NA
2903,01,ORTONVILLE PUBLIC SCHOOLS,2006,NA
2904,01,TRACY AREA PUBLIC SCHOOL DISTRICT,2006,NA
2905,01,TRI-CITY UNITED SCHOOL DISTRICT,2006,NA
2906,01,RED LAKE COUNTY CENTRAL PUBLIC SCH,2006,NA
2907,01,ROUND LAKE-BREWSTER PUBLIC SCHOOLS,2006,NA
2908,01,BRANDON-EVANSVILLE PUBLIC SCHOOLS,2006,NA
4000,07,CITY ACADEMY,2006,0.766666666666667
4001,07,BLUFFVIEW MONTESSORI,2006,0.207253886010363
4003,07,"NEW HEIGHTS SCHOOL, INC.",2006,0.3515625
4004,07,CEDAR RIVERSIDE COMMUNITY SCHOOL,2006,0.972477064220184
4005,07,METRO DEAF SCHOOL,2006,0.343283582089552
4007,07,MINNESOTA NEW COUNTRY SCHOOL,2006,0.241071428571429
4008,07,PACT CHARTER SCHOOL,2006,0.2
4011,07,ATHLOS LEADERSHIP ACADEMY,2006,0.830917874396135
4015,07,COMMUNITY OF PEACE ACADEMY,2006,0.827118644067797
4016,07,WORLD LEARNER CHARTER SCHOOL,2006,0.00714285714285714
4017,07,MINNESOTA TRANSITIONS CHARTER SCH,2006,0.724461105904405
4018,07,ACHIEVE LANGUAGE ACADEMY,2006,0.770666666666667
4020,07,DULUTH PUBLIC SCHOOLS ACADEMY,2006,0.491591203104787
4025,07,CYBER VILLAGE ACADEMY,2006,0.170542635658915
4026,07,E.C.H.O. CHARTER SCHOOL,2006,0.497109826589595
4027,07,HIGHER GROUND ACADEMY,2006,0.956416464891041
4029,07,ST. PAUL CITY SCHOOL,2006,0.836795252225519
4031,07,JENNINGS COMMUNITY SCHOOL,2006,0.583333333333333
4032,07,HARVEST PREPARATORY SCHOOL,2006,0.727710843373494
4035,07,LIFE PREP,2006,0.75
4036,07,FACE TO FACE ACADEMY,2006,0.568965517241379
4038,07,SOJOURNER TRUTH ACADEMY,2006,0.912663755458515
4039,07,HIGH SCHOOL FOR RECORDING ARTS,2006,0.799126637554585
4043,07,MATH AND SCIENCE ACADEMY,2006,0.0033003300330033
4049,07,NORTHWEST PASSAGE HIGH SCHOOL,2006,0.220125786163522
4050,07,LAFAYETTE PUBLIC CHARTER SCHOOL,2006,0.521276595744681
4053,07,NORTH LAKES ACADEMY,2006,0.212435233160622
4054,07,LA CRESCENT MONTESSORI & STEM SCHOO,2006,0.159420289855072
4055,07,NERSTRAND CHARTER SCHOOL,2006,0.0849673202614379
4056,07,ROSA PARKS CHARTER HIGH SCHOOL,2006,0.564102564102564
4057,07,EL COLEGIO CHARTER SCHOOL,2006,0.628205128205128
4058,07,SCHOOLCRAFT LEARNING COMMUNITY CHTR,2006,0.49079754601227
4059,07,CROSSLAKE COMMUNITY CHARTER SCHOOL,2006,0.362204724409449
4064,07,RIVERWAY LEARNING COMMUNITY CHTR,2006,0.592592592592593
4066,07,KATO PUBLIC CHARTER SCHOOL,2006,0.537037037037037
4067,07,AURORA CHARTER SCHOOL,2006,0.912442396313364
4068,07,EXCELL ACADEMY CHARTER,2006,0.725868725868726
4070,07,HOPE COMMUNITY ACADEMY,2006,0.877338877338877
4073,07,ACADEMIA CESAR CHAVEZ CHARTER SCH.,2006,0.930894308943089
4074,07,AFSA HIGH SCHOOL,2006,0.267379679144385
4075,07,AVALON SCHOOL,2006,0.188811188811189
4077,07,TWIN CITIES INTERNATIONAL ELEM SCH,2006,1
4078,07,MINNESOTA INTERNATIONAL MIDDLE CHTR,2006,1
4079,07,FRIENDSHIP ACDMY OF FINE ARTS CHTR.,2006,0.923913043478261
4080,07,PILLAGER AREA CHARTER SCHOOL,2006,0.785714285714286
4081,07,DISCOVERY PUBLIC SCHOOL FARIBAULT,2006,0.541666666666667
4082,07,BLUESKY CHARTER SCHOOL,2006,0.166666666666667
4083,07,RIDGEWAY COMMUNITY SCHOOL,2006,0.373333333333333
4084,07,NORTH SHORE COMMUNITY SCHOOL,2006,0.391304347826087
4085,07,HARBOR CITY INTERNATIONAL CHARTER,2006,0.385365853658537
4087,07,SAGE ACADEMY CHARTER SCHOOL,2006,0.252873563218391
4088,07,URBAN ACADEMY CHARTER SCHOOL,2006,0.969230769230769
4089,07,NEW CITY SCHOOL,2006,0.63302752293578
4090,07,PRAIRIE CREEK COMMUNITY SCHOOL,2006,0.0803571428571429
4091,07,ARCADIA CHARTER SCHOOL,2006,0.0480769230769231
4092,07,WATERSHED HIGH SCHOOL,2006,0.112903225806452
4093,07,NEW CENTURY ACADEMY,2006,0.296774193548387
4095,07,TRIO WOLF CREEK DISTANCE LEARNING,2006,0.0898876404494382
4097,07,"PARTNERSHIP ACADEMY, INC.",2006,0.989583333333333
4098,07,NOVA CLASSICAL ACADEMY,2006,0.109022556390977
4100,07,GREAT EXPECTATIONS,2006,0
4102,07,MINNESOTA INTERNSHIP CENTER,2006,0.940774487471526
4103,07,HMONG COLLEGE PREP ACADEMY,2006,0.991489361702128
4104,07,PALADIN CAREER AND TECH HIGH SCHOOL,2006,0.227848101265823
4105,07,GREAT RIVER SCHOOL,2006,0.161290322580645
4106,07,TREKNORTH HIGH SCHOOL,2006,0.519685039370079
4107,07,VOYAGEURS EXPEDITIONARY,2006,0.579710144927536
4110,07,PIM ARTS HIGH SCHOOL,2006,0.165644171779141
4111,07,AUGSBURG FAIRVIEW ACADEMY,2006,0.863636363636364
4112,07,ST PAUL CONSERVATORY PERFORMING ART,2006,0.0273972602739726
4113,07,SPERO ACADEMY,2006,0.189189189189189
4116,07,LAKES INTERNATIONAL LANGUAGE ACADEM,2006,0.105633802816901
4118,07,KALEIDOSCOPE CHARTER SCHOOL,2006,0.108597285067873
4119,07,ACADEMIC ARTS HIGH SCHOOL,2006,0.28
4120,07,ST. CROIX PREPARATORY ACADEMY,2006,0
4121,07,UBAH MEDICAL ACADEMY CHARTER SCHOOL,2006,1
4122,07,EAGLE RIDGE ACADEMY CHARTER SCHOOL,2006,0.0384615384615385
4124,07,BEACON ACADEMY,2006,0.133720930232558
4126,07,PRAIRIE SEEDS ACADEMY,2006,0.945945945945946
4127,07,TEAM ACADEMY,2006,0.361111111111111
4131,07,METRO SCHOOLS CHARTER,2006,1
4132,07,TWIN CITIES ACADEMY,2006,NA
